topic,review
Total Disappointment,"We had been for dinner here before and were looking forward to a nice night out with friends. Instead it was a total disappointment. The quality of the food was good but they may as well has given us our main courses in a takeaway container and told us to eat it at home. Our booking was for the second seating at so shouldn’t have been rushed to finish by 10:30. When we were still having our pasta at 9:30pm, cutlery for our main was being laid on the table amongst our plates while we were eating and we were asked if we had any last orders. There was no reason to rush us, we are aware of the closing time and need to clear any alcohol by 10:30. It was extremely rude and I don’t think the server even realised it when I asked what her rush was. From that point on, it felt like they couldn’t chase us out fast enough. Not what you expect when spending a couple hundred per person on a meal. I’m really disappointed they totally ruined our experience."
Dinner on Christmas Day,"Excellent service and food. Even though it was Christmas Day, the customer service was impeccable. The restaurant had a notably larger number of service staff than other restaurants during this period of the pandemic. I thought the calamari was a bit too salty though the sauce helped to balance it a little. The roast chicken and truffle mash was simply the best, and the tiramisu was also wonderful."
"Patchy, Inconsistent Service","Food was decent. Service was however, patchy. We arrived to be greeted and ushered in by a friendly and polite lady. Once seated, we were served by a waiter (Caucasian) who asked us for the type of water we would like to have. We requested for warm water and he poured some boiling water into our cups. We thought that he would return with some cold water to balance out the temperature of the water, but to our shock, he did not. There is a big difference between warm and boiling water, and it was appalling that a restaurant would believe it is alright for guests to drink boiling water. Zero common sense and tactfulness.

Thankfully, a female waitress (Filipina) we provided feedback to was quick to fix this. Kudos to her, she was pleasant and polite throughout the meal.

Subsequently, I noticed that there was a strand of hair in my water. When I informed a waiter (Indian) about it, he gave a blank look, said nothing, and just took the cup away to replace it. There was not even a basic ‘sorry’ nor any word spoken from the moment he took the cup away to when he returned it. Zero courtesy, zero professionalism. Not the kind of service you would expect from a restaurant like this.

The key observation was that staff at the entrance, as well as the female waitresses tending to guests at the dining table, appeared more professional and polite. The male staff serving guests at the dining table however, need to improve on their tactfulness and professionalism in serving guests. Doubt I’ll be back."
Value for money and cozy ambience,I visited this restaurant as part of company dinner. Service was attentive and fast with generous food portions. The prices were affordable as well. Ambience was great and perfect for having conversations.
Thanksgiving dinner,"Not the best Italian I’ve had in Singapore but their cocktails are phenomenal, the fries was surprisingly amazing, very crunchy, the mushrooms pizza was amazing, I had the whole pizza all for myself and finished it. The plus side is their customers service. Staff and manager were very friendly and attentive, too bad we were too full to order the dessert but the tiramisu looked bomb. Thanks for a great dining experience!"
Never disappointed with Amo,"Fries are a must-have, even if on a no carb diet! Pork sausage, onion and potato pizza is yummy! Meats (beef and pork) were ok. Not fantastic. Cocktails are good enough."
Delicious esp the gluten free pasta,"Went for a weekend lunch, no tables as we didn’t have a reservation but we got a high table which is just fine. Ordered gluten free beef shank pasta which is beefy and luscious with al dente pasta. The fries with truffle mayo is a winner. The sauce is on point, it is addictive. The roasted chicken portion is a bit bigger than expected and those who like their chicken tender and juicy will love it. I prefer a drier chicken with crispier skin so it’s not a dish that I will repeat though my partner disagrees. The truffle mash potato is yummy but not exceptional.

The staff is friendly and helpful. We forgot to inform we wanted gluten free pasta and the manager immediately informed the kitchen. The manager understands the importance of gluten free. My partner has a gastrointestinal autoimmune issue, dining experience is made better when the restaurant has a degree of awareness.

Amo has great ambiance using a mix of black metal, wood, glass and yellow lighting to create a contemporary interior with a whisper of industrial chic. The food is great and it’s hard to find gluten free pasta in Singapore. It’s a little pricey but I’d come back again to try the rest of the menu."
"Good Food, Location is Convenient","Fresh ingredients used and SUPER yummy for all the ANTIPASTI and MAINS we've ordered. Except for the two pizza (mushroom, truffle + Marinara) were quite 'cold'. Didn't felt hot from the stove. But still will go back again."
Lovely Environment and Food,Had a great dining experience at Amo during our visit. All the staff where friendly and very accommodating as we were there with my toddler. The food was great and we just love the overall vibe to the place. Would be back again soon!
First Visit,Our first visit to Amo to celebrate our 29th wedding anniversary. Very pleasant atmosphere and the service staffs are really friendly and attentive. The food is good and value for money. A very good dining experience. Highly recommended.
"Sub-par service, overrated pizza","Overall, try to avoid going for late lunch, they will rush to finish lunch service fast and significantly lower their service level through the process. Pizza came with base too tough, dough is nothing amazing too, seemed like a rush/unattended work in the oven."
review,Food and service are not up to our expectation. Value for money quite low for the lunch menu. Food is a kind of fusion.
Pleasant ambience but average food,This is a spacious bright restaurant with good service. The Tuna tagliatelle and Tagliolini with Ikura were good. The calamari was not memorable. The Iberico Pork Neck and Chilean Sea Bass were both overly salty - the pork was tough and very dense- impossible to eat! Had high expectations as previous reviews were generally good. Most disappointed.
Always welcome!,Always a pleasure to stop by Amo' for a nice Italian bite! Like the atmosphere and the people always professional. Suggestion ... try everything! (Maybe not in one shot!)
Nice ambience,"Overall good dining experience with the restaurant, in terms of their service and food. Was recommended and will also recommend to friends and family."
Disappointing,"at this price point, Amò really didn’t impress. i’ve always loved pumpkin based pizzas but this rendition was too sweet for my liking. would’ve helped if there were more/thicker pancetta slices to help balance the sweetness (akin to the classic melon and prosciutto pairing). the beef shank fettuccine with orange ($28++) didn’t stand out either as i felt that the orange didn’t cut through the overwhelming beef taste enough. the Suckling Poh Chops ($32++) were really tough and the Angus Beef ($48++) came horribly charred on the outside while having a really raw centre despite us requesting for a medium well steak to cater to my brother. it felt like they tried to make the beef smoky but just ended up being so charred that the table had difficulties finishing it. we felt bad returning the dish as my brother had already attempted to eat 1/3 of the dish before eventually giving up. other than the calamari which made it better, was a disappointing experience."
Terrible service by this staff,"Terrible service by this staff named Lee. Food was great. Night spoilt by this Lee

1. I was enquiring abt buying of chope vouchers to be used , which was allowed previously. Lee replied, can’t since IM HERE NOW, I DONT KNOW ABT PREVIOUSLY

2. Halfway through the dinner, Lee came over and inform that we need the table back by 830. And we start our dinner at 7pm

3. Nearing 8pm , Lee came over asking if she can clear the table. And We stil have food on the table

Utterly disappointed by their service !"
Chicken to die for,Second time we visited. All the dishes were wonderful except for the pasta. It was rather bland. It was not as good as we remembered it to be. Maybe the chef had an off day. Of special note though is the roast chicken. It really is to die for. Well worth the visit and will come again. #maneklady #manekeats
Reservation Make No Use,"Terrible reservation rule. I made a reservation through Chope, expected to celebrate anniversary at a wonderful dining atmosphere as showed in pictures. BUT BUT BUT even though we reached there at 6.45pm punctually, the manager lead us to the dining area with 4 walls at behind of the restaurant. Why can't you tell us have such first come first ‘seat’ upfront? We paid for the same amount right."
Candy’s Birthday July,"Booked this place on 22 Jul for dinner to celebrate my girlfriend’s bday! Great ambience & love the tuna tartare, grilled octopus & mushroom pizza! Packed for a weekday evening. Recommend to make early reservations."
Food Still Good But Service Could Be Warmer,"Haven't eaten here in a while so was glad the food is still VERY GOOD. Didn't recognise the staff though as it looked like most of them working there were ""new"". They were ok but not as warm and welcoming as the staff I had met on previous occasions."
Nice lunch,"It was pretty crowded at lunch but service was warm yet quick. I loved my starter of pasta with squid ink, which had a nice level of spiciness, while my wife enjoyed her burrata.

We both had the beef main course. We wish there were more pieces, but the three we did have was pretty good. Mine was slightly chewy, but there was no gristle.

Dessert was chocolate slice, which had a nice hit of citrus. It was rich chocolate, so much so that we were not able to finish it. We saw neighboring tables having pizzas - they looked good and we will be back to try them.

They are part of the Aura group, which includes Art at National Gallery."
Excellent experience !,A Jem found in the city. Food nicely prepared and delicious. Restaurant have a warm deco too. Glad to have to try this gem found !
could be better,"good service and good promotion. truffle pizza was a crowd pleaser but apart from that, nothing was spectacular."
Delicious 🇮🇹,"As neighbouring restoran was closed we stepped in to Amo for a dinner. Excellent experience. Elegant interior, welcoming staff and everything tasty. Especially would point out tuna tartar, one of the top ones I never had. Place highly recommended!"
Italian restaurant excellent,"when I entered this restaurant I felt like I was in Italy. Very comfortable and well-cared for restaurant, an elegant table for the best occasions. Kindness and professionalism of the staff who welcomes you with excellent olives as an aperitif, delicious pizza with excellent refined ingredients, the moment of dessert arrived, we ordered a tiramisu and it too exceptional. The wine list is amazing with the best Italian and French wineries. Dinner ended with the best espresso ever drunk abroad and competition with the best Italian bars. Friendliness of Director Jody who gave us great advice on Singapore. We will definitely return to this wonderful Italian restaurant two minutes walk from Clarke Quay."
Valentine’s Day special,"We made a very last minute reservation to celebrate Valentine’s Day at Amò as I saw they were offering Valentine’s Day sharing menu and decided to give it a first try. I was pretty impressed by the great ambience as we walked in and were seated in the back of the restaurant with a bit more private space. Highlights of the night were the mushroom/truffle pizza and lobster pasta.

Truffle Pizza: freshly baked with a crispy yet chewy dough, flavorful mushrooms and a touch of truffles. My boyfriend usually don’t eat mushrooms but surprisingly this pizza has changed his perspective on mushrooms!

Lobster pasta: lobster was perfectly cooked and tender. I’ve always enjoyed the intense taste of lobster bisque but I find their sauce on a bit saltier side, and also a bit disappointed by the infusion of asian gravy. Overall it’s definitely not comparable with the lobster pasta I had in Boston, but we still enjoyed it a lot.

Angus beef: we made a wrong decision by having our steak cooked medium well. The taste and presentation was great but unfortunately a bit too dry and overcooked.

Tiramisu: disappointing. Wish there’s stronger coffee taste soaked in the mascarpone.

Overall we had an amazing night here with great wine."
Ottimo,I ve had a great dinner in this restaurant. Great menu gluten free. Restaurant absolutely perfect from service to food. Same i can say about design. Very good homemade bread gluten free with olive oil. Sure one of my best place to Singapore.
Enjoyable experience,"It was our first time to Amo. Located at a busy street. The food was good, especially the pasta. We would look forward to coming back again."
3rd visit and it's still good,"Went there for lunch. The Mushroom Pizza was amazing as ever. I normally dont finish the pizza crust. But it was so good. We cleaned out everything. We also ordered the 2 set lunches. The Gnocchi was a clap. And the Cod was delicious. Overall the food was as good as ever. For dessert, we tried the Lemon Baba. It was well balance. Will definitely visit again."
Nice looking interior - unprofessionally organized & worse: pathetic pizza. Overpriced & overhyped.,"That any restaurant claiming to be so much better than average could run out of paper(!!!) dinner serviettes beggars the mind, but one that is supposed to make stunning pizza (& charge over$30++(!!!!!) into the bargain ..but can’t manage to even deliver same hot to table should curl up in shame!
And to make maters worse, the REPLACEMENT pizza base was soggy & inedible! OMG!!

Their lauded Rosemary Fries side dish is nice enough, but the ‘rosemary’ bit is a joke ...it’s just a few leaves scattered on top!..$12++ ? Hardly value!

Service ( so-called) was erratic at best & with the poor kitchen work & overpriced menu items, this is trendoid pseudo-dining that’s so overhyped it’s laughable.

Don’t be conned...you can do far better elsewhere."
Good service from Arvin Ligon,"Great service from Arvin Ligon - from point of booking a table reservation, to food recommendations, was very enjoyable!"
Indubitably the best restaurant,"Indubitably the best restaurant in Singapore, great service, genuine and passionate cuisine and the TRUE Italian pizza."
