topic,review
Amazing Asia Grand!,"Decided to have a meal here after some research on restaurants which serve Peking Duck. We entered apprehensively as it looked ""upmarket"" and big dollar signs swirled in my head.
We need not have worried. We were made to feel very welcome by the professional and attentive staff.
The special of the evening was a whole Peking Duck for $S40. How good was that? Needless to say we ordered that plus some BBQ pork belly and mixed green vegetables. All were absolutely delicious and cooked to perfection. In fact we ordered way too much for 2 people and unfortunately left a lot of duck meat. We couldn't even take it with us because we were leaving the next day.
This restaurant was packed with locals which is a very good sign.
Highly recommended."
Very good and authentic Chinese food,I had lunch with a bunch of colleagues at Asia Grand. We had dim sum and steamed fish. All of which was excellent. The service is fuss-free but efficient.
wonderful wonderful wonderful,"never mind the reasonably priced, delicious, yummy food! the service was superb...SUPERB! everyone was eager to serve with a smile! especially impressed when my empty glass was filled up within 30secs! definitely looking for opportunities to be back again!"
Dim sum lunch - arrive after 1130am,"Portions are quite large (ie u get 6 pieces of egg tarts, baked puffs). The best for me was the Siew mai. As we arrived at 10am, the appetizer selection were still not available. So we only had limited order. Place was quite busy though.

Advise is: book a table.. arrive after 1130 hours"
Highly recommended place for Tim Sum,"Restaurant is conveniently located, walking distance from City Hall mrt.

Had a great Tim Sum lunch with my Parents , Uncle and Cousin. We really enjoyed all dishes especially the pork knuckles in vinegar, and chicken feet! The Peking duck is delicious and value for money.

Service is excellent too! Would recommend to visit this restaurant."
"Amazing Peking Duck, amazing value","This friendly Chinese Restaurant offers a truly wonderful Peking Duck, sliced and prepared at your table. The seafood is also fresh and delicious and the vegetables are crisp and tasty. The bill was a pleasant surprise too, really good value and highly recommended."
Very Delicious Food,We were invited here for a birthday celebration. The food was delicious. The service great. The sucking pig was very well done. Good place to hold a celebration.
We had so much to eat !,"Took some time to decide what to eat cos there's so much to choose from in the menu! There were 4 of us and we ordered steamed bamboo clams, crab with egg white, yam ring, claypot rice, roast chicken, spinach & fish skin with egg yolk. Plus 2 types of soup - the chicken with black fungus and rice wine and winter melon seafood soup. The food is of good quality and the service is great! Total $356 for 4 of us and we really 'stuffed our faces' with so much food! We had to give dessert a miss"
A predictably good Chinese restaurant,"Asia Grand have been one of my favourite Chinese restaurants in Singapore and I reckon it is for many too: Food is consistently good and reasonably priced with service always attentive including from the owner and his senior managers. Many of their staff have been with them for years; which says a lot for how the restaurant is managed and run.
Their Chinese food is predominantly Cantonese probably because of the owner and executive chef’s Hong Kong heritage. They are quite famous and very popular for their lunchtime dim sum.
I always go there as default family or business meals, and always order their lup mei fun: rice slow-cooked with preserved meats such as Chinese sausages, liver rolls, waxed duck and vegetables in a clay pot. They use very high quality ingredients and there is a huge serving of choy sum vegetables for balance. Even the smallest portion is a meal in itself; ample for two to three persons. The sauce they pour over the dish is very delicious; like the icing on the cake. When you finished eating, you can ask them to use the scrappings of the burnt rice on the pot to cook with stock for a soup to round off the meal.
They are also well known for their roast pork, Peking duck, steamed chicken with ham and all manners of fresh seafood (yes, they have several tanks of them). For the vegetarian, they would recommend their bean curd with spinach and enoki mushrooms. I also love their stir-fried vegetables of sweet peas, lily bulbs and cashew nuts; something you can pick on as the meal progresses.
They are one of the older Chinese restaurants in Singapore; having started in the defunct Asia Hotel along Scotts Road (next to Sheraton Towers) and remained very popular for family occasions, dining with clients or just a simple but very good Chinese meal!
They are conveniently located at the ground floor of Odeon Towers (across from the rear of Raffles Hotel or diagonally from Raffles City) with ample car parking space. Reservations are encouraged."
Excellent service and dim sum,"We were the last customers at lunch time, but they were very friendly. Dim sum were perfect. I would come back!"
Make your reservations !,One of the best restaurants around. Do make your reservations to avoid disappointment. We went for their dim sum and had a wonderful meal.
for a few dumplings more,"Asia Grand is an excellent joint for dim sum with very attentive service in an agreeable if somewhat unexciting environment. There are plenty of tables nicely spread out in the dining room, which is clearly popular with Singaporeans. The main menu covers a la carte dishes whilst the dumplings are ordered off a separate paper list (in English as well as in characters). The choice is somewhat carnivorous (lots of pork) and, regrettably, there is one offering with shark's fin soup but there are sufficient other dishes for pescatarians like me. The pastry is delicate, and the fillings generous and tasty and, if you want some greens, the kai lan is excellent. The shrimp cheong-fun is good but the sauce with the fresh scallop version works less well (too strong/sweet for my taste). The imported Tsing-Tao is ice cold, the tea very acceptable and the prices reasonable. Once your order is in the dishes come thick and fast so you may prefer to request your dim sum on a 'rolling basis'."
Excellent Dim Sum,"Came here umpteen times with family or colleagues for dim sum. Pricing is very reasonable and location is near City Hall and Bugis. Peking duck is highly recommended in which serving starts around 11am only.
All in all worth to make a trip down and try to make reservation in order not to wait too long for a seat."
Great Cantonese dinner,"Great Cantonese dinner with family and friends! The restaurant is packed we had to wait for 30 minutes for the table but the waiting time worth to try. Good food and impeccable service. I don't know the price because my friend ordered and also payed the bill

Definitely to try"
Top Cantonese restaurant for suckling pig,"Haven't had the Cantonese suckling pig at Asia Grand for nearly a year. Ordered one to share with family and friends for lunch and it remained as tasty as before.

The size of pig used was the right size to ensure maximum crispiness of the skin while the meat remained tender during the roasting process. Also the fatty layer beneath the skin was reduced.

The end result was thin and crispy pieces of suckling pig skin to accompany sprigs of spring onion and dollops of thick sweet sauce on steamed bite-sized pieces of circular flat breads. The chopped pieces of meat were juicy and tender to bite.

Asia Grand remains on my list of top Cantonese restaurants to enjoy roasted suckling pig in Singapore."
"Good food, interesting dishes","We have been with some friends/collegues recently to this place, we went there for lunch and we had a 10-course menu, among which typical Yee Sang Chinese New Year salad, abalone, scallop gratin, suckling pig, etc. The service was good and the restaurant is in a convenient location. Overall pretty good!"
Exceptional sweet and sour pork,"We accidentally found this restaurant close to our hotel and arrived quite late in the evening before closing time. We quickly chose a couple of dishes of which the sweet and sour pork was exceptional. I don't even recall ordering this dish as it often is prepared in a rather bland way. But this this was full of flavours and had great texture. I would like to come again and taste other dishes, too."
Very prompt service n good food!,"Hey, this place served up the dim sum within 10mins of placing the order! And it was a busy lunch hour on Christmas Day!

Impressive service. And they were running a promotion on Peking Duck (@$40/-). Good deal. The duck skin was wrapped and served on the table mid way thru the dim sum. Great!

Most dishes are good, and they have my fav 咸水角 (which they call ""delicious dumpling""!). Yummy!

Couple disappointing dishes, which I would skip next time: 小笼包 (dry, no soup), egg tarts (tasteless and the crust is flaky but oily).

Best dishes: steamed rice (盅仔饭), yam dumpling (芋角）and steamed pork ribs.

Overall, above average dim sum, like tong lok, and other hotel's Chinese restaurants (wan ting, tien court).

Price-wise, like most singapore nice dim sum, about $30 per head."
Acceptable dim sum,Came here for dim sum lunch this week with some colleagues. Generally ok selection of dim sum and reasonable service. Not too busy in the week before Christmas so no reservation was needed. Paid $85 for 4 people but wasn't quite enough for me.
Authentic Chinese Cuisine with a Diverse Menu,"If you want to find a not too crowded place, right within the city area (esp. if you're near Raffles Hotel or City Hall area) for some quality Chinese food, Asia Grand is the place to be, where I especially like it for -

(1) A good spread of Chinese food - ranging from the roast meat section, Peking Duck, various types of soup, poultry, vegetables, seafood (Think Chilli Crab etc.)

(2) Service is good - staffs are very courteous and helpful.

(3) Operating hour starts at 11 am - 2.30 pm for lunch, and 5.30 pm - 10 pm for dinner. Hence, you can come here for brunch if you're ok to have it after 11 am or just pop by for lunch or dinner.

(4) Location is very convenient - It is just across the road from the famous Raffles Hotel, and it is within 10 minutes walk to the nearest mass transit train station (City Hall) and also 10 minutes walk to the nearby shopping malls (Raffles City or Bugis Junction).

Restaurant address is -
331 N Bridge Rd, #01-02 Odeon Towers, Odeon Towers,
Tel: 6887-0010"
Best Dim Sum in Singapore,Everytime I travel to Singapore Asia Grand is a must for me. Make sure you don't go after 1pm because they can run out of certain types of dim sum. You will love the Peking duck or suckling pig. Those are always a must. Make sure you try this place its a hidden gem in the city. Its located right behind the Raffles Hotel.
excellent restaurant,"the restaurant has been around, with some of the older staff for a long time since its days at scotts road. the new location has better dining facilities. the old location was eventually rebuilt with a new apartment, hamilton scotts. had dined there for more than 15 years, never for once we were disappointed with the food or service. too bad this time around they didn't make it to the michelin books. They deserve better recognition in singapore. serves cantonese dishes and dim sum."
Worth trying the dim sum,"Attracted to this restaurant because of the Peking duck. I think this is one of the cheapest we can find in town (S$40). However, I think our duck was ""over roasted"", the skin was rather dry. But the ee fu noodles fried with the duck meat was nice.
The dim sum that we tried were generally good too. Service was prompt, restaurant is spacious. Nice place for a family gathering."
The place for Chinese food,"We were invited by a colleague of mine from our Singapore Office. Accordingly this visit was well planed and one of the hot spots for chines food in Singapore. The restaurant was predominately visit by locals (what a contrast to the Raffels). The Peking Dug was just great and very special. Great place if you want to test a broad variety of Chinese food...we had 8 (!) courses.....each to share, which is recommendable. Excellent food..we would come back..."
Asia (perhaps) grand,"We had struggled to find a place on a busy night, so the hotel concierge said try Asia Grand. He described it as Cantonese without fancy white tablecloths. This seemed to resonate with our needs. We had actually walked past it approx 2 hours earlier and were put off by the yellow curtains which seemed to be very unwelcoming. Why the privacy?

Once inside, it looked better than we had expected, fears allayed.

We ordered several dishes and our trepidation grew when the first 2 meals arrived, as both were not to our taste. Mistake - do not order off the daily special listing or chef's recommendations.

After the bad start, we were much happier. Very good diced beef in black pepper, lovely snow peas served with cashew nuts and a very tasty seafood fried rice.

Asia Grand satisfied our needs. Had we stopped after the first 2 courses, who knows?."
Love the Peking Duck,"This is one of my favourite placed for chinese cuisine in Singapore.
The Peking Duck is a must: very tasty and crunchy duck skin rolled into a soft wrap, all dipped into a very tasty sauce.
I also love the Suckling Pig and the selection of dessert."
"Horribly Expensive, BUT extremely GOOD quality food","As you mouth opens wide when the food comes, and your eyes pop out at the tasty dishes start coming to your table, so will your eyes and mouth open wide like a goldfish when the bill comes. But I guess it is the price you pay for (excellent) service, and (top) quality food. You cannot go wrong here. The crowd here is terribly large, so reservations are much recommended. But if you do not have cold hard cash, do have at least 3 credit cards. haha!"
Decent food and a below-average experience,"We had dinner with friends, a total of 8 adults and 4 teenagers. We ordered a set menu for 10, that was priced at $468++. After we ordered, they came back to tell us that they cannot offer one of the dishes with live prawns as they had run out of live prawns. So their alternative was 'normal' prawns and they can make a salted egg yolks prawn or wasabi prawn. We asked if we can have beef instead, but they came back saying it cannot be done. (Not happy!) We are stuck with their 'normal' prawns, from which we chose the salted egg yolks prawn. The prawns were soggy, and very disappointing.

I feel that they should have the flexibility of offering more alternatives when they run out of produce. Why should we be given inferior produce?"
Delicious Tim Sum at Asia Grand,Delicious Tim Sum at Asia Grand where they formerly from the old Asia Hotel. Price has gone up but still reasonable
Old school,"Fret not, if you're looking for an old school Cantonese dim sum. While the interiors are pedestrian, the food is worth shouting about. Wide selection of traditional favourites to choose from. I highly recommend the rolls of prawn and mango. The lotus leaf glutinous rice was decadently moist and bursting with the flavours of scallops."
Traditional Chinese,"This is a big restaurant and it is full with local regulars.

We have been invited here by a very good friend and enjoyed the Chinese hospitality. The Peking Duck is carved at the table and the meat in the noodles at the end of the meal was as delicious as the Peking Duck

There is plenty of fresh seafood, lobsters and fish, all kept in tanks at the one side of the restaurant

Here they serve as well more exotic dishes like shark fin soup, not everyone's taste I am sure but something I think is important to mention

Service is excellent and always there when needed

The flavor of the food is very good, no doubts, but we did have better in Singapore, that's why it is only 4 stars and not 5 stars...."
Value for money Peking Duck,"The peking duck @$38 is delicious and value for the money, you may also add $10 to cook the remainder of the duck for another dishes. Majority of the dimsum at this venue is tasty and worth a visit if you have tried before.

I must comment that the service is very attentive and the servers will change your plates when needed."
"Great dim sum, diligent service","We very much enjoyed our lunch, the service was extremely diligent, an empty water glass verged on impossible. The food was quick and extremely tasty, the steamed custard buns for dessert were mouth watering pinnacles of the meal.
Trying to find a way to get back as the pieking duck being served to other tables looked amazing."
Yum cha..,Simply love to yum cha at this restaurant. . Reasonable pricing for quality dim sum.. must try the peking duck for $38... Service is also good...
CNY lunch,Food and service were awesome. Staff was attentive. I like the Yu Sheng very much but didn't really appreciate the shark fin soup cause I feel too much egg rolls. Overall was great .
Great dim sum and peking duck,"We were here for their famous lunch dim sum. Ordered most of the items. Except for egg tarts, chicken feets and pork ribs dim sum, the rest of the dim sums are consider above average. Peking duck is a must order dish. Service standard is definitely above average. I will recommend a return visit to this restaurant."
One of my favorite chinese restaurant in singapore,Asia grand must be one of my favorite chinese Restuarant in singapore. It is owned by 3 brothers that had migrated to singapore many years back. The Cantonese food is very fine and yummy and it doesn't cost you an arm and leg like some others restaurant.
Awesome food and service.,"Was craving for good Chinese food and came here on a whim.

The Good:

1. Excellent service. The staff was super attentive and courteous and we didn't have to wait at all to get their attention for ordering, changing our order, obtaining their recommendation or having our tea refilled. Plus, a super warm welcome at the door. I found it particularly heartening to note that they had some senior staff working here, who've probably been around with the organisation for a good number of years. I suppose the quality they bring to service is markedly different from most other restaurants where you find young undergrad or poly students etc with no training or experience in the service sector.

2. Big broad menu.

3. Great food quality and 'china'- no pun intended!

4. Open till a bit later than most other places.

The Not-so-good:

I found the seating arrangement, with its big round tables spread all over the place as somewhat unwelcoming and suitable mostly for family and large groups. We visited as a couple and found there were no quiet 2-seated corners or nooks or smaller tables for couples or smaller groups. This is something the management may want to look into."
Number 1,"The service at this restaurant was amazing. The food, possibly the best Chinese food I have had in years. The Peking duck- 10/10."
