topic,review
Really Good Satay,Best Satay food joint is located in Lau Pa Sat. The setting on the street is quiet authentic with fires burning and various satays being cooked. We had prawn satays and they were pretty good. Nice place to go or dinner at night.
It really is the Best Satay!,"The name says it all! Some of the best satay we have ever had. Not the cheapest of street foods but definitely worth a visit. We had the chicken, beef and prawn and it was really good. Their peanut sauce was very good."
Lau pau sat hawker Centre,Awesome authentic Singaporean hawker Centre. Satay and fresh Naan bread was amazing. Cheap and good food
Best Satay? More of Tourist Best then authentic best.,"Back in Singapore as tourist, was looking forward for some great food. After googling found Best Satay Lau Pa Sat stall 7&8 with raving reviews. The buzzing street & flames looks great & felt Yes that is satay. but was disappointed with the taste when served with a sweet version of satay source, lack of authentic spice & heat, coupled with sweet satay sticks. The lack of contrasting flavours, was utterly disappointed, when spoken to the owner, she said is to cater for tourist taste. Honestly if visiting a country for their local bwest food & got a tourist version of 'local food', then there is no longer a need to travel across the ocean in hope to have the what used to be great satay!"
Delicious satay!,"Absolutely delicious satay! We had a mix of chicken & prawn which we're both great and loved the satay sauce. Really worth a visit, surreal restaurant, your sat on plastic pop up chairs and tables in the middle of the city with huge sky scrapers around you! Very reasonably priced!"
Great Satay,"Right outside our hotel, blocked off street and satay stalls as far as the eye can see.
Sat down with these guys and was not disappointed. 60 satay sticks for $42 dollars paired with a Cold tiger.. awesome.
Service isn't overly friendly but the food is great and arrives quickly.
Great spot and we will return."
Staff should have better service,"The Satay is the best in Lau Pa Sat, but the staff is impolite, the service should be improved. There are chicken, beef and sheep Satay, I like the chicken the most since it is juicy, tourists can order shrimp here"
Best Satay is right.,On the side of the famous Lau Pa Sat. This hawker stand is deservedly call Best Satay. Great really tasty.
Great value satay.,"We had our satay in a little side street ( closed off to traffic from 7.00 pm ) beside Lau Pa Sat. It was very well priced and the service was slick. 10 sticks each of mutton,beef and chicken and 6 of prawns for S$26. Atmosphere was fun and the Tiger girls running around selling handles and jugs of cold beer. Don't sit beside the cooking area as you will come away smelling like a satay stick !!! Sit further in and they will deliver to you and don't worry about getting your change it will come right back to you.
If you go ENJOY."
Satay heaven,'Satay Street' was right next to our hotel. The food is excellent but not inexpensive. The tables and chairs are somewhat old a bit grotty and cleaning them is not a priority. But the satays are simply superb. cheaper during the day than the evening. But the night experience has plenty of atmosphere as the smoke from the grills wafts over the crowd.
Lau Pa Sat photos,"I have written a review and uploaded photo's, but they didn't save so here they are again. Lau Pa Sat was excellent - see my other review."
Best Satay 7 & 8 - Great food but rude manager,"We ate at Best Satay 7 & 8 tonight. We got the chicken, prawn, and beef satay for $26. The food was great, but when I paid the waitress she didn't return with my change. I paid $51, so should have received $25 change.
After asking for our change and nothing happening we spoke to the manager. She just started yelling at us! She questioned whether we had in fact paid at all. After being told off for a long time, our $25 was finally returned. Unfortunately, my opinion of this place was already damaged by then. I have no idea whether it was an honest mistake by our waitress, or if she stole the money.
Please try one of the other stalls instead."
Sataylicious !,"A wonderful setting. Best to go in the evening when the road is closed and converts to an open air street food cafe. Ordered a combination of chicken and mutton Satays and they were delicious. Later saw the prawn ones which looked quite inviting. Supposed to be the best satays in town in a wonderful heritage location. Incidentally ""lau pa sat"" means old market - pa sat derived from pa sar in Malay or bazaar in Hindi / Urdu."
Best satay Number 6,I love their satay .. I tried others but I love this stall.... Is the best. my Favourite. The servers from this stall are also friendly and cheerful.
"Best Satay by name, best satay by reputation","Located on Boon Tat Street. Very tasty satay!! Comes in chicken, beef, mutton or prawn. Our favourite was the chicken, we went back for seconds and even thirds. The owner Ainon was very friendly and welcoming and very lovely to chat to. Would recommend this satay place out of any in Singapore. Has won some very deserving awards. Will definitely be back next time we visit Singapore."
Best. Satay. Ever.,"First visit to Lau Pa Sat, and can't believe I have been missing out on the most amazing Satay all this time!! When you arrive on Satay street, it's really busy. The stall holders all try and get you to buy from them - to be honest i was a bit taken a back by the experience initially as it's not something you regularly encounter in Singapore. That being said, it wasn't unpleasant and certainly wouldn't put me off going back. Some how we settled for a Best Satay and it was amazing. You sit down, tell the chap your order off the menu. We opted for a small (you can choose small, medium, large etc) which consisted of 15 chicken, 15 beef and 6 prawn which we swapped for chicken. They cook it, deliver it then you pay. We paid Sg$21 and it also came with 3 bowls of sauce. My only regret is that I had to share!"
Indeed best Satay,"How simple can it be? Eating in the street (that closes to traffic at night), just outside the Lau Pa Sat (or Telok Ayer Market), this simple food that is so tasty due to the seasoning, to how is marinated and how is grilled. I had the mix of prawns, beef and chicken and was so satisfied, but didn't resist for an extra 10 of chicken. The drinks are ordered to another stand that is always passing by the tables. Singapore prices."
Great street food attraction,"Located on the street between food court and Sofitel- packed. Lots of tourists, but also locals. Shrimps more expensive than beef/lamb/chicken. A little bit messy- you will not necessarily get beer before food. Anyhow, worth the experience."
Satay Galore in Singapore,"At the Lau Pa Sat alfresco area, you will find mostly satay stalls by the numbers burning sticks & sticks of satay for the big crowd of diners there. Competition is stiff and it is good for the diners who could have a choice of ordering from the different stalls. The satay sold are made of chicken, mutton, beef, big prawns and some other meats that have been added to the original satay. It is always advised to order from the stalls or kiosks themselves than ordering from their runners who are everywhere in the dining area promoting their food.

With so many diners eating satay, which starts after sunset, Lau Pa Sat has come to be known as a Satay Centre in Singapore."
"""Best Satay"" says itall","Our taxi driver dropped us off on the corner of the food market, on his recommendation.

We decided to walk around first to see what we liked, it was busy and every stall asks you to look at their menu, but didn't hassle us which was a nice change!

finally we decided on going back outside to Best Satay as it had the nicest option for us.

We enjoyed our meal and beers, nothing fancy, just satay meats.Lovely!"
Simply amazing...,...A street dedicated to Satay! I love always already the smell of the charcoal when you are approaching and then you have to decide between all the stalls... Tipp: Try them all ;)
Singapore time institution,"I've been coming to Singapore regularly and always visit Best Satay 7&8 at Lau Pa Sat on my first night to get a reminder of what this city is about.
Yes it's a bit of a tourist trap but the prices are okay the food is good and the beer is cold. And the buzz of the on street tables reminds you of what makes this city such a great food destination.
Augment with extras from inside the adjacent hawker market if you can't face a pure meat and beer rush. The Japanese stall just inside is recommended as are the roti prata.
You just have to do this at least one (every 3 months)."
Amazing satay,"Perfect street food, what more do you want? Lau Pa Sat is a great place to bring visitors as well. Highly recommend."
"Overrated, poor value","These stalls are a tourist trap. Satay are only OK, beef quite good, chicken and prawn dry and overcooked. No rice cakes served and bland sauce. Guys, you could do better."
Good satay,Felt pressured to sit down & order satay from the people walking around with menus. The satay is very nice & reasonable price.
Best Satay 7 & 8 scores a 10,"After multiple visits to Satay Street over the last 10 years there is no doubt in my mind that Best Satay No 7 & 8 lives up to its name. Consistently offering yummy Satay I always choose the combination with Beef, Chicken & Prawns. Matched with a jug of Beer (Tiger) it is an affordable and delicious way of enjoying some lovely food in a great setting. Not to be missed."
"""Tourist Hot Spot""","It's all about the tourist here... obviously full of tourists the place is a $$$$ grab for the shop owners although there was a few decent meals throughout.
High pressure selling, others trying to sell over the top of me whilst trying to make a deal and felt I was screwed over after agreeing to pay for Singapore Chilli Crab and ending up with plate of sauce with a large head shell (bigger than live one he showed me) a few claws and not much Crab meat anywhere...RIPPED!!!!!!!!
BEST SATAY'S 7 & 8 did great job for us outside on street and do look the best overall, although satay's I wouldn't rate near a 10 out of 10 their service was great and allowed me to go look elsewhere first.
A true experience which was great to see but couldn't say I'd rave on about it.
Prices seemed okay, food about average.
Close to city centre.
Is open late."
Amazing satay 7&8,"The best satay is outdoors at the side of the food court where they cook on open barbecues. Make sure you eat at 7&8 this is the real authentic secret recipie satay where you eat outdoors sharing a platter of succulent meats chicken, pork and langoustine marinated in the satay sauce with extra dip all washed down with a jug of tiger beer.
Beware inside you will find touts asking you to sit and they will bring you food from 7&8 they will bring you food but it's not from 7&8 and you will pay more money, so make sure you are outdoors in front of 7&8 where you can see them cooking."
The Satay was not good,"There are a few stalls there and the one I tried, I think it was #4, was not good. I was approached by the stall workers.
I would suggest trying a stick of satay from each stall to decide which is the better one before settling on one."
Over rated Best Satay Stall 7 & 8!,"I travel to Singapore on a regular basic and never skip my favorite satay.

I must say this trip, the satay were a great disappointment. Firstly, the prawns were cold and so were the chicken. The chicken were not well grilled. I guess they were overly busy and did not pay attention to the quality of the food served.

Next time, I shall try the other stalls instead..."
