topic,review
"Top quality bar, top quality vibes and top quality service!","I booked the second floor of blu jaz for a party and everything was amazing! Have been a long time fan of Blu Jaz and its sister outlets, and booking the venue for a party did not disappoint. The second floor was beautiful, with a mishmash of quirky decor pieces and furniture which gave a fun, cosy and bohemian feel. Anuj, the event manager, was very efficient in answering my queries and giving me advice on everything from food, drinks and even to decorations and table arrangements. The floor in-charge for the day of the party, Pawan, and his colleague were excellent and ensured that my friends, family and I had a perfect party! The food was, as usual, amazing, and the venue was perfect for hosting a large crowd. Would highly recommend Blu Jaz for hosting private events. It is a unique venue one-of-a-kind in Singapore and would definitely impress friends!"
Top Jazz Venue,"I’m not an avid jazz fan, but I do love good live music of ant type. Friends go here regularly, and had a suspicion that some big names might show. Sure enough, Wayne Tucker, the New Yorker trumpet virtuoso arrived and played an hour long set.

The venue is smallish, with space for about 50 inside, and seating for another 30 outside. Good service."
Blu jaz vibe,Blu jaz is always popular with a lively atmosphere. They have a very good selection of both food and drinks. Happy hour is late afternoon to early evening. The grilled salmon and chicken satay sticks are very good. Well worth a visit.
Ok for happy hour,"I understand people tend to go here for the buy one get one free happy hour drinks and it's handy for nearby offices.

Service is slow, inattentive and very disinterested. Food is poor...we had satay chicken, wings and fish gougons ..all overdone and fried to a crisp. Salmon also overdone though I requested it done medium rare. Poor selection of veg..squash and eggplant?! A tiny scoop of potato. Not enough pita with dips. Here with work colleagues. Would not recommend for food.

Screens for the World Cup cannot be seen when it's raining."
Good value,We ended up at Blu Jaz by default as it was near our accommodation and we were late getting out for dinner. Good service and great variety of meals. Prices a welcome relief from the expensive restaurants closer to the river. The only negative was being right by a busy road but overall was a good value and enjoyable meal.
Great place for events,"Hosted a private event at Blu Jaz Cafe Level 3. Anuj, the events & marketing manager was very prompt answering all my queries and gave me a tour of all the suitable event spaces. This helped me decide which event space to use. On the event day, the staff were attentive and helpful. The event went smoothly and the guests had a good time. The buffet was a nice mix of Mexican,Mediterranean, local & Western dishes. Anuj had the place nicely decorated with balloons. Will recommend your venues to my contacts."
Great place to chill,"Great atmosphere, gives a entirely different feel of being in Singapore... there for a friend’s birthday celebration. There’s happy hour price for the beer, Tiger Heineken before 8pm.. we ordered sambal fried rice, yummy... chicken chop never goes wrong.

birthday girl and I ordered marinara (tomato seafood pasta) but it’s way too salty, and just that few pieces of seafood? Fish and chips were decent.

Great place if you just want to sit back relax and enjoy, chilling with friends with a bowl of Tapioca corn chips with salsa dressing (you can ask for more as they only gave so little), what a good way to end the night... cheers"
Not happy!!!,"I'm a local resident who took my husband to this bar for the first time. We were very disappointed! We ordered the chicken skewers,which we have eaten all over the world. The skewers which were 10 for 10 dollars were barely one bite each in size,the satay sauce was oily and not suitable. Skewers should be at least four time this size for the same price. The cucumber which came with it, only had four tiny pieces for ten skewers, ridiculous! The garden salad we ordered, for 9 dollars, which was just a few pieces of lettuce leaves and 1 cherry tomato cut in half, again ridiculous! Then, to top it all off, we thought as we were on holidays we would have a cocktail. We ordered the long island ice tea which we have also had enjoyed in many places around the world. The long island ice tea at $16 SGD,was the worst ever in history of cocktails! It was watery and made very badly. When we told the staff and the owner, they simply didn't care and they didn't do anything about it. Take our advice, do not waste your money here, choose another more deserving bar or restaurant in this area. They surely have no idea about global hospitality and they missrepresent Singapore tourism. Do not go there. Even a hawker centre/ food court would have replaced the food/ drink if it wasn't made correctly. Stay clear of this one."
"expat, white","If you're a lonely expat worker, far from home, then this is your community centre where you will find other lonely expats. But if you're local, you can really bad service and perhaps no attention at all. Forget about this place. Let it rot."
Good food / good price,"Good ambiance, good food, fair price. Try pasta ail oil with sea food. Perfext level of spice thai sauce."
Great atmosphere,"Called into this great spot for a light dinner and drink, located in a Bali st, this place was pumping. The service was great and staff were very friendly. We had the platter of dips and bread very nice and reasonable . Would recommend to anyone looking for a relaxing place for a drink and snack or 3."
"If you love Jazz,street ambience and buffalo wings..!","Super busy on weekend,I was lucky to find a table. Order 2 bottle of French red wine ,repeat buffalo wings order..good crowd ...great music..

Only downside...1 toilet for about 30-40 peoples... a bit too much.. would be better to have 2 at least separate male and female.."
A great night out,"Wonderful atmosphere and an interesting area to enjoy a meal in. A refreshing change after eating in hawker malls and food centres. Food, drinks and service were all of a good standard"
Surprisingly ok,"When my friend suggested dinner at a music venue, I was a bit hesitant. Really? But it actually turned out ok. Food was hearty, tasty and very reasonably priced. Nice place for a casual dinner. We were seated outside, which looked more conducive for dinner as the inside looked a bit dim."
Good food with great atmosphere,Blu Jaz was just up the road from us and packed every time we went past it so thought we’d give it a go. We sat inside but outside on the sidewalk was a bit more happening. We ate too early for the live music. The prices were really good. Not massive meals but they still filled us up. My husband loved the Cabonara and the Salmon was great too. Great atmosphere inside and the service was good and really quick. We will be back.
Party Function,"A cool place to hold a cozy farewell party. Good food, friendly management and nice ambience! Love it!"
Wonderful ambience!,"Bali lane is one of the my favourite places in Singapore especially on a Friday evening!
This place sits right in the middle of the lane and ambience is just amazing.
With jazz music and your favourite mediterranean food to go with, nothing much can go wrong."
Wonderful atmosphere,"What’s not to like? Perfect setting amidst the hustle of the Haji Lane area; excellent, efficient service, live music, and reasonably priced."
Company dinner,"Excellent service, Good customer service. Not forgetting their manager Mr Anuj who tends to all my queries. Relax and Chill atmosphere. Highly recommended"
Relaxed beer and jazz,"Don't know about the food, but people looked happy. I like the place for the great relaxed atmosphere, good beer, good service and live jazz. If this is your thing, you will love this place.."
Casual drink after dinner,This venue is a great place to enjoy after dinner drinks outside while listening to live music. The staff are very helpful. They had 2 for one drinks until 8pm. It’s located in a colonial style building which adds to the atmosphere. The bar is in a lively area near the sultan mosque. I would thoroughly recommend tourists visit this area for dinner and drinks. I came here in the day on a previous occasion and it lacked the atmosphere.
Amazeballs!,"The best place for everything. With friends, colleagues, dates, you name it. They serve great food, great drinks & great smiles. You have never lived if you have never chilled in Blujazz."
Sunday Jamming Session and a Cold Tiger Beer... Just perfect.,"I am a lover of Jazz and so when in Singapore a visit to the ""Blu Jaz Cafe Bar"" in Bali Lane (Kampong Glam) was high on my must do list. I managed to get to the late night Sunday Jamming Session and it was great... The musicains were on top form and the Tiger Beer was nice and cold. The decor and ambiance is as groovy as the Jazz... Highly recommend this to any Jazz fan."
