topic,review
Great dinner with friends,"I’m came by this churrasco by the recommendation from a work associate, and it really is something.

I will not tell you how much this space is great in a very special kind of way.
I will not tell you how the atmosphere is very friendly and perfect for family and close friends.
I will not tell you how rich is the buffet and diverse in all kinds of salads.
I will not tell you about great staff who will bombard you every two minutes with the grilled meat of finest quality.

I will tell you how you can get all this for 50 Singapore dollars (plus the cost of drinks of course)!
Which considering the amount and the general high prices which you will encounter as tourist in Singapore sounds like too good to be true.

The only drawback, if I have to say one, is the outside location/neighborhood where this hidden gem is located. It could be far better and some people will be thrown back by it.
(That’s why it’s lacking that fifth star)

But maybe that’s not such a bad thing after all, I mean if it was too visible and shiny then it couldn’t be our hidden little gem."
My only Choice for Churasco BBQ,Me and my family often come here and this time i brought my Nephew and kids. Had a good time. Fresh cut of meats and very gd Service. There is a Valet Service as well and i do advise to use it as parking is minimal around there. Priced Reasonably and from all the Churrasco out there. This Restaurant is tge best of them all. Highly recommend it.
"Amazing experience, can't fathom the complaints","This place is the best Brazilian buffet style place I've ever been anywhere in my life. I may actually go so far to say it's one of my favourite restaurants in Singapore.

The food is incredible, I don't know what they do to their meat, but it's indescribably tasty. Similarly, the server lads are super, super friendly, and I particularly love the one guy who is always grinning slyly everytime he tempts you into taking some extra beef or whatever, with his wonderfully encouraging, devil on the shoulder demeanor. I honestly can't speak highly enough about this place.

I've been here so many times, with so many large groups of people, every single one of whom loves the place. It therefore actually angers me reading the negative reviews that are on here. It's a nonsense, this place is absolutely wonderful and you should go."
Know this place over 20 years and i was never disappoint,"This meat restaurant maintain their popularity for many years. Excellent grilled meat, very good service and nice atmosphere. Always great to come back."
Birthday Dinner,Well I heard much about Brazilian food this evening friends wanted to take there son out for his birthday. Must admit as a meat eater from Louisiana it was not something I really really enjoyed. Would I eat here again? Only if friends wanted to come.
They'll meat you!,"Visited this place with family for dinner buffet for S$50 each. The way it works is that you help yourself from the salad buffet which is good but not too exciting. Then the waiters come to you with different meats on large skewers and slice off pieces onto your plate. They bring tons of smoked duck, fish, chicken, a variety of beef and pork. All the meat items I have tried were really good. They also serve flambed pineapple, sliced off the skewer just like the meat - it's also very good, especially to finish off your dinner. Service was great and very friendly."
A genuine experience with excellent service,"For those of us who have had Churrasco at restaurants a little closer to Latin America, the seasoning and preparation may seem a little off. However, it’s a genuine experience and the meat tender and flavorful. What takes it to a full 5 stars is the value, the service (best we’ve gotten in Singapore thus far) and a bonus for us in that, per the restaurant staff, the chicken and beef are halal (the restaurant itself is not as it serves pork, but if you inform them in advance, they won’t offer it at your table)."
"The Original Brazil, and the Best!!","Have visited this restaurant since 2002 every year on an average of about 5 times a year. I think the record is ten times a year in one or two of those 15 years. Why do I keep coming back? The food is excellent, that is always important, but to me, especially through aging where I cannot eat as much as I used to, the staff are equally important. The staff treat you like friends instead of customers, and there is genuine warmth in them wanting to ensure you have the best possible experience. They get to know you and they often recognise repeat customers and great them like buddies. This is the restaurant which I often use to host friends as it has fantastic ambiance. They opened a branch at Gilman Barracks a few years back but that didn't work out. I have also tried other restaurants with this same concept but they don't measure up. So it will be, for many more years, me being back at The Original Brazil Churrasco at Sixth Avenue, because it is the best."
Great Food all you can eat!,"I have reviewed before and nothing has changed except perhaps got better. Fabulous Salad Bar, far more choices than usual. Staff are so very friendly (They need to be, their knives are so sharp!). The meat! Oh the meat! Here is not a suitable place for a vegan. Comes out on spits carved directly onto your plate and it keeps on arriving. Beef Lamb Chicken etc etc if you like meat you will most certainly enjoy, combine it with a selection of their very excellent wine.
My tip: Do not eat anything for a least 12 hours prior."
Best churrasco in town!,The Brazil Churrasco is by far the best churascaria in town. We love to eat there! If you enjoy meat this is the place to be!
Reasonable price and food,Treated my husband to dinner at the restaurant. Service was excellent. Salad bar was well stocked and food was good. I like the beef short ribs and grilled chicken especially. The waiters also sang a birthday song in Portuguese for us. It was a great experience!
"BRAZIL CHURRASCO, SIXTH AVENUE, SINGAPORE","This restaurant is popular with local crowds and serve WESTERN food. The salad is BUFFET style, whereby clients choose the selections of veg from a round section os serving table. The quality of the greens is good and the choice acceptable. The dinners will be offered a small cup of soup of the day. The main course are mainly MEAT (CHICKEN, LAMB, PORK, BEEF, CHICKEN LIVER....) being served via waiters. The serving is repeated, and clients can eat as much as they want. The quality of the meat is acceptable. The wine list is acceptable for normal dinning. Service is good. Seating arrangement is a bit crowded; as the restaurant has limited space. Prices is acceptable. Location is slightly out of the city, but can easily reached by most type of transport. A good place for a mid range meal."
Best Brazillian restaurant in town,"The location of Brazil Churrasco is a little far if you're staying on Orchard but it is well worth the cab ride, not so easy to get a ride back though. The staff seated us very quickly. The restaurant is very clean and not too noisy for the amount of waiters serving. There is a great salad bar but don't eat too much because there are so many meats to choose from. Don't miss the Caipirinha cocktail. Putting it all together; the ambiance, the staff, the delicious food we will definitely return."
Bring an empty tummy,"The meat is cooked beautifully and with fatty, lean, spiced, plain all available,so depending on your palette, there is something there for you.

The only disappointment is the salad bar, it was a little like 'why bother' as the offerings looked as though they had been done under sufferance and with no real effort....they were just as they looked to eat as well!

however meat is the star and that was brilliant...highly recommend it."
High quality!,"We've been visiting these places from Brazil to Dubai and everything in between, so our expectations are usually high.

This place was very good. Service was good, the buffet was good, but not too good, so you could really enjoy the meat.

Service pacing was ok, a bit fast, but again not too fast. They dont provide red/green tags, so everything is offered, but it didnt get pushy.

Quality of the meats was exellent. From chicken to Picanja it was cooked to perfection.

Price is desent, compared to the quality of the foods and service its cheap!

High reconmendation for everybody familiar with the concept."
Lunch,As good or better than any I have been to in South America. Huge salad bar and so so much meat how on earth anyone manages the complimentary ice cream for desert is beyond me. Make sure you are hungry before you go. Worth to visit. Sin $15 from downtown by taxi.
Decent Atmosphere but pricy,"Servers were quick to fill your plate, and they were polite and professional, but it seems to me as they were being polite and professional for the sake of it. With regards to the food, except for the chicken and fish which i find it ok, the rest of the food seemed a bit salty. Even the mushroom soup tasted salty and the cup that holds it is only as big as a wine cup. I have been to neighbourhood western food restaurants and their soup is a lot much nicer then that. I have not tasted brazilian cuisine before, so i am not sure are they really supposed to be a lot more saltier?

The salad, however, was a 5/5 for me which is why i rated food at 4. They have rice, fruits, Fries a lot more and overall, in comparison to other buffets i have been, the salad offering is definitely on par with some of the good buffets i have been. The place was filled with 90+% capacity, ambience is ok and if you would like to celebrate birthdays and stuff like that, i guess its fine provided the price range is ok for you. I do think the price is more on the expensive side though, like low high range."
Best mix of meats and greens,"We arrived very much earlier than our reservation had stated, but the manager welcomed us with open arms. The buffet of salads was a very pleasant surprise, and is bound to please any vegetable lover! The variety of meats was also another pleasant surprise, and the waiter who explained how things worked and the several meat cutters were very friendly and patient when interacting with a first-time customer like me. Just a little note - one should definitely visit this place with a very empty stomach... there are up to 14 types of salad and 10 types of meat waiting to be savoured. This is definitely a place worth returning to!"
Best churrasco in Southeast Asia,"Authentic Brazilian churrascaria in Singapore - great food and great service. Welcomed by a lady staffmember and promptly seated. Went for the $49 all you can eat deal. The buffet has typical Brazilian dishes like aipim frito (fried manioc/cassava) and palmito (hearts of palm, nicely grilled instead of cold). Farofa, feijoada, and caldinho available upon request. Then the meats started coming, including the star cut - the picanha, perfectly salted and grilled Brazilian style with a nice, smoky aroma. There is a reason why churrasco in Brasil is the paixao nacional, national passion because there is an art to grilling the meat, turning it to achieve the perfect temperature. Other cuts were equally delicious - maminha/alcatra, costelinha de boi (beef shortrib), picanha com alho (picanha laced with garlic), coracao/chicken hearts, etc. Pao de queijo was served on the table and two sauces - vinagrete and a sweet mint sauce (presumably for diners who prefer it for their lamb). They even have Guarana Antartica! Excellent service by the passadores/staff including the carioca Brazilian gentleman. The music coming through the soundsystem started off with Spanish guitar instrumentals (including a version of Manolo Escobar's Y Viva Espana) when they first started the dinner service, gradualling changing to Brazilian music including bossa nova (we heard Agua de Beber). Highly recommended, o sabor do Brasil em Cingapura, the taste of Brazil in Singapore - imperdivel - not to be missed - as they say in Brasil"
Superb!,"Was in Singapore to watch ""Air"" in concert on Esplanade with wifey. But we decided to go couple of days earlier and have some Singaporean dishes. Had an idea to have a nice ""meaty"" dinner, so we browsed the internet and found this ""Brazil Churrasco"" place.

First I tought it's a little expensive for a dinner... but when I sat down they just wont stop delivering great food to the table. From Beef Tenderloin, Brisket, to Roast Duck, in total 14 dishes if Im not mistaken. Great Food!

Loved the Tenderloin, Lamb Shoulder, Roast Duck, Chicken Liver, my wife was crazy about their Pinnaple Roast.

Staff was amazing, service was on point, ambience is very nice it's not to stiff like fine and dine spot, but it's not crowded like food court.

It doesn't end there, we had a smoke outside to let the food digest, since it's a LOT of food we ate. So the owner ""Martin"" was smoking outside too, we had a nice chat....
..
.

And our night ended with Martin took us to an authentic Singaporean Bar down at Far East Plaza. Cool guy!"
"Not as good as it used to be, service standards still great","We've been to this place several times over the past 11 years. It's probably the longest surviving and best Brazailian style churrascarria restaurant in Singapore. It's still reasonable value by local standards (the all the meat you can eat buffet is S$49), and they will overwhelm you with meat while you're there. The service standards are really good by local standards. The staff are friendly and very attentive. That's the good part.

So what's the downside?
1. Drinks are starting to get pricey. The Caipirinhas (about S$15 each) seem to have shrunk a bit, and the glass seems to have far too much ice in it. They don't seem as potent as they used to be either (in the olden days back in 2006 two of these would almost knock out the average Singaporean). Still nice, bit not as epically great as they once were.
2. Over-emphasis on less expensive cuts of beef (still nice topside). They only brought us tendeloin/fillet once towards the end of our meal. I don't recall any pork being offered even once.
3. The desert helpings are tiny for the (high) price and they are not included in the buffet.

So, by Singapore standards, I can still rate Brazil Chuuascaro as ""Very Good"" whereas in the past it was ""Excellent"". The service is still excellent, but the food and drink while still acceptable have declined.

Top Tips:
Don't pay for valet parking. Park across the street in the underground car park beneath Guthrie House. Don't bother with the desserts. Expensive drinks."
"True to their stellar reputation, they delivered a brilliant evening.","My partner loves meat, so for his birthday, I thought of bringing him for Churrasco. At first I made a reservation at another Churrascaria restaurant in town, which I've been to a few times. Yet after reading up on handfuls of average or poor reviews of them on this website, I found Brazil Churrasco and visited for the first time this evening!

True to what others have said about the wonderful service, most of the service staff and passadores were friendly and smiley. One lady staff, Maya, who got us seated was very attentive to us. After knowing that it was our first visit to the restaurant, she gave us an introduction to the menu and the extensive salad bar. When I checked the salad bar out, she was there to point out highly recommended dishes and what Brazilians usually have (Garlic rice and beans) I'm just an ordinary guest, but her service made me feel very special.

Other Passadores were also very personable. When I told one of them I was saving my stomach for medium rare meat, it came out almost instantly. When I nodded to one of the server's question about having more pineapples, it came in a snap. These people work very efficiently in a team, even though they do not seem to exchange much words with one another. Tikki, a cheery Brazilian passadore, brimmed with pride when we asked him how long he had been working with the restaurant. ""22 years!"" he chuckled as he went on to serve other guests, flashing his two rows of white teeth all the while. Aeson, a filipino passadore, also chatted with us like old friends.

The salad bar has an extensive range of vegetables from broccoli to fritters. My favourite is the fried kai lan, garlic rice and beans and the banana fritters.

Additionally, the cheese balls were PHENOMENAL and so were the glazed pineapples . A myriad of meats were served- chooks, beef, duck, pork sausages and ham. I'm no rotisseri connoisseur but i found the roasts to be well-salted and nicely done. Beef is my favourite and it was sensational.

To end off the scrumptious meal, we had lava cake. The vanilla ice-cream was very good and so was the moist chocolate cake.

From the service, to the variety and quality, this place makes every dollar worthwhile. Thanks guys, I'll definitely come back! :D

We went there on a Tuesday evening."
Best Brazilian Churrascaria in Singapore,"I have been to many churrascarias, both in Brazil as well as in the US and in Singapore. This place is the best one in Singapore and beats Carnivore hands down. The meats are fresher and better tasting and the service is great. The caipirinhas were nice and the salad buffet had enough variety to complement the several meats that the servers brought to our table."
Just average,"I'll start if by saying the service was really good. The majority of the meat however is just average, and over salted. Perhaps coming from a part of the world where the meat is of high quality my expectations were too high. The pork/ham came off a round processed roll not leg ham. Poor quality cuts of lamb and beef except the beef rib which was good and tenderloin was ok. Chicken was 90% bone and the fish was almost inedible. We have been to many Brazilian BBQs joints around the world and this falls well short unfortunately. Not bad just not great. Harsh but fair"
Meat lovers,"If you like your meat and visit or life in Singapore, this is a must visit. They have a nice salad buffet. And the servers come ate your table with big pieces of meat and slice parts directly on your plate so you get juicy meat. Think of pork, sirloin, chicken, lamb and so on. The sugar pineapple is nice ending to a great meal!"
Excellent !,"This is a restaurant I can strongly recommend. The service, the atmosphere and of course the food. Excellent all of it. The price is what to expect, average Singapore.
It's a bit far away from Orchard road and Clark key, but there is a few taxis in Singapore, so that is a minor problem. The only thing you shoud be aware of, do not go into the "" salat bar "" trap. Bon apetit."
A lovely experience,"I went with my family of four after we had been recommended by my father's friend. A lovely ambience. Staffs were friendly. Excellent service. Location is a little far from Orchard Road. There were a variety of meat and were delicious. But, pork hams were okay and chicken livers tasted weird. The little cheese balls were great as well! Will definitely visit more! :)"
For Beef lovers away from the tourist sites,"Located In 14/16 - 6th Ave - about 10 min from Orchard by Taxi (only 7 to 8 USD)

Nice simple restaurant with a buffet style menu - take the salad from the salad bar as well as the potatoes etc.

served is a small vegetable soup - very tasty (can have second one without extra charge), thereafter the waiters pass by frequently with all kinds of BBQ meat - Lamb, Chicken, Beef, Pork all in various varieties.

Actually it is impossible to leave without having enough.

No fresh fruit juice available, nice desserts like chocolate lava cake or banana with ice cream.

The waiters are very friendly and serving with much attention.

Prices are reasonable

Can warmly recommend this restaurant - the food is really tasty!"
Awesome food and great service,"The meat cuts are great choice and the salad bar with great selection of healthy food.
Ever smiling staffs that alway make me and my group feel right at home.
A place you wanna be to enjoy the meal and friends"
Date night with husband,"Was warmly welcomed when arrived, amazing food salad bar was good but the meat is the main and it was delicious. The wonderful staff are super attentive and always make you feel you're in a Brazilian atmosphere. Will definitely come back and recommend."
Great food and service,"Such fantastic service, so well explained and looked after. It was really impressive. Food was GREAT! A lot of food..... but the variety was awesome."
"If Churrasceria in S'pore, than only these one!","Located away from touri hotspots, at 6th Avenue, we found our place for meet!
For many years, Brazil was and is a must!
Fresh beautiful food, high quality, thats it.
Friendly staff is providing perfect service and let the guests enjoy the stay.
So do not try others, go there..."
The best Brazilian BBQ in Singapore,"Being from southern Brazil I have had BBQ almost at least twice a month over my lifetime. Tell you: This is the closest to the real thing you'll get in Singapore.

The variety of beef isn't what you should look for. The quality of what they offer is the the big attraction. My favourite is the hump, which is better than in most Brazilian places. The black beans (Brazilian staple) are also phenomenal. Courtesy of the resident Brazilian BBQ master and the lovely team that makes everyone feel welcome."
Birthday Dinner,"First time I have been to this restaurant for a long time and I was not disappointed. Service was good the food kept coming.

Meat was very good and the house wine reasonably priced at S$55. I would definitely recommend this restaurant if you want to have a meat feast.

Paul's Restaurant Rating
Rating 1 - 5
1. Disaster will never go again
2. Poor, likely will not eat again
3. Average, nothing exceptional
4. Good, will come back
5. Excellent, love this restaurant.

Ambience ⭐️⭐️⭐️⭐️
Menu Selection ⭐️⭐️⭐️⭐️
Service ⭐️⭐️⭐️⭐️
Food Quality ⭐️⭐️⭐️⭐️
Portion Size ⭐️⭐️⭐️⭐️⭐️
Value for Money ⭐️⭐️⭐️⭐️

Average Rating: 4.2"
A Carnivore's Delight,"If you are a meat lover like me, look no further... skewers of meat cooked to perfection. Well seasoned, char grilled and yet medium rare... Super scrumptious!

My fave dishes include Topside, Rump steak, Garlic beef and chicken hearts! For a fixed price, you can have as much meats as you can handle plus a good buffet spread of salads and sides!

Save room for dessert, which for me is the grilled pineapples! So sweet and so good!"
Focus on the beef,"Generally it's a decent experience for the price. Obviously they start with a big piece of chicken first (you can't take a small piece, so it's best to pass). The beef comes later - they have five different types of beef, and it's best to take as much as you can as it won't come back. While they have to turn a profit, it would be polite for the beef to come back some of the time. Perhaps I was disappointed because I had high expectations but I have tasted better outside Singapore. There's a good salad bar though. The low ceiling makes it deafening when the restaurant is full."
"Consistent quality, simply the BEST churrascaria in Singapore!","My whole family has been a regular here at Brazil Churrascaria since 2009. Everytime we have birthdays or overseas guests, we bring them here. From then until now, this is still our favorite! We did try other churrascarias but they're not even as close as this. Even our American friends agree this is one of the best churrascaria they've ever tasted. Selections at the salad bar are HUGE, it can satisfy both Western & Asian tastes. Try the banana fritters, Mango salad, fried baby spinach & other spicy mixed veggies which we never found somewhere else. Beware though: the sald bar can fill up your stomach before the meats come! Picanha is still our favorite from the meat selections, but the chicken heart, garlic beef, smoked duck & tenderloins are AWESOME too! Keep up the good work!"
Unexpected Churrascaria,"Sixth Avenue Singapore isn't exactly where I'd have expected to see a Brazilian Churrascaria, but there it is and has been there for over 20 years (apparently).

It's not quite São Paulo's ""Fogo di Chão"" but it does a great job of bringing out course after course of succulent meats, carved from the skewer, straight onto your plate.

And having taken a vegetarian with us (I know, right!!) she was pleasantly surprised to find a lavishly stocked salad bar, overflowing with nice little surprises like seafood of varying types.

It's not fine dining, but for a great night out with friends and a very enjoyable meal, we'll be going again."
Maintaining a high standard for years,"I always find that it is one thing for a restaurant to serve amazing food, it's another to keep doing it consistently. My first visit to Brazil Churrasco was 20 years back and my latest yesterday. The consistency in the quality of meat and the standard of cooking is what keeps me coming back. Never fails to disappoint."
Great Meat,Everybody knows Brazil Churrasco is one of the better Churrasco restaurants in Singapore. I would only like to suggest they train their servers to treat everyone of different races equally.
Delicious brazilian style place,"We had dinner with friends at this place, and it is a traditional Churrascaria. I have been to many brazilian restaurants, in Brazil, Mexico, the US and other LA countries. This is the good stuff, it has a salad table where you can balance your meal with vegetables and other kinds of food, on top of the different kind of meat served by the passadores.
The only reason it does not have 5 stars is that they do not have all sorts of meat. Don't get me wrong, it is enough and the meat is high quality.
We had a great time!"
