topic,review
Ronaldinho Approves!,"If all brazillian food tastes this good, I might be missing out in life. With Brazil Churrasco located at Sixth Avenue, it might not be necessary to hop on-board the next flight to Rio. Excellent variety of beef cuts and other choices of meat like chicken and smoked duck. Beef hump was very tender and beef topside was juicy and lightly marinated so you really get to taste the flavor of the cut. This buffet meal is inclusive of a salad bar. Pineapple was lightly seasoned with cinnamon and sugar glazed, very beautiful and enjoyable. Overall fantastic spread."
A sinnful feast!,"No matter how hungry you are or how much you like meat, this place will totally change your perspective about what ""too much"" means! With about S$40 per person you have unlimited portions of good meat (all possible kinds) and an ala carte buffet with complimentaries. For dinner, try around 6-7 o' clock, it's the best time!"
Excellent,"True Brazilian environment. Great meat, great service and for Singaporean standards fair price. Their Picanha was especially good and so was the caipirinha."
Great for meeting loving family,2nd trip here and just as good as first. More than enough meat and a very decent salad bar too. Ate far too much! Friendly service. Will be back.
meat lovers,need to go if you love meat. nice Brazil restaurant in Singapore. good service. have also a salad bar. and is al you can eat.
Still the best of all the Churrascaria in SG,"I've been coming here since I was 19. It still is the best of its kind of restaurants here in sg. The meats are delectable, the pineapples are always charred just right, and the chicken hearts are little salty charred explosions of flavour in your mouth. The service and excellent and friendly, and their Caprioska are perfectly made. I've been to some of their rival Churrascaria, and although the salad bar pales in comparison cos it's so small (who has salad at these places anyway??!?), everything else is at least 80% better quality. Choose Brazil, nowhere else."
Not just for meat lovers,"Yes, of course they have a great range of meats sliced straight from the skewer to your plate (most delicious rump steak, smoked duck, chicken and more). But I was surprised by the quality and range of the salad bar; I could happily dine on that alone.

I'm sure I visited many years ago, but it feels as fresh and friendly as ever (seems to have had a good refit/renovation in the meantime). The buffet style makes it any ideal venue for friends or colleagues to meet as you can dispense with all the fuss over menus and ordering and get straight down to enjoying yourselves."
Great food and Great Service,"A lovely night out, the food was simply superb and there was a lot of it. I would go back for the salads alone. Although the meat was superb and definitely the highlight. The service was fantastic, this is after all what makes a great meal a terrific meal and here it is done effortlessly and with a smile. We will be back the next time the carnivore in us needs feeding."
Best Churrascaria in Singapore,"Having Brazilian friends, we tried all of them in Singapore and this is surely the best and most authentic one. So now we only visit them when in need of real meat and Brazilian food! They have the best tasting saucy meat, so much choice and coming no stop. The buffet area is also very nice and with much variety to chose from. The waiters: I think they're the best in Singapore, so friendly and smiley, they always prepare for me a more ""well done"" meat when coming to serve it, it feels so nice to be pampered in a restaurant! Thank you guys! The menu has a fixed price and includes the buffet, the meat, some super nice little cheese breads with sauces and a little cup of soup. Don't forget to leave a space in the stomach for their grilled pineapple which is absolutely delicious! Highly recommended!"
Meat heaven for carnivorous,"+ wide variety of cold and hot salad
+ serving up to 10-15 different cuts of meats ranging from beef, pork, chicken, lamb and duck
+ don't forget about their barbecue pineapple, a must!!!
+ friendly Brazilian passadores (meat waiters) coming up to your table carving sumptuous meat
+ request more of your favorite cuts of meat to be serve to you
+ don't forget to try one of the classic drinks caipirinha like a true blue Brazilian

- limit parking space in front of resturant
- don't risk walking in, best to make reservations"
