topic,review
A carnivore’s dream.,This is indeed a different dining experience. Free flow of meat delivered to your table. A carnivore’s dream. It wasn’t terribly busy so we could enjoy the service. The salad bar is self service.
Brazil 🇧🇷 in Singapore 🇸🇬,"First time trying Brazilian here in Singapore! Made a booking quite easily through the linked Apps ! It was my son’s birthday and they included a lava cake for the celebration! The salad bar was free flow and at your own pace … was a great selection including banana fritters , beetroot, coleslaw and many of my favs! The BBQ meats came in fast and furious and the beef (many parts were served like back, shoulder, rump , etc… was excellent 9/10 ! The rest of the meats were also good though the sausages became hard after a few minutes ! Cost 68 per pax buffet , wine is buy one and your own is free corkage , parking also free after 6pm just around the place ! Overall a good experience!"
Not recommended.,"Very bad experience, a very noisy place where the communication between us was nearly impossible. Meat nothing special and salad bar seemed not very fresh…"
Always Great,"I think this was my 5th time here and once again a fantastic evening. Great that now that COVID is over the salad bar was open again and there is a fantastic selection there. These guys do not mess around, they feed you. If you don't come with a hunger then don't go, if your a vegetarian your wish you weren't.

Vicky from Rio is always there and oversees the cooking to ensure its real Brazilian. After living in Rio for 6 years i know good Churrasco (Barbeque) and this is the real deal. Prepare for FOOD COMA :)"
Great dinner,"Went for a family dinner. Craving for meat, basically it became my routine to visit every quarter. Saturday night, the restaurant was quite full. Some of the waiters recognize after some visits and talk some jokes when serving, what makes the experience more pleasant, at home. We asked first for some salad plates and the black beans stew, simple but good as the main is to eat meat. The served portions are good and the types of meat are enough to enjoy a churrascaria experience.
By the time we were leaving, the restaurant became full. I don't enjoy a full time house environment since the meat servings rotation may become slow and undercooked. Just felt a local soda, guarana at 7.5 , overpriced.The meal is at SGD59, up from my previous visit but overall still an enjoyable dinner. I recommend and will come back again."
"First and Last Time, Never Again","PROS:

It's quite a hidden gem, away from the busy bees area.

CONS:

Everything seems so rush, the waiter never explained properly what they are serving us, what kind of meat it was, how it was cooked or seasoned.

It's all like ""Beef Rumps"", ""Chicken Heart"", ""Chicken Thigh"", ""Fish"" etc. All you know is you ended up with five or six different type of meat in one go.

Both of us felt like we're one of those ducks that are being fed with all these meat without knowing what they are. It just kills the entire experience. The meat, some are tough, some are juicy. Very inconsistent. Likewise for the service, somehow our table gets a pass most of the time. Why?

This was our first time and for the kind of price we're paying, it's surely our last.

I really have nothing else to say about this restaurant. It's really that special."
Great barbecue place - trust me I'm a Brazilian,"Went to Brazil Churrasco a couple of weeks ago. I'm a Brazilian and this was my first experience at a Brazilian Churrascaria in Asia. It was above my expectations. The picanha was excellent, caipirinha as well and the Brazilian waiter was extremely friendly."
Excellent Service & 5* for the lady host,"Had an excellent night with my friends!
Restaurant was packed. We were waiting for our turn to be seated and saw the lady host was trying to assist a group of friends infront of us.
Heard the guy saying 'your system is crap' and started to abuse the lady host with words which is terrible just because they are not able to show proof that they are vaccinated.
She looked so calmed and trying to help them out but the guy was sooo rude towards her!
When comes to our turn, she politely apologies for the delay and I told her ""hey u are doing your best and u did well by staying calm!
Dinner was excellent as ever. The lady host came to our table and asked is everything okay which we were very impressed despite her being busy running around helping her colleagues, she went around to make sure customer are all ok.
Dear patrons, if you ever read my comment, please treat the staff and especially the lady doing reservation with respect.

Overall excellent food & service!"
Main hostess had a burr up her hinny! Super off putting,"We have visited this restaurant several times and we invited some friends to go as a sort of celebration to being fully vaccinated. The main female hostess who manages the reservations and seats the guest was flat out rude, full of attitude and totally off putting for absolutely no reason at all. Upon arriving at the restaurant when we were checking in her tone was very short as she directed us to check in and stand in a specific place. After checking in when she informed us we had only 90min of dinning before the table needed to be released for the next reservation, which was totally fine but the way she talked to us you would of thought we just offended her. She had such and attitude and was so harsh with us we were very taken back. It made the start of dinner quite awkward to be honest. We tried to lighten the mood by joking that she would return exactly after 90 min to tell us to go and lo and behold she was back with the same nasty attitude, no greeting, no “how was your dinner”…just nasty/harsh “your 90min is up we need to release the table”…not even a thanks at the end. We were actually all finished, masked up and waiting for the bill. We almost just left because she was so nasty. The crazy thing is is that the rest of the staff was wonderful and the dinner was great but her pissy attitude soured it.

If you are the owner or manager reading this please speak to that lady. We have been several times and the friendly staff is one of the reasons we go back. I know times are stressful with all the COVID restrictions but it’s not the guests fault and with a greeting and exit like that we won’t be back any time soon. We had introduced our friends to this place for celebration dinner but that experience put them off as well so they will not be returning.

Hope someone gives that lady a hug because she needs it.

As for dinner, staff (excluding her), value…all is good!"
Another visit,"Due to the restrictions I was craving for meat and went on a Thursday night with a friend. The salad buffet was not back yet. The meat was good, probably it is the best option in Singapore compared to the other option. The servers came in a timed pace, serving good portions and the meat was well prepared and done. I hate when servers come at a very fast pace before you are able to enjoy the previous portion of meat. It was an enjoyable meal."
Terrible service,"The beef is acceptable and although there's a lot of typical dishes one would expect from a rodizio, considering the distance it's alright. Nevertheless, the service is incredible poor. The waiter rush giving you the beef cuts, without consideration, and being rude. In various occasions the waiter would only ""drop"" the beef cut in the plate (or miss the plate, altogether)"
Good alternative for a churrasco in Singapore,"Good service, frequency of servings. Due to Covid restriction buffet was not available however good portions brought to the table on small plates. Feijoada was good, well prepared. The meat offer , I felt limited but I guess the same of other Brazilian restaurants in Singapore....the meat quality was ok/ good. While the main churrasco course is similar all places around at 50 SGD, drinks and desserts were beyond expected. The traditional quindim, made with egg yoke at 14SGD was not exactly it. Stay with the meat and enjoy the course.Environment is good, you can have business meals and family gatherings."
"Great ambience, excellent","Great ambience, excellent service. We were served by a friendly passador with good sense of humour. The young lady who waited on our table was very cheerful n efficient, filing up our water, asking if we needed more meats, changing our plates. Food was delicious esp the beef hump, beef ribs, lamb, sausage and chicken livers. Even the sides were good, loved the deep fried crispy Kai lan and sweet potato. They serve delicious soup of the day in small little cups, I’ve had the tomato n mushroom - both lip smacking authentic goodness. I had 2 servings of the beef hump - tender, fatty and melt in your mouth goodness. The chicken livers were crispy on the outside n oh so tender on the inside. I think I ate 6 livers! Advise if it’s your first time - go slow, ask for very small shavings of the meats the first time round to taste, then get a bigger portion of only the ones you like the second time round. And just enjoy!!"
Good food,This restaurant is well known among many diners. We drove to this place and reached in time for dinner. The ambience of the restaurant is good. The food we ordered were lamb pieces. They were delicious.
go with an appetite,"great selection of meats and sides - but you need to be hungry to go there and do it justice. not the cheapest place to eat unless you can really ""fill your boots"". friendly staff and nice selection of grilled meats etc - more selection in the evening. we love the chicken hearts hear, but they don't come around often enough for us..........."
No basil churros at Brasil Churrasco,"We first visited Brasil Churrasco 25 years ago, and amazingly the friendly passador from Rio is still there! Homey atmosphere, with a good salad bar that includes heart of palm, feijoada, and you can ask for yummy farofa too. The cuts of meat are not nearly as varied as at the best rodizios in Brasil, but you still find delicious picanha, cupim, chicken hearts, etc. For me, the best time to visit is for brunch on Sunday. You can enjoy a nice siesta afterwards, whereas after a dinner here you might not feel good for a long time! Anyway, you would not want to eat meat for at least a while unless you are a sumo wrestler!"
Family’s Favorite,Been introduced to Brazil Churrasco 20 years ago. We were there as newly weds then and now our 2 boys joins us. It’s our favourite go-to place whenever we crave a good cut of meat and not to mention their extensive choice of salad bar. Great service and excellent food.
Love the food and staff here,"Great cut of meats, friendly staff which are more like friends to us. Maya Fizah, Tiki, all staff there are just amazing."
Amazing Place,"Absolutely recommend everyone to experience this fantastic place, great food and wonderful friendly, knowledgeable staff and awesome owner who all make you feel at home. Greetings from Zambia, Southern Africa. See you on my next trip. Cheers Nims."
Muito bon !,"Consistent quality of the meat and great, smiling, friendly service make this place the best Churrasco in town, by far.
The caipirinha is great, tasty and well balanced, and the wine list offers a wide selection of Australian, southAmerican and European bottles to satisfy all palates.
A must try for the meat lovers."
Excellent Spread of Meat! Eat all you want,Been here a couple of times with family and friends.. It's one of the best so far. The meat selection is excellent. So is the salad bar. Good and friendly staff.
Carnivores fiesta,"Brought here by friends . Amazing place with excellent meats . All types of meat Grill to perfection - from salad bar , grill beef , lamb , chicken etc.... until the grill pineapple !! Speechless just enjoy !!
Will definitely come back .
Very good service too !"
Best option for Brazilian BBQ in Singapore,"This was my second time visiting and I can confirm this is the best Brazilian BBQ spot in Singapore. It's a little out of the way from the central hotels, but well worth the trip. All the meats were on point, the salads were good, even though we only had a few small helpings as we wanted to focus on the meat. But what makes the experience even more memorable is the service.
We were running very late due to rain and bad traffic, but one quick call to the restaurant and they held our table for us. We were ushered in upon arrival and the staff made sure we had everything we need, even said they can top up or bring to the table any special item we wanted.
The one piece of advice I can give is to pace yourself, as you may feel inundated with options, but it's ok to take a breather and pass one or two dishes for later as they will return to you eventually. So take your time to savour each serving of meat, and your experience will be all the better for it. Highly recommended."
Meat galore!,"It was our second visit after 10 years. We are so glad we came. There was a good selection of meats including beef, lamb, chicken, duck and fish. Even the salad bar ""put up a good fight"" for our attention. The friendly service staff topped it off and made our family night out a pleasant and satisfied one. Will definitely be back."
Great Food great service,"Food was amazing, customer service was perfect. The meat was seasoned to perfection and my favorite the pineapple they cook!! OMG!!!!!!!! well worth the price!!!!"
Meat lover's unite,"This is a great place for meat lovers, beef especially. We've been coming here since they opened in 25 years ago. Same consistent quality and friendly staff."
Meat lovers heaven,"Brazilian BBQ: we know what was coming! The buffet with sides is more than enough choices. Try the potato salad for sure!
And next - meat, meat, meat.
Excellent meat. We mainly stick to the beef but the pork sausages are nice too.
If the drinks would be more reasonable, we would have rated 5 stars."
Dinner for 7,"Great as always . Last time i was here was 5 years ago. Standard improved. The salad bar enough to make you full. Variety of meat, lamb soft and juicy, chicken, chicken liver, chicken heart, beef topside, ribs, pork sausage, all topped with red wine and smoked pineapple (never seen anywhere else). Will continue to come back."
The best Churrasco in Singapore,"This place is legit. I have tried many Brazilian restaurants in Singapore and none can beat this. They have been around at 6th Avenue for 20 years. The service staff is friendly and after all these years, the food standard remains excellent.
It's my to go place when I'm craving bbq meats."
Gratifying Wedding Anniversary-Family Dinner,"As a Family of Meat Lovers, this was a place that took us 2 years in waiting. So, having my Wedding Anniversary dinner here was timely great with full compliments to Ms. Maya for making this event unforgettable (Wifey-very-Happy) and to their very friendly “Men-in-Black” (or Meat Servers, who make sure your plate is full of their meats).
Salad Bar is awesome with wide selections that’ll make u feel full (… we were warned), from pastas, rice, greens, etc., before having the meats.
I’d say best of their Meats are the Smoked/Roast Duck (which leaves u wanting for more), Roast beef, Sausages & Ham. (…not sure if there was Pork)
Chicken was ok but thick parts tend to be dry inside. Special chicken parts (ex: Heart) was very appetising with no after-taste.
Grilled Pineapple was a healthy imitation of “juicy-caramel”, that made me ask for more servings.
Drink selections can be improved though for more choices for youngsters.

Overall, we are coming back because we love… our meats / friendly-smiling staffs (…most of them) / great service (Thank u Ms. Maya) & not-too-squeezy seating ambience. Value-for-your-Dollar ? …. It’s a bit pricey but It’s well worth it !!!"
Any meat lover's dream,"Very very satisfied with the service of the staff & quality of the meats at this restaurant! Visited here for my bf's birthday last week and we left with an extremely full stomach. We opted for the buffet which added up to about $61/pax after GST and service charge. Price is a little bit steep, but I think was quite worth it especially if it's for a special occasion.
Website & Facebook both mentioned 14 different cuts of meat, and I'm not sure if that was true, but off the top of my head, here are the items I remember being served:
Chicken liver, chicken heart, roasted chicken breast, roasted chicken thigh, fish (I don't remember how it was cooked but it was yummy even though it could be seasoned more), garlic beef, beef hump, beef tenderloin, pork sausages, duck breast, lamb and of course, grilled pineapple.
The items will be served to you at your table; the staff will come around with the different cuts of meat to ask you if you would like some. They are incredibly attentive and if you say no enough times to what they offer, they will ask you if there are any kind of meats you prefer so that they can bring it out to you.
One waitress, in particular, even tried to accommodate to our request of getting our portion of garlic beef rare. Very amazing service!
Salad bar was nice too, I especially liked the pesto penne, but main star of the show was definitely the meats.
I will come back again soon! I really enjoyed this place."
Churrasco ok,"I was there for a dinner with friends, the place is nice, spacious, the number of servers are enough to cover even if the restaurant was full on a Saturday night. The staff follows with attention, asking if people wanted another round of meat type. The buffet salad has a good variety and is good. The variety of meat is not as much as in a real churrascaria, what is understandable however I felt it very limited, soon after the start, the service was all in a rush bringing meat after meat, while we were not able to finish on the servings, I would expect the servers to dose the timing, we had to ask them to slow down. Some meats were not grilled to the point I have experienced before, either too early, not hot enough/ warm or missing salt (and I don't like salty meat). It was the only churrascaria offering grilled chicken liver (what I felt interesting). The grilled pineapple that usually is good was very green, not sweet and not well grilled. At the end the final bill was around SGD70 a person (just the main with some drinks, no desserts and coffee). Disappointed for the quality of the food based on the price we paid for. For someone that wants to feast on meat from time to time, not sure if it was a bad night or if it may be good to try another place."
Farewell Dinner,"Just had another excellent dinner at Brazil Churasco and never fails to fulfill expectations of great food. Service is very good with staff pampering you with all the meats that you desire. For those who haven’t visited this place, it’s well worth your efforts and is highly recommended."
One word to describe. EXCELLENT,"This is my third visit to Brazil Churrasco and it has never fail to keep up to its standards of satisfying my need for meat. The salad counter is also filled with an array of choices. Different parts of the meat were cook to perfection and the smoked duck is a definite must try! I highly recommend this place to anybody who loves beef like I do. Great ambience, great service, great food!"
A family of regular customer’s great disappointment,"My family have been visiting this place for years and it is a special place for my parent’s wedding anniversary. Tonight we are back again but greatly disappointed.
1) My brother fished out a kitchen towel in the coleslaw. The waiter briskly whisked away his plate, tapped my dad’s shoulder to quietly say sorry and changed the coleslaw at the buffet counter like nothing happened. That was the last of the encounter.
2) The waiter barely know anything about the wine list. In the past, the waiter will describe the wine and make recommendations. Now, the waiter just state the obvious, which can be read off the wine list.
3) The standard of chef had dropped. The flavour of flamed meat no longer exist. It is no different from a piece of roasted beef that I make at home.
4) The familiar friendly staffs are gone. The perks of being a regular customer is the staffs knows exactly what you like and the personal touch, that was why we loved this place so much. Tonight the waiters are not attentive, it was a long wait before someone noticed that our plates are empty and meat have not been coming by for some time.

This place has great sentimental value to my family. For everyone to agree it is time to look for a new place, it really reflects our disappointment."
Average Brazilian BBQ steakhouse in Singapore,"Brazil Churras is an average place, the food is not so good, and it is an OK meal. I went there only once and never got back again"
Not Bad,"Having worked in Rio and appreciated the concept that this restaurant offers, I was pleased at the food and service. The salad bar was awesome and the staff carving the meat very friendly. Just when I thought I was full, along came the barbecued pineapple which was amazing.

Well worth a visit."
Pricey and not authentic,"I lived in Brazil for 13 years as a young adult. So my Family without fail would have Churrasco 1-2 a month. However we decided to try the Churrasco at Sixth Avenue, it was not good at all. It is more to suit the taste of Singaporeans. Sadly to say, the Cupin was way too salty and Meats were hard to chew. I would not go back to this place ever again."
Excellent!,I come here for every big celebration. The food is delicious and it's got a huge salad bar for vegetarians too. Looking forward to returning!
Great Churrasco,"In the pure Brazilian tradition, you can sample several beef meat cuts, chicken, sausages etc and also have a few vegetables to give you good conscience...
Start with a authentic caipirinha cachaça and will feel transported in Ipanema.
A nice selection of red wines to go along with the meat, is available: Chile, Argentina, France you should find something to satisfy your palate there.
Excellent service from the staff: the waitress as well as the guys serving and cutting the meat. Well done!
Definitely a place for meat lovers!"
Meat lovers Paradise,"This restaurant has an amazing selection of meats... 5 types of meat (chicken, beef, lamb,pork,fish) and 14 cuts of meat. The servers come to your table very frequently with the different meats, which they carve off for you, as much as you like. You literally eat until you can’t eat anymore. The salad bar is very extensive and the best I have seen. The servers were very efficient and pleasant. I would like to mention Azza, who was particularly helpful in explaining the meats and making our evening more pleasurable. We had very good service overall. I would highly recommend this restaurant, especially to those who enjoy their meats."
Excellent restaurant and service,"The ambience is beautiful. The salad bar is great with many choices of vegetables.

Great cuts of various meat . Freshly cooked and succulent. The barbecue pineapples is everyone favourite.

Excellent staff service. Friendly and warm.

All of us enjoyed the food, wine and bonding in this restaurant. My second visit here this year."
I’d come here even if they charged double what they did.,"Let me just start by saying the service was impeccable. Especially from the hostess Maya and the server Briggs. Thank you both so much for making my birthday dinner an enjoyable one.

The food was amazing. The beef was great. The lamb was good and the fish was OUT OF THIS WORLD. I personally hate fish but this fish is a MUST TRY, even if you’re allergic.

Overall it was a great experience and I’ll definitely be back here again. Thank you so much for the great birthday dinner."
A restaurant for meat lovers!!!,"Brazilian Barbeque Buffet Restaurant that serves a wide variety of meats, especially different parts of beef. Pork, chicken, fish also served with a wide variety of salads."
Great Brazillian steakhouse with friendly staff,"If you like your meat then this is the place for you. Great salad selection, and as much meat as you can eat hand-carved at the table. Nice atmosphere, friendly staff, and great meat (try the chicken hearts!!).
Also a surprisingly good choice of single malt whiskies, and a small, but perfectly formed, desert menue"
Just great!,"Only for voracious meat eaters!

Don't full yourself with the salads... Just pick a few here and there to wash your palate.
I loved the lamb! Rest of the meats are also just so worth it and more.
Loved the place and locality... nice and quiet outside, but a meat festival inside :)"
The first and still the best Churrascaria in Singapore,"Great prices, very service focused I took a group of 20 men there for dinner, fantastic evening, to really enjoy I highly recommend going in a group"
Hidden Gem -great food and great service,"Authentic Brazilian churrascaria in Singapore - great food and great service,Great place to go for meat lovers .Meat grills are great and unique and have great variety .5 different types of Beef ,lamb ,Chicken heart ,liver ,smoked duck,Fish etc etc .Plus Grilled Pine apple and a great salad bar .Would recommend this place and would definitely come back
."
Not enough meet to go around,"Have eaten there quite a few times back in 2015-2016. Always been happy with the service and quality.
But this seems to have slipped as it appears that there is not enough meat to go around.
This goes especially for the beef.

All in all a disappointment.

We all four left with “half” empty stomach.

Room for improvement."
