topic,review
Awful from start to finish,"What can I say about this restaurant? The service is appalling despite there being almost more staff than guests. My food arrived stone cold and had to be left sitting on the table for another 10 minutes to go even colder because one of my group’s meals didn’t arrive at all. The price was shocking considering we only had one course and the only time the waiters were attentive was when the bill finally arrived (we had to ask for it several times). The waiter and waitress stood over us while we were sorting out our cash to pay the bill. I’ve travelled the world and have only ever experienced that type of pressure-to-pay in shoddy restaurants. Overall the entire experience was stressful, expensive, poor and a terrible reflection on the great customer service that is evident elsewhere Singapore. Avoid avoid avoid! :-/ Would rate at zero stars if that were an option."
AVOID AT ALL COSTS!,"Where do I start! Overpriced and appalling service find it up! We were served by no fewer than 5 different waiting staff but that didn’t improve the experience. Mates main meal came out and luckily was cold (luckily one the loosest possible terms) Had to chase my main twice and in between times we were brought sharing plates for my mates dinner! Was shocked when the bill came as was the most expensive meal we’ve had in the last 2 weeks, with the worst possible service! Never again and I’d recommend you steer well clear-this place would get no stars if that were possible!"
Fine Thanksgiving Buffet,"OK, it was not Mom's hosting of Thanksgiving, but it was what was on offer. There was plenty of food, but of course plenty of people. Uncle Vinnie wasn't there, but some loud Americans were, to make me feel at home. The staff did its best to keep the buffet stocked and beers flowing at the tables. If in Singapore for Thanksgiving again, I would certainly consider going back."
The most waitstaff with an absence of service,Guess it is another wannabe hipster place. Beers aren’t bad. Service is non-existent. KFC (Korean Fried Cauliflower) sounds better than it is. WagYu burger was Ok. Guess overall wouldn’t really recommend. Much better options.
Great Sunday,"Great sunday spot, 2 x tasters and a plate of charcuterie. Excellent beers, cool temperature under the fans and delicious food. Highly recommend"
Nice Place to Chilled!,One of the best restaurant that sells good beer and food. We ordered the pork tenderloin and it really goes well with the beer! We will definitely be coming back again soon!
Overpriced. Avoid. Better,Overpriced. Avoid. Better value elsewhere. Catering to tourists who don’t know better. That’s all I’m going to day
Great food,great food and beer. we had the kurobuta pork tenderloin which was very soft and juicy. wide selection of beer . went with my 2 toddlers and it's a great place for family to chill and have meal.
Still the best craft beer in Singapore,"Brewerkz started the craft beer pub trend in Singapore over twenty years ago, and their IPA is still the best."
The Best Restaurant in whole Singapore!,Were on our honeymoon and Brewerkz has one of the best hamburgers I have ever eaten in my life! ( Guakamole has become on of my favourites)! We also got shampaine so it got even better! Thank you for the warm hospitality and the food.... delicious!
"Excellent food, friendly service and nice ambiance","We've been visiting this outlet and the one at the Stadium for more than 10 years, either for family lunches or attending friends/company events. Service is good, fast and friendly. The food is also excellent (although the price of the lunch menu keeps increasing over the year). We will always come back for a pint or 2 of IPA (and maybe more) and the fish & chips :)"
