topic,review
Underwhelming,"I've been frequenting Brewerkz since they first opened and I have to say the food quality has seemed to declined over the years and my last meal was no exception. We started with the potato skins. They were ok, but lacked any real flavor. My wife ordered the steak, which was an absolute disaster. No seasoning whatsoever; it was if an unprepped cut of meat was simply dropped on the grill. I tried it and agreed with her, probably one of the worse steaks we have had in Singapore. Wagyu burger was ok, but again lacked seasoning. Only redeeming item was the fries, which were well seasoned and crispy. When it was time to pay the bill I asked for the check and then sat and waited for someone to come and collect payment. I finally gave up and had to track someone down."
Clueless Service,"Clueless Service. Asked straightforward question as to when wine bottle by glass opened and met by ""yesterday"" and no further response, further questions answered with""don't know"". Why don't you train your people? Anyway off to the hard rock."
Post-Event Drinks,"Came here with colleagues to sample the beers on offer.
We ended up getting a flight of ales each - IPA's and Pale Ales in the main - but I had one with apricot in it which was really very good.
Nice convenient venue at the slightly (for Singapore) quieter end of Orchard. Great place for a brew!"
dinner for one,enjoyed from home-brews which accompanied baby rack or ribs. Took the double portion which actually is quite a bit (as the ribs are very meaty). But nice and spicy with some fries and coleslaw made a great little dinner with a view on always busy Orchard Road.
Good beer and burgers,"A nice place to have a draft beer and burger. The atmosphere is good and the staff is friendly. The beers are lower abv than in the past, but still good."
Ribs,Best ribs I have ever had so delicious as was the baked potato and coleslaw. Best meal we had in Singapore
Singapore Cold Draft Beer,Casual dining with a smaller menu but good food and cold micro brew beers. The selection is small but there a few good IPA's and an excellent light blonde ale on tap. The nachos are great!!!
Good Beers and Burger,"Great little place. I order the IPA and a Steam beer. Both very good. But if you will only have one, go for the IPA.
I also ordered the Wagyu Burger with chips. It's very good.
And they have nice outside tables, so you can eat, drink and see life pass by.
I recommend."
Nice German Beer Selection,Stopped by for some apps and a couple of beers. The sweet potato fries and onion rings were fine but nothing special. Good beer selection of German style craft brews. We had a 4 beer sampler and the beers were generally pretty good. Nice location with outdoor seating options and friendly servers.
Average meal in a touristy area,"Stopped in for a bite to eat while walking around Orchard. Touristy spot that is quite busy with several restaurants near by. The service was good, the burger was average. The truffle fries were excellent. People watching was also excellent."
Decently Expensive Beer,"We stopped in after walking Orchard Road for an afternoon beer and to get our little guy a snack. After being outside all day, we opted for one of the few indoor air conditioned tables. Our server was prompt and good throughout the experience.

The kids pizza was actually really good sized and came with ice cream - best deal on the menu for $10 SGD. I had the seasonal steam beer which was actually really good and my wife had a 4 beer flight tasting (I was not really a fan of the pilsner). We also ordered a side of french fries to munch on (they were out of the chicken skewers).

At any rate - their beers (as with anywhere in Singapore) are on the expensive end. I think their standard beers are average, but the seasonal or special brews do stand out.

We are glad we stopped in and took and afternoon cheers!"
Year End Routine,"It’s Been Part of my Life since Brewerkz Came to Singapore. Every December will spend time looking back at the past year & feeling grateful to journey on to another New Year.

Having the Fresh Brew refreshes me & boost my spirits.
Catching up with friends is so enjoyable. Great Place Great Time"
