topic,review
My kinda cappuccino,"Located at laid back Changi Village, this area has been a haunt for Poke hunters day and night.

Dine al fresco to get better gps reception and catch your next poke monster whilst you dine. Visited only for breakfast n had cappuccino n eggs benedict.
Opens 9am Saturday n 9.30am Sunday. Came consecutive weekends.

Eggs ben were lovely 1st time around, eggs were just right soft runny- perfect!
2nd time hollandaise sauce was too thick, like squeezed out of a bottle.

Will definitely be coming back for their coffee and desserts.

ps the barista does a nice 3-d foam art with your iced coffee"
Dinner with kids,"Meal was nicely done especially with the 2&3D art on their drinks which my Monster love it! This is my 3rd or 4th visit to the place, will drop by again"
Pokemon Night,Dinner with friends on a Friday night. Food and service was good cum plenty of pokemon to catch while eating.
"Alright food, 3d art standard not consistent",Food was slow & hollandaise sauce was too little for the egg benny. 3d drink was good (mocha and earl grey) but the art was damn bad. my 2nd time here and it has once again disappoint.
Love their 3d latte art,You can customise your 3d latte art for their selected cold latte. Or customise 2d latte art on their hot latte. Can refer to their instagram for ideas~
Little Surprises @ Lunch,CFOB has always been a favourite lunch spot for me & my colleagues. The menu range has improved recently and we're always delighted with the coffee art we receive. CFOB also tries to adhere to our requests for characters.
Cute coffee art,"I specially visited this place just so I can order a cute cup of coffee. The 3D art is only available for the selected iced coffees and they do very pretty coffee art on the hot ones too. While I was there I saw the barista creating a Pikachu coffee art. It's free of charge but during peak hours, you have to wait up to 30 mins. Go during non peak periods, I got mine within 10 mins. Coffee tasted ok."
Be patient to get your order,"This place is famous for its 3D art drinks, but you need 30 minutes before getting the drink. You will get your drink with a very cute animal on the top, probably made of foam. Once you have finished your drink, the 3D art is left.

The French Toast is good. Best if shared because it is a large, thick slice of bread.

This place is packed on weekends. Wait patiently for a seat, then wait patiently for your order."
Good service,"Food nice, exspecially the latte 3D very nice cute and creative . Staffs all are friendly, they provide very good customer service . I will come again ."
Great little coffee shop,Was very impressed with the service and barista art work on my coffee(s) which I had here recently. Very friendly staff
Brunch with a smile!,Late start on our final day in Singapore so missed the hotel breakfast. Had checked Chock Full of Beans on trip advisor so we took a short walk to try it out. We were not disappointed! Coffee latte art is a lovely touch. Mango smoothies are fresh and excellent. We all tried something different from the full breakfast to eggs benedict to pancakes. All were worth the wait. Home made bread to boot! If you are staying at hotel nearby this place is well worth a visit.
3d Latte art,"Great experience with the 3d Latte art which is only available for iced coffee. For the hot variety, unique latte art can also be expected with cute cartoon characters among many others. Food wise, prices are acceptable with decent quality food. The place is perpetually packed during weekends so do head down earlier to grab yourself a seat."
chock full!,"In Changing village on stopover before flying home. Called into this cafe for breakfast. Good choice! Had scrambled eggs and toast, husband had pancakes--- all delicious and beautifully cooked, good coffee too!"
3D iced latte art makes me giggle every time :),Chock full of Beans is our half-way post on our regular weekend 80km bike ride from Tanglin to Changi and back and what keeps me going is wondering what my iced latte will look like! The first time I visited the great little cafe I had not idea what 3D latte art was when they asked if I wanted it - now my weekend wouldn't be complete without it….. makes me giggle every time. Apart from the novelty of foam creations Chock full of Beans gives a really good breakfast/brunch menu and lovely fresh OJ.
The draw of this cafe is definitely the awesomely adorable 3D latte art :),"I visited Chock Full of Beans for breakfast and ordered a decent plate of eggs benedict served on a portobello mushroom and toasted bread (the sesame seeds on the crust was a nice touch), but the draw of this place is definitely the awesome and adorable 3D latte art.

For the 3D art to work you must order a cold drink, so I enjoyed a iced latte with a shot of Baileys topped with a really cute Hello Kitty foam. Make sure to tell your waiter/waitress what personalised 3D art you would like when placing your drinks order.

The only thing that slightly spoiled the mood was to the immediate right of where I was sat (close to the window) there was a small pool of water forming on the seat from water dripping down the air conditioner right above and none of the staff members noticed this happening. Hopefully, that problem is fixed now. I would definitely return here again exclusively for the fantastic 3D latte art :)."
Cute 3D coffee,"Food OK, price a big on the high side Thou air-condition but the spotlights make the place too hot to sit for long"
Cute 3d latte art!,"Saw many negative reviews before heading down and was worried.However, the overall experience we had was fantastic! The food selection was pretty interesting, and the portion size was just right. The hazelnut latte was a tad too sweet, but the latte art was amazing! It was a pity i did not get a choice for the latte art. Service was good and fast! Loved it.. will return again."
Cutie iced coffee n taste good too!,"Loved the coffee! Pretty, cute n taste good.
Unfortunately, can't say the same for the starters (nachos chips n cheese, smoked salmon on toast). These are almost like the stuff we make at home, no finesse.
The salad we had (chicken salsa arrowheads) is good.
The sausage dish is well done. The accompanying mashed potatoes is good. But the sauce is so starchy...it appeared lumpy. So, though tasty, the texture is poor."
Cute place to bring your other half,"They have 3D art for some of their drinks, it's a plus point
The quality of the food and drink will not make you crave for it but definitely edible and will satisfy your stomach for that one visit
Service is good, better than good actually.

Overall, good visit and will come again when we're feeling romantic"
3D coffee art deserves 3 stars!,Perfect 3D coffee art as shown. Don't forget to request for the art! Hello kitty and cartoon characters are common requests to them! Had carrot cake and portobello benediction. Just order the drink and enjoy the attentive service.
Occasional craving,"Chockful is almost an hour's worth of travel from where I live but I do make the effort to travel from time to time. The food there is pretty average, especially for their pasta and other mains. I do like their sandwiches though. What really brings me back is the coffee. It was one of the first to come with 3D art but it tastes better than it looks. Watch out for the weekends though as it tends to get crowded and you may wait up to an hour if you are late!"
Tasty sandwiches,European style cafe ove ring pasta dishes and very tasty sandwiches. Combo so you get a soft drink included. We had excellent BLAT. Good service from friendly staff.
TERRIBLE! !,"Located at Changi. Chock Full of Beans is closed on Mondays. Opening timing 11.30am, we were outside the cafe at 11.15am. There were staffs around us, yet they did not bother to introduce to us what they had in stall. They continued to ignore us until we asked them about the cafe. They told us that they only open at 11.30am and didn't have the initiative to present us with the menu until a guy, which seem like the boss, told us we could sit around and wait first. Reluctantly, they let us in and ignored us.

When the food (Aglio Olio with Shrimps and Squid, Aglio Olio with Wild Mushrooms and Truffle) arrived, the first thing we realised is its oiliness and as we expected, its oil is dripping from the pasta and puddling on the bottom of the plate.

Moreover the pasta is not done al-dente. Nothing on the plate goes well together, felt like they were cooked separately and then mixed together before serving it to us. Minimal effort given to the food. Would rate negative infinity. Coffee wise, not too bad. Cute latte art but the food had ruined it...

Service was absolutely terrible. First of all, sugar was not served with the coffee and tea. When we requested for sugar, a staff was kind enough to pass us 2 sachets of white sugar without asking what type of sugar we wanted. When we ask her for 2 more sachets, she pointed to the counter and told us to take it ourselves even though the place was almost empty other than the couple beside us. Same thing happened to the couple who asked for a toothpick and was referred to OUTSIDE the cafe where he had to get it himself. I mean we would totally understand if the cafe was busy or something but no attention was paid to the customers at all.

Overall, Food= Fail
Service= Fail
Ambience= Passable"
Love it!,"We go there for breakfast on the weekends, and it's fantastic. We stay about 5 mins down the road and this place serves a wonderful breakfast. They have a good variety of breakfast choices and drinks.

It is popular with the locals and especially the cycling enthusiasts who are usually there after their morning workout."
Nice place to chill and catch up with friends,"I was there on a weekday afternoon so it's less crowded. Other than the office lunch crowd, which wasn't much, the place was otherwise nice and quiet. The weekends are a different story altogether though. Overall, good place for a meal and catch up with friends over coffee with a creative twist."
Closed temporarily,"We had passed by on Sunday and noticed quite a number of diners enjoying the brunch sets, so checked out their menus, which was quite interesting, particularly their coffees.

We decided to come back for dinner a few days later. To our surprise, there was scaffolding and tarps all around, and the place was being renovated. We could not find any notice of when that would be completed, but certainly look forward to their new transformation."
