topic,review
"A great variety and spacious, comfortable seating arrangements","This place gets better each time we visit. Our 3rd trip to SIN in 6 months.
The food outlets are very clean, quick and love the authentic flavours they each bring.

Recommend the oyster and egg, carrot and egg, freshly smoked satay sticks with yummy peanut. sauce

The seating is comfortable and tables are large and spacious"
Weird changes…,"Food, drinks and service are great! But after renovation the cooling breeze from the sea is blocked by a hedge and it is terribly hot. The smoking area for this huge capacity of this Hawker is a ridiculous place of 2x2 m far outside the center. Real diversity is different, for sure."
Thai stall near ATM is terrible,Doesn't taste like Thai food at all. Unit is close to ATM area. Not authentic as the cook doesn't seem to be Thai.
Good food at decent price,"Located on the East Coast , a hawker Center in reality. Good local food at decent prices. It’s open air and there’s no aircon. As it’s by the beach , one hopes for a nice Breeze to go along with the food .

If dietary is not a restriction , try the pigs trotters prepare with ginger and vinegar and the ‘spare parts’ . Goes well with rice ! They open around noon . The sugar cane water stalls goes well with the food and the heat . Alternatively , the satay is good too and they open for business slightly later.

Overall , wide selection . Decent prices . Car Park is not quite an issue . Nice location by the beach . Worth to go . But do note - it’s soon to be closed for renovation. Do check it out before heading there ."
Good hawker center for satay,"Good hawker center with awesome satay and sugarcane juice! If you are in ECP, try satay at Rahim Ayam Penyet Satay Istemewa! Highly recommend. Delicious. Also try the sugarcane juice in the nearby stall. It's huge portion as well."
The food is amazing and delicious.,The food is amazing and delicious. The satay is amazing and the coconut juice is very fresh. Perfect spot to hang out
Big hawker centre by the beach,"There is a good variety of stores there to enjoy/try local hawker dishes.
Some of the local favorites that you must have there will be satay, sambal stringray, cockles and clams, fried oyster egg, grilled chicken wings and grilled crabs. Enjoy them with a coconut or beer. While the place is not air-conditioned, it is not that hot there because of the sea breeze.
The stores there mostly only accept cash so do bring enough. There are also ATM machines available.
Before you leave, remember to look out for the elderly couple who sell roasted chestnuts by the entrance. It is very yummy!"
Best place to have satay,"It was the best place to have satay in Singapore. The view was straight to the beach so it was very nice to chill there. You can order from different counters with different kind of food and their special dish - satay. I ordered scallops, beef satay and coconut water. Everything was so fresh and tasted really good. Sauce was very good and I thought spicy sauce fit satay so well. Coconut water was not sweet but it tasted fresh. It felt really like summer!"
Nice Location,"We caught a taxi here one evening for dinner but weren't off to a great start when the taxi driver had no idea what we meant. He took us to East Coast Park Apartments! While Singapore is an english speaking country there are many Singaporeans who do not speak good english so be aware when you are visiting! I was looking forward to eating here but have to say was a little disappointed. It was very busy but it was a public holiday, I imagine it does get busy at other times though as its a lovely spot by the coast for families to enjoy. You may have to share a table & once you have that there are many food choices amongst the many hawkers. We were hoping for cheaper chilli crab (cheaper than restaraunt prices anyway) but alas it was still pricey for hawker food. That said we did enjoy the food we ordered & the tiger beer always goes down well! BTW you will need cash here. Also its a bit tricky to get a cab when leaving, we asked a local & he ordered us a Grab (similar to uber), cost was S$12. Nice spot down by the water to watch all the planes coming in!"
Came back a couple times,We were staying in the East Coast and so this place was sort of local. But soooooo good and soooo cheap - so we decided to come back again for more. First - look for a table and then go choose your food! That’s the system. It’s cash only but ATM is also available in the area. Lovely atmosphere!
Delectable Food.,"An open food court besides the bay, it's a very popular place for Singaporean-Malaysian food. Satay is the main fare but there are seafood, vegetables, purely Singaporean dishes. Sitting is under the open sky or under canopies around tables. There are many stalls selling halal as well as non-halal food. Food was delicious, varied and served fast and sure. Hygiene may be a bit wanting, prices reasonable.
There are arrangements for cycling, skating, boarding. One can see the planes landing into Changi airport."
Expensive and nothing special,"As a Singaporean hawker centre / food centre, the food variety is not bad, but the food is pretty expensive. The place gets warm when crowded and the tables can get quite dirty because many customers still don't know how to eat cleanly or clear their own tables after eating, and the cleaning staff is often not fast enough to clear the tables. If you sit too near the satay stalls, you leave the place smelling like satay even if you don't eat it. If you have no choice, this is the cheapest place to eat at, at ECP. If you have a choice, there are cheaper places to eat at. If you're near to Parkway Parade, the food at the food court there is about the same price, but you eat at air-conditioned comfort."
Store 44 - Good satay!!!,"Tried the satay at this store 44, both chicken and pork, really well done, sauce is good too! They also sell oyster omelette and carrot cake."
Seafood BBQ at East Coast Lagoon Food Centre,"I would like to recommend our locals n foreigners who r visiting Singapore to visit this store, Stingray, store no. 43. They have been selling for at least 25yrs.... The quality n the standard of every dish is fresh n delicious as before! they have different ways of cooking and sometimes they also carry seasonal seafood..... Come try and experience yourself!"
Best Place for Satay and Seafood!,The food at East Coast Lagoon Village is pretty much value for me. I would always visit Adimann Seafood & Satay Specialist for its savoury satay and bbq stingray. Find a table near the beach so that you can also enjoy the sea views while eating your meals!
Lunch,Duck rice Q happened to passby n saw this Q for lunch not bad actually quite strong nice food and watermelon juice in this hot weather
Dinner,"I love having dinner with family at East coast. Food was amazing and delicious. So many varieties etc the best satay , chili crab , gong gong , big cereal prawns and all types of fish. It is cheap and portion is reasonable. The best part is eating near seaside and it is windy. Chill and cosy great place to hang out."
More pricey but nice atmosphere,"Pros
+More selection than a lot of hawkers
+Lovely location by the ocean, nice sea air
+Plenty of toilets

Cons
+Harder to get to than more central hawkers
+More pricey than most hawkers
+The only real game changing con to this place are the intrusive sales touters trying to get you to buy food. I would prefer they let me make my own decision. I wanted to view all the food on offer before making a decision and they were pretty much all trying to rush me.
+Might be a bit touristy for some

Conclusion
========
Despite the cons I'd love to visit again, so cannot fault the marks for this place I enjoyed the food and location too much."
Foodie By The Beach,"A good place to enjoy lots of variety of nice local food. Suitable for both locals and overseas travellers.Price is reasonable generally.

Recommend to attire in light and thin sporty clothing. Surroundings can quite crowded and the air quality can make you feel sweaty when you can't enjoy enough Seabreeze at certain times.

Other than that, the place and facilties were well equipped and maintained. TOILETS are clean."
good food amazing service but pricey,Place has amazing food where you can vibe with your friends with over lunch/dinner. Perfect for any occasion! had my camp over there and the food they provide really delivers! mostly open at dinner time
Satay so Yummy,"They have an excellent Lamb satay, fried oyster and BBQ stingray which is all delicious. I love it and reasonable price"
Introducing a friend to local food,This was the first time in Singapore for my friend and so we chose here to give him this gastronomic baptism. Great selection to choose from with all the classics.
Yummtastic,"Should really bring your friends and eat here, which is by the shores! Really windy and relaxing to take a break here"
Local hawker culture,"This is a hawker centre in Singapore, renovated and one of the better looking one in Singapore. The all-in-one stop to enjoy the local hawker culture with all the street food on offer like the fried oysters, hokkien mee, satay, bbq stingray, just to name a few.

A must-visit for first time travelers to Singapore."
"Cold coconuts, hot satay, and spicy crab","I love this place, the stingray, the chili crab, the variety of satay and the lagoon. You go out to the beach and see the waves as you chew on some amazing lamb skewers, you watch the sand castles and the people fighting for a place to sit. The real Singapore can be tasted not in orchard but in the hawker centers."
"Great hawker food; lots of choice, inexpensive food and beer. Great satay.","Located by the beach this hawker has views out to sea, it is all outdoors but the table are covered. There are dozens of stalls offering all kinds of foods; the more popular ones have long queues, (I think the longest was at 'Song Kee Fried Oyster'). The popular satay stall avoids having long queues by taking your order and giving you a pager to come back for the food when it is ready. The wait wasn't long and both the chicken and beef satay were delicious."
a great selection of hawker fare at reasonable prices,"we often go there if we want a nearby selection of good affordable hawker food. firm favourites are the oyster omelette, various satays, bbq stingray"
Cheap and good!!,"Favorites there are the oyster omelette, satay and chicken wing! Must order when you visit. I like to get the tables facing the sea when I’m there as well."
Sweat in goodness tasty food,"Boyfriend only request is to visit same stall at our little beach food centre for seafood meal. Crab, stingray, veg, clam soup with chinese wine. All at sgd$75. Better taste than restaurant but you must accept the facts that there is no aircon. Presentation of food is as good. Oooh.... the clam soup is heaven."
Haron Satay,We been ordering chicken satay from Haron Satay for a few times. Always long wait. But lately the standard has dropped. The chicken satay were dry and tough. Hard to chew. More like meat jerky. Some of the chicken were only half the portion.
Truly worth the trip,"This was a complete revelation and truly wonderful. Slightly Venice Beach in that you can bikes, skates etc to enjoy this fabulous coast and jetty. The view of the three hundred or so ships anchored just off shore is spectacular as is the walk along the jetty. If you are a plane spotter this is just under the main landing path and there is a landing nearly every minute. To top it all there are nearly 120 hawker stalls in this centre with the most extraordinary food. We could hardly walk out the place we had eaten so much. We have been coming to Singapore for 20 years and had no idea this existed. This is truly an amazing place."
Hawker food with many choices,Great eating place to enjoy Singapore food near the seaside. Many choices as there is many stall opened but only at evening time. Few stall in the afternoon. Anyway you can try cheap food and beer here.
Lots of food stalls! The halal stall we frequented was not that fantastic!,"Went there over the weekends with friends! Lots of stall you can choose from! We ordered our food from a halal store, the food was only acceptable but not fantastic! The place is quite crowded over the weekends! The Satay was not bad! $0.70 per stick! Competition is tough among the various stalls! You can choose from any stalls! Btw the view is fantastic! That’s the best Prize for eating at this place!"
Hawker Food,"The place was quite crowded, but once a table was gotten, we could dig into relatively cheap beer and good food.

Our dishes were Black Pepper Crab, Chili Crab, Fried Rice, Sweet & Sour Chicken, and Satay Chicken Skewers(plenty of them).

The food was pretty darned good and the skewers were absolutely brilliant. While the black pepper crab appealed more than the chili Crab.

Overall a good place to visit for good food with friends."
OK lunch but few stalls open,"Went here on a Thursday lunchtime, following lengthy walk through park. Very few stalls were open and the place seemed deserted. I found a stall selling Nasi Goreng vegetarian, which seemed OK. Accompanied by a Tiger beer from another stall, this was good enough."
Sea food galore,"The place is crowded. Found a table inside. The selection of menu was quick. Will help if the stall owners can speak a bit of English. Ordered chilli crab, prawns, stingray fish, greens, fried rice & bun. Food was a bit sweet. No napkin/tissue given with food. Had to buy it from an old lady selling it.
The place could be more cleaner. It was sad by Singapore standards."
Amazing Food,"One of the best Hawker Centre that I have been too in Singapore. Amazing food selection and friendly, accomodating vendors. Had a small sized BBQ stingray, kangkung belacan and rice for $20! Amazing."
An Oldie But Goodie,This hawker centre has been in the area for more than 30 years now. I have always loved it for its proximity to the beach. You will find all the various local Singapore delicacies here. The must-try is the satay. Hiring bicycles is easy as well. You will be able to ride all the way to Marina Bay Sands.
Amazing food with reasonable prices,The food here is quite reasonably priced and the quality is beyond our expectations. It’s a must try absolutely. Will be back soon.
Lovely and hygienic food,"The food village is located adjacent to the east coast lagoon. Make the best out of the trip here by going a little early in the evening and enjoying at the beach, which is impeccably clean and dotted with ships. Then have great and decently priced grub at the food village. Go for local delicacies. Be sure to drop your trays in the bins before you leave. And then take an after dinner walk on the beautiful and clean east coast parkway right upto the jetty and back."
Busy out of town food stalls,We were recommended to go to this food centre by friends and it was a longish taxi ride from Orchard road. Lots of good food to be had here. It was very busy and buzzy but it was a Saturday night we went there. Only drawback was the 1 hour wait for chicken satay so we didn't bother with that this time. The food we did have was very good and very cheap too. Another drawback was the long wait and josttling for a taxi home. Apart from that it was good food.
Great evening,"We went with friends and loved the evening here. Luckily we went early and we managed to secure a table. The satay we ate was the best I’ve ever tasted. The food overall we ate was well prepared and tasty, the prices are good and it didn’t feel very touristy, which was nice. If you fancy an authentic night market this is a good place to go. Also very clean, no dogs allowed, which I like."
Try once and you are addicted,"My friends bring me to this food village every time I'm in Singapore. To be honest, there's really no fun in going to Singapore and not trying out the food here. Though this place offers a variety of food, I just love their seafood. This time we tried fried sting ray. It was my first and I devoured it in one go. It was that delicious! It was fried to perfection and was smeared with spicy syrup all over. We also had squids, coconut prawns, clam noodle soup and green veggies. By the time I was done, I couldn't move...so I downed it all with a giant size portion of sugarcane juice!"
Best food with affordable cost,"As a singaporean, one of the best thing is that we can get good foods even at late night. If you are in singapore, do come down to East Coast Park Lagoon Food Village. Do try the BBQ Chicken wings at Ahmad Spring Stall and you will never regret it.!"
Outstanding for what it is,This is a very casual laid back outdoor hawker stand partially covered next to the beach and a large lagoon. It's a great place to spend the day with kids.
Cheap nice food available here!!,"It’s a must visit to this place! Seafood spread is the best here. There’s satay too available.. cheap beers! And desserts, all under one roof!"
Wide variety of local food,We liked the wide variety of local food at this place. The food tasted good. Only issue was that the place is not full rain proof.
Halal & non-alcoholic options,"Sunday family dinner, less $70 spent on food and beverages for family of 4. Cool breeze, nice pleasant setting. Place to bond. Went to bedok jetty then after, rented the quad bike $60/hr. Well spent. Plenty of laughters and memories."
Nice tasty end to a long ride,"Really nice weekend activity if you have friends or kids to entertain. Start on the bridge and get a few bikes.. ride all the way to this food court and try the satay and coconut water.

They have a lot of seafood, a few mainland places but no Indian if that’s your thing. The satay was probably the highlight though"
"Value-for-money, delicious food after a day at the beach","Many restaurants in East Coast Park are quite pricey, like Jumbo Seafood etc. Here, you will get tasty hawker fare at a great price. The stingray here is amazing, and so are the satays - some of the juiciest, tenderest I have tasted in Singapore hawker centres. Drink stall owners are really friendly and efficient and will offer/bring you drinks from where you are seated."
Cheap local food,"If you are in Singapore and feel like eating hawker food by the beach, this is the place! There are variety of food here! You can try their Satay, seafood, black pepper crab while enjoying your fresh coconut."
Great hawker food options!,"East Coast Lagoon Food Village is a long way to go if you don’t have a car, but it’s totally worth it! We had a really great long lunch there. Highlights were:
1. Char Kway Teow from stall 46 Choon Hiang, super tasty noodles;
2. BBQ Chicken Wing from Ah Hwee ( I think it’s stall 44), super juicy yet crunchy; and
3. Beef and Chicken satay from stall 55 Haron Satay, seriously good charred bbq satay sticks."
Fantastic,"Very busy vibrant hawker centre, great variety to choose from and very good prices. Highly recommend the chilly crab and satay."
not many good stalls left,"This used to house many good food. But I think the fad has died and the good hawkers have either passed away or moved on to another location, time and space.

Only 2 good stalls left... duck rice and fried oyster.
I don't tell you their stall numbers so that the crowds to these two stalls can still be managed cos the queues can get terribly long.
In fact, I was trying to get duck rice yesterday evening at 6pm.... but when I arrived, the queue had already formed and a stall runner was taking last orders.
Incredible how people plan their business... so sell out during dinner time. It's as good as missing out on likely possible profits.
But oh well, there are many other food choices there, albeit with no queue and standards not as great as the duck and oyster.

Chicken wings are good, but then it is not a staple meal. Perhaps to pair with beer.
Satay bee hoon was legendary, but the original cook is now dead.
The beef kway teow is no longer dishing out quality standards like before.

So really, what reason do you have to visit this food village?
None. Absolutely none."
A great place for family time!,Relaxing and fun park for both children and adults. Nice strolling around and chilling out with beloved ones. Various options for food and drinks at a good price! We love the sea food here and enjoy spending weekend with our family and friends here.
Good food at good prices,"This place provides a good cross section of street foods available in Singapore. Can be very busy, we were there on a Saturday night and it was crowded. Food was good with good variety. We have been here before and would happily go again."
Great food... Great choice,This place was recommended by a taxi driver and didn't disappoint. The area itself is a great area to walk around and check out the East coast... Food was fantastic... fresh and well cooked and a great price. Ready access by taxi.
Just landed with empty tummy,"Street food here, taste good, plenty of choices, well organized. Next to the beach, felt good mood and satisfied."
Haron Satay,"The East Coast Lagoon Food village is a good way to sample local Singaporean fare all in one go. We came here on a recommendation from a friend. We headed directly for Haron Satay booth. I don’t recall the location within the place. But you can walk around first to find it. I ended up with a 10-piece chicken satay from Haron, which was quite good, along with some rice from an adjacent booth. Tiger beer from a separate booth. We came on a Saturday night, and finding an open table was no easy task. I recommend going here as a group. One person can secure the table while others run for food and answer the buzzers when your food order is ready. Also beware its cash only. There are ATM’s on the premises. Stop by the East Coast Lagoon! You can take a walk along the beach afterwards."
Seafood and other local foods in affordable prices,"Having stayed in SG for 20+ years, here's a little insider tip - this is a paradise for local food at a local price! Chili Crab, Black Pepper Crab, Carrot cake, Satay, Buttered Prawns, Prawn paste chicken, Fried Rice.... you name it, they have it! Prices are more affordable than other seafood places frequented by tourists. We come here frequently for family meals and bring our visiting friends here. Be patient when waiting for seats as it may be packed during dinner on weekends and holidays; walk around as it's quite a big area."
Another Hawker Market,"Great, like many of them actually are. Lots of choices, and undercover as well. Unfortunately a bit out of the way though."
Good way to get the local flavor,Someone at the hotel I was staying at recommended this to get a feeling for where the locals eat and she was exactly right. This place was affordable with friendly service.
"Best ""duck rice"" and ""sting ray"" on east coast",Came here for several years already and honestly not all the shops are so great but they are few they really make the difference. my favourite are the DUCK RICE stand 29 if I dont get wrong... as u enter just on your left hand side second shop and the sting ray shop on the right side. Very delicious and everlasting taste. would love to rate the place individually but seems is not registered or possible but so 4* are my general feedback.
My Fave place for awesome Satay and Rojak,"Succulent satay and crunchy rojak..where you ask..East Coast Lagoon Food Village of course..With rows of stalls selling says, you will be spoilt for choice..For me, my choice is clear..It's gotta be Haron's Satay..The meat is grilled just right, peanut sauce not too oily but very crunchy..The Chinese rojak is yummy as well..With only two stalls, you can try both and decide for yourself..Of course being a food village there are lots of seafood and other dishes on offer..So do yourself a favour, give the place a go..You won't regret it.."
Great atmosphere outside,"A good place for seafood and satay. Try the stingray in spicy sauce. BBQ beef, Fried rice top. Good choice of drinks too. Nice place to spend an evening with friends."
A great place for dinner and a beer.,"Plenty of choice here with plenty of locals lining up for their favourite dishes. The satay sticks were sensational! It is a great location and after dinner you can go for a stroll along the parklands there. You need to pick a table and remember the number and then go to any stall, order the food or beers and they will deliver it to you table. It can get crowded on a Friday night but we had no problem getting a table. A great choice to try some genuine local food,"
Best food centre on the east coast,"Easy accessable, ample parking, tremendous choice of food, seafood, chicken rice, sateh, its all there and very reasonable priced, cleaning of tables when they become available is fast and good, very popular seven days a week, but specially on the Singapore Family day; Sunday.
Popuar with locals, as easy to reach via two ECP underpasses and by town folks as well.
Highly recommended by a frequent visitor."
Perfect Place for Dinner,"This Foodcourt is one of my top list to have dinner with friends & families. It's not so easy to get there by public transport and only one bus line operating from Aljunied or Bedok MRT system.You can have black pepper crab which is my favorite ever and prefer than chili crab version,BBQ chicken wing,Teo Chew style steam fish,BBQ stingray or prawn,Rojak,oyster omelette,Sambal kangkong,La La or Chuk Chuk, Ohh mouthwatering isn't it ?"
