topic,review
Brunch,"Stephan and Geraldine run a delightful breton creperie in Seah street.The savoury crepe with ham,egg,cheese and cream was thin and crispy and absolutely delicious.We had the lemon sugar crepe and the chocolate almond slivers( toasted to perfection) crepe to follow!Sooo goood…We will be back soon.
P.S.It is a small cosy restaurant,so make a reservation or just pop in!
Grace 13/8/22"
"Best French Crepes in Singapore, period","Celebrated my 23rd Wedding anniversary with my husband and 3 daughters. The savory buckwheat crepes are excellent. The garlic butter escargot is to die for. The highlight is the sweet crepes. We love the chocolate almond crepe so much, Every single dish is well executed. The price is also very reasonable for such great food! Will visit again. Highly recommended!"
Second visit and maybe 3rd in the near future,"Geraldine sets you up even before your visit. Make sure you make your reservation a day ahead. You will have to place 30SGD reservation fees which will go into your bill. The reservation process is a breeze. Text her on the number on the website and she will get back to you within the hour (we got a response in mins when we texted at 10pm). You can order your food in advance which helps the kitchen prioritise your meal.

It’s a great place to meet. I prefer indoors because Singapore’s sweltering heat can be quite unbearable. But if you do end up in the outdoors, the restaurant does try to relieve the heat w several well placed fans.

Set meal was the best. It includes a savoury, a sweet crepe and a cup of cider which you can top up with a small fee to make it refillable. Crepes are delicious, and almost feels home made. Personally prefer their savoury crepes to sweet ones because they have more depth of flavour."
Amazing food and service,3rd time visiting Entre Nous and I'm still amazed at the quality of food and drink. The Milky Dream is to die for and I can't help but look forward to the next visit to try more crepe variations! This place is a must try!!
Must try!!!,"We tried the Entre-nous and la ouessant - both were light, tasty and filling. For dessert we ordered the homemade creme brulee and it was the best I’ve ever tried!! If you’re around, this is definitely a must-try place!! Also the service provided by Geraldine was impeccable!! Will definitely return to try the other items on the menu."
Excellent service,"Geraldine is extremely kind and attentive. I had the Le Brehat, it was very filling. I liked how it was cheesy. Geraldine did not rush us even though the five of us sat for the whole evening until she locked up, thank you for your patience Geraldine! My pescatarian friend was able to find an option that suited her conveniently as well."
The best crepes ever.,Really enjoyed the crepes - which were made to perfection. The banana caramel crepe was to die for. Will definitely come back for more.
Authentically French,A warm Gallic welcome despite us arriving near closing time. Sadly no photos but the crepes were simply presented and tasted delicious. I’d definitely recommend this place for savoury and sweet crepes if you’re looking for a change to the south East Asian cuisine.
Yummy buttery crispy crepes,"Both the savoury and the sweet crepes were fragrant and delicious. You can taste that the ingredients are good quality! If you are a fan of strong cheese, highly recommend Geraldine’s Favourite Buckwheat Flour Galette. Will come back again"
Magnificent crepes!,"Fabulous experience at entre Nous. They are the most authentic crepe is town. Never too oily, rich in authentic French ingredients, look nowhere else.
Only thing to bear in mind is to eat in need each person to consume one crepe, which is easy for us since I eat two myself.
Had one hot apple crepe - was magnificent. The apples are juicy and don’t taste old, fresh and well marinated. Cooked to order with no taste of burnt crepe, on point."
My go-to place for amazing French crepes,"If you are ever looking for authentic and delicious French crepes, then this is the place to go. They are consistently good quality, delicious to eat and the service is attentive as always.

Only thing to note that they only accept cash or Paynow, which shouldn't be an issue for the vast majority.

Highly recommend to pay a visit. It does get busy during the weekends, so would suggest trying to book, else you can turn up and see if they have spaces."
Good crepes,"Last time I went with my family ,that was 3 years ago.I had a very good time. This time I went alone to try different crepes -still nice crepes - very delicious ,good quality as before.No wonder the reviews from all different visitors are all good! If I have opportunity to Singapore ,I would go back to this restaurant to enjoy all kind of different crepes .Ones again .strongly suggest this excellent crepes restaurant ."
Delicious Galettes!,"Nice cosy, unassuming place hidden at the corner of Seah Street. Their buckwheat galettes are amazing! Tried the egg/ham/cheese and the roasted chicken galettes. Both are crispy, savoury and tasty! Ended the meal with a sweet crepe with apple and homemade salted caramel. Enjoy the meal! Service is great too, will come again."
My Go-To for Crepes in Singapore!,"Been here quite a few times with friends and family and it never disappoints!

Both the galettes and crepes are absolutely delicious with my personal recommendation being ‘Stephan’s Favourite’. The french onion soup is definitely worth ordering as well!

Always a top notch dining experience here :)"
Nice crepes,"First time trying Entre-Nous, and we liked the crepes that we ordered. We had a variety (the 3 Chef's Recommendations and the cream spinach smoked salmon). Each crepe was crispy, tasty, and had a unique flavour. We enjoyed it. Will come back next time!"
Great French food!,Great homely food and service. Must try the apple ciders and dessert crepes! Onion soup and ham/cheese crepes were delicious too.
"Heartwarming, authentic crêpes","Been at Entre Nous a couple of times by now and enjoyed myself every time. The galettes and crêpes taste just like what you get in Brittany, and it's a joy to be able to access those flavours here in Singapore. We got:

- Escargots: deshelled, which saves you the hassle of having to scoop them out of the shells yourself (although that means you do lose out precisely on that fun). Good texture, fantastic accompanying sauce - really the wonder of escargots in general - that goes perfectly with the bread. Minor quibble: would love to have even more bread to sweep up all that garlicky goodness. (The bread in question is soft and very, very moreish.)

- Galettes: I had an Ouessant (cheese, egg, ham, and mushrooms). The buckwheat flour lends the entire concoction a pleasingly complete flavour profile, and the galette itself is cooked to a just-right crispness. Star of the show you can savour with no rush at all.

- Crêpe: had a nutella crêpe. The nutella filling is very, very generous - you get enough nutella on the plate after slicing your crêpe to scoop and guiltily devour. Slight hint of caramel to the crêpe that's an excellent complement - I imagine ice cream would have gone well with all this too.

The crêpe may seem a comparatively humble dish but prepared this well there's no question this is restaurant-quality. Get a galette and a crêpe on the same night and you shall be very happy indeed."
Excellentas usual!,Me and my wife decided to go taste some nice crèpes after not going there for a very long time!! I am happy to say the food was even better than last time we went and the service was excellent! Géraldine immediately made us welcome andat ease! Highly recommended for those who want to have a taste of Brittany!
The Best Crêperie in Singapore,"We had been away from Spore for a while and it was, once again, really nice to be back to find everything we could have wanted from a traditional French Crêperie."
Superb crepes!,Very yummy savoury french crepes and pet friendly for the outdoor seats. Great service and nice desserts too. Will definitely be back again soon.
Excellent food!,Partner and I ordered a galette each and we enjoyed them! Do note that each person has to order 1 galette in order to sit indoors.
A real gem!,"Apart from the delicious crepes (both savory and sweet) which all the other reviewers have already attested to, and the refreshing cider which it’s absolutely impossible to just stop at one glass (or bottle for that matter!), what kept me coming back time and time again over the many years is the relaxing vibe of Entre-Nous which transports you to Brittany and the friendly service which begins even before you step into the restaurant. On our most recent visit, after making table reservation (which you will be well advised to do so for weekends), the co-owner Geraldine took the trouble to inform the day before that they were expecting a busy lunch service and recommended that we order in advance to reduce waiting time. I found that very thoughtful especially since we were catching a play right after lunch. Having placed our order in advance, our food and drinks arrived promptly after being seated and we finished our meal in good time, allowing ourselves 20mins to take a leisurely stroll to the Drama Centre (located just one block away across the road).

Thank you for the lovely meal as always!"
Excellent crepes! 🥰,"Absolutely blown away by the delicious Geraldine's Favorite, the sweet crepe with apple fillings. Recommend to have it if you go.
Tried the savory crepes and they did not disappoint too! Great portion size, very generous with the fillings!
Excellent customer service too! Must try!"
"Best crêperie in town, right in the heart of SG!","Very scrumptious crêperie both salty and sweet, best paired with cider 🥰 been here a lot of times for a long time with colleagues , friends and family, one of my fave restaurant. Thanks always for the great food and service!"
Best Crepes,"What an amazing experience and even better food. This gem of a restaurant is tucked away in a busy street across from Raffles hotel but never forgotten. They were welcoming, very helpful to book a table and the overall experience was fabulous. Highly recommend"
"Great atmosphere, amazing food!","We frequent this place as it ticks all the boxes: amazing food, good service, good vibe and the right price point. The crepes are all delicious and they are super accommodating about any preferences you might have. I love the roast chicken and sautéed onions. The location is also great and it’s a nice spot to sit out front and people watch. We love it and can’t help but go back for brunch nearly every other week!"
Great galattes!,"Good quality ingredients, good buckwheat & overall flavour, & they have a good variety of options. Plus, the co-owner (Geraldine) is always friendly & welcoming. My favourite place for galattes & crepes in Singapore."
Delicious gluten free crêpes and apple cider,"I had the tomatoes and eggs buckwheat galette (gluten free) and for the sweet dessert I had the one with shaved coconut and maple syrup and coconut ice cream.

I have a gluten free and dairy free diet and they have options to accommodate those so it was sooo lovely as there aren'tamy gluten free ""crepes"" or ""pancakes"" available in Singapore.

Last time I was here was probably 10 years ago and this place still remains superb and vibes are pretty laid-back.

A must visit if you're visiting the nearby areas in bugis/city hall!"
Still the very best creperie in Singapore and better than some I had in France,"My n-th time back and the food is consistently awesome as always! There is just something in the crepe batter that makes it so flavourful, and the crepes are always served fresh and crispy.
I’ve tried a lot of other creperies including those popular on social media but Entre Nous is hands down just the very best. Recommended must-tries - La Brehat and Entre Nous crepes to be washed down with sparkling apple juice or cider. Nutella or Geraldine’s favourite for dessert if you still have space (if not make space it’s worth it!)

A cozy restaurant with a great casual atmosphere for catching up with friends over good food and drinks. I’ve even managed to convert a friend who doesn’t like crepes to be a regular an easy recommend ❤️"
"Delicious food, drinks and warm service","Visited with my family including a preschooler and one very picky two-year-old… everybody loved it! The crepes are freshly made, and the salted caramel cannot be missed. Merci beaucoup Geraldine and team!"
Delicious crepe in the middle of Singapore's cultural center,Lived here 9 years and this place has the best crepes in town! It's very hole-in-the-wall so while centrally-located it still felt like a hidden treasure. :) Would 100% go again!
Entre Nous creperie brings authentic French crepes to us in Singapore,"Loving the taste of French food and everything else french, I was really excited when I first stumbled upon this nice little eaterie many years ago, and I always try to come back whenever I am around the area.

Owners and servers are French and it cannot get more authentic than this.

I also like this specially curated French apple cider, which in my opinion goes really well with both their savoury and sweet crepes that they served there.

Came back again today this time with my parents.

My parents are typical Chinese who are usually used to Chinese food. This is their first time consuming French crepes and they really loved it thanks for bringing France to us.

I think they might come back again on their own next time ☺️"
Hidden gem!,"We absolutely adore this gorgeous authentic little creperie. Not able to nip to Paris … never mind! I can never quite decide what to order as I absolutely love the house made duck rillet but also want a savoury crepe! If I’m lucky my friend will share. The highlight for me is the desert crepes with vanilla ice cream … you have to save room for them!

These small family run businesses are an absolute joy … I can’t recommend this one highly enough! Go … just go. You won’t be disappointed."
Our go-to place for authentic crepes,"Highly recommended. Entre-Nous Creperie is our go-to place for authentic galettes and crepes. Great place for the entire family, including young children. We've tried other creperies in Singapore and this is, by far, our favourite. The savoury galettes are flavourful and delicious - the ingredients always fresh. The dessert crepes are super yummy. They also serve a nice cider - the dry cider goes really well with the savoury galettes."
A real authentic creperie,"For the aficionados who love galette and crepes, this is the go to place. Great food!
Do preorder your menu the day before your reservation to save you a long wait!"
Great place to be,"We were 8 pax for a lunch to enjoy authentic crepe just like in Bretagne! The savory galettes were delicious and we all add excellent crepes for dessert to share including the salted caramel, chocolate and lemon with sugar. The cidre was also very good. We had spent many years living in France and the lunch brought us back to our times in France. Unforgettable. Despite that restaurant was full, the service was very good too."
Great crepes,Very enjoyable at Entrenous. We had a very tasty dinner followed by dessert and coffee. The environment is convivial and the other patrons friendly.
Delicious,The food at Entre-Nous is delicious. Definitely worth a visit. The crepes are cooked to perfection. Compliments to the chef.
A must visit,"My family and I have been coming for their amazing and authentic crepes since 2012! Really glad to see today that they still have the same quality and consistency that we love. The restaurant is decorated in a natural/beach theme, the owners are French and the food is 100. Definitely one not to miss!"
