topic,review
ROM Lunch: Amazing personal service!,"My husband and I were looking to hold a small, intimate solemnisation together with lunch for 10 pax. Fulinmen NSRCC was the only restaurant that offered us a private room for this, with no extra venue charges or minimum spending. We also loved the scenic environment of the restaurant, overlooking the spacious golf course.
Right from our first recce visit, Ruel has been easy-going and extremely helpful. He is very responsive over text to any questions I have, and goes out of his way to fulfill some of my requests (e.g. having access to the room from 10am onwards for preparations). On the evening before my solemnisation lunch, he even took the liberty to send photographs of the room setup, to assure me that everything is ready and in place (as attached).
On the day of the solemnisation, Ruel was in the private room at all times, together with a helper. Once we arrived, he served us coffee and tea, and was on standby to offer help whenever he can. Once he saw that the solemnisation was wrapping up, he also took the initiative to start getting the dishes ready for service. The entire event flow was seamless due to his attention to detail. Of course, the lunch proceeded smoothly. Each dish in the 6-course meal was individually plated, and every dish was delicious! We especially enjoyed the lotus leaf rice, which was packed with so many ingredients and super satisfying! For the dessert, the portions of peach resin was super generous too. Ruel also took the effort to check whether each of us wanted the dessert warm or chilled.
Overall, it was a super pleasant experience with Ruel and his team. My husband and I are super glad we chose to celebrate our special day at Fulinmen NSRCC, and our family has nothing but praises for the food and service as well! Highly recommend this restaurant for any occasion, especially for brides-to-be looking for a fuss-free experience for your banquet/solemnisation!"
Good food at reasonable prices,Always a dependable place for quality food and cleanliness. Try the duck and seafood. Worth the drive to nsrcc.
Weekend meal,"Nice ambient, good service and attention to delight your experience for a good weekend meals.... a great get away from the hustle and bustle regular meal outing."
Good restaurant,The environment and food is really good! The staffs are very friendly and professional. Will come by more often!
Dinner,The Peking duck was fantastic and definitely value for money with 30% promotion now. Really enjoyed it . The rest of dishes were very good too! You must try it for yourself !
For birthday celebration,Thanks for keeping the standard up everytime I come... Food is nice n affordable. Food is very generous
Great for gathering,Great service and decent food for a good price. Recommended to come here for a nice family dinner. Their 1 for 1 lobster set meal is definitely worth the price!
Birthday Dinner,"The fish is very fresh, service is good, the Peking duck was very crispy and tasty. They also timed the cake on time."
Good ambience,Food serves are good and nice ambience. Ordered 6 course meal and it’s good and affordable. Recommend to come with friends
Great food great service at a hidden corner of Singapore,The Peking duck at half price is a steal. The 1 for 1 lobster set is great value for money. The service is great. Ample parking space. The shark bone soup is not as good as peach garden’s. Other than that a great place for dinner.
Food eating,This restaurant has a very nice ambience to eat in and the food is very tasty. Service is very good. Have come ample times. Defined would recommend this place.
Fabulous Peking Duck,Beautiful ambience and polite staff. Their peking duck is a must try! Ideal for families and friends.
Lunch,"Just had my lunch at Fu Lin Men. I have my lunch here twice a week The Food was very good and the service is excellent. The Manager, Ms May Lee is very forthcoming and recommend nice food to us."
Great value Chinese food,Great value Chinese food with excellent service. Must go for dish: Peking duck and whatever ongoing promotion dishes/set. A-Mei is ever attentive and friendly.
Food quality & service level,"Food quality is very good, for both dishes and dim sum. Staff are warm and provide excellent service."
Great Peking Duck,"Within a week, I felt that the food was so delectable that I went back to eat there. Service was great as well and is worth the visit."
Fantastic service and food,"We went for dinner yesterday at the NSRCC branch, and the service and food are honestly awesome. The steamed fish with minced garlic is world class, and the service for me and my little baby was extremely prompted. Will certainly come back in the near future - Derrick"
Winning formula,"Nice quaint place amidst lush greenery for a tantalising treat with loved ones. Servers were attentive and friendly while one of the managers, Ruel, frequently checked in to ensure that all was well. These combined with a reasonable price tag makes Fu Lin Men NSRCC a winning formula."
Great place for Chinese food,Both the service and food was amazing. It is definitely worth a visit especially if you enjoy great crab.
Value for money - Premium seafood with great ambience,"Ruel and his team made sure that my family and I felt comfortable from the point of phone booking till dessert. Dishes with premium ingredients, like the pumpkin sauce lobster and sharks bone soup, were worth the value, which was reasonable compared with other Brands of similar caliber. We would definitely return and recommend others to give a try. Remember to ask for parking voucher as it may be complimentary."
"Good food, great service","Nice ambience, good food, great service. Peking duck is awesome. It serves not only with the egg crepe but mantou as well. Tofu is very delicious. Price is also reasonable."
Solemnisation,Perfect environment Amazing decoration Superior service Delicious food One of the greatest day in our life
wonderful gem of eats tucked in city outskirts,"great food, peking duck is crispy and pleasantly surprised on being presented with the succulent drums and a novel way of stir frying the meats with salt and pepper. would definitely be back.
the lead service captain ensures that all things are in place, well done."
Food and service execellent,We are amazed by the food quality consistency and service.higly recomended. We always come here after golf
Fu Lin Men Chinese Restaurant,"The food is superb and the quality is excellent. Im not kidding. Try the Peking Duck, the fish maw abalone soup and crabs, and you will know what I’m talking about. The promotion is irresistible, super value for money.

The outlet manager, May, has a warm personal touch and is observant to fine details. And Raul, the marketing manager, he’s so engaging. The service there makes you feel like a VVIP, as though you are long time customer even though it’s your first time there.

Don’t wait...try and be convinced! ☺️"
Best place for gathering,We went here several times. Food is consistently great and service as well. Right place to eat after the golf. Cosy and elegance ambiance.
Dinner,"Had a wonderful dinner with my wife at Fu Lin Men. We had chilli crabs, asparagus and shark bone soup. All dishes were yummy. We loved it. May and Roel provided great service to us. Thank you!!"
Yummy lunch,Dim sum were fresh and tasty. We ordered a Peking duck and it was very yummy. Service staff - May and the rest of the service staff were very efficient. Relationship Manager is courteous and helpful when I called in to make reservation.
Sunday dim sum lunch,"It's the first time that I brought my family here for their dim sum lunch. The quality of food were very good and tasty. Service by Ruel & May were very attentive too. Will definitely be back for more.
We were also surprised that we were presented with complimentary lime ice cream with lemongrass jelly to end our lunch. Yummy!"
Great service at Fu Lin Men!,Great service at Fu Lin Men! The relationship manager Ruel is very responsive. Must try the Peking duck when u come!
Highly recommended,"Been there a few times since October, the quality of food never disappoints. The Peking duck and Dim Sum is a MUST!! And in terms of service, Ruel and team had done an excellent job!!"
Great good and excellent service,"Food was good, we ordered dim sum and pekking duck. Service was top notch. Manager May took initiative and went the extra mile to cater to the our family of 5 pax. E.g. Dim Sum came in the serving of 5. Complimentary birthday bun."
Lunch,Better food and great service. Highly recommended ..will coming back for sure. All items must be try
Delicious dim sum and nice ambience,Highly recommend the dim sum here. Food is delicious. Have been here a few times and always enjoy dining ambience here. Family friendly too! Only downside it is accessible by car...
Fantastic food and excellent service,"It was a great dinning experience. All my friends were so happy and satisfied with the tasty food and excellent service. Peking duck is a must-try dish! So Delicious! And someone I would like to mention is the manager Ruel. He made us feel like at home, always attentive and talked with smile. Thumbs up!"
Great place to hold small weddings,My wife and I hosted our small wedding lunch there and was pleasantly surprised by the level of service delivered. We had a dedicated person helping us clear out plates and dishing out the food for our table. The Fu Lin Men team also helped us to prepare the tea for the tea ceremony even though they initially said they were not able to and help me with the washing of the cups. The food was also very decent and reasonably priced. My guest and us had a great time there. I would definitely recommend them for casual meals or for important occasions.
Great service and Food,"Was there for family lunch, the peking duck was very juicy and crispy and the service there was really great !"
Daddy's lunch,Brought my dad for dim sum lunch at Fu Lin Men at NSRCC on 8 Nov. He loves the food there. Especially the pecking duck. My girl and niece also like the place so much. Is a thumbs up for everyone. Definitely a good place to recommend. Food is super tasty and the services also the best. Keep it up team!
Happy times!,1st visit to Fu Lin Men @ NSRCC. Food is great n place is clean n friendly! Excellent service as well. Good dining place for family.
Great and awesome lunch,"The Peking duck is really crispy and succulent. We don't live nearby but worth travelling the mile to eat the yummy char Siew bao and other dishes like fried prawn roll.Unlike other dim sum restaurants, the dishes are really unique and fragrant. Highly efficient service as well."
Was there for lunch on 6Nov.,"Was there for lunch on 6Nov. The dim sum and shark fin soup were great. The restaurant manager, Ruel, and his crew were attentive and nice."
Good taste & great service.,Staff were very friendly and service was good. Price is reasonable as well. Ordered the peking duck and it was delicious. Came with buns too which was a good surprise. Crispy chicken floss with fried brinjal was great too. Very aromatic. Requested for food to be less salty and everything came out perfect. Would go back again to try out their dimsum.
friends gathering,"was at restaurant for lunch with 2 other friends, ordered quite a lot dim sum but finished everything!! The charsiew bao was particularly good: very soft with very juicy and tasty charsiew infills. Recommended!!"
Dinner,Great service. Reasonable price. Food is delicious. Good and cosy environment. Very friendly and attentive staff.
Great Place for dinner,"Situated in a corner at NSRCC Resort, this restaurant is a nice quiet place for after golf or just family dinner. The service staff are very friendly and attentive and prices are not exorbitant. Food wise it's what you would expect from a good Chinese restaurant. A must try dish is the Beijing Duck."
Excellent 🦞,Great taste lobster and pumpkin sauce.... Just soso on the beijing duck. Good service. No corkage Theres 1 for 1 now for 6 course set. Worth the money
Hidden Gem at NSRCC Changi!,"Received really good service from Ruel! He was very attentive to our needs, and elevated our dining experience at Fu Lin Men. The food + presentation + service exceeded our expectations, and we will definitely be back for more! We had amazing Beijing Duck, and an impeccable Lobster set meal. This place is a hidden gem in the heart of NSRCC! Do check this place out if you can & spread the word! They definitely deserve our patronage!"
