topic,review
Terrible service,"Service was very bad. Waited at the front enterance for a long time and no one came so walked to a side entrance and the staff told us to go back to the front entrance.
We bought a discount voucher online and informed them before ordering.

Navigating the online menu was difficult with poor scale and loading time. When we asked the waitress for help to take orders, she told us to order online without helping us insisting “it’s easy”.

When the bill came we were overcharged and the waiter argued with us when we told him we bought an online discount although we had already informed the waitress earlier and she had scanned the QR code.

Overall average burgers with poor service. There are better burgers across the road without the lousy service. Will not be going back again."
Big portion burger,"Had the grilled chicken burger set, comes with fries (can choose your side). The set includes a cold drink and hot drink. Value for money for the big portion, can share between 2 pax and still feel full."
Healthy eating,"Love the ability to customize the burger and the myriad sauces available. As people become increasingly more health conscious, I think it is a good move to include it. Also, don't think their burger patty has like 50 ingredients in it, as it taste very home-cooked. Definitely would bring people here for the experience."
Nice meal,Wentfor a Sunday lunch.The food was good.More importantly the service by Lin an ex SQ stewardess was outstanding on table 405.Great experience
Burgers for vegans,"The four of us had a very pleasant dining experience and the food was good. Because we were vegans, we were somewhat disappointed that the restaurant did not have plant milk options, like almond milk and oat milk. So we could not have cappuccino. We had to walk across to Kind Kones in Forum Galleria for cappuccino and vegan ice cream dessert"
Good service and experience,"My first visit was very pleasant. Made a reservation via Chope and was greeted politely by the staff during Safe Entry.
All the staff that we encountered were in good spirits and polite in interactions, and about 2 of them stopped by our table to check on how we found the food.

Burgers are a satisfying portion and some may like they have a tray of sauces for your free use at each table (Mayo, some kind of marmalade sauce and 2 others maybe ketchup?)

Quiet eco ambience and lunch seats filled up quite fast. A lot of expatriate diners.

It’s at the foot of International Building (Yotel) beside TCC."
Good food and ambience (Dun expect too much on service),"Vegan burger with avocado and added mushrooms is nice!

Also thumbs up for their trademark sweet potato fries.

Food served within 15-20 min upon order, hot and fast.

Tried to reorder more food for second round. Waited in vain for 20 min
Order not captured despite sending in through in app.

Asked the server for assistance, he checked and realized our earlier orders also not in system.
Starts to lost his patience in figuring what went wrong n not apologetic at all.
Poor choice of words and tone.
We are willing to share what are our previous orders but his service attitude could have been better in handling customers."
Awesome food and good service,The food were really tasty and my kids enjoyed the food and ambient. The service was awesome as the waiters were very friendly.
“Lost” (or not lost ) Chope Table,"“Lost” Chope Reservation was a regular thing for Hans Im Glück . That was what the usher told me when I arrived at the entrance on time at 7.30pm to be shown to the table I booked on Chope. (I even showed her my mobile has a call from their number to confirm the reservation; which she told me she had no record of my mobile number and she was on a break at 5pm when that number called me ?Ooh a scam call or what automated machine called me ?
Quite bizarre...Mm...

When I called my friend to ask if she had arrived ; she was already at the table. She told me it was the same usher who brought her in under my reservation at 7pm? (So the Chope reservation was not “lost” before 7pm?)

Anyway, the snacks and drinks (thirst quenchers and beer were nice.
The burger was very dry(not my ideal burger which would be juicy... )

The environment (inner area ; we were at table 204) was nice too.

1 hour later, the same usher asked us to change to a “2 persons” table as another booking for 4 persons at 9pm arrived earlier.

Mm.... We were not told we needed to clear our table in 1.5 hours.

I hope the next time we could be informed the terms and conditions of our booking in advance.

Yes, even though I had a bizarre first visit, I would not mind to come back again for the decent Beer, thirst quenchers and snacks."
Vegan friendly and helpful and friendly,Very good service and very helpful and friendly services staff . Food are very vegan friendly and tasty. Great place for vegan and non vegan .
The best Veggies burgers in Sg,"Tired of being served impossible patty / beyond meat burgers which are just replicating meat texture (which vegetarian would want to eat that stuff ! ) we discovered Hans IM Gluck a year ago and it has been our favvv since then -- widest choice of patties -- walnut patty with fig jam , spinach patty , red pepper sauce and feta cheese patty are just a few from the variety ! and if u order a naked burger they give you some generous salad to compensate for the bread ! Service is fab, smiling faces and eager greetings make it a very pleasant experience every time !"
Good food with great service,Food has always been good. Very friendly and kind staff. Special lagar available in this outlet too!
Foodies,"Friendly staff, nice foods and drinks,,plus the view too comfy. The burgers are the best beef too juicy."
Good food and good service,Good food and good service. They are attentive and welcoming. I enjoyed myself there. Will definitely visit again.
Widest range of vegan vegetarian burgers,The service is good and friendly. The food options for vegan and vegetarian burger is fantastic. Would be fun to have a tasting option for the burgers. Good German beers.
"Premium burger, surprisingly affordable","Ordered the set (via the app) which came with the burger, a side dish (I had the German salad), a beer, and a cappuccino- all for $30. Not bad at all for a premium burger restaurant at Orchard. Highly recommended."
hans gluck review,the burger set is a great mix and value for money. i love the ambience and am a regular visitor of this place
Birthday dinner,"Headed down to the outlet at Orchard, staff were very very friendly! They helped with orders because there were so much to choose from and we didn’t know what is of our tastebuds. Food was not bad, a little on the drier side but it was still acceptable. Oh also, the chope vouchers helped us to save $10 from total bill! Totally fuss-free! :)"
Great burger,"Excellent veg and vegan options! Filling, delicious and just the right size! Friendly staff and clean environment!"
Always consistently good service and food!,"It's my regular haunt on Friday evenings with my buddies. One of the few places that serves beer before 2230hrs, and continues on with other non-alcoholic drinks and food till late. The waitress even told us the story of the origins of Hans im Gluck! Do ask her when you are there!"
Okay burgers and service.,Okay burgers and service. The ambience is nice. The photos look nicer than the way the burger is served. Nice and flavorful.
Good Value German Burger joint,Attentive service; good value burger meal. Yet to try non beef burger. Would be great if place has more air con seating in SG context.
Great & Healthy restaurant,Great & wonderful restaurant. Staff are friendly and helpful. Food menu have variety healthly choice. Highly recommended
Dinner at Hans Im Gluck,There were many choices especially for vegetarians and vegans. I chose a vegetarian one which was meant to be spicy but it was barely spicy. The meal came with a side and free drink. The sweet potato fries was amazing!
"Hans is not from Hamburg, otherwise his hamburgers would be better","We were going to try the new Shake Shack at Liat Towers, but got turned off by the 30’ queue and more importantly, the fact that it was recently visited by people who were Covid19-infected.

We had to wait 5’ before being seated by a blonde Caucasian (yes!) staff member, as there was no one at the reception counter. Ordering from the digital menu is a challenge, as letters are too small for the phone and we keep getting disconnected. Once orders have come through, service is very swift. The burgers are not great, but not bad either, better than the somewhat soggy thick fries.

Would we come back? Probably not. There are better burger places in town."
dinner,we had set meal which comes with two drinks. food is good. service is not too bad. staff are friendly
Wide selection of burgers and sides. Tasty and good portion.,"You can select what type of bread you want which is great or even go naked without bun. Perfect if your not very hungry as it’s pretty filling.
The set with 2 drinks - one hot one cold- side of fries or salad, and burger of choice is $20+. Good value and large portion, good enough to share.
Service is also friendly and fast. If you want a gourmet burger, this is the right place to go. The sweet potato fries are yummy and there are many different condiments to try.
You can also order some German appetizers or full salads if you want to go healthy."
