topic,review
Average at best,"We had high expectations coming in to try both Italian and Japanese tasting menus with wine pairing.
In overall assessment, the service was very good, ambiance and food was average and value was disappointing.
We ended up having the Autumn Tasting menu and the Italian degustation menu

Wins:
- The booking experience, reservation confirmation and informing us ahead what food is unavailable was very professional. All the ladies that were attending to us last night were very courteous, friendly, attentive and did their best.
- Presentation of all the dishes was great
- A few of the dishes were outstanding in quality and taste: Special Aglio Olio Peperoncino, Capellini with Lobster and Porcini and the Tramonto dessert.

Opportunities:
Food
Out of the three Amouse bouche we got, only the crab meat cone was good. The macaroon was soft on the outside, but hard and ice cold on the inside. The ‘Burrata’ piece had no taste at all. On top of that, it was the exactly same thing as my first course. That was weird. Burrata is creamy, oozy and has a lot of flavor. This tasted like a mozzarella ball you buy in Cold Storage.
Shabu Shabu lacked flavor in the consommé. Just bland.
Cold Carbonara - not sure what the effort is here, it wasn’t bad, but would have tasted way better if it was at least not ice cold.
Chicken mousse uneventful. Pork belly was 80% fat and 20% meat. Only memorable thing in the duck dish was the raspberry sauce.
Saved the worst for last - Tartufo e Mochi - completely inedible and just underlined the fact that the chef wants to have truffles in almost everything.

Beverages
The wine pairing was a complete joke. A cheap prosecco served in an Ikea-like flute, poor choice of white and red and some sweet wine served again in the same Ikea flute.

All in all, expectations were far from met. First impression walking in the restaurant properly dressed up, only to be looking at screaming kids in the pool and one of your guests with a hoodie and a hat (what happened to smart casual dress code?). There was absolutely zero wow factor in this experience. If you’re going to charge a 500 dollar dinner for two and call yourself a Michelin star fine dining establishment, you really need to step up your game.

I really apologize for this review, I predominantly leave positive ones, but this was really disappointing and we felt the value for the experience we hoped for wasn't there at all."
Lovely degustation Italian-Jap fusion,"There were three set menus to choose from: autumn set, Italian degustation and Japanese degustation. We tried the Italian one as we didn’t like sea urchin in the Jap one.

All dishes were beautifully presented with a Japanese influence. Take a look at our food pics. A wonderful collection of tastes was encountered in several dishes. Service was very attentive.

Nice and quiet. Faces an unused pool on the top floor, which isn’t that high today (24th floor, which looks like a dwarf when you have buildings towering almost double this hotel’s height, right in front of the pool view)."
Will be back again,"The food is very well prepared. The presentation, color, balance is very good. I love the wagyu beef tartar, which is very rich in taste, and duck leg confit, with the corn puree, very smooth with rich corn flavor, and also the chocolate dome. And all the staffs are very friendly and provide very good service. Will be back again."
Lovely Italian restaurant with great service!,"Il Cielo offers amazing wines, food and service. Staff are extremely knowledgeable and make great recommendations. Highly recommend the Capellini Pasta & Charcoal Crust Scallops - must try! The restaurant is by the pool side and the ambiance is very charming, perfect for a date night. Thank you Sarah, Caiying, Jasmine, Didacus and the Chefs for the lovely experience! The service we received was amazing and we will definitely be back again!"
Great food and service,"il Cielo is an excellent restaurant with sumptuous, good quality food served with creativity and great service and friendly staff."
Great Dinner Night,"Staying over for the night, and Opus was full. Family was open to Italian, so it was a good thing il Cielo had space for us.
Turns out to be an even better alternative.
My mother enjoyed her Japanese degustation, and Dad indulged in Summer Tasting.
I was soaking in the ambience, where natural comes into an air-conditioned dining area, I call that the best of both worlds.
Many thanks to Caiying, Sarah, Didacus, Jasmin and not forgetting chef Sasaki for this experience."
Anniversary Dinner,"Love the tenderness of the wagyu. Indeed a chef’s signature for the spaghetti. Our favorite was the scallop -super nice sauce. My partner and I got our most wonderful anniversary treat top with champagne! And most important of all was the relaxing ambiance we are looking for and the hospitality and the attention to details from the staff - Didaurs, Jasmine, Chi Ying, Sarah, and the superb food from the chef Sasaki"
Delicious,"We came for the weekday 4 course set lunch. Highly recommend the foie gras and the sea urchin pasta. Both are worth the supplement cost in my opinion. Grilled angus beef and panna cotta was very good as well. Thanks to the crew Didacus, Jasmine, Cai ying, Sarah for their excellent service and Chef Sasaki for the amazing food."
55 Birthday Dinner Celebration,"We had a Fantastic Birthday dinner with my Family. Staffs are very friendly and made our dinner enjoyable. Best Risotto with Braised Beef we ever had. Thank you to Chef Sasaki san and Didacus, Jasmine, Caiying and Sarah."
Lovely evening with attentive staff,"My partner and I had the 5-course Summer Tasting menu by Chef Sasaki. The staff, namely Didacus, Cai Ying, Jasmine and Sarah were attentive throughout the night.
Food was excellent and we liked that each dish was explained in detail.

I must really compliment the service here. I mentioned offhand that it was my delayed birthday celebration due to the earlier P2HA restrictions, and they thoughtfully arranged to serve a dessert plate. The restaurant overlooks a pool; the view is high enough such that it feels tucked away from the city; but still strategically located towards Marina Bay (we could catch a glimpse of the National Day fireworks from afar).

Thoroughly enjoyed ourselves and we highly recommend this lovely place."
Dinner,"Celebrated an anniversary dinner here. We were served by Didacus, Cai Ying, Jasmine and Sarah. Kitchen was led by Chef Sasaki.

Very lovely, cosy restaurant with a beautiful poolside view. Caught a glimpse of the fireworks from the national day celebration. Service from the team was also impeccable - all of them were attentive and very accommodating.

The food itself was excellent, especially the unagi capellini. The charcoal crusted scallops were also delicious and worth coming back for.

Will be back again sometime soon!"
Great lunch,"I wish there was some light music playing in the background in the restaurant but due to new government rules, I think background music is forbidden. The food is good but without music, the restaurant loses its vibe as it just feels like a high class canteen serving food. I hope fine dining restaurants can play music soon!"
very disappointed,"my 2nd visit: extremely disappointed with the quality of the cuisine.

Ordered a spaghetti bolognaise; a restaurant of this standing should not NOT be able whip up a good one. In its stead I received a cookie-cutter average tasting bolognaise - there were no hallmarks of the fine standard I had experienced at Il Cielo during my 1st visit (which was postpandemic so no excuses from their management thank you...)

my friend ordered a Swordfish for a main; it was fishy and it arrived H A R D ie overcooked - I haven't tasted swordfish before but hadn't expected a slab so tough.

It was a very disappointing experience; culinary standards have slipped and slipped during the Phase II Heightened Alert - Please go do something about it and no excuses about not finding the right kitchen staff or training them properly bla bla bla."
Il Cielo: Best restaurant with a view in Singapore!,"Amazing restaurant with one of the most beautiful views in Singapore. One you must visit for lunch or diner when you are in the city!
Chef Sasaki, who spend several year in Italy, combines the Italian dishes with a flavour of Japan.
Michelin star worthy in my opinion.
Sarah and her staf have been wonderful in giving a home away from home feeling.
Thanks to her and her team: Didacus, Jasmine and Cai Ying."
Excellent services and wonderful food!,"You can tell great effort and lotsa details put on the each dish by chef Sasaki! Also had a pleasant anniversary night thanks to the great services from the crew (Didacus, Cai Ying,Peggy and Sarah!)"
Wonderful service with delicious food,The food was delicious and the service was excellent. Thoroughly enjoyed the dining experience. Restaurant has a bird's eye view of orchard.
Amazing!!,"Service was fantastic, ambience was quiet and food was absolutely amazing! Had a great time here celebrating my birthday thanks to the wonderful team, Didacus, Cai Ying, Jasmine, Sarah & lastly, Chef Sasaki! Thank you for the wonderful night :)"
Personal Experience,Third visit there. The service was good and the staff very friendly. Pasta portion maybe can reduce slightly. Colour presentation can be enhanced. Dessert presentation look messy this time round.
Great start on the reopening of dining in,"Great Dining experience here on the first day of operation after dining in is allowed!

Ordered the Welcome to the Sea,Capellini Burro e Timo, Capesante Inpanata!

All the dishes were perfect! Enjoyed the freshness of the abalone, sea urchin, lobster and scallop! Pasta was probably the highlight!

Didacus was the main service personnel who attended to me throughout the dining service and the service was simply immaculate! Jasmine and Cai Ying also served me as well and they displayed super good service!

Strongly recommend this Italian Restaraunt!"
Appreciable,"We wanted a fine restaurant for enjoy Italian food appetit, little bit fine dine but good taste with savour"
Great ambience. Great service. Yummy food,"Ambience is great for a couple night out.
The Japanese Degustazione Menu really suits me. I love the soup & pasta totally.
Thanks Didacus, Jasmine, Cai Ying, Sarah & Chef Sasaki for the great evening."
A very pleasant dining experience,"Food was excellent by chef Sasaki. Importantly, we were attended by a team of very friendly people, namely Didacus, Cai Ying, Jasmine and Sarah. Will sure be back!"
Great Birthday Lunch,Lunch was great and surprisingly affordable. Served by Didacus who provided impeccable service. Will be back
Great food!!! Excellent service!,"1st time visiting here for a birthday lunch for my wife. Surprisingly very very tasty food. A nice restaurant with a nice view, great food, great service from the team and chef! Definitely will come back here for more celebrations."
Fantastic food with wonderful service!,"We would like to compliment the team for the fantastic food and the wonderful service when we were there for dinner on 20th Apr.

Didacus
Cai Ying
Jasmine
Sarah
Chef Sasaki

The dishes were meticulously prepared and the flavours were immense which were thoroughly enjoyed by our family. Least but not least, the service provided by the team made us felt comfortable and indulged throughout the dinner. Thanks again for everything!"
Amazing food and service!,"Amazing food and service! Came for a birthday dinner on a Friday night and ordered the burrata, lobster capellini and carbonara risotto. For dessert we had the yuzu sphere. They were all mind blowingly good. The staff were super friendly and attentive despite being busy. Thank you for the amazing experience, Didacus, Cai ying, Jasmine, Joel and Chef Sasaki♥️ we will definitely be back!"
"Wonderful food and ambience, perfect for anniversary dinner","My husband and I chose this venue to celebrate our anniversary and we had no regrets. Even though it was our first time here, we enjoyed ourselves with the creative, beautifully plated and delicate/refined Japanese-Italian gastronomy that surprised our tastebuds at each turn. Each dish is a feast for both the eyes and the tummy. While the food was the main star of the show, other highlights that complement this meal include the tasteful music, soft lighting, cosy indoor ambience by the Hilton hotel poolside, as well as the memorable service by the team: Didacus, Cai Ying, Jasmine and Joel, with special mention to Didacus for checking in regularly at our table and providing warm, friendly conversation to put us at ease. We are already planning our next trip back to Il Cielo and can’t wait to see what’s next in store - since the seasonal menu changes every quarter to reflect the palates and flavours of four seasons. Today was the spring menu but we can’t wait to see what flavours and textures that summer, fall and winter bring! Looking forward to come back and relax in a restaurant that serves food - and hospitality - from the soul."
"Special Thanks To Cai Ying, Jasmine, Sarah, and Chef Sasaki!","I would like to express my gratitude at the with special thanks to everyone of you tonight with all the preparation to make our family dinner a very good experience at this special occasion. extremely well.

I was hoping that you could kindly pass on my utmost gratitude for the outstanding hospitality that was shown to my family by Didacus, Cai Ying, Jasmine, Sarah, and Chef Sasaki!

Sincerely,
Anders's family"
A Fantastic experience,"sheeshhhhh the quality of the food far exceeded my expectations together with the top-class service created a unforgettable and fantastic experience,would highly recommend."
Compliment,The risotto is delicious the best way to eat risotto for first timer and the service here is very gud
Il Cielo,"The ambiance is really nice. The food is so good authentic italian. I love the Risotto
Thank you for the good service shoutout to Sir Didacus who explained our food. And to other staff. Cai Ying, jasmine and sarah!
We will surely coming back here.
Must try the Risotto and Capellini."
Excellent Food,"I went with my lovely wife for lunch, they served fusion food with a mixture of Italian and Japanese. We ordered lunch 3 courses and 4 courses set lunch. Overall of the food is over my expectations but the tiramisu not so satisfying."
Birthday for husband,"Didacus, Cai Ying, Jasmine, Sarah and Chef Sasaki are very friendly and their services are excellent.
Food is good. Will recommend anyone to come"
amazing service and good food,"satisfying birthday dinner at il cielo! the service team was v friendly, Didacus was extremely attentive and nice. food was great too!"
Great service and even better food!,"Saw the reviews of il Cielo online and decided to take my partner here for her birthday dinner and got absolutely blown away by the food prepared by Chef Sasaki, who then came over to chat with us at the end of our 4-course dinner (every dish was a gastronomical blast!).

Service was really exceptional as well, special mention of Didacus, Cai Ying, Jasmine and Sarah!

Will be back for more."
