topic,review
Good Indian food,"My hotel was couple of kms from little india and had to buy loads of souvenirs so little india we headed couple of times. Kailash parbat is known brand in India, so were pretty comfortable with it’s presence nearby itself. Food was good, basic simple tasty. We are vegetarians so Some ppl told us it would be tough for us to find suitable food in Singapore(i am going to repeat this statement in other reviews also for benefit of travellers). We had more veg food in Singapore than in india!! And good food. Stay near Little india or known veg restaurants and your woos are taken care.."
Delicious,"About 300-400 mtrs from Park Royal at Kitchener road, this restaurant is below Hilton Garden inn. Nice cozy place with some very good food and service. You can get anything from dal’s to chole bhature and they are delicious.
A must try restaurant while in Singapore."
Satisfied my taste buds,"My first day in Singapore.. I was with my in-laws Nd two small kids nd my husband.. being a vegetarian.. I searched for Indian restaurant.. so I tried many restaurant there later .. but as 1st day my nd mine whole family’s taste buds were satisfied..
The food they serve is excellent.. there preparations nd way serving is superb.. thy r very polite..my husband late for lunch ..as he had some work we were waiting for him in the restaurant for 1hour..the food served on his plates for him was not hot as he was late .., this was seen by the manager ... The manager was so nice lady .. on arrival of husband.., she microwaved the food .. so that it can hot nd better to eat

Yes it's quite expensive compared to other restaurants.. But then too ..Ur stomach is satisfied even the tastebuds

I am taking about the resurant in little India next to the temple ..it's best.

And guys this has branch near Mustafa centre too but there manager is too rude .. even they do not serve properly"
"Good snacks and sweets, main course was OK","Visited Kailash Parbat a couple of times over the past month. Firstly the place is kid-friendly which is great for families. The first time we went we only ordered snacks and dessert. The chole, pav bhaji and pani-puri were excellent and the pan kulfi was great. The next trip we ordered mains and one indian chinese dish. The paneer butter masala was ok and the gobi manchurian was disappointing. Overall still a good place to visit for good Indian food."
Best of Best Chaat Place in Singapore,"Can not explain it much but Amazingly delicious Chaats choices & Beautiful menu preparation..!!

Service can be improved , though few of them are always happy to Serve the customer well .

Would love to see some Maharashtraian Food choices on the menu .

Have visited several times but You will see me more often soon

Thank you"
needs improvement in food quality,"We ordered the following food:
aamchi mumbai sandwhich
pav bhaji
manchow soup

As compared to the indian food that we have in India , this preparation lacked that extra ""bite n sting"". The food was comparitively bland and the sandwhich was a let down.
This place looked popular as even at the late hour of 10 pm there were quite a few people having dinner."
Best place for Chats in town,"Everytime we want to treat ourselves with chats we head to Kailash parbat. Nice ambience, very good service, top of all yummy food..."
Trusted taste for midrange dining,"Chaat items are great, and so is Chhola Bhatura. Can’t go wrong with these choices every time you visit. Paneer pakora and kulfi are good too."
Good Indian food.,"The food was nice, with Indian taste, specially North Indian. Hindi speaking people with Hindi music overseas gives an extra star abroad where spicy food is scarce. Worth."
Good food but can get crowded,We visited here in January and the place is good. The food is very tasty and the service is great too. Food arrives pretty fast and cooked to perfection. The only negative is that it can get crowded and then you cant hear your family members or friends sittinf across from you.
Best place to enjoy authentic Indian meals in Singapore !!!,"Kailash Parbat located in Little India is probably the best place to have authentic, tasty Indian cuisine in Singapore. There are very few places in this country where one can enjoy genuine, tasty, Indian meal, especially Vegetarian, and this is one of the best !!! The location is on the main road in Little India. Place is quite big and well designed. Interiors remind us of India, especially Mumbai. Loved the food quality and taste. Service was prompt. Had a hearty meal in Singapore after quite a few days, so the pleasure was even more !!!"
Awesome Jain Vegetarian food,Kailash Parbat food made our stay in Singapore like home as we needed Jain Veg food. Awesome variety and tasy food. Great service.
A Bad Experience,Kailash Parbat was not such a delight to us as the food was average and not worth the money. The music was very loud and awfully annoying. The sweets were really bad and too sugary. The cottage cheese was stinking and all the food was with lots of cream. The way the waiters took the glasses was so unhygienic and they were not in proper uniform. Do not try this restaurant and go for some other one in Little India. You can try if you want but the restaurant was average and below our expectation. That's why I give it TWO STARS.
Great food and service,"Food tasted authentic as if you are eating in India. Very good service with very less waiting time. Lastly, huge variety to select from. Again, thanks for the great food and service."
Review on the food,We ordered the pani puri platter there it was one of the best chats we have eaten in singapore even the pav bhaji is excellent there the staff is courteous and humble. We also ordered falooda kulfi there wich suld be given a double thumbs up. Overall a great experience we had on our family trip. Also its not too heavy on the pocket. Highly recommend this place for vegetarian food.
Hygienic?,"My family and I often visit this restaurant because the food is great! Every time we go there, this Chinese lady who clears tables will talk to us. This time however, she asked us, “is the food nice?”. And we said yes of course. Then she shocked us by saying, “I see how they make it in the kitchen so I never dared to eat the food here.” Firstly, she made us all lose our appetite and secondly, she kept coming back and repeating it to us. I don’t think I’m going back there anytime soon. You should consider having her fired because she ruins your customers appetite and badmouths your restaurant."
Great eat for a vegetarian,"In Little India under the Hilton. Ambience is great and service is excellent. Orders are delivered very fast and quality & taste are 5 stars. Visited it twice on a 6 day stay. Food slightly pricier when compared to other surrounding restaurants but it is worth it.

Has a wide spread including Chaats"
Worst service and poor quality of food,"We arrived at the restaurant at approx 5pm. The restaurant was empty and the host could not be bothered to make an effort to acknowledge us or sit us down. Finally once seated and menus given to us we looked through the menu and decided what to order. When we called the waiter over to place the order only at this point he said they are only serving a limited menu and full menu is served after 7pm. They could have told us when we arrived that they only serve a restricted menu. We ordered papdi chaat, pau bhaji and lime juice. They must have had these items on tap as they were bought out to us in under 3 to 5mins. The lime juice contained more water than lime, the papdi chaat must had no flavour and the pau bhaji was aweful. The prices these guys charge are so expensive and the food is the worst I have ever experienced. There are much better restaurants around the vicinity for example Raj on the Race Course Road, they are a more professional outlet."
Hit and Miss Chaat But Awesome Dal Khichdi,"Somehow Kailash Parbat's outlet in Little India doesn't get any reviews - people are perhaps posting their reviews on the other outlet. Nonetheless, this place is supposed to be your go to place for Chaat even in the streets of Little India where there are so many other options. We went there on our first night itself thinking that if we liked the place we could eat here often during our 5 day stay. But sadly we never returned because we were not completely satisfied.
For starters we ordered a Sev Puri (SGD 7.5 +) and Ragda Dahi Puri (SGD 9+). The Sev Puri was spicy and delicious just like you would get in India. But the Ragda part of the Dahi Puri turned out to be disappointing - it was bland and basically boiled chickpeas - completely without flavour. We didn't eat more than half the dish and decided to order main course (which we hadn't planned to) - Daal Khichdi (SGD 12+) - which was the hero of the day. Piping hot and just how they taste in local Mumbai restaurants - it was absolutely delicious.
The service was prompt. They were also kind enough to see that our kid was not enjoying the chaat and gave him a complimentary bowl of muri and namkeen mixture. Rates are slightly on the higher side for the chaat but would have been worth it if the flavours were right. A 34 SGD bill for 2 chaats and a single main course is one of the more expensive tabs you will pay in Little India."
amazing Indian Food,Right in middle of Singapore.. if you have a craving for quality Indian Street food.. this is the place. . tried Dahi Bhalla Papdi.. dal makhani.. garlic naan.. everything was amazing.. comfortable sitting and not too expensive.. loved it
"Good Food ,Good Service But Prices on High End","Food was good, Service also good, but pricing seems to on quite high side , seems 100% top up on STD pricing"
Excellent Food and Service,"I would recommend this place for authentic Indian Chaats. My personal favourite in KP is Vada Pav and Pani Puri. And the lassi here is just delicious. Sandwiches are quite tasty, but they seem to be a little on the dry end for me. The staffs are quite friendly and helpful. Overall an excellent place to relish some Indian foods in a budget friendly way."
Ethnic tasting Indian cuisine.,"Stumbled upon this resturant by pure connivance. My mother is a falooda lover. Different types of falooda are served here all tasting amazing.
The sandwiches had a very rustic taste only found in some places in india so i was more than glad to visit this fine establishment twice during my visit to singapore. The staff ( specially the waiter who has a sister in saudi) made us feel extremely welcome and engaged in conversation and helping us to choose from the menu."
Good,Come and indulge in Some excellent quality of Indian food please do visit with your friends and family I personally recommend
Reputation,"I am an avid fan of KP and its Pani Puri in Mumbai and as usual it has its own reputation of serving delicious food and it did not disappoint me either.

The best part is the taste of PP is exactly the same. It was my first visit to Singapore outlet and I thoroughly enjoyed it."
the food is good but service extremely poor,"As I entered the restaurant I was escorted to my table and served with water.

the person who came to take the order was least bothered and was busy chit chatting with another client. We ordered our food first we received a dish that was not for us. He placed the platter and then apologized saying it was not for us. he again said it was for us, we checked and told him it wasn't then again he apologized. (was a very casual apology though). After a few minutes again he got us some food which was not hours and again we told him and then he went to another table. and finally our food arrived.

The taste was good, nothing great but good food. The juice came flat and we had to tell him to get ice. normally they should ask while ordering.

When we left again no smiles.

above all this the restaurant had around 100 people capacity but there were only 8 guests including us so imagine this mess with 4 serving staffs. imagine with more clients.

finally we went out and ate a busy food joint which was ananda bhavan trust me had great food !!!

There is another restaurant called gokul which is also a good indian restaurant nearby"
Indian chaat in singapore.,"They have 3 outlets in Singapore, I visited two of them and both are good.
They have a huge variety in Chaat like bhel puri, paani puri, pao bhaji etc.
North Indian and south indian is also good.
loved the royal falooda.
Almost all staff is indian and they also speak Hindi.
Prices are also reasonable a family of four had starters, chaat , main course and desserts all for some 65 singapore dollars."
Best Pure Veg family restaurant,"This is the only pure Veg North Indian restaurant as far as I know.

Food quality was great, ambience is good too, good housekeeping, crowd good too.
Sometimes need to wait to get the table for dinner, mainly on weekends.

Kailash Parbat has to branch there in Little India, One is just under the Hilton garden inn, Serangoon road.
2nd is in front of Mustafa centre.
Both are good and have same food quality."
BEST VEGETARIAN DISHES IN SINGAPORE,"The choice of food was varied. We ordered for Butter Naan, Paneer Masala and Dal Fry. Food was delicious. The waiting time was less than normal. The crowd was good."
Amazing Chaat!,Love their Chaat items and their Indian Daals are not bad either! Go-to place for Pani Puri ! On the pricer side though. Tasty mithai / indian sweets as well. Service could have been better and seating arrangement in both outlets can be improved.
Terrible chat item,They only waste time ob decorating item Very expensive Staff not polite specially if you go in the afternoon and slow service Bad experience 👎🏻
Best Food we had in Little India,"We were group of 7 members, all Vegetarians and looking for some good options for dinner. One of my local friend suggested about this place. And her suggestion was absolutely right. We get the best veg food with authentic Indian taste and lots of veg options here. Delicious food.. Little costly but taste recover all."
Great food in a platter,Amazing Desi food and gives one good variety of chats and other Indian delights. Don't miss out the soups there as well.
indian taste,"this restaurant offers a wide variety of indian cuisine.The food is really delicious but the service is average.If you are looking for a vegetarian option and indian taste,this is the place to go"
Heaven for vegetarians,"Dal makhni, paneer butter masala, butter nan, jeera rice, chole bhature, all items are very delecious. Taste is like as in india. Service was to good. Bit expensive but no problem, you are in singapore."
Excellent Food,This place is located very near to the Mustafa Shopping Centre . It caters to excellent Indian food with very authentic taste and aroma. The North Indian dishes are a must try. Service is also decent.
Excellent Indian Food Restaurant,Whole variety of Excellent and sumptuous Indian cuisine available. Had a variety of Chat items to start and had tasty Chole Bhature and off course Lassi.
Delicious!!!,The service is very good. Staff is very co-operative. The food is awesome. You would love to eat chats.
Food....Bit expensive but delicious,"Food is little expensive but tasty. Ambiance was good....special mentioning for spinach Pullao.It is situated near hilton garden hotel, approximately 500 mtrs away from Little India MRT and Farrer Park MRT"
Average Chhat,"We went there for Chat, but it turned out to be just OK. Lunch choices are also available with reasonable service/I will say overall Average"
Heaven for Veggies,"If you are a vegetarian and wish to have Indian food, you can visit this place not only to satisfy your hunger but also to enjoy the food. A bit expensive but if you can find tasty Indian delicacies at Singapore, it's worth."
Very nice and tasty lunch,The lunch choices were very good. The food quality was very good and even the quantity was enough for 2 people in 1 vegetable.
Amazing!,"Wow, what can do say! I wish I lived next door!

The food is amazing and the service is good. We had puni puri, chole bhature, tandoor paneer, kulfi and ras malai. Everything was amazingly good. I also had a mango lassi. I am not usually into lassi but this one was wonderfully thirst quenching!

I am looking forward to my next visit and there are so many dishes in want to try!"
The food is very tasty but also heavy so go here only if very hungry,"We took the Bhatura platter (big mistake as the bhaturas were flat and oily) , Cholas, Paneer kadhai and a mixed vegetables. Very tasty but lots of cream and oily
Would recommend ordering Bhaturas separately as you get fresh Bhaturas
Seating is comfortable and service is good"
Good Indian food..!,"Liked food a lot amidst Singaporean cousin (If u miss Indian food there). Pros: Good taste, hygiene, accessible,u will meet lot of Indians there Cons: Rude staff, economical."
