topic,review
"Lots of variety, great stuffs",Great vegan options. I personally love the pani puri there. Good ambiance. Great taste. Lots of variety. Very recommended.
Love to go,"With my family, I visited this restaurant. Newly renovated branch on Belilios Road looks gorgeous, with nice architecture. Our recommendation is to try Chole Bhature and Dahi Puri. Dahi puri is very satisfying when you are hungry. I try to eat at least once a week."
Good Indian vegetarian food,"I had my dinner in this restaurant, it is next to ma kaali amman temple. The food in the restaurant is very nice. Good options in north indian and street food. I has ordered for veg biryani, paneer korma and sev puri. Good food."
Absolutely brilliant!,"We had the signature Bambaiya Dahl Puri which was not our favourite, yet still very good.

TheTikka Chaat was amazing - sweet, yet savory and an explosion of flavours. Highly recommend.

The Cheesy Masala Pav, a spicy blend of tomato onion gravy stuffed inside a butter laden pav (bun) blew my head off! I love a spicy curry, but this one left me for dead. However, stupidly I kept going back for more.

My carnivore father thoroughly enjoyed every bite of authentic Indian food. If it wasn't our last night in Singapore we would definitely be back."
Service not great,"I have been coming here since it has opened amd can see the service is grtting wordt even with staff

I Stood for 15mins to be sested, the place was empty, I then approavched 2 different people and thry said wait there as they were so busy with 3 tables being full. I thrn sae a couple came through the side entrance and just went to a table and sat down and the staff started serving them. I then I decided to go and sit down myself.

There was short guy with glasses, he just ignored me, he wasnt even wearing uniform,.was wearing a CK T shirt.

Even when u want to order or ask for the bill, they just ignore you. I even thought about just leaving as no one was bothered about taking my payment, then someone acknowledged me after 20 mins of waiting.

I always looked foward coming here, but now I dont think I will bother"
Pathetic standards,"I visited this restaurant on 24 July dinner .Was seated and waited about 25 minutes for some one to attend to me .I ordered Lemon corriander soup .The soup was served in a very sub standard way with no service plate & the soup cup was not even bothered to be cleaned even ,The bhel puri was to hot to handle .I did point this to the Manager over there .Standards are abysmally low .The restuarant does not care about all these I guess they have customers /tourist visiting them once .The AC grilles are full if fungus & water drips every where .It is very substandard & could be a victim of futrue food poisoining issues .be aware"
Good Food and service,Good food and always managed to meet our dietary requirements. Very good friendly service from Nalini from Singapore.
Bad hygiene and service,"Came back after 3 years. The hygiene and service levels have drastically reduced. The chutney had a white layer over it which looked fungal and the other jar had food stuck to it.
The cold coffee was served in a mug which had milk stuck to its bottom. The staff did not even bother to clean the outside of the jar before serving.
Food was average."
Need serious hygiene check up,"The food was average, the prices are a little bit high for this type of food and type of restaurant. The lady who cleaned the table has also handled food ( without washing her hands or using a sanitizer ) which is disgusting. They need counseling in food handling and table manners."
Staff discriminates. Go elsewhere if you aren't Indian or a local.,Absolutely disgusting service and treatment by staff. Their blatant racism persevered over professionalism. The female server refused to take our tables order and the male server skipped over a few members of our group while taking orders. They should be ashamed.
Horrible Experience,"Horrible experience with rude staff that ultimately led to me not receiving my order. On Diwali, I ordered using Grab Pick up for my entire family including my 2 year old daughter and elderly in laws. The order was accepted and shown to be in the kitchen with the order showing to be ready for 1.10pm. We arrived a few minutes early and waited for the order to be shown as ready to be collected on the app. At 1.10pm, it did, so we proceeded to the counter to be greeted by a rude and curt lady asking what we wanted. My wife showed the order number on the app and she responded that the order was not even accepted by them. My wife explained that it showed as order is in kitchen and then order is ready but they pretty much ignored us saying that they are too busy! I contacted Grab to see what the issue was, and when they attempted to reach out to Kailash Parbat, they did not answer the phone. The recourse? Order is cancelled and a S$3 refund was offered by Grab. That's not even as much as my transport cost me and does not resolve the issue of where I am supposed to get the food from. Kailash Parbat staff? They continued to ignore us and their phones!

I understand that it is Diwali and potentially the busiest day of their year, but simple customer service and being prepared would go a long way! Acknowledgingly, with the current COVID safety measures, orders from Grab and similar food delivery apps are going to be the norm, so ensuring that the phones are manned is paramount. I would have at least expected the restaurant to suggest that they could look at the order and prepare it then due to a mistake by their service provider. And Grab should be ashamed of themselves for such an insulting appeasement offer after acknowledging the time, effort and money spent on going to the restaurant and waiting just to leave with nothing.

For Kailash Parbat - as was obvious, they have no care for their customers and blame Grab systems but don't take any accountability when a customer has come to pick up an order, rather ignore them.
For Grab - blame Kailash Parbat for not answering their phone, and then blame them again for device potentially being faulty but don't take any accountability.
For the customer (me) - having pre-paid S$120 for a meal, wasting my time to get it, leaving hungry people at home on a religious day for me, to be passed all the blame by Kailash Parbat and Grab, and running around at 2.15pm trying to find somewhere to eat.

Thank you Kailash Parbat and Grab for showing that money matters more than customer service!"
Don’t waste your money for the brand.,"The quantity and the quality is too bad. Lost its charm no point spending any money here. Lame pav bhaji, potato and tomato Puree with pavbhaji masala, bambaiya dhai puri was like sweetest lassi filled puri. Ordered platter was worst. Never had such experience before.

Ordered veg momo was not even cooked.

I guess time to look for other places."
Worst dining experience in years,"Served outside packaged food, when confronted… claim shortage of staff ! Could have told upfront when I was ordering."
Home delivery worst service,"They are famous for unprofessional customer service. They dont inform the delay of the delivery and no one bothers to call. We have to call and chase them to know the status of the food. I recently placed an order overnight for the next day delivery, inspite of them having more than 15 hours of prep time they couldnt deliver the food on time and they absolutely dont want to take ownership for the delay saying it is not our problem"
Incredibly sweet service and fantastic food!,"We were totally new to this kind of Indian food, and were hesitant to try at first. But the warm and super welcoming service, made us take the plunge! And it was so worth it. We felt like tourists in our own country, and the whole experience was very enjoyable!

The staff taught us how to eat certain foods, explained some of the ingredients, and even specially made custom versions of dishes that my wife couldn’t take (she can’t eat chili). I have never experienced such homely attentiveness in a restaurant ever.

Definitely will return, and bring my friends and family too!"
Glass piece found in food,Ordered chole bhature and found glass like piece in the chhole.. cleanliness and safety both compromised.. never going to come back
Home delivery worst service,"The food u get for home delivery is totally different from what u get in the restaurant. They took 2.5 hours to deliver our food which was like eating leftovers from the day before. Veg manchurian had no vegetables in it and was tasteless. Chaat platter u get in home delivery is not good either. Don't ever order for home delivery from this restaurant. The waiting time is too much and even after waiting, the food u get is disgusting."
Food was too spicy for us to even enjoy,"Food orders: Pani Puri, Papdi bhalla chaat, daal makhani, paneer butter masala Each item was extremely spicy to the point of being inedible - and this is coming from a Desi!"
Avoid online ordering from their website,If you want to have your lunch as a stale snack then order online from their website. otherwise there are better and faster options to get delivered from other more reputable restaurants. They take 2 hours to deliver food...a reputable brand like them cannot speeden this process which is such a shame
The food is decent. Sometimes,The food is decent. Sometimes it’s good sometimes it’s mediocre. Service is also decent given what time you’re go and how packed they are. You have to keep asking for things and they “eventually” come. The hygiene of the place and waitstaff is questionable though. Every time I’ve been there my friends or husband mentioned that of smelled of urine and I agree. Always a ton of kids who are going around touching all the silverware etc that are sitting on the tables and no one bothers to clean them for the next round of guests after they have been touched by so many hands. Seats always have food and crumbs on them which patrons usually clean themselves. One time I noticed the waiter use his bare hands to tuck back some noodles that was falling off the bowl as he was taking it to the table to serve. Gross! This is Singapore not some roadside dhaba in India. Please set your bar higher.
"Comfort food, good staff","Kailash Parbat scores on all fronts - good food, friendly staff, decent prices, good location. We’ve been frequenting this haunt for a decade and hv always enjoyed their service n food. Special mention for Ms Jyoti & Mr Sunil from their Syed Alwi Rd Branch in Sg. Excellent staff members."
Arrogant Service Staff,"Your online feedback system seems broken. Below is my complaint:

""I was at your restaurant yesterday (3/10/2020), about 7:45pm. I usually go there mostly on Saturdays. I like the food, and the ambience of your restaurant. For some reason, the reservation system tablet wasn't working yesterday. A register book was kept in place instead. I saw people had written their names and numbers, so I did the same-- thinking that the names will be called in that order. A few moments later, a family of 3, and another person entered the restaurant, so I stepped back so they could write the names too. At the same time, one of the staff members got there and told the family and the other person that they don't have to write their names, instead they can just let him know. So he took note of their names, and I kept telling him that I had been there before them, and my name is written in the register. He didn't pay any heed to that, so I repeated myself, and he didn't even bother to look me in the eye this time. And he left. I tried calling him 3 times, but he did not care. I was just too hungry, and I did not want to create any scene there, so I left. I like your food, and your restaurant, that's the reason I frequent it. But what happened yesterday shows lack of respect towards customers. I can understand the reason for preferring larger groups, but that doesn't not mean that smaller groups can be conveniently neglected. I might not eat at your restaurant again because of what happened, but I hope at least this will be considered as a constructive criticism so that your staff is better trained to be respectful to everyone, irrespective of their group size. Thank you."""
Delicious north Indian food in nice setting,"This popular restaurant offers amazing food, a friendly staff in a nice atmosphere. If you go one time, you'll want to go back. Great for vegetarians."
"Chole Bhature , Gulab Jamun and Sev Barfi simply outstanding",Problem of Choice . To have the chat or the Chole Bhature or binge on mithais . We ended up doing all and had a wonderful time
Very bad customer service!,"This restaurant has very bad service! Please train your staff better!

I had placed a dinner order via the grabfood app at 230pm. The order was to be delivered at 645-7pm. The delivery arrived at 830pm. That is fine, i don't have an issue with that.

They missed one of the orders. It was definitely not a fault with the grab app as the receipt by the restaurant that was attached to the delivery items contained the missed item. I called the restaurant back upon receiving the order from the grab delivery person.

The staff who picked up acknowledged that they missed an item and told me that they will send it to me that night itself. I did not receive it. If you're not able to deliver on your promise call and tell me. If for whatever reason you are not able to call me, at least drop me a message as you have my number from the previous call.

I called back the next day and spoke to the manager of the belilios lane branch. The manager who was very rude, told me that the ""location where i stayed was too far to deliver"". He mentioned that he ""will add it to my next order"". I told him that it's not fair that i have to spend more at your restaurant when you have screwed up. He then added that ""he was very busy and to text him my address"". He didn't even bother to take it down. He also added that he will send over the missing order item ""either today or tomorrow"".

I have yet to receive this missing order which this restaurant owes me. I will proceed to make a complaint with GRAB and CASE if this order is not met. I can brush it off if it was a small amount but it's not.

Such an appalling attitude by your staff for speaking to me so rudely when it was your restaurant's mistake."
Rediscover the fabulous snacky street food of India,"One of the iconic casual snacks as well as street food chain from India. The branch at Little India does the mothership restaurant at Colaba , Mumbai proud.

The Chole Baturas are top nautch and so are the various chats of North India or the vada pavs, pav bhaji from the streets of Mumbai
Reasonable pricing and friendly staff also help in making the overall experience stand out"
No brainer for vegetarians,"Has the usual fare, tastes good and service is quick. I went as I had little time between arrival and meetings. Recommend if you are the picky Southasian vegetarian."
My wife birthday,It’s worth visiting here again n again #Amazingfood I always celebrate our special occasion here Specially thank to Manager Riaz he a gem thanks 😊
These hotel is best hotel,These hotel is best hotel for indian food in Singapore..best experience. Food quality is awesome.and staff is also very good .owner of these hotel is also a very nice person
Vegetarian Indian food,"A spacious, comfortable and clean restaurant in the heart of Little Indian. All the other customers seemed to be local and enjoying their food, a good sign. The staff were helpful and explained the choices well along with recommencing dishes. It was a reasonable price and very tasty. Only vegetarian food served, but that seemed normal for the area."
Great taste,Food was very tasty. The soup and the non veg options were very tasty. They could have morw options for the dessert
"Very good, central, spacious, very large menu, good servive","Excellent lunch, quick, helpful and efficient service. Highly recommended though not cheap. They accommodated my request for not very spicy, explained the differences between various vegetarian options, and met all expectations. A fine experience. The price on the high side."
Too spicy,"Went to eat here during my stay in Singapore. There are not very many restaurant that serve Punjabi food in Singapore. The seating is ok typical of an Indian restaurant. We ordered paprika chat, Chole Pathure, veg pullao. Asked them to make the food mild but it came out to be quite spicy. Rice were very basic and pathbreaking was chewy. We decided to take Gulab jamun with us to have with tea whe we return to our hotel room. I went there because of good reviews but couldn’t understand how people could review it so high as we found it just very basic. I went to use the toilet but had to come back as firstly the lights were not working and the smell and state of the toilets on the whole was disgusting. When I told the staff that lights are not working in the toilets I got the response “I know”. We left majority of the rice as they were tasteless and I left half the pathbreaking as it was far too chewy. Papri chaat was ok. And the price I paid was the same as we paid in our hotel restaurant so I will never visit it again even if I revisit Singapore."
"Good for Veg, Jain Options","It is like a brand recall if your are an Indian. You will feel like you are in Mumbai after entering the premise, after looking at the Menu & after having the food.

But all these come at a cost, it is a bit expensive relatively."
Bad service for home delivery and party catering.,Quality of the food is good. But I have to give 0 rating for their service.always late for min 1 hour.
Very very good vegetarian food,"Extremely clean restaurant located in Little India and close to the subway train station. Food is excellent, although on the pricier side. Amit, the manager, very friendly and helpful guy who ordered a grab for us when we didn't have wifi, no taxi would stop to take us to our hotel and no one else on the street would help us by using their phone to order a taxi for us. We then decide that the next day we will visit his restaurant for dinner and were not disappointed at all"
mouth watering vegetarian indian food,"recently we were in Singapore, and being pure vegetarian without garlic was a problem in Singapore. but kailash parbat made us at home with their gentle and vibrant attitude , fast services and real taste of india food . highly recommended."
Singapore holiday,We were looking for vegetarian restaurant for our dinner after visit to gardens by the bay. Our driver suggested us to visit this restaurant. We reached this restaurant the place was full but got table very quickly. Food was excellent and delicious. We wanted to visit again but couldn’t make it. Overall good ambience and excellent indian food.
Awesome North Indian fare on offer!,"After a busy evening including a Saturday evening visit to the bustling Kali Temple on Serangoon Road, we had two hungry tired children in tow with four adults equally tired looking for some authentic Kailash Parbat fare, not dissimilar to what’s on offer in Mumbai, India. Kailash Parbat Serangoon stood up to its reputation all right in awesomely authentic fashion. We had to wait 10-15mins to get seated but once in, the service was prompt & attentive and the food piping hot and mouthwatering! We tried the Chole Bature, Aloo Tikki, Paani Puri, Paav Bhaji, Dahi Puri & some Rice and Black Dal for the kids. For drinks, we tried the Mango Lassi, Masala Chaat & Fresh Lime Soda. Each item was ‘spot on ‘ in taste and it turned out a sumptuous meal. We are sure to return!"
BEST VEGETARIAN NORTH INDIAN FOOD IN SINGAPORE,"This is probably one of the best place to eat North Indian food in Singapore, even the chat items and sindhi food are best.
the food is the best & the service is excellent.
the staff is really good specially Mr. Rajesh, Mr. Riyaz & Mr. Amit.....all other team members are good at service.

Please note weekend evening the waiting time varies from 30 min to 1 hours."
Food is good but Extra 10% Tip is a pain,"Food is really good, its a bit costly. But the cherry on the Top will be 10% compulsory TIP.

You can not deny that extra 10%. So if bill is around 80 SGD for 4 then ultimately it will be 88 SGD. 8 SGD in Tip around 400 INR for TIP, seriously its too much for any Indian.

so went only once there its way too costly."
tasty food,very good food & location.. staff also very good.. we eat approx 4 / 5 times in 5 days.. but it was really nice food.. Service is also fast.. weekend is crowded... book your table early in weekend..
Delicious authentic Indian food!,"Located at heart of Little India and near the Hilton hotel, this restaurant serves a wide choice of Vegetarian only food. The food tasted authentic and delicious. It brought me back to memories when I spent my holidays in India previously. The table queue system is efficient and the service is rapid. Worth a try if you like spicy food!"
Chaat Supreme!,"Was missing Indian food on a short trip, and this was excellent. The chaats are wonderful, the dhal makani perfect, the bread authentic (butter naan!). No wonder it's frequented by locals. The bhel puri is nicely presented in a bicycle cone :)"
Good food but service slow,"Very nice food, authentic Mumbai chats, nice ambience. Took more time to prepare the food. More varieties"
Disappointed,I had so high hopes from this place but was utterly disappointed. I ordered the chaat platter and fresh lime soda. The fresh lime soda was horrible - I even asked to change it which they tried but it was still horrible. The platter looked good but was overall below average - could have been so so much better. I finally lost hopes from this place but ordered kulfi faluda - which was decent. The washroom was next to the place outside the entrance which required a code - weird!
Delicious North Indian dishes!,"The chaat platter is a must-try (except for those who can't take spice). So is the Kofta Dil Bahar, which we devoured with butter rotis. Saag paneer is tasty too. Lime soda complements these dishes. Reasonably priced at about 41 for two persons.
WE took home really good cashew burfi, for an additional price.
Average service quality. Simple interiors.
Will return."
"""Working Hours"" - 11:00 a.m. to 10:30 p.m.","These are the times advertised on the web site and at the restaurant. We arrived at 5:00 p.m. and were told that we could only order cold street food - i.e. hot dinner items were not available until 7:00 p.m.

Having had street food in several Indian cities, we were surprised that this Singaporean version was bland and tasteless. It was also VERY expensive. We dropped 25 SG and left most of the food on the table. We then went to seek dinner elsewhere."
Delicious food. Could be even better if service staff stopped looking so miserable,The food ordered was excellent. The layout inside is clean and tidy. I couldn't work out whether the waitress was just miserable or didn't like us for some reason. A smile and a greeting costs nothing and would have made our experience a little better. Note the rest room is located outside the building so ask for the code and directions if you need it.
The Hindu hotel beside Hindu Temple,"The location of the restaurant is just adjacent to the temple . So it is very easy to locate the restaurant. You are having options from chaat pakori to delicious
Sweets . All the main course are good in tastes and the dishes are brought in unique Utensils. You can look at the picture uploaded for sweet Lassi. Good food good tastes."
Best vegetarian restaurant in Singapore,"We visited this restaurant every day for dinner during our trip to Singapore. The food is amazing, good quality delicious food. Must try main course: Paneer tikka lababdar and Dil bahar kofta."
Excellent Indian Food,The place is famous for its cholle bathure and I would highly recommend the same. We stayed in singapore for 4 days and we had most of our meals here. The place is serving the indian food with same taste you get in India. They are serving everything from chaat to great north indian food. A must visit for Indian Food.
Excellent Indian food,"Great place for some great Indian food , specially for those fond of Indian street food . Decent ambience and service . Weekends can be super crazy and one will have to wait for sometime to get a table
Improvised menu and yummy food , one must visit"
Great food but sloppy service,The food there is amazing. You can order anything from the menu and it is going to taste great. The only problem is that the service is sloppy and slow due to lack of man power. If you don’t go early the waiting line can go as long as 2 hours. It is a sure visit to this place for Indian food
Decent vegetarian restaurant,"Had a dinner on one of the nights with my family here. We were living in the Hilton next door so the location was very convenient.

Food - The menu was extensive with vegetarian options only. The taste of the food was ok and nothing too great. I had higher expectations as the restaurant was pretty crowded and I was underwhelmed by two of the three dishes we ordered.

Service - Slow! It was a busy night but still could have been better. A server didn’t come to take our order for at least 15-20 mins while we just sat and waited.

Price - Reasonable and portions are big."
