topic,review
"Authentic Lebanese food, wonderful staff, fun location","This is by far one of our favourite restaurants in Singapore, either for a night together as a couple, or to take friends. We have been coming here for five years now, regularly. The location in Capital Square is fun and always buzzing, but the restaurant is a nice sophisticated haven in between the other bars. The food is fresh and tasty, authentic to what we used to have in the Middle East, and consistent in quality and presentation. We have never ordered anything from the menu we didn't like. My husband and his friends like the offering of Mazaa beer, and the house wine is a good quality Lebanese wine and an extremely reasonable price. The best part is the staff who always remember us and greet us warmly, remember our favourite dishes from the menu, or are willing to recommend something new, are helpful but never intrusive. A must try."
Good is good but the dessert ruined our impression,"The Food is good, tasty and authentic.
The staff is „doing the Job“. No warm feeling or vibe like usually you have in a mid-eastern restaurant.
The dessert (Baklava) is a rip off!
All pieces Fitbit two mouths at $18
And not close to a Baklava. Totally dry and they use mixed nut, not walnuts or pistachios (only for decoration)
I’m from ME, so my criticism is maybe a bit tough but based on experience."
"Authentic Middle Eastern cuisine, extensive menu!","Great ambience, friendly staff, excellent service. Our go to place for middle eastern food in Singapore."
The fact that it has survived SG's F&B scene speaks for itself!,"We have been repeated customers of Kazbar since.. , year 2000?! Long way back! We have been living in and out the country, and still go back and love the place. The fact that Kazbar has survived that long in Singapore's F&B scene speaks for itself. The owner and staff have been consistently friendly, even when they are overwhelmed (e.g. recent post lockdown); the food quality has been consistently excellent - our favourite are lamb chop, the accompanied garlic sauce, and cold meze. Highly recommended!"
Authentic Lebanese food,"The best Lebanese food in Singapore, authentic, fresh and very tasty. The staff are extremely welcoming and professional. I highly recommend."
Excellent place for Dinner,"Excellent Middle Eastern and Mediterranean food and drinks! Ambience is great, service is excellent!"
19 years of serving for a reason,"Firstly, how many restaurants truly will go to the efforts to cook everything with extra virgin olive oil? when most customers don't know or care. This is testament to the efforts to create good food from quality ingredients, so matched with an authentic Lebanese menu and team effort for top service this restaurant is my go to for all occasions"
I love it.,"Kazbar serves the best vegetarian mezze platter in town. Great location, cosy atmosphere and attentive service."
Excellent kitchen,"Great food, great staff. Recommend to try musaka, meat platter, feta cheese salad. Total 100sgd, 2 people full:)"
"Awesome food, very happening environment, birthday song was a surprise 👏. Last but not least kind people and service.","I love the staff, very kind and caring. Amazing food, lamp sausage are really awesome. Visit again soon."
Wonderful time at kazbar,We all loved the dips so fresh and yummy. The grilled meats especially the lamb chops were stellar. Had the poison sumac their house cocktail and it was exotic and delicious!
Relaxed Middle East Restaurant,"Was visiting an office nearby so stopped off here today for lunch.

Restaurant operates with indoor and outdoor seating. Has a special lunchtime menu of specials for $22 which I opted for - had the lamb sheesh kebab. Added Shorba soup to start. Service was quick and efficient - seating comfortable. Portions were too large for me, but I guess that’s better than being too small. Great restaurant with a wide selection of dishes. Saffron ice cream for dessert was exquisite."
Amazing food and ambiance,We will definitely return to the restaurant. Food was great. But the spicy calamari as tasty. The chicken wings are our favourite on this visit.
Delicious Foods with Excellent Service & Nice Ambient,Will come back again for enjoying this authentic foods. Good values for money for such fresh delicious foods and draft Belgian wheat beers...
Very good food and vegetarian friendly,Nice place with a wide variety of dishes and several vegetarian options. All very good. The place is noisy though so not recommended if you expect to have a nice conversation.
A sure value,Always great food and impeccable service. One of our fav’ in Singapore. Just hope the Almaza beer will be back soon 😉
Delicious and Fantastic Service,"We went for lunch and had a fantastic time. All of the food we had (hot and cold mezze platters, baklava and ice cream) was so delicious, well-presented and proportions perfect. The place was buzzing through the whole time we were there and it was a lovely vibe. In particular our server was just excellent, so friendly and kind and professional."
Super Friendly Staff!,One of my best experiences. Staff were really friendly and service was top notch. Will definitely dine there again.
Rock The Kazbar,"The restaurant atmosphere, location and staff have earned mines and colleagues business. A most whether living in SG, visiting and have time to catch happy hour or just a simple date evening. If you like wings, definitely TRY Kazbar wings!"
Excellent Middle-eastern Food,"I must say this is one of the best places for middle eastern food. We took the hummus and the mixed grilled platter. Awesome! I love lamb chops but rarely buy at restaurants cos the meat is little and its surrounded by a thick layer of fat. Here there's no fat and the lamb chop portions are of good size and succulent. It is one of their must-try! Although we went on a Saturday, the crew were fast, attentive and polite. Food was delivered fast. Like this restaurant. Will return with friends."
Great middle eastern food in Singapore,The Food & Drinks as well as the service are really good at Kazbar. The staff is friendly and helped us with the selection of dishes.I'd totally recommend this place if you are in the mood for good food
Authentic Lebanese Food,"This is one of our favourite restaurants in Singapore. The food is authentic, reasonably priced and delicious. The staff are attentive but not overly so. It is also in a nice location where you can hear the China Square bustle but still enjoy a conversation."
Not a friday evening....,"Food is very good but too noisy on friday evening ! Music too loud inside, same outside with the other restaurant..impossible to talk to each other so not nice. Better to go on weekday or at noon"
I go to the restaurant to,"I go to the restaurant to order a takeaway as checked that the prices through delivery services are different from the menu on their website, in addition to delivery charges. When I order the food, they wanted me to order online which I found strange and fishy! They do take orders on the spot which I finally convinced them to, and found out that they overcharge for each dish for ‘plastic containers’. They must be doing darn good business in this covid-19 situation when every single other restaurant is offering discounts ! Not charging more!! Worst is it was not disclosed which is a crime in singapore. When debated, I was told the extra charges are in lieu of service charges for a takeout, hahaha! Well done and all the best."
