topic,review
Anniversary celebration,"We checked in at Park Royal at Pickering for anniversary celebration. The checkin comes with free breakfast buffet. To maximize our staycation, we also tried the international dinner buffet and we were glad that we did. The buffet was the typical pre-pandemic setup, where you can head over to the food table and pick what you want. But as a safety measure, you will inform the Chef on what dish you want and they will load the plates. There were a lot of food choices and my most favorite was the mashed potato. That was the most delicious mashed potato version I have tried. The buffet comes with free flowing drinks such as orange juice, coffee or tea. The desserts have limited cake options but was compensated by the really nice tasting basque burnt cheesecake. Since it was our anniversary, we were given a complimentary lobster dish . Really grateful for that. Staff are all friendly, nice and approachable. We love the ambience of the restaurant. The buffet breakfast is nice as well, with lots of options to choose from. We enjoyed our experience."
Good ambiance yet unworthy,"Service is good, the staff were friendly and helpful but the food is dry, no taste, I mean everything the food shouldn’t be..I feel like food in the hawkers is way better than the food in this Restaurant. Tasteless. I cannot name one except for the bread for tomatoe soup that is nice or worthy of your penny. Really disappointing food.."
Lime Restaurant has great ambience and service for buffet lunch,"We are at Lime Restaurant for international buffet lunch. Ambience is good, the service is very good,
Each diner is srrved with a bottle of water and glass. This is more hygienic. The waitress noticed we have not order drinks after we are seated for a while and adviced on how to use the QR code to order drinks.
The variety of the food is just nice for 2 hours setting for us. Food quality is generally good except some items is a bit salty. Beef is roasted just right, pinkish on the inside. Dessert is great especially the Yuzu meringue.
When they heard that we are there for birthday celebration, they served us a dessert with a candle. Great service."
Buffet dinner,"Buffet dinner with family. Variety of food and flavours. Tried their famous lobster laksa and durian cream dessert. Snow crab was not so tasteful together with the roasted beef. The lamb chops were good. As well as the salmon and sushi.
Staff were attentive and friendly. As it was my daughter’s birthday they offered a small cake with candle for us. The tables were set apart more than a meter and number of dinners were also well within control. Overall food was good especially the desserts."
Good buffet lunch First meal,"Good buffet lunch
First meal of the day n staycation.
First Buffet in months- Japanese, roasted meats, salad, soup, noodles n cooked dishes. Free drinks, coffee or tea, fruits n cakes for desserts. Value for money for hotel guests. Good served hot. Crowded even on a Friday."
Excellent Service!,"My wife and I enjoyed a buffet lunch on the afternoon of 4 Sep at Lime Restaurant. The food was excellent, but the service really set it apart. I would like to specially mention the manager on duty at that time (wearing a grey suit) who was very kind and attentive, and offered all the patrons excellent service.

I found the food offerings to be extensive and diverse, and especially enjoyed the desserts. Staff also took precautions when serving, and they all wore masks and latex gloves.

I will patronise again."
Good service,Food is good and there are quite a variety of selection. Staff (Falini and Eileen) are efficient in serving and clearing of tables. Friendly and polite too. Thank you!
Lunch at the Lime,"Fantastic food and even better service! Thanks for a memorable Birthday Lunch!

Special thanks to Amy from the banquet crew for the friendly service! And Dervyn Chew for always going the extra mile! Will definitely be back!"
Wonderful hotel cafe,Wonderful hotel cafe with buffet and ala carte menu. Good service and good quality including nice ambience too. Suitable for business and friends gathering.
High Tea on 26/8/21,"First and foremost, deepest gratitude to the staff, Fahlini, for the outstanding and prompt service.
Ambience was pleasant and soothing.
Lastly, food was scrumptious and appealing.

My first dine- in and definitely not the last!"
Great time at Lime,"Went to Lime for their dinner buffet and had a great time. Checking in to the restaurant was fast and efficient with assistance from Yus. The food was very good, particularly the lobster laksa, fresh oysters and lime cake. The service was even better. The chefs (Alfirin, Alex, Sarhi) were very accommodating of our questions and food requests. Other staff (Ryan, Fal, Wan, Aisa) were friendly and patient with our questions. Also thankful to Eileen, Wei Feng and another staff (Clint or Chit) for keeping our table cleared of the used dishes. Wonderful experience overall."
Dining at Lime,Dined at Lime and food was great and service was even better. We were served by Amy making our dining experience a great one. Would recommend visits to this restaurant when you are staying or visiting nearby. Service has been great. Will definitely come back.
Great buffet for couples,"Lime offers an incredible array of food options, even vegan too, along with wine and desserts. Incredibly welcoming staff who are accommodating to random requests (we had to ask for tools to eat the crabs). Overall a great place for couples and dates and would highly recommend."
Credit Card dinner promotions,"We were disappointed with our buffet dinner within such a nice hotel. The food menu was limited. However, we still managed with a few better ones. Lobster laksa, roasted pork and durian penget were acceptable. End of the day, it was not valued for money."
Friendly place,"Cause of the new COVID-19 restrictions, I didn’t understand how to go about ordering in the buffet. But thankfully the chefs were really kind and patient with us."
Fantastic Buffet,"Great ambience with friendly staff, this restaurant also serve very good buffet where you can go and chose the pick up the items. Only thing is the server will help you pick, but most places after COVID has gone for a la carte. The raw station serves mussels and sashimi. There are also local delights with the famous Laksa, Satay and Rojak. I love the dessert station which featured many delectable local favs and English cakes."
You have to go back for seconds (& thirds)!,"Went with family of 5 on eve of Mother’s Day. Restaurant setting did not seem to have changed since the last time I visited a few years ago for the CNY Reunion lunch. Really enjoyed the food back then as they had items that were not available in some other buffets during the season.
There were 4 stations- the seafood on ice (very limited selection); the western (very limited selection); the Asian (very limited selection); & the dessert station (very limited selection). And because the selections were so limited, we had to go back for seconds & thirds not because of how great the food was, but because we were still hungry.
We already almost had 75% of whatever the restaurant was serving half an hour into dining, & the rest of the time was filled up with conversations around where we should have gone to, & how great the food at those other places were.
Service was crappy too, despite the restaurant being less than half occupied.
I made a cup of instant noodles after I went home & that cup of noodles was surprisingly more satisfying!"
Food selection very limited.,"Went with family to Lime Restaurant on 24 Apr 2021 for buffet dinner. Selection is really limited. Laksa was very good. Some meat was really very raw. There is no choice given - as to whether we want well done, medium rare, etc. We chose to go on Sat as we thought the famous Bak Chor Mee etc would be there. But last minute, they were taken off their website. Not worth the price."
Weekend buffet lunch,"Finally we are back to the buffet line where we can see the food instead! Some items like soup, salads, desserts, beef rendang and prata are still ordered off a menu. The rest like sashimi, chilled seafood, bbq, noodles, rojak, etc are self helped. There are only 2 Q, one for the chilled items, the other for hot, so diners thought they can just go straight to the noodle station, then it creates a bit of friction between people in the Q - would be good if wait staff gave a bit of explanation at the beginning when they bring diners to their table. We have never been to Lime b4 so although spread is not alot, we feel it is enough. You can have laksa, beef noodles, mee soto from the noodle station. Enjoyed the Grilled salmon, laksa, rojak, satay and sashimi. Durian green bean soup is weird but rest of desserts are good. We also loved the decor of the place. I guess we just miss the old buffets.
Standard coffee/tea is included in buffet but I wonder why is it not under the beverage tab on the online menu for easy ordering?"
Extremely disappointing.,"Was on a staycay (7-9 April 2021) at the hotel for the birthday of my wife and zero of the dishes we tried we're good and worth the price they charge. Standard dropped significantly compared to just a few years ago. Which the recent reviews seem to support.

1. Hygiene: Chefs were playing with their phone regularly even when wearing gloves, which totally defeats the purpose of wearing them. So hygiene wise less than 1 star if I was able to.
Wonder what NEA would say of these standards.

2. Meat (Beef, lamb and pork belly) was super dry most likely because they prepare way too much in advance while the restaurant is not yet busy enough at 7pm, not enough volume makes the dishes just sit there, even the pork belly was completely cooked dry.

None of the other dishes stood out. Less choice since the pandemic and lower quality basically.
Calamari were tasteless and instead of tartare they served it with low quality mayo.
Veg dishes can be found better at a cheap cai fan place and the seafood wasn't great either sadly.

Only the dessert station was decent, which was recommended by a great waitress after raising the issue with her of the food standard having dropped so much. So credit to her for the good customer service recovery attempt.
She admitted that similar complaints are more frequent nowadays, really sad to hear.

I received quite some empathy from the waitress when bringing up the standard dropped considerably, however we still ended up paying close to $100 pp for a mediocre buffet (house pours included).

Just received a standard reply from the manager on my Google review. Pathetic, so definitely not coming back to Park Royal and Lime or recommending the hotel in general for that matter, which I've done in the past."
Terrible,"Absolutely overpriced and not worth it at all. Variety is terrible, and quality is nothing worth raving either. Was celebrating my mother's birthday and this dinner absolutely crapped out. Will never visit again."
Cold food and not fresh,Food was served very cold and not fresh. The choices of food are very limited for dinner menu. Very disappointed dinner for an not so cheap price. Need a lot of improvement.
Worst high tea ever,"Lime restaurant used to be my first choice when it comes to high tea. To my dismay , the standard had dropped significantly in terms of food and the friendliness of the staff when we visited the restaurant on 17th March 2021. We were not allowed to enter the restaurant till 3pm and nobody informed us and we stood at the restaurant reception at 245pm stupidly and nobody attended to us.

The 3 tier afternoon tea definitely does not justify the price that we are paying for. It's so bad that me and my friend did not finish the food.

Dear Lime restaurant, please train your staff to be more attentive and dont let your guest standing in front of the restaurant. This is very rude and not acceptable. Thanks!"
Poor selection,Was a regular patron for this restaurant. Haven’t been there since a year ago but standard of food definitely dropped a lot. Very less selection for Sunday brunch and not worth for the $88 ++. Food was served cold and doesn’t look appealing at all.
"Excellent food, excellent service","Due to Covid19 restrictions, buffet isn’t what it used to be. Gone were the days when we can just pick what we like and go for unlimited serving of the food we like without troubling others.

At Lime, they have upgraded their system to ordering via mobile phone instead of writing on a piece of small order chit (they provide 4 copies previously) and you will feel Paisay to request for more.

Kudos to the waiter & waitress for being patient to us for repeating our orders and they always serve with a smile on their faces. I’ve been to other ala carte buffets whereby the servers will pretend not to receive your orders and will not walk pass you after a few rounds of orders.

Food is excellent and I would attest to say Lime is 1 of the best hotel ala carte buffet in Singapore. The mini steak n lamb chop are excellent and so are the Asian dishes. The fried rice can improve with a little more flavor but I’m not complaining, it’s just nice if you have kids.

I would like to commend on your waitress by the name of Mei Chuan. She was very attentive when she was clearing empty plates on my table and to my surprise she even ask if the food were alright for my children and offered recommendations on what would parents with children usually order. She’s a delight and she greets all other guest with a smile. Will also be good for Lime to include children friendly menu :)

Overall, I enjoyed dining at Lime and will recommend to all my friends. One of the best hotel buffet with excellent happy service staffs!"
Good breakfast,Had a breakfast which was very good. They arranged vegan food for us. There were some hiccups in service but Mr. Vincent and Ms. Aesa were very helpful and gave us a wonderful service. Highly recommended.
Friendly service and food spans across a variety of different dietary requirements,"Lime is the main restaurant of this hotel. I tried the crab balls ( plant based). Although it was meant to be an appetiser, the dish was enough for me as a main. It came in 8 small pieces with a wasabi mayonnaise at the side. Staff, Aesa was attentive and friendly"
Lime Restaurant,"Both morning and evening staff are warm and friendly. Although restaurant is not halal certified, their malay staff are quick enough to identify muslim visitors and advise them that the meat are from halal sources. Really appreciate their good gesture. Their lobster laksa and durian pengat will make us come back for more
Thks to Vita Wan and Amy for making our dining at Lime very comfortable."
Variety are limited,The oyster and seafood are very fresh but the variety of food are quite limited for the price paid. Not worth $99+++
7.30,"The food is tasty, especially lobster laksa & friendly staff. There is no regret to visit. The place is comfortable."
The Lime Restaurant,"Food served here are great! Restaurant staff and Services are excellent! Highly recommended! First time trying to dine in this restaurant and it was an amazing experience. Very fast delivery of food requested to be served , thank you"
Lunch getaway,"I brought my husband here for his birthday lunch. Ambience is great n food is super delicious. Whats more their service is fantastic. Staff so attentive to each and every detail. When i casually told staff Vita its my husband's bday, she surprised with a slice of cake with a candle. Super delighted. Will definitely come again for its wonderful cuisine n service. N not to forget the durian penget. Thumbs up."
Great service but food was disappointing,"Service was great and food was served promptly. However last order for Festive CNY Dinner Buffet was only till 9pm. Beef was tough and slightly cold, desserts selection was pathetic if you are looking forward to it. Only mini tarts and bite sized cakes were offered, felt like I was at Taka's Basement sampling session. Free Yu Sheng for every 5 pax dining and I must say it was the highlight of the meal. Overall, it was not worth the money at all ."
Standard dropped due to Covid restriction- Lime restaurant ?,"Went for business a la carte buffet dinner over Christmas 2020 at Lime restaurant. Booking was difficult over phone, no one picks up call. Operator took my reservation with no return confirmation on day of dinner, a usual practice. Parking is free for first 2 hours only. Ushered to table but without menu which staff took hurriedly cannibilised from another table. Food was mediocre standard, dropped from previous 2X visit- due to Covid restriction ? . Under-staffed so needed to wait to order, each time. For the price paid , better moved to other dining. End of future visits."
Service with a Smile at Lime,"I've been to a lot of Hotel Buffet Restaurants here in SG and I love giving good revuews esp if I really loved the service given by the staff. Sometimes what's important for me is the service then next is the food coz it's hard nowadays to find friendly staff esp in Food or Hotel Industry. But with Lime Resto I was truly amazed by the service given to us by Ms. Cathy of Lime Resto. She was super friendly and willing to take our pics and even gave me complimentary slice of cake! She was always have this ""Service with a Smile"" and very fast to give our requests! Please give some credits to this lovely lady as she really is doing her job well! We can't find people like her nowadays. I will be back for sure if u have staff like Cathy! By the way, shoutout also to Aesia or aeisha a pretty Filipina Lady who first helped us to take our orders, she is really accomodating & always smiling even with mask on :) she is super nice to our group also and always suggesting nice food which we can try. Thanks again to Lime Resto! Keep it up! Dinner buffet was superb my friends loves it! Esp the steak very tender and juicy and surprised that juices and softdrinks coffee tea included already as some hotels got extra charges although surprised thay oysters got additional
charge. Anyways, overall we will recommend the resto to our friends bec of the quality service provided to us! Keep it up guys! Thanks again Cheerful Charming Cathy!"
Impressive High Tea,"Excellent service by Vita, pleasantly surprised by the spread and felt very full even after the supposed small quantity of food associated with high tea, free flow of coffee and tea is great as well, highly recommended"
Satisfactory Buffet~,"It was weekend and we came by for the buffet lunch, which was now being converted to ala carte style due to Covid19 as social distancing policy is implemented.

The restaurant has a nice and cosy ambience with high ceiling and nice decors around. And surprisingly, the restaurant was almost full-house.

The lunch buffet actually started at 12.30pm (instead of 12.00pm when most restaurants do so) and we were ushered to our table by the friendly staff.

Menu and ordering of food was via scanning of QR code which we had encountered difficulties in which the staff came to and fro to fix the problem but was eventually resolved after the 3rd attempt (he was saying the network/server was down). Afterwhich, ordering was smooth.

Well, to be honest, the spread of the buffet was not great as we had expected, in fact, much lesser than it's counterpart at Ginger and Spice Brasserie which we recently visited. If I didn't remember wrongly, there were 5 main categories of food (like starters, seafood/cold, local flavours, western delights and pastries) and under each category, there were only about 4~5 dishes. So it's a little disappointing.

Having said that, the food were generally nice and yummy and generally there were no complains except a few suggestions to help them improve. For example, there was only chicken satay, which they can include mutton or beef too. There was only laksa and what if some diners cannot/dont like to eat spicy food, so good to include one other kind of noodles or say, fried rice. May can also include some street food like rojak (or salad and bread), popiah etc.

But the pastries were super nice and good! The cakes and ice creams and how perfect it would be if there's waffles to go along with it. Coffee and tea and orange juice were inclusive in the buffet, along with fresh cut fruits.

Service was prompt and staff were generally efficient in clearing plates.

Value for money. The quality of food was fine but as mentioned earlier, the spread was quite small and that made this factor, a little tough, not too worth it (since at about the same price or even cheaper, you can have much more choices of food and I am comparing it with it's own counterparts and not other restaurants which we went to recently too). If a few more dishes are to be included, it would be better.

Overall, we did enjoy our lunch here but unless they improve in this food spread (or if they have special promotions like 1-for-1), we would prefer to return to the other 2 Parkroyal restaurants and other restaurants we went. (do check them out in my earlier reviews)"
Wonderful and enjoyable lunch at the Lime Restaurant,"Had a wonderful a la carte lunch buffet at the Lime restaurant. Due to covid, we are unable to take the food ourselves. However, all the food was served quickly upon ordering via QR code. The sashimi is super fresh till I requested for a second plate. The roasted pork is crispy and not too oily . The food are all serve hot especially in the cold weather nowadays. The dessert is so appealing and yummy. Highly recommended the Durian Pengat. The smooth and creamy texture make us feel like having more but we are too full for that haha.

Last but not least , the stuffs over there are all very friendly. I would like to comment on Vita, Falini and Amy. Vita whom greeted us when we first stepped into the restaurant. Follow by asking what we want to drink so she can prepare while we ordering the food. Thanks Kak Falini that helps me to take more wasabi for my sashimi. I know the station is very far.

Overall the experience is excellent with good atmosphere. Would definitely come again !!"
Dinner time 😊,"週末帶老爺去5星級酒店吃好料，佢睇落好緊張
應該多點帶佢出來吃吃喝喝玩玩
Excellent place to hang out with family for dinner time.. The section is good, super ambience.. The staffs are very attentive. The place very clean with ensure we have the safety distances between tables even we are still in phase III period in Singapore..
Spacious truly a 5-stars dining experience.."
Disappointing buffet breakfast,"TLDR: limited selection and long wait for ala carte breakfast only to be served with sub par food

We had an à la cart breakfast at LINE restaurant on 4 January 2021. The food was sub par and the service was very slow and terrible.

There were two timings for the breakfast. One is from 730 to 9, and then at 9 to 10:30 am. We had to order the breakfast to our assigned table using a QR code, due to the current covid restrictions. The food items were quite limited, such as the bacon-hash brown-chicken sausage with scrambled eggs set, another set’s version with sunny side up eggs, pancakes set, omelette (vegetarian) set, fried beehoon with chicken wings, and congee set. The black coffee with milk, and black tea with milk were considered separate items during the order.

We were seated at our table at 9:40am, and ordered at 9:50am. We had the beehoon, omelette, bacon and sunny side up, and black coffee. We were waiting for some time, that one of the servers asked us if we placed our orders and that we can order more since service stops at 10:30. We said yes, and mentioned we wanted to see how the food was before ordering more. By then, we also requested orange juice, a few pastries and sliced fruits since it was taking a while.

By 10:05, still no food came. We ordered a set of pancakes. To our surprise, this arrived in about 5mins. But the other items haven’t been served. By 10:15, we opted to order more since it’s really taking a while.

It wasn’t until 10:20 when I had to call the attention of another server, that we’ve been waiting for 30mins with only 1 item served.

A couple mins later, the items arrived and it was such poor quality. The chicken sausage was cold. The bacon was crispy, but also cold. The omelette was quite warm, likely just cooked, but bland. The congee was also bland, and one bowl was with salted fish and the other bowl with just light soya sauce. The noodles were also bland. The saving grace? The chicken wings, and pancakes albeit slightly chewy instead of fluffy.

I honestly don’t mind waiting for food, especially if the quality is great. But to be served with cold food items after waiting for a while — that quite unacceptable. The quality and standard were quite sub-par. The food items that were served were also incomplete, and we had to follow-up a few times.

Overall, I was expecting a lot given this was highly rated restaurant. Will I go back? Probably to try other meal timings like lunch. But will I recommend to opt for the breakfast option when booking your stay? Probably not."
Extremely Disappointing Hi-Tea,"We came here for the Hi-Tea, but was not informed at all during the booking or when we sat down that they were serving a different menu for its Hi-Tea. When I enquired with the staff, I was then told that this was their festive menu, and it tasted really horrible. Extremely disappointing."
