topic,review
Lime @ Park Royal Pickering on 22 Dec 2020,"Went there for lunch, still prefer that we go get our preferred food selection.

Due to Covid and social distancing, we had to be served. It was a ""Festive"" theme but was not a very good one that I expected, reasons:

1. Food took a long time to be served, and some items we ordered were forgotten
2. Menu items like roasted pork, duck and chicken came served cold. Not even warm or hot.
3. Very limited selection of food and beverages. But claypot laksa was hot and good.

Basically we waited a long time for food to be served (around 20 minutes wait) and this does not include our forgotten order,

Personally I don't think it was a good and worthwhile meal. For such a festive price, indeed very pricey.

I feedback to the staff Mr Yuus, but he sounded quite defensive so....(No point and doubt will still return)"
First time visit to parkroyal Pickering,"First time visit to parkroyal Pickering that I stay 1 night in the hotel.

I feel amazing when I step into the hotel room as it has a cosy and warm feel

The dinner in the lime restaurant was great as the creme Brûlée was great and the log cake was great as well

The nature garden is so windy and feeling relax when I was there"
CHRISTMAS DAY LUNCH RUINED!!!,"To start,let me just share our experience at your Lime Restaurant. From the Cashier till we have the table assigned, we didn't even heard any of your staff greeted us. We placed our first order we actually enjoyed it, after we placed the sec6roynd, this is where the bad ser we experienced. Vita, your Filipino staff took our order list,and informed her that we didn't received our Roasted Meat, she gave us but with a rude service. I know you guys are into rush and trying everyone to serve all your guest. We were shocked when she placed the Roasted Meat on to our table without realising that it's kind of rude with a loud noise and almost dropped onto the floor. She ignored what had happened. We realised that our orders taking long for us to be serve. It's mostly like 25-30 minutes hence the restof the table especially the one beside the glass wall keep placing their orders and being serve fast as well. How about ours? Our second round when it is coming? Until I approached Vita (not sure if I get her name correctly), and sha said that it is already been keyed-in the system. But how long to be serve? The person in a Reindeer Costume named YUS, I believed he was the Restaurant Manager approached me. Yes he did, but he didn't take any immediate actions from the first time I approached and keep ignoring us. Even one of your Malay Staff told us ""if you want to make a complaint, go ahead"" and also saying that it depends on the Chef which dish to serve first.Fid he just said that to us?. What is this service of him? Until we really fed up and lost our appetite not to eat anymore whereas one by one of our ordered food serving us already but we already no appetite to eat.When YUS ( Restaurant Manager) came to our table and I asked himif he the Restaurant Manager and he said yes, he keep on apologising of the bad experience we had but its already been ruined. He then giving us an action to our bad experience which I think we deserved it as we did not enjoy our meals at all. Were not really sure if we are the only one experienced this but we don't deserved to be treated like this. We are also your guest but it seems we were the unlucky ones not given a proper treatment as a guest. Seems everyone is enjoying their meals but here we are waited a long period of time until we lost our appetite. We ordered the 3rd round ( but the 2nd round not even complete yet), and one by one being serve fast? What is this, is this a joke? Give complaint from us to be serve fast? I'm sorry but this is however were treated and this what we felt during our visit to your Lime Restaurant. It is supposed to be a Christmas Lunch fruitful but end up become Hungry and Angry more."
Festive buffet,"Was there this afternoon for the festive buffet and it was terrible! Food choices was very small, the portions even smaller and they all came cold. Ordered the satay and waited an hour for the 4 sticks to reach our table; they weren’t even cooked properly. Found fish scales on my hacked up pieces of sashimi fish and when we asked for more Kikkoman as the amount served was so little, we waited another 30mins. The restaurant was terribly under staffed so service was slow; I feel sorry for the service staff as we can see they are trying to get service done fast - it’s the system or lack of it that’s making a failure of this buffet event.
Save your $$ and time - don’t eat there!
Enclosed is a pic of the “Seafood Platter for 2” served to us, and beside it is the Sashimi Platter."
Lime Breakfast,"Had breakfast there as part of staycation. All the staff are polite and attentive especially Amy. The food was good, especially the Carrot Cake. Service was also pretty fast. The pastries came warmed. Even the plate was warmed. That impressed us."
What a mess,"Make earlier request via email to Twinkle Sta Monica
Senior Team Leader. Nothing was done though i was told a cake will be given for anniversary celebration.

Roasted meat set was cold n meat left on counter too long.

Wok fried broccoli with garlic & oyster sauce tasted nothing of the sort. More like steamed.

Heng kee curry chicken noodles tasted nothing like the stall at hong lim. Signature laksa was bland & tasteless.

Deserts were mediocre. Not fantastic.

Service was atrocious. U could wait anything between 1/2 an hr to 45 mins for one order to be served.

Waiters all over the place. One waiter delivered the same dishes 3 times. And 2 times delivered our order to the table beside us instead.

Lucky there was 1 plump macik who tried her best to make things right. Other than that, the price did not justify for the service & food paid.

And for goodness sake the Rudolph cos play by the manager in charge, don’t u think it was too late to start barking orders at ur subordinates when u realise a few tables are not getting correct orders n having other tables orders served to another table??

Empty plates for 30-45 mins before the waiter came over told us our slip was lost. 1.03pm pass slip, 1.42pm waiter retook lost order, revised order came at 1.45pm

Wont be coming back to this half baked standard restaurant."
Very bad experience at the,"Very bad experience at the Lime restaurant yesterday. We went w a group of 4 of us. When my friend arrived, the staff can’t find our reservations and was hold on at the counter for 10mins to look for our reservations when we had our reservations made few weeks back. We were practically rush through our meal as they need to rush us out by 2.15 pm cos they need to turn over for hi tea. Totally understand that constrict. And we were asked to place our order first for dessert when we were still have our mains. Our order was missed out many items and was told they lost the paper. Our order for tea for 4 persons came 2 to 3 x when we told the server that you guys had already serviced us , his reply is oh is okay and just placed on our table when we are already no space for food!! When we asked for our desert cos they missed out again. Asked for feedback form, unprofessionally told us sorry we don’t have you want you can go website. Oh dear a 5 stars service not even want to find out more .
. Honestly for the price we paid for we don’t expect such service and the menu choices was not a lot too. The beef was so so not tender the lamb wasn’t hArd . Turkey was dry so I wouldn’t even recommend to go for the buffet. We don’t enjoy our lunch and it’s supposed to be a birthday treat and Xmas celebration for us. Sadly, The standard has dropped substantially when the first time I went a year ago for their lobster buffet."
Lime's great tasting buffet,"It was tough getting a reservation at this restaurant which has been gaining popularity lately. I enjoyed a staycation and enjoyed the restaurant dining experience on the day I checked out as I could not get a spot for the day of my staycation. The food is very good and the serving size is good. I enjoyed the lobster laksa, the roast meat dish was good too. The Turkey was not that great. The veggie was great tasting broccoli and it was served piping hot. The lamb was good too.
The desert that was great tasting was their coconut kafir lime ice cream and the gula Melaka ice cream.
I would definitely recommend this restaurant as not only was the food good but their service too was very good."
Breakfast Menu,"The breakfast menu is nice, do try their carrot cake, chocolate muffin and definitely chicken wing!

Big shoutout to the staff especially Jason :)"
Buffet selection for festive menu was too little,"Due to covid we can’t pick the food we want, but we need to order thru menu form, service was pretty fast just not much selection

Staff fie was very attentive and keep asking if we need anything. Glazed ham was good and the chicken satay was superb wish they could have more variety and selection."
