topic,review
Outstanding bar,"Came for a quick drink - stayed for few hours. Not a big fan of cocktails myself but Lime's ones are totally worth to try, such as the Darth Vader. Good selection of spirits. Nice atmosphere with the good music. And, of course, the wonderful service provided by the team, especially Suren, Ryan and Alice.
Definitely will be back in future for a drink... Or two."
Not worth,"Bought the Christmas Eve Lunch Buffet spread and it was indeed pricey. Despite it being pricey, the food spread was very poor. There was the hype of how good Lime Restaurant's food was but the quality of some dishes were just not up to standards. There was no cold dish - lobster at all with an average of spending of $150/pax.

The only thing that can make up the price was the service rendered. All the staff were friendly and attentive, and were really helpful. But really disappointed with such a small buffet spread of mediocre quality."
2nd visit was not as good as the first,"After a lovely experience at Lime in a few months ago (if I didn't recall wrongly we were super impressed by their staff Denzel), we decided to revisit for my birthday.
2 days before the reservation, a whatsapp message was sent to me to confirm the booking, and I shared my excitement about revisiting for my birthday. I didn't ask for anything, but Lime offered to put in a slice of birthday cake for me (not expecting it, but feel happy for such a kind gesture)
Fast forward 2 days later, when we arrived, we were given a table in a rather central location of the restaurant, and would have preferred 1 at the side, we tried to ask, but server was hesitant, so we erased the idea. Unfortunately the table beside us spoke loudly without pauses for the next 1.5hrs, but we understand that the restaurant can't do much about that too, so no fault was placed on them,
I enjoyed the durian pengat most, followed by the fresh chilled prawns, while my husband loved the laksa and pandan chiffon cake more.
No sign of the cake that was mentioned in their message was served though, and I didn't think I should be asking for it since it was meant as a goodwill gesture by Lime. Would have been better if they made an effort to remember, or they should not have even mentioned it while confirming the booking. Definitely not hard up for the cake, but we just didn't like the feeling of someone saying they will do something but it's not fulfilled.
There was a 15% discount by Citi when we paid at the reception counter, which was nice.
Food - Good
Service - Could be better"
Outstanding Hospitality,"The moment I stepfoot into the ParkRoyal Pickering, I was greeted and welcomed by Natasha and Murli at the entrance, which elevated my experience as I was excited to indulge in the Christmas-festive buffet food.

To add on, Ryan, Thu zar and Jay Rex served both me and my partner with great hospitality as we feast on the wide range of food available.

Thank you so much for your hospitality and service, kudos to you guys!"
Friends gathering,"Food was good, and the seafood especially the oysters were very fresh. Our waiter, Chang, was very helpful, efficient, and was very attentive and accommodating. The restaurant had great Christmas decor too."
Average,They should have informed on the page itself that there is additional top-up for festive lunch or even when customers just arrive at the place. Could have said something. And not halfway through the lunch you ask your customer to pay up.
Surprising Visit WOWed by James!,"It's a random visit to come to Lime for a catch up over some drinks. I was pleasantly surprised by James's service! He's friendly, a great conversation maker, and a very experienced mixologist who is able to give superb recommendations. We totally love interacting with him. He's meticulous and checks on the comfort & satisfaction.

Tried 'Darth Vader in Tight Jeans' & 'Punch by Bruce Lee'. Fantastic recommendation!

Will I return again? Definitely.
Will I recommend? Yes..please do.

Thank you Janes for adding an additional sweet touch to our lovely night."
What an awesome service- James at Lime,"James is such a dear! Polite, professional and so grounded. He knows his drinks excellently well and great recommendation. I enjoyed my wine recommended by James. And of course Punch by Bruce Lee. Thank you James for your excellent service! Well done!"
Chillin Birthday Night,"My friends and I celebrated my birthday at the Lime and it was amazing! I love the interior design it was different from the others high ceiling with the eco friendly style ambience. The food was decent its just had limited choices. They have these pass around dishes and its kinda unique from the other regular buffet restaurant. We loved their fresh seafood especially the oysters it was fresh and juicy! In addition, there lobster laksa was fantastic and you should try it!
The staff are very attentive and accomodating they even made an extra mile to have a free lucky draw! That was amazing! ☺️
Its worth the visit and a memorable night for us!
Thank you"
Special dish by Chef Shashi of Lime Restaurant,"We are delighted by the thoughtfulness of Chef Shashi from LIme restaurant. It was my birthday and was craving for something comforting. We described the noodle dish to Chef Shashi. He say he would try to whip it up for us. To our surprise, the noodle dish hits all the right spot! Never have we been so touched by this kind gesture to create a noodle dish just for us. We are not VVIPs but were treated like special guests! We later found out he ran over to the nearby supermarket to purchase the special noodles just for our dish. This service is what makes us return to Lime ... Lime bar bartender James is always exceptional, as well as Belgium, Suren and the whole gang.. Always very smiley and welcoming. This place marks a sweet ending to my birthday and will always hold a special spot for us! Thank U to the Lime gang! You are simply the best!!"
Great food! Wonderful Service!,"My family and I had a wonderful time with this restaurant. We enjoyed the food and all the staff were very attentive, cheerful and helpful especially Aesa and Dereck (hope i spelled their names correctly). We will come back for sure!"
Service and food,The service was fantastic. Staff was perfect and they were really kind. They tried their best to give a fantastic service and it met my expectations. A big round of applause to the staffs there. It was an awesome and an enjoyable experience. The food on the other hand was really delicious and gourmet. It was perfect and fit my taste buds. Props to the chefs there. They really satisfied my palate. The place has both beautiful interior and exterior. I recommend this place!
Tiers of Joy,"Tiers of Joy is the cutely named high tea at Lime, situated in the Parkroyal on Pickering, Singapore. Some of my family and I enjoyed this lovely experience as part of my birthday celebration and all of us were more than satisfied. The food was delicious and the endless cups of tea were more than welcome. And I can't forget the wonderful welcoming attention of both Satieeish and Michael. Thanks all for a lovely experience, one that I am happy to recommend."
Bleh buffet lunch,"Had buffet lunch to celebrate an occasion. I was so disappointed. Paying S$87 but the spread was so limited, ie no oyster, no lobster, cooked food tasted was so so."
Great Restourant,Great quality of food. Like the Asian food the most as well a the cheese cake from the LIME. Great chef. definitely will come back again
Lobster feast with no lobster bodies seen,Very disappointed as we came especially for lobsters but was told weekend lunch don't come with what indicated in the promotion. Paying more than 88sgd only had lobster claws in laksa and they limit our request. Payment showing lobster feast so unhappy with the over experience feeling cheated. Hearing many other customers questioning the waiters and waitress too.
Had the Lobsterfest set lunch on a weekday,"Could not get reservations for the Lobsterfest buffet as they were only taking reservations for big groups (not for 2 pax) so I settled for the Lobsterfest set lunch at SGD45/pax. It was amazingly disappointing, which made not getting reservations for the SGD162/pax buffet a welcome relief. The lobster bisque was devoid of lobster flavour or meat (far inferior to the lobster bisque at Jack's Place, which is served with pillowy warm garlic bread, compared to Lime's cold and hard garlic bread which seemed to be leftover from breakfast maybe). The mains (lobster risotto and lobster ee-fu noodles were mercifully forgettable) and dessert was an unfortunately memorable mishmash of small pieces of fruit reminiscent of what one associates with canned cocktail."
Disappointed,"lunch buffet with 2 friends here to celebrate my birthday, from the picture on website , food on menus looks impressive but not that fantastic actually. we made sure to be on time as was told by the restaurant reservation for that day was full house. Maybe the manager at counter was so overwhelm by the full house reservation, I don't feel welcome at all."
LobsterFest & Good Service,"Both my girlfriend and I enjoyed the LobsterFest , especially the lobster bisque and risotto, which were exceptional. We loved the ambience and table arrangements, and the staff was friendly, polite, and helpful, the training must have done them justice .
Satieeish in particular deserves recognition for his creditability, so I wish to thank him for that."
utter disappointment,"Limited lobster spread means a drop from 12 to merely 3 dishes, of which you can only find lobster meat from the laksa. Kitchen was really slow in refilling the dishes. And towards 1.30pm they stop refilling entriely. Variety was pathetic small and were in very small portions. Totally not worth the $88 price tag. Never going there again."
Lobster galore with just minor glitches,"The lobsters served are quite fresh and tasty. The service provided was also adequate but felt they having a manpower crunch coz their staff quite overwhelmed.

Only negative point was the slow replenishment of food at the buffet counters. Some dishes like chilli lobsters , halibut fish took quite a while to get replenished after it ran out.

Will be great if a wider variety of beer is offered instead of just one brand which is included in this buffet.

I would also suggest offering a wash bowl with lemon water for diners to wash their hands as eating lobsters can get messy esp for chilli lobster dish!"
RE: Very friend and helpful Restaurant staffs,"A lot of food choices, excellent dining and cleanness. this is my 3 times of visiting.
so as the in-room dinning."
A great buffet experience.,All the staff is very dedicated and friendly. The food selection is wide and interesting. The food quality is great. Even soft drinks are part of the package. A must revisit.
Great cocktails and interesting menu,"While staying in the Parkroyal Pickering Hotel, we visited the Lime Restaurant for a couple of meals and the bar for a couple more occasions. The bar staff know their stuff and have invented some really interesting cocktails as well as being able to provide house-made vanilla smoked whisky-very tasty and unusual. Food was good quality and not like usual hotel food. If you are staying at the hotel, you receive a discount on your bill. Would recommend."
Great food!,"It was our first time having buffet dinner at Lime Restaurant and the experience was excellent.
The restaurant is spacious, food selection is good and taste great, the service is excellent, too.
The waiter/waitress would clean our dirty plates very quickly, they even offered complimentary cake and candle for our birthday friends. I would come back for sure! Highly recommended!"
Like the spacious ambience and decor,"I was having an ala carte dinner here during a recent staycay. Tuna salad, seafood chowder, oysters and grilled cod.

I’ll give the grill cod a miss and the rest was good. Service was impeccable for me.

Love the overall ambience and the spacious feeling. Might want to try the buffet here next time."
Breakfast was good with options,Amazing restaurant with great view and breakfast was good with lots of options. Hotel was amazing and highly recommended.
How to ruin a nice place with bad service/unapropriate emplyoyees...,"I had dinner on 28 April around 8pm. I liked the location from outside while we were going next to it. Although it was almost empty we stoped to check it. We stayed for a while and no one came to us to bring us the menus. I went to ask them and we placed the food and drinks order. Food was very good, but when they brought the food they directly brought the bill although I didn't asked for it. I gave the the credit card and the lady left (we were on the terrace). Of course I told her that it is not normal to bring the bill now but she ignored me.
While we were eating she came to tell me that the credit card is not working. Of course it was working, but as strange as it seems she didn't know some basic things about credit card payments. I told her that it is not noemal to process payments while we are during lunch, but she ignored me again. Some seconds later she asked me if I want one more beer..:). Of course I refused becuse we didn't felt welcome. Otgerwise the location could be a bit more clean, but is overall a nice place with good food... so if you are lucky you might have a different experience."
Buffet dinner,"I would like to thank the restaurant manager, Yus, for his bubbly personality while making my 21st birthday memorable. The staff, waiter and waitresses — Wang Jian Ping, Eileen and a short-hair lady who served us throughout our time at Lime are surprisingly attentive. Such a service would not be possible without the proper management of the restaurant manager. My family and I had a worthwhile dinner. We appreciate the GEMS service from your fellow workers too!"
Excellent Service,"Nice ambience and definitely with good food to match. Perhaps the best of all is the exceptional service by Eileen, who very patiently took the time to explain the menu, food, recommendations, and also checking up on us along the night.

Walked away surprised and had a very pleasant night, thank you Eileen!"
Litmus paper test on Lime failed again,"Done a review for their xmas buffet in 2017, how is this acclaimed lime (turning sour)4yrs down the road (in the pandemic era of covid)? Esp it is in the top 400th in similar cuisine/catgeory out of the 13K restaurants, the more it need more honest regular reviews!
For the price we paid, having buffet in the pandemic is really no enjoyment, as everything is served by the wait-staff in bits and grab, you cannot self-grab the food on your own and decide how much u wanna

I have already mentally lowered my expectation! eg the selection of sashimi will be limited! The famous dessert- durian pengat is reduced to a pathetic small cups (but of cos u can go for as many rounds)
However, nearly all their soups are well-made! Luv them so muccchh!

I dont remember having any Foie Gras (have it in 2017!) this round

The chilli crab is small sized but would be better if they help the customers to crack the crabs more….
Seafood and most food selections are badly reduced , i thk Lime shd half the price!!! We shdnt be paying so muchhhh for rhe decor)

the beef is quite tender and well-roasted but isnt this a basic expectation??!
What more could i say then? The litmus test failed… Lime turned sour? Was expecting the Christmas pricing which we paid could be much more befitting!"
Excellent service,"Had an a-la-carte lunch at Lime on a Sunday afternoon, and was greeted by wonderful service from Amy, whose cheerfulness and attentiveness really made our days.
We had a Shellfish on Ice Platter, as well as Caesar Salad, and Fried Chicken & Waffle. The cooked shellfishes are relatively fresh and yummy, the chicken waffle... I probably love the waffle more than the fried chicken.
Overall, a very pleasant dining experience, and I will be back."
"Great Food, Superb Service","Celebrated my friend’s birthday at Lime restaurant. Had their international buffet dinner which was fabulous, especially the sashimi, oysters and scallops. We were especially impressed with the service provided by the waitress, Eileen Soo, who was always smiling and attentive. Love the ambience too! Would definitely come back again."
Only 4 tables occupied tables but no service,"Had been wanting to try famous high tea at Lime for years but was never able to secure a reservation. Finally dined there with a friend on Friday afternoon.

It’s a straight forward menu or either free flow coffee/tea for $74 or add 2 glasses of Prosecco for $78. No brained which one we chose.

We had to place our order for the Prosecco 3 times. Staff could not explain the low/high acidity of the Baccha coffees that were available. The French press coffee came with no cup. Placed an order with one staff and she took the order but when to get another staff to take the order again.

I empathize with the COVID staffing situation. But these staff appeared to have little training and just put to work. Pity."
Breakfast experience @ Lime Restaurant,"Staff
Friendly and approachable

Food
Glad that it was still full buffet style as some other hotels were still serving semi-buffet. *Thumbs up*"
Excellent service and great food,"I came with my family and the restaurant was full. Immediately, the staff tried to find a table for us. The manager, Nigel, even went an extra mile by decorating a cake to celebrate my girls birthday. I also ordered a lemon meringue pie and it was served warm. All the desserts were lovely! Will definitely be back with our friends and family!"
Worst buffet,"Visited the Lime restaurant and will never go back again. Worst buffet ever. Lady Chef who assisted us was rude. Ask her for fish maw soup and she told us don’t have, but the restaurant only have 3 tables join for buffet. Later then she brought out a big container of fish maw soup, but I think they cut all the cost with very little fish maw and other ingredient to cook the soup, the soup basically is a starch soup (refer to the picture).

Ask for the choice of juice available, the lady supervisor name twinkle told us to scan QR code to order. We only see orange and Coca Cola. We ask for other choices but was told there is no other choice. Refer to the discovery website, they mentioned choice of juices and soft drinks, coffee and tea inclusive in the buffet (refer to the picture). Turn up its a marketing gimmick to get people into the trap. Poor communication & marketing.

Buffet line basically not as good as mentioned in the menu. Choices are limited. Dessert taste meh.

Their famous laksa with mini lobster was tasteless with just spicy taste, no salt, no sweetness from the coconut cream. Me and my friend who had the laksa both of us got bad diarrhea and vomited few hours after the dinner.

Will not recommend them."
Lime Restaurant,The food here is of very high standard and it taste really nice. And not forgetting Eileen Soo who was truly amazing in her customer service. It has been a long time since I had such wonderful customer service experience in a restaurant. I don't know what her position is but I think she deserve a promotion for her outstanding attitude towards customers. Two thumbs up!
Lime Resturant,Food and drinks were very enjoyable and reasonably priced . Service was good . The bar staff were awesome
Unimpressed experience,"Went to the restaurant for CNY eve dinner. Reservation and entry was smooth. Area is spacious and staff are polite and friendly.
However service becomes disappointing because the plates are not cleared after finished. No service staff are around to be called. Took a while to come even when we ordered online to ask for clear plates. We even have to bring our own dirty plates to their counter/trolley to clear space.
Food wise is also so-so. There are only cold station, hot station for western and Asian food. However most of the food are salty on palate. However dessert station is more appetising. Online menu doesn’t offer alcoholic beverages and service staff are nowhere to be seen to ask about ordering alcoholic drinks. And when finally ordered, had my glass of Prosecco.. got a shock to see the bill that I had been charged a bottle instead. But thankfully the cashier crew were quick to rectify this misunderstanding."
Lime Restaurant,"Very disappointed with the buffet spread, absolutely not value for money even with the 20% credit card promotion."
Buffet breakfast at Lime,"Limes serves a good breakfast spread, which includes breads, cereals, asian, fruit and yogurt. It is not the biggest spread around but quality is high. The nasi lemak with fried chicken is the best I have ever had in a long time. Ambience is very nice and service is prompt and polite."
A so-so high tea experience...,"I was disappointed with the high tea menu of Lime. For one, of all the high tea experiences I had, Lime had the least number of variety of pastries served. Lime only had 10 kinds, excluding the scones. I wouldn't have minded if it's just 10 kinds of pastries if the taste was exceptional but no... the pastries were just so-so, nothing fantastic. One good thing that I'm looking for in my high tea experience is to be surprised with what kind of treats will be served and if the taste would be exceptional... sadly, Lime didn't have deliver or probably I expected too much... ☹"
Dinner at Lime,Very happy with the service and attention to the customers needs. The staff Eileen Soo is extremely friendly. We have a great experience at the restaurant
Brilliant service and amazing foods recommended,"Service was amazing. Well done team. Special thanks to Eileen Soo for making birthday surprise for my friend. He felt so happy!

Apart from that, the Executive Sous Chef did a great job. He recommended the laksa which I was not thinking to have it. And that taste has had made my day."
Delicious food made special by lovely customer service,"Attended midweek to celebrate my husband's birthday, turned up early (630pm) so no queue at all to get served. Food selection was great, good selection for both adults and 2 children. We mainly ate from the japanese, western and desserts selection. The waitresses came to say hello to the children as well, even though they it was getting quite busy after that, and you could see them all rushing around to try and serve the customers."
A number of tasteless dishes,"Surprisingly, quite a number of dishes were very under seasoned. The salad barely had any sauce, baked salmon had no taste, Peranakan prawns weren’t fresh (the flesh was chalky), achar and seasoned veg had little to no taste. Pretty disappointed, as they were food that my mum like and she did not enjoyed. Other dishes like the sashimi, the roasted pork, sirloin steak and laksa, durian pengat were decent. Overall, for the price it’s not worth the visit."
21/11 visit.,"Very friendly service staff. Can see everyone working really hard, even the chefs trying their best to give us the best experience they can give. Thank you for feeding me."
Excellent service made the food taste that much better,"Visited Lime for dinner as part of a birthday staycation at Pickering. The food options though not varied, were all of high quality. What really shined was the excellent service by the incredibly friendly and professional staff, notably Eileen and Liqiong.

This is especially true for the dessert section, the Durian Pengat and Basque Burnt Cheesecake were heavenly. If one were to visit, the ice creams are certainly not to be missed, Vanilla Ice cream tasted like it’s made with real vanilla, and the light brown colour seem to back that guess up. Coconut Lime Sorbet was luscious, with 0 ice crystals, a rarity where sorbets are concerned; Gula Melaka Ice cream was excellent too.

Food aside, what really impressed me was the extremely high quality of service and generosity of the restaurant. The buffet is in an actual buffet format where you point at what you want and the chef will plate your food for you. That’s right, they actually went the extra mile to plate the food like as if you were ordering ALC. Furthermore, the restaurant was also incredibly generous with their portion, my family love prawns and the Chef at the seafood station served us a HUGE plate full of delicious and fresh prawns after finding out. The older lady at the Peranakan section was also extremely friendly, giving us fantastic food recommendations that did not disappoint.

Lastly to the star of the night, Liqiong and Eileen, they were frankly two of the most service oriented staff I’ve encountered, it was such a pleasure having them serve us. For instance, they were constantly making sure that we were having a great time, and offering desserts and making sure we are are extremely satisfied. They noticed that we had lots to eat and again proactively offered some Hot tea to cleanse our palates for another round of sweet goodness! Props to these two rockstars.

If there’s one criticism I have to give, it’s that some of the food were quite cold, specifically the slow roasted beef. The lobster was also quite over cooked and slightly rubbery. That might be things to watch out for, but other than that it was an excellent dinner.

The restaurant also gave us a surprise birthday cake upon hearing that it was my birthday. Thank you Lime for the excellent experience and I look forward to more exceptional gastronomical adventures with you guys."
