topic,review
Good Chinese food.,"The Goodwood is a heritage hotel - one of the oldest in Singapore, and this is one of their 2 top notch restaurants. I found the interior rather narrow like a corridor but enjoyed our table outside beside the pool.
Like many Chinese restaurants in Singapore it has an extensive menu with a good choice of vegetarian options. Starters was deep fried Sichuan Onion pancakes which were surprisingly not 'oniony'. Main consisted of stir fried Asparagus with Honshimeji mushrooms which was cooked just with the right amount of bite and crispy noodles with mixed vegetables. Though full couldn't resist the Mango Sago with Pomelo for desert!"
"Funny, but not funny","Singapore service is hit and miss and this meal was definitely a miss. The service was terrible, a bunch of dishes were unavailable and I even heard a waitress tell a neighbouring table that they had run out of rice... at a Chinese restaurant!! You can’t make this stuff up!! Give this place a miss would be my advice."
Celebration dinner,"Hosting a birthday in the family, this restaurant is a favourite in our family. As Chinese New Year is in a couple of days one must try the Ye Shang. The smoked compor duck, Kung Pao chicken, string beans with meat, prosperity noodles, shredded chicken with mustard sauce, garlic pork with shredded cucumber were all great tasting and favourites. Price on the high end with the environment quite cosy. Service was good. Special gourmet tea are also served!"
Service is amazingly bad,The food was nice Chinese food. Nothing special. The service was the worst service I have encountered in a restaurant. Manager had serious attitude. And the poor girl serving us had no idea what was going on. So disappointed.
Very good quality food and service,This hotel is inside the Goodwood park hotel in Singapore. The food quality and services are all good. Could be slightly pricey but worth for the price overall
Vegetarian options. Good food and service but had to wait,"We went there for lunch on Sunday. We ordered vegan food. They had a vegetarian menu, and the waiter was very good in recommending vegan options. Food was generally very good. However, it appears that they were short-staffed, and we had to wait a long time for our tim sum."
Consistently good for decades,Yet another visit and yet another excellent meal coupled with courteous service makes a Singapore trip incomplete without a visit here..
Good food...nice ambience,"Happened to be here with friends after a long day. Soon after entering, stress of the day disappeared just because of the ambience. Once food was served, the presentation and aroma was great that we could think of nothing else."
Very nice but not exceptional,"Dinner booking made late so assume we were given a table outside on the terrace for that reason. Nice space overlooking hotel pool but this was a cool evening so probably inside table best if you can and better atmosphere. Service was only average ..waited long time for drinks and staff were not very knowledgable on dishes. Peking duck was very nice as were fresh XO prawns, pork belly small plate and onion pancakes (spring onions in a short pastry). 2 gins, water and one bottle of house white was around 350 Sing dollars so quite expensive for a very nice but not exceptionally meal and service."
Great Food!,Went here for a family dinner and had a really lovely time. The food was great. The portions were quite big and they had enough vegetarian food too. The staff was really nice. At one point we kept ordering and cancelling and ordering a dish but the lady didn't get annoyed at all (even though we were being annoying). They were so effecient too. The location is quite nice.
The best Chinese food I’ve ever had,"Were invited for by a local friend. Dim sum was delicious, amazing food and service. This place is a must if you enjoy fine dining."
AMAZING MENU,"Services and Food is good. The portion of the food is big and hearty. They are famous for their Duck - Tradition Peking Duck as well as their Wood Fire Beijing Duck and their signature Noodles and the Lettuces dishes. Their steam stuff is equally good so on the safe side, do orders more steam stuff from the menu.
Plenty of tables available as the restaurant is big so last minute booking or no reservation is okay.
Their dessert is mango. So, do try their mango."
Beautiful Restaurant,"The menu is overwhelming in size and variety and it made for a difficult choice. Everything we tried in Ming Jiang was top quality and absolutely delicious. The stem lettuce dish with shitake mushrooms was outstanding and was chosen at the last minute as an add on for some more greens. This was one of our most memorable dining experiences in Singapore and one I would like to repeat on my next visit. Portions were large, even the small dishes were far from small. My note for next time, is order less, order steamed prawns and the stem lettuce dish ."
Food To Die For,This is part of the Goodwood Park Hotel and serves the best Chinese food dishes in Singapore. Great service and ambiance.
"Excellent, as always","The really good thing about this restaurant is that it has maintained the quality of its' food over the years. I have never been disappointed. We just love the food here and return quite regularly.

For starters, the crispy peking duck and the hot and sour soup with crispy rice are both very good.

For the main course, the chicken with dry red chilli is very good but the pepper beef is simply outstanding.

Top it off with the mango pudding. Yummy."
I didn't know what I was ordering...but who cares?,"The menu was a bit of a minefield. I couldn't tell what I was ordering, how big it was or the total cost really. It is certainly well patronised by the locals which is very telling and a good sign. It was lovely food - I could have used a bit more direction on what the specialties actually were but the end result was bliss on a plate."
Excellent Chinese Cuisine,"Located in the Goodwood Park Hotel this restaurant serves excellent Chinese cuisine. Whilst some of the menu would sound familiar to people from England, there many dishes, which are different and more authentic Chinese. If you are in a party of 4, go for the whole Peking Duck part of which will be served with pancakes and the remainder with noodles making two excellent dishes. The staff are particularly helpful and engaging. Highly recommend."
Very good dinner,"We had a family dinner here and the food was top quality, delicious and the serving sizes good. We had a range of dishes including shark fin soup, seafood claypot, salted duck egg prawns, sautéed fish, spinach with shrimp and mushrooms. The table service was good and efficient. It did take some time for the food to arrive but the restaurant was full that night."
Delicious dim sum and wonderful service,"First time here and what a wonderful surprise. From the service and ambiance to the food, everything was a delight. We especially loved the dim sum - Xiao Long Bao, char siew puff, Ee fu noodles as well as the durian pudding."
Good quality!,"Good Chinese restaurant at the Goodwood Park Hotel. Not too big, kind and fast service, great quality. Everything at reasonable prices."
An old Favorite,"Been coming here for years but last night I was informed my favorite prawn dumplings with hot chilli oil were no longer on the menu
Well, apart from this major setback I would still recommend this very high class Chinese restaurant as my other favourite tea smoked duck pancakes are still available
We have always been able to get a table without a reservation as it's quite a large restaurant and the staff are very accommodating. As I said it's our favorite and also for some local friends."
Relaxing poolside dinner,Thoroughly enjoyed our meal here. Service was attentive. We sat outside and it was great sitting there having a good meal and nice wine. Would go again.
Daughters Birthday Party,Went with our whole family for dinner to celebrate my daughters birthday. The service was very slow. The Wine List did not come. We asked for the wine list. We ordered the wine and they took a long time ( about 40 mins) to bring the wine. We then asked for the menu. The Manager had no enthusiasm in her. We ordered a few dishes . The restaurant was half full and it took a long long time for each dish to arrive. The dishes were OK. A good service would have made the food taste better
Dining by the pool,"Nice relaxing ambience to sit and dine by the pool. Area is sheltered hence no worries about rain. Service is prompt, food portions are reasonable."
What a treat!,My host ordered one of weekend set lunch menu which was a real treat! The most memorable for me was the salted egg yolk prawns. It was most exquisite. The ambiance was what you can expect from Goodwood Park Hotel and the service impeccable.
Best Chinese in town,One of the best Chinese places that we visited during our business trip. The restaurant is packed with regulars. We wanted a taste of authentic Chinese and that’s what we got. Both the chicken and the vegetarian dishes were perfect. The service was very good and we got the orders at a regular pace.
Exceptional,"Joined for a wedding reception; they served suckling pig and Peking duck and it was absolutely sublime. The service was swift and the was executed very well. Every dish was quality and cooked perfectly. Would have no issues in recommending this place and would highly advise trying it out. Looking at the menu, its not cheap, but your going to be happy with what you have paid for!"
One among the best Sichuan restaurant,"On my frequent visit to Singapore, I have always make a duty to have a meal at Min Jiang.
Great atmosphere, very good authentic food.
The Peking Duck is a must.

I will be returning to Singapore and I have made a booking already for dinner.

This is a restaurant that bookings is essential.

Enjoy"
Undeniably awesome hospitality,"The service at Min Jiang is undeniably awesome! Friendly, warm, attentive hospitality constantly displayed throughout our 2 hours of lunch, up from the managerial level to the front line hospitality team. And don't get me started with the durian dessert...I can talk about its beautiful taste and wonderful texture all day long! The dim sums, too, were doing a great job in pampering our palate and satisfying our tummies :)

Thank You so much for this excellent experience that gave so much joy and comfort to me and my friends."
"High quality, reasonably priced dim sum","I ate lunch at this restaurant at the Goodwood Park Hotel while in Singapore during two stays on a recent trip to Europe. Fantastic quality, and the prices per pot were very good. Service was excellent and I didn't have to wait long to be served. I'd definitely go back."
Outstanding,"I must say I had one of the best Chinese dinners in Singapore The restaurant is classy but not that different from many others, what makes the difference is quality Shark fins soup, Peking duck, mango dessert... all delicious Will definitely come back"
High quality food with Very high pricing,I have found the food to be consistently of high quality. Plenty of options for the family - both vegetarian and otherwise. Their beef cubes are out of the world as are nearly all their vegetable dishes. Good service - but all this comes for price. Very expensive. Dont be surprised to get a bill of S$ 200 for a family of 2 adults and 2 young kids with an average appetite.
Excellent food. A little noisy,"Came here for dinner and had the dinner set - the duck starter very nice; everyone liked the bee hoon noodles. Have to admit the rest of the food was forgettable. Set had too much food. Shark fins soup so when one asks for a swap, the soup wasn't that good. Noisy for the price point"
Singapore's Culinary highlight!,"Min Jiang came as a recommendation from friends who used to live in Singapore. We couldn't be happier that we sought suggestions because the restaurant was wonderful.

Arrival was a bit shaky as there was no one at the reception when we arrived. We had to wait for I'd say about 2-3 minutes before someone came to usher us in.

The wait staff was incredibly polite and friendly. One of the diner in our party was allergic to shellfish and nuts. They have an incredible personable attention to his needs, including the chef someone out to ensure us that their food was prepared separately with zero cross contamination. What a lovely and reassuring gesture.

The erstwhile black pepper crab was every bit to its renown. Succulent and fresh and indeed just the right spicy. We without a doubt prefer black pepper over red chilli crab. Latter we find too sweet.

Beside the crab we ordered fish, chicken and shrimp appetisers and entrees. The Sichuan and Cantonese cuisines were delectable at fine restaurant, every morsel fresh and delicately presented.

We strongly recommend this award winning restaurant which is an outstanding choice for fine dining choose or any occasion."
Excellent cuisine,"It exceeded my general experience with Chinese restaurants. My favourite dish was the shrimp cooked in wine. The shrimps were very fresh, big, and crispy. They were cooked in wine prepared with the Chinese ingredient 'dongui' and herbs. The taste was phenomenal, I even drank the broth that came with it. Other dishes such as the beef spareribs, lemon chicken, and braised tofu were all above standard. I highly recommend this restaurant!"
Excellent food,"We decided to eat in the hotel due to being tired, what a good decision it proved to be. The food was excellent with the Peking duck an absolute highlight.

Service was extremely efficient and friendly and we received great recommendations on what and how much to order.

Well worth a visit"
Fabulous duck!,Been to this restaurant before and loved it - best Peking Duck! Great ambience but sadly this time we were served by a trainee. No towels at the start or finish of dinner and it took an age for her to make up the pancakes so cool to cold and not well wrapped so tended to fall to pieces as we tried to eat them. We realise that staff do need training but would prefer it wasn't when we have come from Australia and booked a table well in advance. The flavour was still delicious and the lychee desert was a world beater - a fresh gourmet delight.
Consistently good value dim sum and Schezuan cuisine,You can rely on the consistent quality of food and service. An outstanding place to take guests. Highly recommend the restaurant. Accessible for wheelchair if you enter from the 'back' car park
amazing dim sum,"Our host took us for lunch to this restaurant within the hotel, Every aspect of the visit was 1st class, the service, quality of the food and regular top ups of tea. A real treat."
"Great food, good service & great ambience",My overseas friends enjoyed the food very much. Much neglected great restaurant. Try the smoked duck and Mongolian Chicken. 👍
Food is good..,"The food is good, especially their Crispy Duck smoked in Camphor Tea and Steamed rice with preserved Chinese sausages wrapped in lotus leaf. Went on a weekday evening and it was crowded. There were still many guests coming in after 9:30pm and the alfresco area was quite packed. Will return to dine at this place.

Room for improvements:
The flooring is sometimes quite distracting as when someone walks past, you can feel their movement, plus small walkways. In addition the serving time of the food is not well coordinated as some dishes took quite a long while to come, so some dish that were on our table became cold... In addition, the service have plenty of room for improvements. It was difficult to get hold of a staff, probably understaffed, so we ended up taking things for ourselves as we gave up waiting."
Sichuan,"One of the best for Kung Pao Chicken, String beans with chicken, Xiao Long Pao, smoked duck, and many others! A Favourite for Singaporeans for a Long time. Book early or you will not get a table!"
Food is pretty good,...but the customers can be really annoying. The service is all it can be under those circumstances.
Old Favorite in Singapore,"We Went with high expectations and also informed our friends for whom it was first time.
Fantastic Food.
Higher than expected taste.
Very good service also just make sure you are good two hours plus away from closing time and every thing will be hunky dory.
Main selection was Vegetarian and each dish was better than the other.
We loved Crispy rice with Hot and Sour Soup but then also loved
Onion pan cake so much that we ordered next portion.
Mock chicken with black bean sauce was amazing so much so that my wife wanted to know the supplier to them.
Should not miss their Tofu and also Peking Duck - all vegetarian.
Truly five stars.
Go with high expectations I am sure you will love it too.
PS: please do indicate you need food without Ajino Moto."
"Great food, good services, beautiful dim sum at the pool","The set up is in a beautiful colonial hotel, restaurant is half inside and half al fresco. The outdoor part is way nicer for a brunch. Service was spot on, and the waitress was kind enough to remind me which dishes might include meat after we explained to her I am pescatarian (this is not usually the case in Singapore I realise so usually one has to ask for every single dish). Food was really good, authentic, fresh, super tasty, yet not indulged on condiment or salt. Highly recommend."
Pleasant afternoon lunch with friends,"We had just arrived back from our four day cruise and wanted to have good Chinese lunch before catching our flight back to Dubai. My wife and I were staying close to this lovely hotel so chose Min Jiang which was rated highly. So five of us agreed to meet at 1.30 pm directly at the restaurant. There is seating inside and outside ( facing the swimming pool ). However we chose to be indoors. We ordered quickly from the menu as their last orders were at 2 pm. I was impressed that the server who took our order didn't have to write down any of our choices ! She must have an amazing memory. She got it all right of course. The food started arriving without a long wait and I must say that everything tasted wonderful. Our friends were also pleased and it turned out to be a lovely afternoon, well spent. After lunch we sat outside for an hour, enjoying the relatively pleasant temperature and green surroundings. Would happily go back again."
Great Chinese food,This place is not cheap but you get what you pay for. Perhaps the best Chinese food we've ever had. Very fresh seafood and vegetables. The prawn and pork fried rice was excellent. Had the mango dessert and it was enjoyable. You can dine inside with AC or outside by the pool like we did
Great food !!!,The Ming Jiang is one of the top choices if you are looking for great chinese food. One of the highlights is definetley the hot and sour soup and one of the best you can get in Singapore.
"Great food, reasonably priced",I was there on Christmas Eve and had the set dinner. The food was simply delicious. Each item complimented each other very well.
"Great food, less great service","Cards on the table, I really like the food here - their Lobster Szechuan hot pot rocks and we've had very few bad dishes across a wide range of options over the years but.... it's always been pricey and now it's getting silly - the lobster dish we love used to be charged at a fixed rate for small medium or large but now it's per 100g and unless you're careful, your waitress will decide how much you need - Sgd135 of lobster later..... the wine list is decent but at the higher end price wise for Singapore and sadly the service tonight was pretty sloppy, not bringing dishes together, trying to clear tables when we're not finished, trying to serve wine but not watching when we're empty (would much rather a bucket on the table and we serve ourselves!!)... still like the atmos of the outside tables and will go again but Imperial Treasure in Paragon is better value for money...."
Superb,"Min Jiang came to me very highly recommended and it did not disappoint on any aspect. This is authentic Asian dining at its best.

Seating is available inside or out which is always a choice I appreciate and we were seated straight away even with the restaurant close to capacity.

The Xiao Long Bao are some of the finest I have had anywhere in Asia. We ordered a selection of main dishes to share and all were excellent."
Food on the expensive side not matching quality.,"Min Jiang Restaurant has been around since 1982. I can still recall the time when they had their outlet across the road where the Spa is now situated. In those days, we enjoyed their selection of Sichuan and Cantonese dishes, particularly their Chicken diced with Dried Chilies; Long beans with minced meat; their Mango pudding and Pancake dessert; etc.

We returned to dine at this restaurant and I was surprised to see that they’ve moved into the Goodwood Park Hotel. The entrance is small and unimpressive, dining tables lined in a long tight row inside, but in a more spacious arrangement outside at the verandah next to the Hotel’s main swimming pool. The outdoor space is cooled by ceiling fans, whilst inside, it’s air conditioned. There are six private dining rooms.
Service was initially attentive and polite, although several times when I wanted some attention, I found no waitresses visible, possibly they were busy serving elsewhere.

We ordered the famed Peking Duck done in two styles; the Ham and Melon soup; The Marble Goby; the Abalone with Tofu; and the Noodles with Lobster. The first dish to come was the complimentary birthday buns. Small, but adequate in size so as not to fill you up. The Peking Duck was served all wrapped neatly in wheat wraps. This was tasty especially with the plum sauce, and with the spring onion shoots giving it a crunch. The Ham and Melon soup was delicious with a hint of stock aroma. The Goby fish had a meat that was sweet and slightly crunchy, but it also had lots of bones; the Abalone with Tofu was disappointing as the abalone meat ( a sliced piece ) was tough and the tofu unremarkable. When the Duck returned, the meat was minced and fried. This was to be placed on and eaten with lettuce leaves. We found the meat too dry and saltish. The Noodles and Lobster was just alright, meaning there was no Wow! factor. Served with a well-flavoured stock, a small portion of noodles and perhaps two to three mouths full of lobster meat.

Average cost per person for this meal without wine was $70.00. It’s certainly not cheap to dine here as almost every item is chargeable as ‘per portion’. Consider the Marble Goby, served about 100 grams in a small cup costing $20.00 per cup; or the Noodles with Lobster (actually half a small lobster) at $26.00 a portion. Neither of the above two ‘portions’ will fill you up. We brought a magnum bottle of red wine and there was no corkage charge. Being inside a five star hotel, I suppose the charges need to be classy as well, but their standards I feel, need some catching up!

Operating Hours: Lunch & Dim Sum: 11.30am – 2.30pm (Monday to Saturday), 11am – 2.30pm (Sunday) Dinner: 6.30pm – 10.30pm
Dim Sum High Tea Buffet: Available from 3pm to 5.30pm on Saturday, Sunday and Public Holiday

Min Jiang Restaurant, 22 Scotts Road, Goodwood Park Hotel , Singapore 228221
Tel : +65 6730 1704
Nearby MRT Station : Orchard"
Fantastic Peking Duck,"This restaurant offers one of the best Peking Duck in Singapore. The skin is very crisp and the meat they serve afterwards, the buns and crepes are very crisp. The food is always good and I have been there for many years and go back every time I visit Singapore. A lot of space and ideal with families and large parties."
So so tasty,A great variety of Asian food all cooked to perfection with service to match. A warm Singapore night sitting outside by the pool a Gin and tonic and some sumptuous selections that tickle your taste buds. I'm sure you get the picture.
A quiet break from the midday hustle of Singapore,"Try a terrace lunch to escape from the Singaporean aggresive AirCon. Take care when ordering as the portions are large, rather just try two main dishes and their rice. If you are feeling extra hungry their house Singapore noodles are excellent.

As with most upmarket hotels, neither food nor drinks are cheap by Western standards."
Great food and service,The food and service were great but despite all the other reviews the only disappointing thing was the Peking Duck!
"Good food, Good service & Good environment","Have a very good experience dining in the restaurant. The food is delicious and the service provided by the restaurant manager, Moon is very good. Will definitely visit again."
Fantastic Meal,I visited Min Jiang with my family last week and had a wonderful time. The peking duck was great and so were the other Sze Chuan dishes we tried. The service provided by Moon was attentive and made us feel very comfortable. She was very accommodating to our requests as well. We will definitely visit the restaurant again!
Excellent Service and Foods,"I would like to express our amazing experience when I was served by Restaurant Manager, named Moon Ng on the 30th September.

I was visiting this restaurant with my family. This was our first experience with this restaurant. Highly recommended Peking Duck, crisp and perfectly matched with traditional crepes. Moon has made us feel comfortable and welcomed during our time there.

We had such a brilliant evening and I am really looking forward to being served by her again in the near future."
Good food & great service,"Good food.. Try the peking duck, sharks fin soup with crabmeat, and the avocado cream with ice cream in whole coconut.. Friendly service by Ms Moon and Ms Beckie.. Good ambience.."
