topic,review
"Not the same, but still a great hangout","Has the feel and look of almost every pub that appears in Singapore these days, which is a shame as i preferred the feel of the original set up - before the re-opening at Orchard Hotel

However, the staff are still the hardworking and friendly lot - run off their feet a bit during the Eng v Wales Six Nations night as it took almost half an hour for our drinks to arrive

Still, the pub I’m most likely to drink at when I’m in town"
Great pub,Amazing irish pub. Great atmosphere and variety of food and waiters come around to take your order. Everyone friendly. Its located in the bottom of the Orchard Hotel area just off Claymore road as well. Can't fault it. Great music to sing-a-long to if you want.
Good food great beer,This pub is located a short 10 minute walk from Orchard MRT and just off Orchard Rd. Muddy Murphy's show all the major Sports on big screens and also host live bands. The menu is reasonably priced but if you want the Guinness Pie order early as they do run out. A pint of Guinness costs about $13 and go down very well in the humidity. Muddy Murphy's was busy on the occasions I visited with ex pats and would recommend a stop here for a bite to eat and a pint. Staff were attentative and I didn't have long to wait for another beer.
Expensive pub with atmosphere,"Walked up to the pub from Newton’s food centre. It took about 20-30 minutes. Got there about 11pm. No tables available so shared seats with another few people around the outside keg table. Outside was for smokers so that was the first problem.
Music was fairly loud, so had to shout at our friends.
Drinks were pricey about S$14-20. Drinks nothing special. Bar food acceptable and priced according to the expensive expectations.
When we left about 1230am it was still very busy.
Interesting place to visit but just like any other Irish pub and expensive. However, everything in Singapore is expensive these days. No more bargains."
An Irish Pub that Delivers,"Staying at The orchard and looking for an eating outlet I stumbled on Muddy Murphy's. I am so glad I did. I ate over three days at different times. It became THE Eating place for me. Enjoyed the pints, the Sunday Roast, the steak and Fish & chips. Some say it is pricey but I found it worth it. Muddy met my nee my needs and satisfaction was the end result. I will be back the next time I am in Singapore."
Consistent,Have been coming here at the various incarnations since it opened. Bacon butty and a couple of pints - always delivers.
A Pub That Changes Character With The Time Of Day,"Been going for years, back to when Muddys had the underground pit. Its a bit awkward now (access wise) at the higher level however more than compensated by the excellent pub grub menu, the brilliantly friendly staff, an unexpectedly good Sunday afternoon blues band, and bloody sports - just enough screens and not everything is AFL! This is not a blokes pub but family friendly, I see families bringing in their toddlers and having a nice Sunday roast or an afternoon lunch when the pub isn't so busy. Past 6.30pm and the geezers come in swearing and talking football, oil & gas, and whatever .. but its a pub for goodness sake and I like it.
Just be aware if you have youngsters - as with any pub - after 6pm there is a more adult character. Standout item on the menu is the all day Irish breakfast which is truly magnificent and can give the Sunday roast a run for its money. Well done Muddy's. Do I get a free pint for this review ?"
Great atmosphere,"We always choose this place because of strategic location and great ambiance.
Live band is great and the service was okay.
Food was good too and normally their set lunch was inviting!
It was always our choice for lunch and normally if we were lazy to travel, we would have our drinks after work. Great place to chill with friends"
"Good beer, Service is ok","Guiness beer is great, I didn´t expect anything else..
Service quality could be better though.

Still recommended for having a drink"
As Good As Ever,"I like the new Muddy Murphys and think its as good as ever or even better. The staff are warm friendly and always make me feel welcome. The food is excellent and its the best place in Singapore to watch sport.

My favourite visiting time is Sunday afternoon around 16:30 when the band strikes up and I relax and listen to a fantastic selection of well played tunes.

Dont miss this place when you visit Singapore!"
Interesting plsve,"Nice little bar with football on, drinks reasonable priced and excellent food. Was some interesting clientele"
Ok,"It is a sports bar, respectively pub in Singapore - that says it all. Drinks are, like in most places, fairly pricey. Staff is friendly and has a good sense of humor"
Good Irish pub,This is a good Irish pub located inside the Orchard Hotel. Food and drinks are very good although the drinks are much more expensive than in the UK but this is what we found in other bars as well so it is not an isolated incident.
"Good food, great service, good beers!",Thoroughly enjoyable simple food well presented and served in a very friendly manner at reasonable prices - nothing to complain about whatsoever and plenty to enjoy!
A good Irish pub,"Called in yesterday for a cleansing ale or 2 in this very nice pub. Can't say enough about the staff especially Jay who helped us with every enquiry we had and was so pleasant, she is a credit to herself and her employer. Thanks Jay for all your help

Andrew & Dianne
Australia Nov 17"
A nice place to have a pint or two of Guinness.,Loud noisy and boistrous bar with multiple TVs to catch up on major sports. There is outdoor seating too for people who like to have a drink and smoke
Just Don't,"Rated well, but really disappointed. Soup was insipid, fries a mess. Service indifferent. Yes, there are beers. Also, right in the midst of one of Singapore's zones to find women of the night."
