topic,review
Overcook Wagyu Ribeye Steak,"We went for Sunday Brunch, and we were happy that we were able to get a reservation on the same day. As the restaurant was helm by Giovanni Speciale, we were of the impression that the good will be at least competent to great. My son order the Maine Lobster, and I order the Wagyu Ribeye steak. I ask the steak to be cook medium rare.
To my horror, the steak came out medium well on almost 2/3 of the steak. The only remaining eatable portion is between medium to medium rare. Hence the instruction given to the chef must have been correct, as I still receive 1/3 of the steak in medium rare. It is almost like eating leather on 2/3 of the steak a real disappointment on the Chef.
The Maine lobster is good, and the rest of the stuff was ok as well. But I'm wondering how can a competent chef do not know how to cook a good quality steak, so I'm giving it 2 stars."
Great food and super friendly staff,Quiet and nice environment for dinning. Good spread of main dishes and semi buffet. Staffs are friendly and fun. The environment is pretty much like a fine dinning
Quite Good,"Went for lunch. Generally good service. Quality ingredients used for buffet. We were mostly delighted. Wish they had included a soup in their buffet. Would have been perfect. Desserts appear to have been improved upon. Oh, the appetizer buffet has a significant western slant. So there were a few things I didn't bother to try as I don't like them....cheeses for example. But what remained was interesting enough. Décor could be ""brighter""."
Delightful lunch spot,"Pleasant and warm service. Good selection at the appetizer buffet, but unfortunately food wasn’t always replenished. Wide choice of mains and the Laksa is highly recommended- comes with succulent scallops and even cockles (optional)! Waiting to return to try the other mains!"
Cold cuts and appetizers are better than the main course,This place serves semi-buffet dinner. Appetizers and desserts are freeflow. Seclect one main course from the menu. I had the paper wrapped seafood. It was good. The highlight was theappetizers for me. Very good spread.
Nice semi buffet option,Ample selection of mains to order from but dessert selection is rather limited. Could be better if they enhance their dessert spread.
Best Buffet,I always feel like home when I have lunch at One Ninety. The staff are super attentive and friendly. Food is healthy and yummy.
very good customer service,Loved the variety of entrees offered together with the semi buffer lunch. Value for money to opt for the entree. Food is good. Ambience cosy.
A semi buffet as good as full!,"One-Ninety has got it all - great ambience (cosy lighting, huge chandeliers and warm service through and through), posh factor, great curated smorgasbord of semi buffet so filling you can doggy bag your main course. The selection is sufficient and the food was palatable . It's great value for lunch and afternoon away your brunch till you set your napkins down."
Great food,Always great dining experience here with friendly service. Perhaps been better in terms of table location
"Good service, good food","Service was good but it could be better. The staff were observant and removed the plates once we were done with the food. However, the table was not set-up properly; ie missing cutlery. Request to top up our cups with water was also not fulfilled. Our bill was not in order when presented. Most typical restaurants would not be that careless.

Wagyu rib-eye was a little bit of disappointment. It was not flavourful, tasted bland and uneventful. The characteristic wagyu flavour was extremely weak and diluted. The beef was also not as fresh as it should have been. It could well be a defrosted wagyu rib-eye by all accounts.

Side buffet spread was better, and that's probably the only item worthy of a 4-star."
It would have been 5 stars if...,"Great lunch buffet - quality ingredients/food not about quantity. Reasonably price.

The negative aspect of this place was the ambiance is so-so, located in the basement dark corner of a nice hotel - not the best place to have such a place.

Also the waitress dropped and broke/droped a glass filled with water all over me - glass shards all over the table/floor. Although helped us move to a new table, didnt really offer us any returning vouchers/discount - which is a bit shocking for a 5 star hotel / restaurant and just unacceptable service

I would return for the semi-lunch buffet however I do hope the staff would take into consideration the point above. Just cause the customers says they are ok with no injuries do not take the kindness for granted. I could have easily made it very dramatic and complained/make noise to management. I hope this will be rectify in the future for other customers

Lastly the parking here is ludacris. 18$ for 2-3 hrs of parking. Thankfully the restaurant offers parking voucher - 50$ / voucher."
Grill at its best!,"Grill at its best! they have this great griller oven that dishes great grills. Wish they had pork chops in their menu. It'll add a wonderful item to meet our ""total experience"""
"Excellent Service Staff, Cozy Ambience, Great Food","When I arrived with my dining companions on weekday, we were greeted by friendly host. The cozy lighting, quiet and spaced out tables were perfect for business discussion. The restaurant is not too noisy.

The layout of how food was displayed interesting with different appetizing colors for example black tomatoes is displayed next to bright colored cold cuts. They are simply eye pleasing.

The varieties of appetizers are sufficient to keep me happy and satisfied. They have great selection of cheese, accompanied with a jar of pistachios, dried cranberries and honey. Rye Thin breads and bread sticks are the usual occupiers on this section.

On salad bar, the greens are fresh, condiments provided include interesting Merlot dressing other than the usual caesar and balsamic dressing. I topped up my salad with roasted duck as the main protein. Surprisingly the ordinary looking roasted duck was flavourful. They marinated the duck well, each bite is tasty without any sauce required. Seafood salad was delish, large chunks of easy to peel lobster and crab claws were a draw to seafood lover. Moving on to cold cut sections, they have several types of ham. From Parma ham, shaved honey baked ham, iberico ham and the list still goes on. Love the rock melons, they are fresh and super sweet. Pairing it with Parma Ham is never wrong.

There is also a selection of Mediterranean dishes like Baba Ganoush and couscous salad, Roasted zuchini and Ocra (Ladies Finger) salad.

Make room for dessert, so many yummilicious tarts and cheese cakes to enjoy.
They have green tea cheesecake, Bread pudding and so much more.

One of the service staff on duty called Yuthana from Thailand was very prompt, friendly and helpful.
He made the whole dining experience so pleasant with his professionalism. Kudos to the Four Season's training on staff service attitude.

Would I come back again for meal there? Definitely."
Good Semi Buffet with main,"My wife and I dined here for lunch on Saturday and dinner on Friday. The food was good, but we felt that they could have rotated most of their buffet items instead. 80% of what was served for lunch was served for dinner. This might prevent repeated diners from coming regularly due to lack of new items."
Good set lunch with main and semi-buffet,"We had the semi-buffet and main for lunch at $52 ++. We got 50% off with the Amex platinum card. The semi buffet had a good selection of ham, salad, cheese, grilled vegetables and seafood. The dessert selection though small, they tasted good. There was a good selection of cakes, bread pudding, and fruits. For mains, there were a lot of choices from italian, asian and grilled. We had the tuna and prawns from the grilled section. The service was friendly and ambience was great.o"
"Attentive service staff, mouth watering chilli crab!","Had a hugely satisfying dinner last night @One ninety restaurant. Tried their Semi Buffet which include a main course and a spread of appetizers and desserts to choose from.

1. The buffet spread isn't the most exciting, but offers unique dishes. Definitely not your usual salad buffet.
2. They have a limited time only chilli crab promotion which we can choose for the main course. Of course, for the 1kg worth of crab,there is an additional cost of $38 in addition to the $64 semi buffet set. The chilli crab sauce is fantastic. Better than Jumbo in our opinion. Very flavourful and spicy. Sufficient sauce was given and comes with fried buns to dip the sauce the traditional way. It's nice of them to give us additional buns after witnessing how much we enjoyed the dish.
3. We ordered the cod fish in soy sauce (+$8) for the other main course. Cooked just the way I would like it to be.
4. Kudos to the wonderful staff they have in the restaurant. Very attentive to the slightest of needs we have. From topping up of our drinks to serving new plates for us and offering additional buns. A shout out to the staff (Chinese bespectacled staff) that served us, didn't manage to get his name though. But he's certainly top notch."
Great place for business lunch,"Excellent buffet, sensible in variety and laid out intelligently so one doesn't have to walk all over the restaurant. The buffet is priced reasonably at $42 with an optional menu selection of main course for an addition $10+. The selection is wide enough, without becoming confusing. Staff are watchful and attentive.

The restaurant is not overly busy, so it is possible to have a good conversation over lunch. Quality of food is consistently excellent. This is a favourite place of mine for a quiet business or private lunch."
All I can do is shake my head in disbelief,"On a recent trip to Singapore, my partner and I booked a table at this restaurant to experience their semi buffet dinner. We arrived on time, greeted by someone at the front desk, shown to our table, where we were greeted by our waitress for the evening. Asked to select if we wanted A la carte or Semi buffet, after much pondering we decided to try their semi buffet menu. We both selected the wagu beef, and advised that we were in a rush, so please don't start preparing our main until we've advised, we were told not to worry as it normally takes up to 50mins before mains are served. Great! plenty of time to enjoy our buffet starter. We then selected a bottle from their wine list, but told it wasn't available, disappointing, but no worries, we'll select another one. Not fives minutes into our entree, we see one of the chiefs bringing out two steaks??? He wondered our way, where I proceeded to tell him, no that will not be ours! What a joke! We then spoke to our waitress who told us there was a mix up in the kitchen, we asked that we will not be served those exact pieces as we requested med rare and if we are to get it will be well done. We then re-confirmed that will will let her know when we would like the kitchen to start preparing the main, again we wanted to enjoy and relax, not to rush. We finished our entrees, plates were cleared but we weren't ready to have main just yet... well to bad , out comes our plates of steak, but this time in a vain attempt for them to rectify their error from before, they served our mains on overly large black plates, really????? Sorry but we hadn't advised we were ready for our main. You would think a five star hotel restaurant could accommodate this simple request. The kerfuffle that took place near our table was just so off putting. By this stage we had three people waiting on our table. The waitress, the chef and the restaurant Mgr. We were asked if we would like pepper, we said yes please, only to have to end up getting the pepper grinder ourselves. We were given a dessert to compensate but honestly, there was already a sour taste in my mouth from this whole experience. Food was average, over salted to create flavor. Not a good experience overall. The table next to where we were seated was vacated before we had been seated and you could see that there must of been a family with young toddlers. The fact that during the whole duration of our visit, that table wasn't cleared up. Sad as I hate giving bad reviews, but sorry guys. It just wasn't great. Communication between wait staff/Kitchen staff need to be worked on."
Simple and very good,"One-Ninety is the main breakfast / lunch restaurant in the Four Seasons hotel.

Both breakfast and lunch feature buffet options as well as a la carte choices and a great selection of both western and asian dishes.

As buffets go, the selection for both sittings is pretty good especially as breakfast is included with some room rates.

In keeping with the rest of the Four Seasons, Singapore, service is very good - friendly and attentive."
Great ambience but average fair,"I find it strange that a high end restaurant will leave the box around. Maybe it's the Rolls Royce of biscuits but the the presentation leaves much to be desired. On the plus side, the wait staff were v attentive and warm."
"Very good food, topped only by the excellent service","I was here with a bunch of friends recently for dinner during the first Singapore Restaurant Week event of the year. We chose One-Ninety because the dinner sitting times of many other participating restaurants didn't fit in with our schedule. And One-Ninety certainely turned out to be an excellent choice for all of us. The restaurant was quiet when we arrived but the waiting staff used the opportunity to engage us in conversation, as well as to explain the restaurant's dining concept. The appetisers and dessert were offered in a buffet style which allowed us to try the many different dishes on offer - most of us were impressed with the scallops, duck, and the cheesecake. But the main courses were the attraction of the night. My dining partners found their portions of baked salmon and spring chicken a little too large, but my octopus was just nice since it meant I got to have more dessert. Throughout the evening, the waiting staff checked in on our experience. Much as the food was very good, their service will probably stay with me longer."
Best Rissoto in Town!,The Chef whips out one of the best Risotto I have ever had in my life! Worth every single dollar. Great place to chill on the outdoor with a cigar in hand.
Above average,"Tried their buffet lunch on a weekday. Food is ok. Although the selection is small, but quality is good. Nice ambience too. Service is ok."
Devastatingly Disappointing Sunday Brunch,"Visited One Ninety last Sunday (19 Feb) for Sunday brunch as I had a visitor in Singapore. Made a reservation the same morning - was surprised that they had a table available but so pleased as from previous experience the brunch on Sundays was one of the best in Singapore.

Went to the hotel and proceeded to the restaurant. I could not believe my eyes - this once sumptuous and spectacular Sunday brunch was no more ..... I reminded me of the opening words of Anais Nin's book Paris Revisited ""The Paris you love is dead"" - the buffet I remembered and loved was surely dead. It was a glorious and spectacular buffet - in my opinion the best in Singapore. Former food and beverage manager Daniel Simon was the architect of a feast so wonderful you would remember until old age - fresh seafood, ethnic foods, sushi, it even had a bouncy castle upstairs and children buffet where you could deposit your children. Ah days of yore!!!

No we had a meagre offering similar to a weekday lunch. Buffet starter - main from the menu and buffet dessert. Such a disappointment. How could a restaurant fall from such a stupendous event to such a mediocre apology. If Mr Simon is still alive the GM urgently needs to bring him back. If he has expired he must be turning in his grave to see such a desecration of a once glorious restaurant he created and nurtured - I mean somersaults - not the odd turn!!

My visit was devastatingly disappointing. Not worth a visit - I can't be the only one thinking this as the restaurant was less than 25% occupied - as opposed to the old buffet which had two seatings - more than twice the number of seats on each seating which spread to the corridors, adjacent bar and patio. How very sad. In those days 100% occupied and very difficult to get a reservation. I certainly won't be visiting again on a Sunday."
Great food and service!!,"There is a combo deal for 64sgd ++ for the starter buffet and a main course. Else you can have a la carte which is a mix ofFar east dishes, sub continent and italian ...or just grill with a steak! Service is impeccable and friendly. Looked at the wine list st by the glass and looks decent. Then move onto the lounge bar which have an outdoor space to try one of the many cocktails or sip a cup of tea."
High standard of service as always,"Love the usual high standard of service here. The Truffle Foccacia is our all time favorite and always go well with a nice glass of champagne.

They have a nice list of below $100 wines now with decent offerings.

Can never go wrong with their wood fired grille items.

Only place that we go to that offers consistent service at 7-8/10 levels."
A slight slip in service quality,"I have been a regular at 190 for a while, and have always thought of it as an excellent venue for a buffet lunch. While the food remains great, there seems to have been a huge turnover in the service staff there, and this appears to have unfortunately resulted in a very visible drop in service quality - as evidenced on 3-4 recent visits. I have seen service spoons lying on the floor, next to the buffet tables and the waitstaff passing by would not bother to pick them up. They also don't seem to pay as much attention to detail when taking drinks orders."
Good food,I liked the buffet for starters and desserts. The fish as main course was well prepared. Overall a nice hotel restaurant
Pleasant experience but food was rather average,"This is a casual and very open type eatery, a little like a high end canteen. It is pleasant though and it's a nice place to do casual meals with the family, especially if you have kids.

Staff were pleasant, very polite and though they were busy on the night we were there, they still tried their best to be attentive and were generally all very professional.

The food however was rather average especially the steaks. I think this was a disappointment given that the restaurant name gives the impression that this is a steakhouse. The steak and the lamb were really very average. The tuna steak however was pretty good. The sides were actually of a more spectacular standard than the mains itself. The grilled veggies were absolutely one of the best we have ever tasted."
Relaxing atmosphere.,"This outlet is our second trip there.What we like this place,is the services and not that heavy filling food you normally get from buffet.
We only there for their semi buffet dinner..there's a change to their main menu,with three group of choices.Italian selections,Asian specialties and from the Grill.
At $64 ++,is reasonable with this kind of atmosphere and service.And it will be wonderful if they add in a cup of hot beverages .
The restaurant manager SaifAli and staffs like Shaan and Simon has make my day brighter and enjoyable.Thumb up for their great services."
"Great atmosphere, great food, drinks and service","Great place to hang out or for a business meeting. Excellent service, great food, drinks and service. And most important great choice of cigars and an outdoor area, which is well appointed and where you can actually sit, relax and enjoy you smoke with a nice cognac or whiskey.
This place is a must visit when in Singapore"
Superb service and food,Excellent service from arrival to departure. The manager and every service staff were polite and friendly - hallmark Four Seasons. Food selection and portions were generous. Loved the experience - a wonderful dinner. We will be back!
Good food and service,"This was our first visit to One Ninety.

We were greeted by friendly staff who explained the menu. You have a choice of the buffet or choosing from the menu.

My husband had the steak which was cooked perfectly and I had meat platter. This was really good.

We look forward to coming back."
Remains a great value meal!,"Went to try this old favourite after its recent makeover (unnoticeable; but I was told that the floor was redone). The food spread remains as good as ever. All the old favourites are back, including fantastic desserts (including the bread and butter pudding as well as the fig pie). Remains a great value meal!"
Fantastic service,"Had lunch couple times here and they have never failed in their service. We ordered a wanton noodle for our 15 month old grandson and he didn't seem to enjoy it so the Restaurant Manager offered us spaghetti at no extra charge. All the staff were attentive and friendly. The executive pastry chef also came to chat with us.

Their set lunch was good too. If u enjoy antipasti and dessert, you must try this restaurant."
