topic,review
Good breakfast- but 0.8% short from a 4-star review! (69.2%),"We stayed in the Four Seasons Hotel Singapore during our Singapore Trip 2023- and we had breakfast at the One-Ninety Restaurant for the five mornings. There was a good selection of food from the buffet- but selections wasn’t as comprehensive nor as much when compared to the Royal Plaza by Scotts/ Kempinski Hotel Singapore. Unfortunately, scrambled egg wasn’t available in the buffet counter, on the other hand you will have to order it (although quality-wise was very good). Food quality in general, was quite good especially the egg bar. The “chef recommendation” changes everyday- sometimes congee, sometimes beef noodles, and sometimes even Kaya Toast with egg. Service in the restaurant was erratic. There was one morning where the service staff Anne said “We don’t have tables anymore in the restaurant so you will need to wait”- and then 1 minute later a table was given to us. We do notice available tables in the restaurant that are not opened to the hotel guests. The tea inside the teapots were very mild as there was only 1 teabag inside- and shared for 2 persons! This wasn’t acceptable in a 5-star hotel- and hence we changed our drink selection to everyone getting different drinks to maximise the quantity of drinks available (but of course this doesn’t improve the mildness of the tea). Ambience in the restaurant was good- with adequate lighting and mood. Overall, some good breakfast- but service has to be improved for a higher rating to be given."
Lunch on 22 July 1pm,Restaurant is very good for business lunch as it is quiet and food is classy. Will visit restaurant again.
Beautiful memory of lunch,"The staffs were really courteous, the food was excellent. Note that you need to order the starter separately as the main buffet is primarily finger food. Nonetheless, overall a very good experience"
Great food Great Service,Very happy with the food we ordered. The services were excellent. Enjoy the dining experiences. No regret of choosing One-Ninety Restaurant. Definitely will be back.
A la Carte Luncheon,"I had the seafood bouillabaisse with a fillet of snapper and an assortment of clams, scallops, mussels, squid and prawns. Everything was acceptable except the scallops, which were over done by the time I got to them. This dish is best consumed WITHOUT indulging in a lengthy discourse. Lesson learnt - If one intends to have a very leisurely meal that is relatively long drawn, eat something else. Less criticism is accorded to the two desserts. The texture of the Anjou pear tart and macaron, and flavour of the rhubarb sorbet were exceptional."
Semi-buffet lunch with a botanical decor,"Not the first place one might think of for a buffet meal. Ambience: peaceful and surprisingly, exuded a tranquil atmosphere, in keeping the with ""botanic"" theme. Service was friendly and efficient. Chose the semi-buffet lunch option - for the price, you get unlimited helpings of starters and desserts, with the option to add on a single entree (for additional $10). Reasonable but not extravagant buffet starter and dessert options. Starters were generally salads and a couple of seafood options, and three options with meat portions. For mains, chose risotto and duck confit - both were of superior quality and portions were large. Desserts were generally of superior quality also, I would say a cut above most buffet options. Coffee and tea included.
Slightly annoying that we were served and charged for ""alkaline water"" without being informed about the additional charges. Buyer beware."
Lunch Meeting,"Was there with a colleague to catch up on some office matters. It worked out very well and very pleased with the attention given by serving staff and assistant manager. Great job, folks!"
One of my favourite restaurants!,Always a delight to dine in One-Ninety Restaurant. It's a steal to have semi-buffet lunch at S$38++ in a beautiful environment with impeccable service. Definitely my good to place for brunch.
Hidden gem in Orchard,Nice ambience with elegant and cozy deco. Staff are attentive and helpful. Def a good place to dine with family or intimate friends.
A reliable international brasserie,"A personal fav, primarily in light of its convenient location, but also because of its ‘not-the-best-but-very-good’ food at not-outrageous prices, excellent service, and peaceful atmosphere. They recently expanded their menu. We had an excellent rendition of bouillabaisse, although most surprisingly, they don’t have aïoli or croutons. Marseillais guests would have to bring their own."
Great dining experience,"Absolutely love the food quality, selection and service The ambience is exceptional as well Will come back again in the future."
Excellent Food and Service,We had a really lovely memorable dinner. We chose to have the set menu as it had a wide variety of menu items to choose from and it definitely did not disappoint. The food quality and preparation was 5 star and absolutely delicious. Chef De Cuisine Pierre Barusta and his staff made our dinner celebration an event we would like to repeat soon.
Relaxing Brunch 😊,Visited the restaurant for their Sunday Brunch. They have attentive and friendly staff. Love how they still allow us to head over to their station to chose the buffet items instead of waiting at your table for them to serve to you. Their Wagyu steak was yummy !!
Service and Food Quality at its BEST !,"Staff friendliness, attentiveness, professionalism stood out.
Due to Covid, food selection (although Semi Buffet) was reduced, regardless the food served during semi buffet lunch is enough to fill your stomach.
Food quality is of a 5-Star hotel standard, food was fresh, seasoned to taste. Desserts were amazing.
We started lunch at 12pm and finished at 3pm (no limit to time per seating).
Totally recommend this restaurant to everyone looking for a relaxing time, catching up with loved ones or friends over lunch."
Astonishing high tea,"It quite a wonderful hightea that we had with my friend. The food is great, especially the peranakan curry. Also must give credit to YY and Ying with their exquisite service."
Love the salad and dessert buffet!,"Brought my mum for lunch at One-Ninety. Was pleasantly surprised by the quality spread at the buffet with a variety of desserts, salads, cheeses and bite-sized mains to choose from. We opted for the semi-lunch buffet with a main course which came with a soup of the day.
(+) Desserts were excellent; the canelés, bread & butter pudding and almond cherry tart were my favourites
(+) For the savory items, the grilled asparagus, tom yum chicken balls and Tzatziki dip stood out

Overall, a pleasant dining experience with warm service and quality dishes. Would definitely return for the buffet itself!"
Fancy cosy space for breakfast with great service,Had breakfast here as in-house guest and everything was great - great quality and quantity (big portion alert!) complete with great service and on judgements for my slight wastage of food.
Wonderful Service,"The service here was excellent from start to finish. The senior lady staff was friendly and efficient, and she and the chef helped to check which dishes had buckwheat/soba, which my wife is allergic to.

While not having a wide variety as before, the semi-buffet appetizers were good, and I especially loved the cold salmon, the Thai duck salad and the pate. The char kway teow had a nice hit of wok hei and was tasty - it was a little on the sweet side and a little bit of spice would have elevated the dish. The squid ink pasta with crab was just okay. The crab meat was fresh, but the entire dish was bland, so much so that I had to add salt and pepper, something which I rarely do. Portions were generous.

Dessert was also pretty good, though the ondeh ondeh had too much brown sugar and was overly sweet. The signature chocolate cookie and the lime meringue tart were pretty good."
Memorable night time !,"I wish to show my appreciation to the service staff.. they were all nice professional and very attentive! We dined at the main restaurant first and I wish to particularly to commend the Chinese guy who served us, I regret I didn’t check for his name, pls find out and let him know that he made us feel very welcomed and also he surprised us with the red velvet cake!! It was executed so professionally but yet sincerely! Lastly we also enjoyed the drinks and ambiance at the bar. Also send our appreciation to the Filipino guy who recommended us the drinks! It was Perfect!"
Sunday Lunch well done!,"Getting fed up with resto asking you to leave after 1.5hrs. Found One-Ninety lunch hours from 12-3pm. Called and the lady was very pleasant told me we can sit there from 12-3pm. Such a nice experience of lunch ""buffet"" for a change. They actually do have a station filled with nice salad, burrata cheese, dessert and laksa! On top of that, you can order 1 main course which is of generous serving and quality is very good! My gfs have Duck Confit which are cook to perfection, I'd Fish which is well done. Each of us have a bottled of nice warm water so you don't have to keep troubling waitress to fill up. Also comes with coffee or good selection of tea! 4 of us sat there till 330pm. Service is very good. I will be back again!"
Neat and cosy,"Had a staycation in four season hotel and took 2 days of breakfast at one ninety. Restaurant is neat, cosy and classy. Variety of breakfast not a lot but acceptable. Taste of food is average as per restaurant standards. Staff are exceptionally friendly and helpful."
Good ambience and service,"Semi buffet during COVID-19, variety of the food is not much but the quality is still good, service is good with minimum stuff only, atmosphere is perfect."
Reliable coffee shop.,"Reliable coffee shop. Nothing extraordinary about the food, but prices are generally reasonable. The semi-buffet is kind of boring, but fresh and healthy. Friendly service staff."
Terrible Food... Tasteless!,"The selection of cheeses was deplorable, the food was absolutely tasteless, the pork tasted like raw protein... why did I even bother going? Waste of money."
"Nice ambience, great service and food .",Our first time visiting the restaurant great entree selection and thanks Simon for the excellent service. Thanks for the service rendered and the birthday cake. Ambience of the restaurant was pretty.
Excellent value - need to sort the service a bit,"Set lunch is ne of the best valuers in Singapore - as long as you avoid things like the bottle of sparkling water at $12 of course. We topped up for the steak option which was excellent. There was a lot of food and very good quality - including good cheese with nuts, quince jelly etc. Classy.
The waiters seemed confused/clueless on what order to bring the food. You choose salad first and the waiter was about to bring our main course at the same time - we said no wait. Then soup came which we didn't expect - followed of course by the main course 1 minute after, so the soup was abandoned - we are not doing a picnic...... These are simple things that would improve the experience to make it excellent.
Next time I will give them instructions on how to serve the food - but we will go back, it was very good nonetheless."
relax and enjoyable lunch,always a good selection of food spread for the semi-buffet lunch. the restaurant dining atmosphere is excellent. good value for money.
Great variety of food,"Excellent variety of food on the menu. The salad bar had a wide selection of fresh vegetables, meat and nuts. The Maine lobster and snapper bouillabaisse were spot on and highly recommended! The king crab tagliolini looked amazing but unfortunately it was slightly overcooked and lacked the lemon flavour. Service was average. We were served a second bottle of still water without our knowledge and were charged for it."
Delicious for a Birthday Meal. - Could be Better,"Visited for a Birthday Meal, the food was delicious and the service was as expected for the Four Seasons. A pity that the Lamb was sold out and the buffet service was incredibly limited due to covid-19. Would like to be back after all this is over so that we can enjoy the buffet again. looking forward to it."
Excellent but over crowded,We were there during the week of the Chinese New Year and thus place was crowded every morning yet service was very good and varieties of food and taste were very good.
Excellent breakfast buffets and good dinner,"Friendly staff. Excellent hot choices on comprehensive multicultural breakfast buffet: fresh juice of the day (beetroot carrot ginger), shu mai and dumplings are a favorite. Excellent quality salad ingredients, fruit, cheeses. Great breads and pastries. Dinner very good too: Wagyu burger and Chinese New Year sweet and sour pork. Very convenient while staying here; multiple birthday cake acknowledgment for one of us guests."
"Good food, great service","My family went to One-Ninety restaurant at The Four Seasons on New Year’s Day and had their semi-buffet brunch. We were delighted by the huge spread of appetisers and desserts. All the items were excellent in taste and quality. However, the choices for the main course were not very impressive and the list included a number of local dishes, such as Hor Fun, as well as breakfast items like Avocado Toast, that did not seem to justify the $98++ price.

Although the main course was disappointing, the service made up for it. My sister had informed our server that her Miso Chicken was very salty and he offered to replace it with another dish of her choice from the list, even though she had eaten at least half of the chicken. She was immensely pleased with the Ricotta Pancakes that replaced the Miso Chicken.

Overall, it was a pleasant experience that would have been even better if the choices for the main course were a little more exciting."
Great food,Absolutely loved the food and the staff. Great buffet as well. Definitely one of the better Indian restaurants in Cape Town
The average decibel level at One-Ninety barely reaches a third of 190,"This is more a brasserie than a fine-dining restaurant. However, the fantastic service, chic and peaceful atmosphere, decent food at reasonable pricing (relative to the location and atmosphere), flexible hours (it’s open 16 hours a day) make this place attractive not only to hotel guests, but also people living in the neighbourhood or folks wanting a respite from the noises of Orchard Road. At lunch, the sinful char kway teow is amazing - more yummy than at many hawker stalls even if it’s more than five times the price!"
Quiet ambience & impeccable service,Always loved One-ninety for its impeccable service & lovely ambience. Nice place to catch up with friends. Food is good quality & well spread.
No need to speed at 190 km/h to eat at 190,"Many of our friends living or working in the neighbourhood use this as their cafeteria. It’s open 16 hours a day, the à-la-carte menu is adequately long (with both western and Asian dishes), the food is not bad, prices are more reasonable than at comparable lounges (eg. Brasserie Les Saveurs at St Regis), and service is swift. At lunch, the sinful char kway teow is amazing - more yummy than most hawker stalls in town!"
"Beautiful setting, food and service.",We ate dinner from the al a cart menu. Excellent food quality & portions sizes. Good kids menu and kids table wares. Service was outstanding and the design and set up is beautiful. We will return.
Excellent service and food,"The restaurant was amazing. The breakfast buffet had many options, including fresh fish that was wonderful."
Excellent Wedding Anniversary Dinner,"We always make it a point to come back to One Ninety @ The Four Season’s for special occasions esp wedding anniversaries. Today’s visit was yet again memorable & pleasant. The customer service at Four Seasons was highly commendable..

Starting from the phone reservation where the lady noted our first name & could tell me our full name & our last visit to One Ninety. At our dinner today, we were given a quiet corner as requested. There was full attention from the moment we entered the restaurant. Sean Chan, the manager and the Indian service staff were excellent & polite. They served with pride & dedication. They made our wedding anniversary dinner very memorable by making us comfortable & even providing an anniversary cake plus more cakes from the main table.

Atmosphere
There is always a sense of peace & calmness. After the renovation, we noted more botanicals around the entire restaurant, this increases the cosy & homely feel. Sofa was very comfy with the cushions.

The new menu
Very different menu compared with the previous. Some usual favourite day were missing (grilled salmon, fish curry). No semi buffet with the anti-pasti & salads which I will prefer still. We ordered the seafood tower which was served with liquid nitrogen and a spectacular entry to our table, was impressive with very fresh seafood and tasty sauces. The other dish that we ordered is the Nasi goreng which contains generous portion of fried rice, satays, chicken wings & keropok.

Four Seasons Hotel as it is, never fail to impress. This is still the very reason why we first selected Four Seasons for our wedding 15 years ago. Keep up the excellent job...please continue to make every encounter a wonderful experience."
Sunday Brunch is excellent,"After the relaunch, the decor is classy and welcoming - a botanical theme that is cosy and fresh. It is a semi buffet which means bread, a seafood tower and a main entree is served at the table but the salads, appetisers as well as desserts are on a buffet line. We loved it. Today's buffet line has a clear Mediterranean inspired theme in the appetisers and the charcuterie selection of parma hams and lomo iberico slices were on point. Smoked burrata, the stuffed tomatoes and dolmas were divine. We learnt not to jump to conclusions too easily by thinking that the selection was smaller than other buffets (the Line for example) as the quality of food here at One-Ninety was high. We had an impressive three- tier seafood tower and the entrees did not disappoint. Please save space for the wonderful desserts! Great job, One-Ninety! We know where to go for Sunday Brunch now. =)"
Business,"Went with bosses and colleagues. Service was good, food not bad and nice atmosphere. Good for chilling out"
Good variety of food for the price,"We enjoyed the food, the variety of food and the service given, it has been a nice dining experience for us."
Really nice lunch in what could be wrongly felt to be another hotel coffee shop,"We came expecting a standard coffee shop experience (large but boring buffet or the usual list of club sandwiches and salads). Instead, we had a very qualitative lunch, giving the flexibility of combining from a simple but fresh starters buffet and a varied menu, offering both local and more traditional options.
All main courses were delicious.
The service was equally efficient and friendly."
Excellent cuisine and service.,"After a lapse of two years, I decided to pay the restaurant a visit following its recent renovation. I was pleasantly surprised at the quality of the food on offer. Most of the dishes were delicious and well presented especially the avocado salad, and the sea food tower. Service was top notch."
One of my favourites in Singapore,"A very nice restaurant, located in Four Seasons Hotel with one of the greatest breakfasts ever, but also a perfect a la carte menu. The staff is more than lovely, so I tried it several times while I was there."
Excellent food and service,"This was the perfect sanctuary after an evening check-in at the Four Seasons. All the staff were genuinely friendly and, even though dining alone (business travel is not all it is cracked up to be) on a weeknight, I was made to feel most welcome."
Great Sunday brunch,"Celebrated my son’s birthday there this afternoon. The Sunday brunch is a semi buffet. The spread is great ... love the sushi and salad. We also ordered our mains (a choice of fish, chicken, beef and mussels ... there are also Asian cuisine to choose from) and the Seafood Tower. All in all, great food and fantastic service."
All in Good,"We are not buffet people but all my family and friends whom we recommended this restaurant enjoy it and revisit the restaurant again and again. The food is not like “normal” buffet full of hot meats but with very quality white cold meat and vegetables, which attract us. Cheese and desserts are also very nice. We always feel very satisfied and full.
Service is also a bonus to mark this restaurant excellent!"
semi buffet dinner,you choose a main course on the menu and the dessert and appetizers are buffet. the selection is intimate but its good quality. service is good too.
buffet breakfast was nice and quiet .,buffet breakfast was nice and quiet.The food options were not a lot but the quality was of high standard
Christmas Lunch,"Luckily for us we were able to secure a table for Christmas Day brunch on short notice. The kids room was a hit with our toddler, the balloon artist was one of the best we have ever seen.

The selection of food was plentiful and very tasty. There was no way anyone could have left feeling hungry. We were very pleased with our selection and would recommend."
Sensational Food,Not your typical hotel restaurant. Staff are really good. Good wine selection so it is perfect if you want to dine out close to home :-)
Lovely Lobby Restaurant in Four Seasons Hotel,"The One-Ninety Restaurant, open to the lobby, offered a wonderful breakfast buffet with a wide range of foods and beverages. The pastries changed every day and American and Asian offerings were presented. Breakfast was from 6:30 to 10:00 am, so a guest had plenty of time to sleep in and still have a nice breakfast. Wait staff very helpful and friendly."
Love the laksa,"Recommend the laksa. They have scallops, mussels and big prawns. As they say 'you get what you pay'. The service is just excellent, staffs are friendly and never in a hurry to explain anything to you, including directions to shops."
Breakfast galore,Breakfast served here will fill your stomachs and put a smile on your face. Wide variety of hot and cold dishes including a choice selection of Japanese and western favourites. Service is hard to beat.
Good birthday lunch with friend,"I went there to celebrate a friend's birthday. The main course is very delicious, but a bit small portion. The buffet line for the started and dessert is good, but not super impressive. Service and atmosphere are excellent."
"Small servings, small buffet spread","This is about their semi-buffet. Firstly, it cannot be compared with other hotel buffet spreads - it’s too small here, and nothing oriental. No soup also (!!!). As for the main course, be prepared for small portions (both the Asian and western selections). For that price, in the midst of strong competition, I’m definitely not returning.

Service is good.

{Now now, if you are in the hotel and wants a really good meal, there is a fantastic Chinese restaurant just above it.........}"
good,awesome food and ambiance provided by the restaurant. Will definitely visit again along with my friends and family
Thumbs up,"Tried the semi buffet lunch on Sat. Surprisingly, the food quality is very good and spread is definitely sufficient for a semi buffet. Was not expecting roast duck, chicken and roast meat on the table. Top up for Steak and frites - the meat is grilled perfectly to our liking. 2 rounds of coffee and tea is included in the semi buffet. Crayons and colouring paper is given to entertain my 2 yr old. Having a AMEX platinum card make the deal even sweeter! Service team is friendly and prompt. Thumbs up for our overall experience. Will be back more frequent. :)"
Average fare at high prices,"I've been here twice, for lunch & dinner at their semi-buffet. Spread was limited even for a semi-buffet, mains were average, high prices, and the price of the buffet unbelievably doesn't include coffee or tea, which the waiter informed us we had to pay for separately (but at least was trained enough to inform us at the time of order rather than us finding out at checkout). Atmosphere is elegant & each table is at a good distance from the other, perfect for a business or intimate meal. Waitstaff are unobtrusive. Still, I wish my meals there had been more fulfilling."
Probably the best breakfast buffet ive had,"Stayed at the hotel for three nights. Its probably the best breakfast buffet ive ever had. The bar, that carries the same name, also was wonderfull. Professional staff that makes you feel right at home."
Good semi buffet dinner,"Good spread with salad, cold cuts, cheese, cooked food, dessert stations. The main course completes the entire dinner experience. I love the cod fish, succulent and juicy cod fish cooked to perfection! Love it!"
Semi-Buffet Dinner,"Just tried their semi buffet dinner. I felt that some of the options on the menu are quite overpriced. So appetisers and desserts are buffet and you select an entree. First of it is split into 3 segments, Italian, Local and Western. Italian has the typical pasta fare but top up S$10 for the braised lamb shank which is tender and excellent. Local has items like Hainanese Chicken Rice, Laksa, Char Kway Teow. S$64++ for local fare is not for locals I reckon =). The western has items like spring chicken and for top up of S$32 you can go for the wagyu ribeye, Maine lobster. The buffet has the traditional appetisers like sushi, roasted duck, pork belly, salads, cheeses etc. Desserts has cakes and sweet items. A little overpriced but the service and quality of food is excellent!"
Good,Main dishes were nice. The buffets spread was little and too crowded. Area too small. Should have more space to move around
