topic,review
Decent place,"Nice place, but no noise cancellation, so you could hear everyone clearly and it was getting too loud, even the bartender mixing drinks could be heard very clearly.
The service was good by the girls, but the main in-charge did not seem a customer friendly person."
Seating issues because of covid,"We were assigned 2 sofa seats which was difficult to accomodate 5 people. We requested to get an additional chair on the side but we were refused because of covid situation. I would like to bring this to the restaurant's attention. Two sofa seats and the table is good for 4 people, definitely not for 5."
"Food quality and standard is always top notch, minus one surprising change","We always love the American-diner style food at Overeasy. It was also very kid-friendly and accommodating with our young child. I was just a bit surprised that water is suddenly chargeable and that the small bottles are $5 after the first complimentary one (which shared amongst 4 adults, did not go very far). Given that tap water is drinkable in Singapore, I don't really understand this."
you get what you pay for!,"food is a bit pricey but delicious! we had the hangover and avocado toast off the weekend brunch menu, mac n cheese and corn dogs off the sides menu, an oreo shake and a strawberry shake. a wonderful meal!"
"Great location, passable food","Outdoor atmosphere was great, with a view of MBS and CBD. Cocktails were quite good, and definitely light enough for those who don't drink much. Food portions generally not too big and were generally of passable quality. BBQ ribs were tough and tasted average, and the Mac and cheese was alright. Come here for the views and drinks, but probably not the food."
"Average, would not recommend.","We could only have our table for 2 hours; after that, we had to vacate if anyone else had made a reservation (luckily no one did, so we could stay). Restaurant was loud and noisy even without piped music. Service was good, but nothing to crow about. This was my second visit. On my first visit during a weekday afternoon, the restaurant was not even half full but my husband and I were denied a booth -- I had made a reservation for this -- yet, walk-ins were immediately shown to the available booths when they arrived after us. For this reason, I do not recommend this restaurant."
Overeasy Dinner,Staff were friendly and helpful. Food was satisfactory! Would definitely be back again to try the other signatures on the menu!
"Nice view, good food",Was able to reserve outdoor seat with a good view upon request. Food was bit pricy but reasonable considering the view. Service was bit slow during the peak hour
Excellent!,"Alfresco facing the bay. Everything was wonderful. Cocktails, food, service were all superb! Will be back regularly for sure!"
great!,"great food and ambience, just abit hot outside even with fan. Tried lobster Mac n cheese and truffle burger and they taste goood"
Subpar service. Average food. Not worth the pain.,"Terrible service. Average food. We used to visit this restaurant and loved the food and found the service good. This evening we were in the area and thought we should support one of our favorite restaurants as we adapt to the ‘new normal’ but a misunderstanding between us and the service staff resulted in an awful experience for me. No, I am not expecting an apology, it was an misunderstanding but the staff made us felt awkward. And when my mojito came, it tasted like ice water, hardly any rum. Yes, it was the worst mojito I have ever had. And no, I was not expecting extraordinary service but as a former customer service manager, to me the absence of ‘thank you’ and eye contact as we paid the bill and walked out showed was very telling and rude. I am all for hiring locals and teenagers but the service is expectedly subpar. The young waitress who served us was tactless and borderline insulting. The dinner for two costed us more than $100, for that price range a certain level of service is expected but this restaurant falls way below that expectation. In my opinion, since there are many other restaurants nearby offering the same fare with much better service, I would suggest spending your money there instead."
Many repeated trips,"Have been my many repeated trips there, accompanies by fantastic views and food (Broccoli salad, F&C all-time fav)"
UNHAPPY Customer,"There was no mention about minimum order when I booked a table on their website. When we went there, we were told that there is a 50sgd minimum, it was surprising but OK coz we expect to bill more than that. However, when we're about to pay, we were told again that it was 50sgd/person! it was embarrassing as we are about to leave the place, however we were forced to order again just to reach their minimum order! The dinner became an embarrassing and a very unhappy occasion. WE WILL DEFINITELY NOT RECOMMEND THIS PLACE AGAIN!"
Al Fresco dining with a fantastic view!,Our family had a fun Friday Night out at OverEasy! My kids love the burgers & the sliders. While I like the Grilled Cheese sandwich & Chicken Buffalo Wings! We enjoyed the Al Fresco dining with the superb view of the Marina Bay. 👍
Amazing Experience,Overell experience was awesome! They even gave me a slice of cake as a birthday treat! Thank you Over Easy Staff!
"Neither food not the service were acceptable. They even did not ask why we haven’t eat the food at all, just asked toPAY","Neither food not the service were acceptable. They even did not ask why we haven’t eat the food at all, just asked toPAY"
"Great food, excellent service","You've got to try it to know it! Was concerned that it would just be another overhyped restaurant. Went to celebrate sister's bday cos my nephew wanted to try something different. The food was great! Service was excellent. And though we were too full for desserts, server offered a complimentary waffle to end off our celebration."
"Great food, service staff needs to be improved","Went there for mother's day and was extremely excited for our meal. Started when the waitress came to take our orders (she had bangs), she spoke with a rude tone and was overall, unfriendly. While clearing the table, another waitress dropped the knife on my father's pants staining it and walked away without offering any serviettes to clean up the mess.

Finally, the first waitress constantly spoke to us with an attitude and even after we finished eating, she kept rushing us and the moment i finished eating, she told me to put my mask on in an impolite manner despite me still finishing up my drink.

As a service staff, especially on a special occasion like mother's day, she should be considerate and realise that we do not owe her anything as customers. The food was great, but really there should be more training/vetting on the staff that you hire. It really creates the image on Overeasy and am really disappointed in the entire experience."
Good food but bad side effects,"It was a good visit, the view was great, the service was prompt.
The food was also good (sweet potatoes was yummy). However, I was down with food poisoning a few hours later. Could not breathe properly within a few hours and vomited that night and having diarrhea and fever since Sunday, 2 May (today is Tuesday). I had the hangover burger. I ordered medium rare... guess I should have ordered medium? Maybe the experience would have been better...? Lost close to 3 kgs so far... aish... oh, the milk shake was awesome and the waitstaff was attentive."
Awesome Party with Friends,"We had gathering at Overeasy with friends on a busy Friday night. We were pleasantly delighted that the staff had arranged fabulous seats facing MBS for us. The view was fantastic and the staffs were so helpful in recommending the food and drinks, and also taking several photos for us. Highly recommend the Mac and cheese, topped with mushrooms and truffles ($18) 1 for 1 beer is also a good deal but it ends at 8pm. Will certainly be back again! Thank you~"
Good vibes,"Good vibes, we went there for drinks. But my friend got this Kyoho Cocktail and it was too diluted, she didn’t like it that much lol. That said, the vibes and service were superb which made up for the diluted cocktail."
Amazing food and impeccable service,"Went on a dinner date at Overeasy, One Fullerton on last Friday evening, the place was really crowded but we got seated quickly and food were served within 15 minutes after we ordered. Love the American diner design and warm lights, which also enhance the dining experience and ambience. Would definitely recommend my friends to try!"
Overeasy over looking the Marina Bay,Great experience at Overeasy. Was given a window seat with a great view as it was a birthday celebration. Staff was really nice to cater to our request.
Depends on what u r looking at,"Cocktails and Beer during Happy Hours are affordable. Cocktail is a bit tasteless unfortunately. Food tasted average. Choices of add on of truffle mayo and change to potato fries can be a put off, all chargeable. The outdoor table that we had was not ideal. A green box blocking the nice river view and back facing the view. One of the plus point is that Service staff did take initiative to put in extra napkins and clear plates and check on us from time to time."
Overeasy,"Food was delicious, portions were moderate sized. Service staff were all very prompt and pleasant to my children."
Not-so-great food at a high price,"The truffle burger lacked the juiciness you would expect in a beef burger, and the buttermilk fried chicken burger was rather plain. Both were coupled with a side of soggy and slightly stale fries. Even though they were generous with the portion, the prawn linguine could have been more flavorful."
Great atmosphere poor service,"Lovely restaurant location. Raj the manager was welcoming. thanks Raj. The waiters forgot part of the order and that came after the meal was finished. Most of the food was good, except the Broccoli and Avacado salad, though the Quinoa and Feta needed to be balanced. The Ceaser salad with Shrimp was frankly not good."
Horrible Experience,"Food and drinks were great. However, the service leaves much to be desired.

Pros:
1. We were promptly seated outdoors upon our request despite not having reservations.
2. Food and drinks were served promptly.
3. Staff were generally polite.
4. Great views

Cons:
1. We were seated beside a shrub and dealt with ants half the time. Though I ignored it since we wanted the outdoor seating.
2. Acquaintances of staff threw water from the table behind us towards the shrub. The staff apologized but the water kept coming. My partner had to shift her handbag as it was getting wet. Despite the ambience, I was reminded of a wet market.
3. We were not done with our food close to closing time (we were reminded that they were closing soon, so my bad) but a male staff straight up grabbed our plates 7 minutes before stated time. The least they done is to inform us politely before taking it away, or even offer a takeaway and I would've paid extra for that. Unfortunately, nope, all that was uttered was ""Time"". I mean I'm sure I paid my fair share for the food.

Overall, I had a good first impression but by the end of it, my experience spoke for itself."
Picturesque view!,"Spotted this plc after a bday dinner at PS and make reservations for pre ChristmAs gathering with gfs. Had a nice patio seat with a great view and a gd list of drinks n food to go along w such a view. Loved this place, had a great catch up and will definitely come again soon.

Ps: do make your own reservations early to avoid disappointment cos this plc is Always fully booked on wknds!"
"Good Burgers, service could be improved","Had ordered the To Die For and Truffle and as usual the standard was there. I wish I could say the same for my Philly sliders, but it was terribly late (possible missed order) and was not up to what I had expected as the meat was dry. Possible suggestion would be to check if all orders have arrived, as no one had noticed my missed order until I asked the waiter to follow up."
