topic,review
Good Variety & Quality of Foof,"We had our family lunch here with my parents and the kids, as we have been doing so over the years as Princess Terrace is probably one of the best Restaurant offering Penang fare. Always a delightful meal, enjoyed by the older folks as well as the kids. Do make a reservation in advanced and ask for ongoing promotions! We love the Char Kuey Teow, Laksa and array of kuehs!"
Automatic Egg Maker Sunny Side up & Omelette,Made an omelette with onions and tomato to my taste with the automatic egg maker; the best part being its freshly made. It even knew how to pat pat the omelette before serving it.
The cafe not the buffet,"The cafe offered a small range of meals for those not wanting a buffet meal in the main restaurant although I'm told that it serves a very good Penang buffet,but we ate ate the cafe reasonable priced meals and the staff member was very friendly and helpful with great service"
Annual visit,"We have been celebrating my Mum’s birthday here every year for the last 7 - 8 years as she enjoys the Penang food buffet. It was her 83rd birthday yesterday and our party of six again enjoyed the wide selection, delicious food and friendly service. Judging by the number of diners yesterday, this place is still going strong!"
Satisfy your craving for Penang cuisines!,"There is a good spread of the typical Penang dishes and cuisines, including assam laksa, pig's trotter cooked in black vinegar, mee sua soup with duck drumstick, pig's stomach soup with pepper, popiah, and kwei pie tee. These items are prepared in the hot kitchen and served in individual portions to diners.

The self service counters offer many other salivating options, including mee goreng, fried kway teow, and foo yong egg with crab meat. There is also a salad spread and a self-service station for rojak mixing. For the savoury dishes, my only wish was for the tau kwa (fried bean curd) and nasi ulam (rice cooked with various spices) to be served heated/warm/fried.

For desserts, I had fun mixing my own ice kachang, which brought me back to my childhood days of eating ice balls. The kueh kuehs were served in delicate portions, which is great because I get to sample a wide variety without over-eating or feeling guilty!

I was there with a friend on a Monday afternoon, and practically all the tables available were occupied. According to my friend, whose mother is from Penang, this buffet is well-known and has been established for decades. There were several large groups of diners who were there to enjoy good food and more importantly, to catch up with one another. They look like retirees and it was heartwarming to see friendships being strengthened and perpetuated over people's mutual love for food! Given the popularity of the place, my advice is to always make a reservation before hand, even if you intend to visit on a weekday.

The price per person is rather high, and especially for children (at half price). My suggestion is to check out different food and restaurant apps for promotions and discounts. For example, one app offers a 40% discount at 12 noon when the buffet opens, and a 50% discount if reservations are for 1 pm! That will give you approximately 1.5 hours to sample the different cuisines before the food stations are closed, which is still a fantastic deal!"
Excellent spread,As usual the spread was good and taste very authentic. The black vinegar pig trotter and pig stomach soup was excellent as usual.
Best place for Penang Buffet,"Took some friends who were visiting to The Princess Terrace Cafe for lunch. Good place for visitors to try a variety of Southeast Asian food. My favorite is their char kway teow, duck noodles, chicken wing and small pancake with banana sauce. The decor is bit worn but so far the food has been consistent. Staff was very accommodating as well. Found a discount on Fave which made it extra nice!"
Lovely food,"Had a peranakan buffet with friends, food was amazing and the choices were plenty. There was a robotic egg chef called Auscar that was very entertaining. It cooked omelette and sunny side up, amazing to watch him in action. Staff were friendly and efficient.Highly recommend."
penang buffet,"wonderful penang food. I been here three times so far. Love their char kway teow, mee goreng, chicken curry and braised pork belly. Service is decent too."
Penang Buffet in Singapore,"The meal got off to a rocky start due to confusion at the reception. I had made a booking and later needed to amend. As I was unable to amend the booking on the app, (1) my sister called to make a separate booking independently without my knowledge(2) I had to cancel my original booking and make a new one both done on the Chope app.We ended up with 3 tables reserved for us because (1) my sister was unable to call through to cancel her booking and no one got back to her after she left a message.(2) the restaurant mistakenly saw my cancelled booking as a fresh booking and set aside a table for that as well.On top of that, the table which was to have been for us had been given away and staff then had to scramble to look for another table. This took a while to sort out and thankfully after that was done, the meal was able to proceed.The food was good and the variety wide enough. I normally enjoy the Penang rojak, the Penang laksa and the kway teow thng. The satay was good as usual, as were the nonya kueh. I've always liked the tau huay as well. The acar was a bit more sour than usual though. Unfortunately, I was too full to be able to sample everything but managed to round off the meal with self-assembled Penang chendol.The wait staff were kept busy by the Saturday lunch crowd but were eager when called upon. All in all, it was a leisurely afternoon lunch."
"Standard dropped significantly. Cold food, bad quality - comments from a loyal fan","We have been visiting cafe princess for a number of years and always looked forward to the good Penang food when we visit with the family. Our last visit was in 2017.

We visited again on 16/1/19 and was so disappointed with the food served that I actually did not feel like paying for the dinner. My first stop was at the kueh pie tee and poh piah station and it was the worst that I have tasted anywhere in Singapore. There was no prawn to top the pie tee and the poh piah did not have any fried garlic. The filling was also lukewarm.

It was downhill from then on. The prawn noodle was mediocre- the prawn was tasteless. They ran out of otah at 8.15 pm and there was no refill for the rest of the evening. The soup was very mediocre and the other food was lukewarm. And they served breakfast stuff like Chee Cheong fun and yam cake (the Cheong fun was left in a steamer that wasn’t turned on. I had to turn in on!)

I did not bother to eat any other of the entrees served but my other family members were as disappointed as I was. We asked the manager why the fare was so disappointing and he said that the chef hasnt changed. Well, we can tell difference and it is worse than any hawker fare.

The management is clearly unaware of the standard of the food. My friends have told me of the drop in standard in the last year and I can now confirm that this will be my last visit until someone tells me that it is good again.

I hope the cafe can review the quality of the food and the service standard. It’s such a shame to lose its reputation that has taken more than 15 years to build."
Most pathetic high tea ever,"This is the most disappointing high tea i ever had. Firstly, the manager who attended to us upon arrival had an attitude and was not welcoming at all. We were ushered to the tables that were along the walkway where the hotel guests have to pass through with their luggage. And our table was just outside the toilet. Why were we given such treatment when all other tables in the proper cafe area were empty and they had closed off the section?

As for the spread, you can forget about it. You can get better spread at a hawker centre. There was fried kway teow, but it tastes burnt. There were no cakes or pastry but some pieces of sandwich and nonya kueh. They also served the leftovers from Christmas - a mouldy looking Christmas stollen. Other than that, there were laksa and prawn noodles, served by a rude and disgruntled staff!

This was the worst high tea experience ever, and will certainly not return !"
Last reservation time,The last reservation time shouldn’t be 1.30pm as the buffet closes at 2.30 pm. Not quite enough time to enjoy the spread.
"Princess Terrace, the place to go for local Penang food",The many visits to Princess Terrace never made me tired of it. The wide spread of Peranakan kueh kueh and Penang delicacies are the reasons why I am always back to this place for more. Just love the kuey teow soup and hokkien prawn noodles. Super delicious.
Farewell Lunch,Standard of food has not been as before. Selection of food has remained the same despite the increase of price. Only appealed to past customers. A bit hard to attract millennials if no changes made.
Penang food galore! Yummy and plentiful!,"Rule of thumb for buffet...variety. This buffet has all the street food u can think of,...and then some!
Rule of thumb of an enjoyable dinner...yuuminess! The signature noodles (fried or soup) are all very good. The curries n otah are spicy enough to challenge the mild tongue.
There are some misses (small dim sum..yam cake, Chee cheong fun...thumbs down).
And to cap off an evening of good conversation....the dessert selection! And not overly sweet nonya kueh-kueh that suit me perfectly!
I’ll be back for more goodness!"
Queuing @ Nonya Buffet Lunch,"Joined a family lunch at this place and it is my first time visit and what an experience! The buffet was very popular and therefore super crowded. What a mess. I had to queue and wait to order and collect some poh piah and kueh pie tee while others did not - totally no system and control at all - that why I decided to stand there and wait for my order to be served and self collect (training in patience) LOL.

Satay is always sold old. Got to wait. Queue for prawn mee, tau-hway. There was also chee cheong fun, curry chicken, prawns, mee goreng, rojak, fried stuff, a wide range of nonya kuehs, pan cakes, penang chendol, teh tarik etc. Food is average but perhaps its because its buffet style. If we want to eat nice nonya food, I would go elsewhere, or even take a drive up to Melaka for an outing. Still, it was an experience to try out this place. Won't be coming back any time soon"
Wonderful penang laksa,"Been to this wonderful restaurant at lunch time at least 3 times over the years. Great choice of food and great variety, but not overwhelming in quantity. Especially loved the satay and desserts. Great location to meet up and chat with friends and family."
Irresistible authentic Penang cuisine.,"Princess Terrace Café. Located at 403 Havelock Road Copthorne King's Hotel, Lobby Level. This is the only buffet place you can enjoy your favourites Penang / Nonya cuisine to your heart’s content without any waiting people or distracting noise from large groups of diners. Princess Terrace Cafe is the ideal place for family and friends to come together over delicious buffet meals. Offering a tempting authentic Penang cuisine such as Rojak, char keow teow, kueh pie tie and Laksa (Penang style) and with a variety of yummy desserts such as Nonya kueh, soy bean curd, and bobo cha-cha. It’s a casual, family-friendly feel. About the Service and atmosphere also get really high marks! Staff are very professional the service is friendly, and excellent.
Overall, a decent Penang style buffet at relatively affordable prices."
Enjoyed the buffet breakfasts,"We were staying in the hotel and the buffet breakfast was included in the tariff. We enjoyed the variety of Asian and European dishes on offer although at times had to wait for dishes to be replenished. Egg station was excellent. The breakfast is totally self serve, from tea/coffee to juices and all other selections. Sometimes we were escorted to our table and a 'Reserved' sign placed thereon. Other times we had to find table space and then one of us sat guard while the other made their selections. Clearance of used crockery and cutlery was hit and miss. We were satisfied overall . Now dinner is another matter, if you are partaking of the Penang Buffet you are escorted to a table and again left to your own devices. If you want 'a la carte', then, good luck. You will be escorted to a table and then have to wait for some time to receive the menu. Drinks and meal service took an age; it just seemed that all hands concentrated on the buffet. Our only dinner in the restaurant was enjoyed but the service was appalling."
Good food,Good spread and very authentic taste. Simply love the food! My friends also enjoyed the food very much. Will surely return again.
FOOD IS DELICIOUS,Food is delicious especially the Prawn Noodle. But the staff manning the Popiah & Kueh Pie Tee counter needs to be motivated. His face is so unwelcoming. I will usually skip this counter because I don't have appetite seeing the chef serving so unwillingly. I went there thrice and similar experience with the Popiah counter chef. Sad though !.
Lousy Buffet,"Went for the high tea buffet with family just the past weekend and it was so lousy, no proper ""main courses"" and very limited food items, about 10 and mostly kueh pastry and sandwiches. The live cooking stations were serving prawn noodles and laksa, also with the wrapped spring rolls (popiah), were just so so, although not many diners but still had to wait as service was slow and staff were not friendly. (maybe they had to longer beyond the earlier lunch session and unhappy)

Paid for almost $90 for 4 and totally not value for money! And we left after 30 mins later because nothing to eat! Will not come again."
Disappointing and Terrible~,"The cafe is well known for it's Penang Buffet and have visited previously for the lunch and dinner buffet and overall was still satisfying. (I have written reviews about them in other forums but not here then)

We learned only recently that the cafe also offer a high tea buffet on weekends and so decided to try it, thinking that it's new and should be quite good and comparable to it's lunch and dinner, with slightly fewer food items. We were totally wrong and utterly disappointed as we were anticipating it to be quite ok.

We arrived at about 2.45pm (high tea buffet starts at 3pm to 5pm) and were ushered to a table just next to the counter where a number of lunch buffet diners were still eating. Initially, we wanted to sit in the inner part of the main cafe (tables with sofa seats as we have elderly senior citizen and thought it might be more comfortable for her) but were ""rejected"" because that section of the cafe is to be ""closed"" and not opened. Ok fine. But the stupid thing was that they rather let diners sat along the walk-way (corridor leading to the 2 lifts) and at the other side of the main lobby, the dinning section while 90% of the main cafe area was empty. It was so bad where diners lack of privacy with in-house guests moving in and out of the lifts through the walkway to go to/from the main entrance. It was later when we realized that the so called ""closed"" section was reserved for their staff to ""eat and relax"" when we saw one of its managers eating his meal and then a chef sitting there to relax. Of course, also understand why it was closed because staff need not walk too much and too far in to clear the plates! (bad service and brainless planning).

And by just sitting next to the counter, you could imagine the noises, like phone ringing, staff answering, diners coming in and queuing to foot the bills and even chefs also went up there to ""chit chat"" with the cashiers/captains from time to time. Cannot even have a good ""peace of mind"" to enjoy food and chit chat!

As mentioned earlier, we sat at the table at around 2.50pm. At 3pm, no one came to inform us that the buffet had started, until we saw other diners moving forward to get the food! Most other cafes/restaurants would do so especially if they let the diners in early. And we also saw some of the lunch diners eating food from the high tea session and it was only about 20~25 mins into the session, the staff then started to request these diners to take their leave. (but they did inform us about 10 mins before the close of the buffet to get more food but what was there for us to take?).

Next, on the food. What you see from my pictures here were almost all the food offered at this so called high tea buffet. Spread was pathetic and very limited (in total, no more than 10 items) and I could recall all the items, chay kueh teow, laksa, popiah, spring rolls, prawn noodles, fried carrot cake, glutinous rice, sanwiches, 4 pathetically mini small size nonya kuehs, green bean soup, bobo charchar, black glutinous rice, cut fruits, coffee and tea. That's all.

Among all, only the chay kueh teow (not sure if it's local or Penang version, no cockles but not here or there) and prawn noodle soup were just passable, others were like not at all nice, either too bland and mushy (fried carrot cake), hard popiah skin with overcooked ingredients, making it too wet. Coffee was bitter and Teh Tarik was too sweet.

We were quite surprised and shocked to learn that a 4/5 star hotel high tea buffet spread was just like that!!! Then we saw diners started leaving after about 30 mins into the session. My goodness! I will talk about the price later.

Ambience was overall nice, with vintage with the nostalgic feeling. Some items looked old fashioned and aged, but it's still ok. No complaint on that.

Service. Servers (not the main staff who ushered us in) were quite efficient in clearing used plates and were polite. Some of the chefs, including quite an aged lady, were manning the popiah and prawn noodles booth, were quite slow and queue was formed up waiting. I am not being bias against elderly workers and always respect their independence, contribution and experience in their work but they should be assisted by younger chefs especially when ""you know there is a queue of diners waiting for the food and especially with a very limited spread of items, people will naturally with no other choices but to eat the same kind of food again) to fasten the cooking/preparation process.

Also they seemed impatient with expressionless face, and projected an ""unwelcoming"" image. Are we at a Prison cell, queuing for food?

Now, value for money! Totally not worth it. We paid almost $22 per pax just for this limited spread high tea buffet! Will you? Comparing to it's lunch or dinner buffet, well, you can give it a miss, and rather and better to have your meals at McDonalds, KFC or even at a food court.

Recently (just 2 weeks ago) we dined at the Marriott Cafe for high tea too, the spread there was like 20~30 times more (which we could not even try all the food), with seafood, sushi and salmon, hainanese chicken rice, bak kut teh, satay, laksa, curry chicken, nasi lemak, just to name a few, at about $28 per pax! And though there were also some ""hits and misses"" of the food, would say most of food there were nice and yummy. (Please refer to my review of the Marriott Cafe here too, the immediate recent review just before this Princess Terrace Cafe revjew)

With just a $6 difference, diners could enjoy so many other kinds of food, though mostly are local iconic street food with a wide range of pastries and cakes. Trully worthwhile and great value for money and some more ""Marriott"" experience!

Also I also remembered, some time ago, we visited another hotel's cafe in bugis/little india area, that offered similar spread of food items like this Princess Terrace Cafe, with the buffet price of just about $12 per pax (including tax and service charge). We didn't really ""dare"" to complain about that since the price was so cheap and what could you have asked for!

Having said that, it's totally not worth coming for this high tea or diner will be greatly disappointed and felt terrible. Is this the Copthrone standard?

This is the worst high tea buffet we have had not only in Singapore and also in our ""walk around the world"" (or even in Penang). Somehow other cafes/hotels around the area, like next door Mirammar, Furama Riverfront, Holiday Inn Atrium, the other Copthrone Waterfront (opposite the street) with Four Points by Sheraton, we have all visited, where they offer a reasonably good buffet spread and none was rated as poorly as this! Or even the former Gallery Hotel (now becoming Hotel Intercontinental service apartment) or Novotal, Swissotel Merchant Court, Park Hotel Clarke Quay, Furama City Center etc, were all much much better. Prices were also within the same range but the spread was more extensive and food tastier.

As you can see from all my reviews, it's very very rare and uncommon for me to give an establishment a below 3-star, not to mention 2-star rating, regardless of hotels, cafes, restaurants or places of attractions visited because I trust there will be areas that operators do well despite of having shortcomings.

But this place, in particular, the high tea buffet truthfully deserved a 2-star or lower rating. Saving it, is only the ambience and partly is its' Copthrone brand name and since I could not give a 0.5 star, I have no choice but to give 2-star though I felt it's more likely to be a 1.5 star rating.

One last thing. And I think only this hotel ""proudly"" does it. There is no sofa or seat in the main hotel lobby area for guests and you will have to stand to wait be it for the buffet to start, waiting for check in our check out or for tour/transport pickup (unless you go over to the dinning section or cafe with tables and chairs). Really ""amazing and eye-opening"" sight!

Will not return to this hotel in the near future and not even for it's lunch or dinner buffet as there are ""on par, if not better"" similar buffet in town!"
