topic,review
Wonderful food and location chaotic service,"We visited to have a celebratory honeymoon meal with a great view on a weekday.

Upon arriving there was no one to greet us like the adjacent restaurant, we were waiting a while all waiters seemed very busy. After choosing our table we enjoyed the great view however you need to be lucky with the weather as the windows can fog up on the outside leaving you with no view even if you choose a window facing seat, this may be down to how cold it was on the inside.

We found that all the waiting staff didn't seem to have specific areas they looked after which made the service feel chaotic we constantly had different people coming to us to check if drinks had been ordered, if food had been ordered etc telling one person one thing and then telling another person the same thing was frustrating.
We also found the room very cold to the point being uncomfortable and made our food go cold very quickly, we didn't want to hang around for further drinks as we were in need of warming up.
The food itself we had both steaks which were absolutely gorgeous, very well cooked and tasty, the pudding was also great. The cocktails we had were nothing like we'd had before and amazingly tasty, the mixologist is great here, it was all the treat we expected it to be. Thank you also for the celebratory cake.
I think it would have been 5/5 if the service wasn't so disorganised."
Skai's the limit...,"… and a superb benchmark in my book.

This review is truly long overdue. After countless visits at Skai, I’m guilty of taking for granted the faultless execution by the kitchen and warm, discrete yet friendly front of house crew.

For starters, the setting is unbeatable and always impresses whether for a casual business meal or something intimate with my partner. Skai has a fantastic chic space. We personally have our favourite spots in the restaurant but I believe any table will afford you that zen view of Singapore’s skyline.

We're a big fan of their cocktails, such creative concoctions and always delish. The menu is tight but excellent and I love the Japanese inspired elements. You’d be missing out if you passed up on their beautifully grilled wagyu cuts. We’re also suckers for their toasty sourdough bread, oh-so-juicy crab cake and sinful foie gras that never leaves us any space for desserts. One day in the not so distant future perhaps, we’ll exercise enough control to make room for that…. :)

It goes without saying that the Skye team’s repeated gestures of generosity is not lost on us. We’re always well taken care of by various individuals and my sincere apologies for not remembering names. Not only do we enjoy the cool, contemporary vibes here, even elderly folk like my parents have thoughts of a return visit of their own…. they’re a fussy couple so this means a lot.

In the meantime, I’ll be looking forward to my own indulgence next at Skai as a lovely post gym workout meal. Now, how’s that for decadence!"
Great Service,"Nice place, stunning views and excellent service from Fern, our waiter. He is very accommodating and friendly. He did an amazing job- above and beyond the norm. He made my wife’s bday celebration a memorable one!

Dan from Chicago, USA"
Review of SKAI,The ambiance is perfect at the 70th floor and able to see the view of entire Marina bay sands. Just sadly the food I don’t really like it cuz it doesn’t hit my taste bud. But overall good experience
Outstanding experience,"A truly memorable evening. Spectacular views, incredible food, wine and the service is outstanding. I cannot recommend highly enough the new 4 course menu paired with with wine flight. You will not be disappointed. Amazing"
Our 30th Anniversary Dinner for just the 2 of us,"We usually patronize Prego, but we were very impressed with the professional and friendly service at Skai. We were celebrating our 30th Anniversary over dinner, and we were given an excellent table by the window. The service was impeccable in terms of taking our orders, serving of our orders, taking our picture to remember this occasion by and generally making our dinner experience not only memorable but we deeply appreciated the level of attention and service given to us. We will most certainly to make a return visit to Skai not only for special occasions but also for business meals. I'd highly recommend Skai to family & friends .... and especially to anyone visiting Singapore for a birds-eye view of our Island Republic."
Best Steak in Singapore with an excellent customer service!,"We enjoyed the experience! Great food! They serve the best beef wagyu steak! It literally melts in your mouth! Thanks for the recommendation,, Leo and Fern! To top it up, excellent customer service by Fern! Truly a 5-star experience!"
Superb Experience,"The service and ambience is superb!!!! The staffs were very friendly and accommodating, Fern was assisting us while we chose our food, and He recommended the best options possible. Leo went to greet us as well and told us to enjoy our dinner. This is something we look forward to when we visit in the restaurant, to feel welcome and enjoy the stay and food. We will surely book for more occasions here at Skai."
Great dinner at Skai,"Had a wonderful and memorable anniversary celebration at Skai. Service staff, in particular Fern, was especially attentive. Highly recommended!"
April and Tiffany made our day!,"Fantastic service, fantastic ladies. Ms April and Tiffany took care of us so well. You rarely get to see such warm, genuine hospitality from staff in Singapore! Made it very special. I hope someone at Skai sees this and takes good care of them. You take care of your staff and they take care of you!"
"Breathtaking View , Indifferent Service","We had the privilege of celebrating our special occasions here a number of times but after this' forgettable' experience, we beg to differ !
Food was as good as usual : we ordered Foie Gras, Irish Oysters, Scallop Tagliatelle, wagyu Westholme Flat Iron medium rare and we enjoyed the cuisines .
Service was cool & rather robotic- lack of personal warmth/touch for a fine dining restaurant .

Incidentally, the evening became very 'unforgettable' for me after we returned home and had our usual round of fresh fruit and about to retire for the night - i felt growing discomfort and went to the WC . From 11.30 pm till over 2 am in the wee hours of the morning i almost made the WC my bedroom with intermittent acute stomach ache!!!
Thankfully my dear wife was spared the 'unforgettable' experience ."
We had the perfect everything,"Everything was amazing, from the view of the city to our wonderful server (shout out to Stephanie, she was so helpful and efficient!)
The champagne was so refreshing, the food was absolutely delicious (we repeated that tuna at least 5 times, and I so badly wish I had ordered the tray of cold cuts at least one more time-biggest regret!). The only thing I wasn't completely in love with was the risotto. Also, I have to mention that falafel was the best I've ever had."
"Great view, poor service","Not sure if it was because we came at peak hours (during afternoon tea) but staff was borderline rude and inattentive. Food was decent, but our table was basically ignored until it came time for the bill. View and aesthetic was superb though so not a total loss."
Fantastic view,"It was the last night of our holiday and we wanted to go somewhere special with a view, and Skai did not disappoint. Luckily it was a clear night so the city vista was great. Lovely food and atmosphere. Recommended."
Stunning Views & Classy Ambience carry the day!,"Visited SKAI for lunch and was blown away by the views from 70th Floor. Ambience was also classy and mighty refined. Lunch options for vegetarians though were limited. We had BBQ Spiced Cauliflower, ChickPea Tofu & Linguini Pasta with classy red wine from Chile. Dessert of Chocolate mouse was a bit sad."
"Amazing view, food and service","Visited Skai restaurant on our trip to Singapore. The service was amazing, the waiters were so attentive and made sure we were well looked after. The food and dessert were definitely worth the visit and not to mention the view of Singapore city was simply breathtaking. Would definitely recommend this place."
Disappointing,"The experience was most disappointing. For a steak based restaurant the quality of the rib eye steaks we has was very unsatisfactory . Perhaps some of the issue is cultural in what constitutes a good steak but gristle in any language can not be good. At these prices most of the steak should not be destined for the rubbish bin.

Scallop first course was excellent. Desert was pretty good but because the main course was a failure it was hard to recover. Great location but!!!"
Wonderful experience!,"Wonderful experience! Celebrated our 7th wedding anniversary at Skai! We love the view, the food, and the service! ⭐️⭐️⭐️⭐️⭐️"
Birthday celebration,Staffs are warm and friendly. Food is great ! It will be even better if they offer poultry as another option for main course.
First visit to Skai Restaurant,"A friend brought me here for a birthday treat and their service was impeccable and we got a seat with a great view! Great food and ambience to just chill with friends after a long day at work. Especially loved the baked vanilla cheesecake which came as a pleasant surprise for me — slightly tangy, coupled with the pineapple sorbet. It was a refreshing treat to end off our meal."
Excellent view and food,"It has been a joy to visit skai again since COVID started. The restaurant is fully packed for Easter and the food, service and smiles are all good. Our server was Pandian who delivered excellent service, top notch!! Thank you Skai!"
superb place to celebrate birthday,"This was definitely a 5-star experience, the food was top-tier and simply scrumtious, the service was great and the staff were very polite and freindly, definitely will come back."
Fantastic food and service,"Went to celebrate a birthday for dinner. Everything, from the breathtaking views, to the food, to the immaculate table service, was outstanding. the wait staff were always on hand, discrete but ever ready to respond to us. The food was fantastic as well, and my partner and I loved everything from the starters (especially the crab cake), and the mains (in particular the grilled cod). Special shout-out to Mr. Pandian, who was helped us (and many other patrons) take beautiful photos.

Fantastic experience, would definitely return."
Amazing experience,"Food was amazing. Had the beef and cod. The cod blown my mind.

Drinks was good.

Service was excellent. They are so nice!

Worth coming!"
Boozy Brunch @ Skai,"We had to queue for sometime before we were brought to our table. Nonetheless, everything were all good in the next 3 hours: ambiance, booze, food, and staff service. Unfortunately, we were not able to get the names of the staffs who were hospitable throughout our brunch experience."
Food posioning ruin staycation,"6 march 2022 , 7pm dinner 1 crab cake Westholme flat iron Baked cheesecake Panna water Vomitted at 1.30pm numerous time in staycation in Fairmont."
Beautiful Ambience and Excellent Service,"Located on the 70th floor, SKAI served a beautiful panoramic view of the city skyline, be sure to come before dusk to observe the beautiful sunset. We had the 1kg Porterhouse along with the crab pasta and black cod. The food was decent for the price but what helped made the experience even more memorable was the service rendered by our waitress Stephanie who were detailed and patient with our requests. From the generous serving of bread appetisers to the complimentary birthday cake, she made sure we had all our needs met. Thank you Stephanie for the wonderful service that night!"
"High floor, low score","At Skai you pay a few hundred dollars to eat the great view only, not the food. Service was not as prompt as we would have expected. We ordered 2 starters to share. It was $34 plus each for 2 mouthful's of food on each plate respectively (taste was ok, nothing special). The Westholme Wagyu Flat Iron was $75 for a 4 inch x 3 inch portion of meat that had a line of gristle all the way through and was tough to chew. It came with 4-5 leaves of salad. It's ok if your core purpose is to have the view. If in addition to the view, you also want a good quality meal that respects you as a consumer to complete an all round pleasant experience , this may not be the place for you"
"Awesome Team, Outstanding Services!!","I rarely use TripAdvisor to write review but I would like to write this:
I actually drop by last year 2021 December to make a early reservation for my Best Brother and his Wife Birthday Celebration for this year 2022 March.

Where by I think might not be able to get a Nice view seat as requested because if last minute request.

But JAMIE somehow able to accommodate my request and my friend seriously enjoy their meal in Skai as well as the Excellent Service!

The explanation of each dishes was in form. Once again, I will definitely be coming to enjoy"
Birthday celebration,Greatly appreciate the meals delicately prepared by chef Paul and the impeccable services provided by Leo and Nino . Fresh succulent seafood and meats excited my taste buds the whole evening and the performance put up by the cocktail mixer teased my eyes . Would love to see all again .
NEXT LEVEL ……. Literally,"This place is out of this WORLD!!!! I literally was blown away from start to finish. As soon as I walked in the view took my breath away and so did the decor. THEN the food arrived woah …….
We did the Valentine’s Day high tea and it was absolutely divine. We devoured every last bite and each thing we ate was more delicious than the last. Also the cocktails were next level and let me tell you I know a thing or two about cocktails I don’t mind paying too dollar for a cocktail when they taste that good. Highly recommend."
Great ambience. Amazing food! Celebrated my husband’s birthday and its a perfect place :),"Served by Fern and he was so polite and passionate about his work. Always checked up on us if we needed anything!

Place was perfect. Caught a nice sunset during our dinner service. Thanks so much. Will definitely come back again."
Great dining experience,"Enjoyed our lunch at Skai. This is a place you can trust to expect good food, great service and wonderful view."
Perfect dinner date venue with spectacular view,"Had our Vday celebration here. Great ambience , great food ( their crab cake was especially good ) , great view, great service , great experience. We would like to particularly thank Stephanie for her excellent service. She is very attentive and polite. 10/10 would visit again."
Brunch/ Celebrating Valentines 💝,"The view was great and excellent service the server Fern very nice he always approached us. Fantastic experience here, worth it!☺"
Brunch during Valentine,Great service all the way from start to finish. We were seated comfortably and given a brief of the food that is served by Fern
Average food and service. Nonetheless view was fantastic.,"Been here for dinner before and of course was mesmerised by the awesome view from level 70. Decided to drop by for lunch to celebrate friend’s bdae and personally we all love the daytime scenery.

Ordered a 3 course lunch with eggplant as starter, salmon as main and hazelnut as dessert. Salmon was a pathetic small slice and was quite undercooked from the colour and the skin wasn’t crispy as well. However dessert make up for the overall meal experience. My friend ordered a lobster for main at $76 but I would feel the portion is small for the price paid. Definitely can understand the small portion for the set lunch but not for e full price Ala carte main. Service wasn’t fantastic and can feel the staff is rushing to clear plates and prepare for high tea servicing. Throughout the servicing, there isn’t much warmth or smile from the waitresses which I do expect more from a fine dining restaurant.

In term of quality and standard of food, would feel it has dropped from the last time I came in Oct 2020 for dinner. Food portion was smaller and also feels like it has sat in the kitchen for quite a while before serving out. Not even lukewarm for any of the mains being served out.

If you want to experience the view, yes would recommend. For food, I would think twice."
Great service!,We were there to celebrate my husband's birthday and our wedding anniversary. Food was delicious and service was even better. Staff were attentive and hospitable. We had a great experience there and will dine there again.
Everything is perfect here,"The quality of steak and wine from Coravin list are just superb! The service staff are friendly, attentive and knowledgeable."
Nice service from Ally,"It's the second visit and because of my friend move over, I decided to come here. Ally is such an amazing person, she looked after is. Took care of us. ally is amazing"
