topic,review
Great visit for last day in Singapore,It was a great experience! We enjoyed everything we ordered and the exceptional views! One of our favorites was the laska spring rolls! Just delicious!!!
Family vacation / birthday of our daughters,The birthday surprise was lovely. The staff were friendly and the service was exceptional. Thank you!
Very nice experience,First time going to a bar lounge but it was a great experience with friendly staff with good food and drinks to boot. The price is also good for a bar that is on top of marina bay sands. Will cpme back again
Birthday celebration,"Didn’t realised there is a Spago dining room, and Lounge. Staff was accommodating to help us with a table after we sat and ordered drinks.

This visit was for my wife’s birthday celebration, and I am thankful to the staff for accommodating the change and table.

We enjoyed ourselves y the dinner. Service was good, food as well.

Thanks Spago!"
sunday afternoon lunch,"Service is great. Weekday lunch at the restaurant is far better as the menu is more extensive than at the bar & lounge area. I wasn't aware the restaurant was closed on Sunday. I ordered the tomato starter which is very good but portion is tiny - 3 cherry tomatoes + 1 small tomato, The mains portion was large though for me. Would have been better if the portions were more balance. Ambiance is nice - cool breeze and great view!"
My fave,"My absolute fave! As always, the staff are wonderful, food and cocktails are delicious. Special thanks to Reynan, Billie and Arlene!"
Amazing Staff and Service,The staff and service at Spago was absolutely incredible. They make you feel so welcomed. What an incredible experience. Can’t wait to be back and dining with them again.
Average,"The food served by Spago for infinity pool guests were average, at best. I have expected more from this establisment and was disapponted."
Excellent,We had a really lovely experience at Spago. Wine was excellent and the food bites were really good. Great Sushi & Sliders
Good restaurant with fabulous views,"We lunched there on our last day in Singapore as we had not been to the rooftop of Marina Bay Sands & wanted to see the view. We were told on booking that we would be allocated a table for 2hrs. This sounded to be sufficient time but in fact was not, as both entree & mains were slow to arrive, which meant we had to skip cheese, sweets & coffee - a bit disappointing as it was my friend’s birthday. She decided. to order a dessert anyway, but had to rush to eat it. Food was excellent & we would return, armed with the knowledge that we need to order immediately after being seated."
Drinks with family,"Amazing views, delicious cocktails, great music. The food was really tasty and the staff super friendly."
Good food n drinks,Well done dishes and good variety. Variety of drinks and wine was impressive. Dessert was particularly good
Spago Bar a must do if Singapore.,A fantastic location that is matched by friendly and attentive staff looking to make your experience memorable. The team behind the bar mix great drinks and present them uniquely. A must go to if you are traveling through or to Singapore.
Nice place with a great view,We were there to celebrate my son’s birthday. The food is nice and we got to change to a nicer pool view. Will visit again. Thanks
Amazing views from level 57 at Spago,"My family and I enjoyed some early evening delights at Spago, sharing a number of entrees whilst taking in spectacular views from level 57 of the Marina Bay Sands Hotel. The service was really good, and the food was very flavorsome. Very relaxed environment, with good chilled music playing. Worth a visit."
Birthday celebration,"Food is good, timely served. Staffs are friendly
Ice water be served and I feel this is adding point .
Environment is so chill, and the staff even fulfilled my request as I request to have candle to blow the cake for I wanted celebrate birthday for my best friend

Surely will visit this place again"
Father’s Day celebration,"The service was impeccable. While the menu is not most kid friendly, the staffs made extra effort to ensure the items we ordered were made to suit the kids. We enjoy the experience very much."
"Spago, Bar Lounge Marina Bay Sands, 57th. Floor","Yummylicious Food, especially the Cod Fish, love it so much, ordered 2 plates, just need more options on the Menu for Children 1 - 5 years😋🥰"
Fabulous Dining Experience,"The eggplant appetizer was delicious and gluten free which for me is crucial. The main course I had - pork chops - was one of the best pork dishes I’ve had in ages. And my friend had the quail which was heavenly ! All gluten free. Because it was my friend’s birthday, we were given a celebratory cocktail! Yum! Highly recommend!"
Great place,"Great place with nice views. Not really catered for vegetarians or vegans, but the staff went out of their way to prepare something. Even the French fries are fried with other meat items."
Amazing view and cocktails,"This is an amazing bar, just happens to be 57 floors high with unbelievable views as well. We had the Halo Halo dessert which was fresh and wonderful, plus some tasty cocktails. Service was very friendly too. A great spot to visit."
A wonderful evening with Business Partners,"Food was great! The beef tongue was my favourite and all the other food were nice. The drinks were great and the service was wonderful.

If there was one matter that didn't work too well... was the need to take the lift one floor down to use the toilet,"
View from the top of MBS,"Spago lounge is the go to bar for cocktails champagnes and bar bites with a view, dining with visiting friends from overseas who wish to get a sight of the world famous rooftop infinity pool."
Lunch at Spago,"A holiday in Singapore is not complete without experiencing the Marina Bay Sands area. Take the opportunity to go to Spago Bar and Lounge on the top deck of MBS for fantastic food and beverage, great service and amazing views of Singapore."
Perfect Singapore Experience will return soon…,"Food, view and service best in Singapore Phenomenal experience 100% satisfied Food was well presented and delicious Thank you"
Friendly staff & great drinks,"I visited Spago for breakfast and in the mid-afternoon for drinks. Lovely, friendly staff who welcomed and remembered our multiple visits. View was spectacular."
