topic,review
A very popular place!,"This was near to our hotel in a smart part of Chinatown, close to Maxwell Hawker Centre.
The menu is very limited, but excellent. It offers delicious Nasi Lemak with all the usual accompaniments plus a selection of different sambals. Set in a casual dining area, tables for two or more, often sharing a table.
The food was excellent, staff were friendly and helpful and it had a buzzing atmosphere. We would definitely recommend."
Coconut lunch,"I was there for lunch, lucky for me, I didn't have to get in line because I was quite early, Normally, the restaurant was really crowded and people waited for their turn and the line was really long. I saw it when I left the restaurant. I ordered basic set with chicken thigh. Because I had allergy to peanuts so I asked them not to put any peanuts there. Rice was really good with smell creamy of coconut. Chicken thigh was juicy. I liked their fish, it was crunchy and fun. I didn't order any drink just had ice water and I thought it was cool enough for lunch because it was hot outside, I asked for a little spicy sauce and ice water cooled down spicy food . The crazy thing was that people ate with fork and spoon which were kind of hard to use for chicken. I wish it was a knife there. Staff were really friendly."
well here's a funky wee surprise,"rocked up Saturday lunchtime and headed the queue to get in for about ten mins. This place is busy and great atmosphere. Good vibes, good demographic mix and simple menu. Went for the coconut rice 'basic' which is rice, ton of fried spicy chicken - delish!, and some fried anchovy, peanuts and fried egg. very fast service considering how busy the place is. Very inexpensive and great value, couldn't eat another thing all day. Worth queuing up for, one day you won't be able to get into this place so go now while the queues are small! enjoy !"
Overprised hotwings and rice,Way overpriced for what we got. Super boring food and we were still hungry afterwards. Would not recommend
You must try this!,"A ‘must ‘ when you visit Singapore!

The Coconut Club is so popular that people were lining up outside. We were fortunate in that we got a table for two within ten minutes. The ‘basic’ meal was $12.50 - unbelievable value for a huge meal of chicken, rice, fried egg, sambal,roast peanuts and fried shrimp (hope I got those right but whatever it was fabulous food and great value). We did add two serves of vegetables each which were just delicious. Couldn’t fit dessert in though. All in all a fabulous lunch."
Probably the best Nasi Lemak in town.,"We went on Saturday evening and was surprised to get a seat within 5 mins. Our order was taken very promptly; the basic nasi lemak with a couple of side dishes (otah-otah and sambal squid). The order came around 30mins; not that we are complaining, thats pretty the expectations for all the famous restaurants.
The lemak was exceptionally good, fragrance rice, the succulent chicken breast, the sambal with a good balance of peanuts and crispy anchovies. Best to go with a side dish of delicious sambal squid.
The otah-otah is a ‘must try’, a very authentic taste.
Overall, we it very much. Will definitely come again."
Beef Rendang!!!!,"Nasi lemak is good with chicken thigh meat, the sambal for me it is spicy but still manageable, okra is amazingly delicious, beef rendang is a superstar here for me. Beef rendang is so tender and soft and full of flavours. You can't leave this place without ordering one here. The Cendul also good ^^ yummmmmssssss.... try to avoid after 12pm as it gets long queue."
Excellent customer service.,The only nasi lemak to eat if you are willing to dish out 12 bucks for a plate. Excellent customer service. Will definitely return.
Amazing Nasi Lemak,"When a restaurant focuses on one dish only and there are lines at both serving times to get in, you know it's for to be good! Coconut club doesn't disappoint with their star dish being amazing. Succulent chicken coupled with fragrant coconut rice with peanuts, ikan bilis and a lovely and deep sambal make for an amazing dish. There are a number of side dishes which are also lovely, curry chicken, sambal kangkung, ladys fingers help to make a perfect meal. The portions are great and the price just right. If you want to get a seat, come late in the afternoon on weekdays or 15 minutes before the afternoon and evening service starts. Weekends are busy but the wait is worth it!"
Lunch,"Always a queue, even on weekdays. Run by millennials. Efficient service. Open concept. Add ons are generally more expensive than the basic meal itself. Avoid the otah which is an add on."
Comfort food in a comfortable setting,"Heard about this place from a foodie friend. Was told that while their nasi lemak (coconut milk flavored rice) is priced on the higher side, it is delicious.

Came at opening time of 11am but there was already a line. Waited 45 minutes to be seated. We ordered 4 plates of classic nasi lemak @S$12.80 per plate, and a side dish of beef rendang @S$16. The rice is very flagrant, chicken pieces are fried to the right brown and crispy level, sambal chilli + ikan bilis + cucumber slices completes the dish. Beef rendang is also tender and flavourful.

We ended our meal with dessert which is cendol and 3 pieces of nonya kueh. The cendol is really good and is a must try together with their nasi lemak."
last meal in singapore,"we were walking around at lunch time when we came across this beauty
the line up to get in was about 20 people deep so i knew it must be good
i went in and asked about making dinner reservations and was told they do not make reservations later than two days prior ,what a shame.after telling them it wasour last day in singapore and our anniversary as well they made an exception
whe arrived at 6 pm and were seated at a nice cozy table and were given two complimentary glasses of wine to celebrate our anniversary
the waitress came by and after explaing the menu we ordered , now they only do one dish nasi lemak and then you can order sides which were very good
we opted to get one nasi lemak so we could try some other food as well
we had a great fish stew that was unbelieveable as well as some grilled prawns that were equally as good
after dinner we were treated to great local desert (also at no charge )
the entire experience was wonderful andthe staff took real good care of us and for this i am grateful ,you made our last night memorable"
Surprising find,"Was walking around chinatown in Singapore and I cane across the CoConut Club. Fantastic atmosphere, great staff, extremely friendly to a weary traveler. You may need to share table with others, but I didn’t find it an issue."
Yummy,"Saturday brunch with friends from KL. We had the nasi lemak with chicken thigh and shared the otak, sambal kang Kong and paru sambal lado (beef lungs) which was surprisingly good. My KL friends liked it, very close to the traditional nasi lemak they get back home, especially the chilli paste. It gets crowded between 1130-12 noon. Good thing we arrived at 11am."
Nice Ambient with authentic Nasi Lemak,"Restaurant atmosphere is real nice located in good location. Service is beyond expectation,restaurant explained us about their meal including its ingredient. Our fav dish,Nasi Lemak,tastes good. Sure we will be backnext time."
Delicious nasi lemak in a casual relaxed atmosphere,"Wife and i
Came in a little after lunch around 1:30 PM and their was still a queue outside. The specialty nasi lemak was the reason why we came for lunch and it did not disappoint. They also recommended spicy clams which were very fresh and some fish in curry sauce which was excellent! Staff was friendly, approachable and professional. Great lunch!"
A great lunch find - looks like we're not alone!,"What is the worst thing and the first thing to settle when you go to a restaurant or hawker centre in Sin? Where to sit, right? Coconut Vlub has this nailed. Rows of basic yet comfortable seats, and they get diners to line up outside so they can be brought in when seats are available. We cheated the rush by arriving for lunch at 11.45. The food? Who does not know or like nasi lemak in its many varieties? Food comes fresh with hearty portions. Extras included long beams and a lodeh-type gravy with pumpkin. Due to a small ordering hiccup a dish arrived late - the server brought us some kueh FOC to make up for inconvenience altho we expected nothing. A good lunch experience and good to see a happy and passionate staff."
Nice Nasi Lemak,"Their ""The Basic Nasi Lemak"" is a must ordered dish come with Breast or Leg set. The otak-otak is worth to try as you can eat the fish meat inside. Worth to queue for their food. But it is not near to the train station."
Traditional Nasi lemak in upmarket setting,"Delicious coconut rice with chilli, runny egg, fried chicken thigh! Easy on the palate for most tourists and a must try local Malay food. Located in the upmarket Ann Siang hill, prices are four times that of what you’ll get in a hawker but a good choice for tourists to try local food in a comfortable setting."
High end local breakfast,"Sambal makes good nasi lemak. In this case, they have proven right. Expensive if you compare to hawker centre standard. About 25 dollars per person. But worth the family outing together on Sunday."
Not sure why this place is so popular,"We went to Coconut Club last night. There was a long line. We got in line and waited for about 30 minutes to get a table. The service was horrible. It was at least another 20 minutes before a server even talked to us. The woman who seated us seemed shocked that no one had taken our order. She took our order and our food was so-so. We then ordered dessert and waited and waited. We asked about it and the person who took our order never submitted it so they had to take our order again. We were not thrilled by the experience.

The woman who seated us said she was going to give us something to take with us as an apology but it never came and we left after a while and went back to our hotel. I would not recommend this restaurant."
"Wonderful food, great service & friendly atmosphere!","We were seeking authentic Malaysian and landed on Coconut club vía TripAdvisor. The clientele was clearly local & young. The food was out of this world! We needed a bit of help deciphering the menu but both staff and people around us helped and made recommendations. Everyone here was friendly from the waiter, to the girls who made food recommendations, to the woman who handed my husband her water when he coughed, to the man who explained the origin of the deserts & paid for our Grab! It was like joining a community, the beef Rendang still haunts me for its multilayered spicing , the nasi lemak is perfection & the deserts - aah! This place is perfection and I WILL be back."
Great Food,Had a fantastic meal here and the staff were really helpful and friendly. Had the traditional Nasi Lemak followed by Cendol with adzuki beans. Would thoroughly recommend.
"tourist trap, so-so dish, poor service",overpriced tourist trap. the nasi lemak is nothing special. the chicken meat is hardy and looks like not properly cooked. the staffs are unfriendly and seem to rush everybody to order. the cashier play with his phone when we are paying and we have to wait until he's done with his business before he attend to us.
Sparkling Service from Fifi,"The famed Nasi Lemak and Chendol were decent but not exceptional. The best part of my visit to the Coconut Club was surprisingly the 5-star service rendered by one of its servers named Fifi. He was cheerful, chirpy and caring. He would regularly swing by to ensure that we had enough rice, made sure we sample the best desserts and vegetable dishes. Fifi is the best server in SG that I have come across in years in SG."
Best Nasi Lemak in town.,"What a fabulous place! The team was nice enough to make a reservation for me on request as it was my husband’s birthday. We tried their Nasi Lemak, sambal sotong and ladies fingers. All full of flavour, spice and absolutely delicious. Well worth the money and the staff too was great!"
Delicious!,Yumm!! Ordered “the basic” which seems to be the most popular and I can definitely see why. Flavours were amazing and for the price you couldn’t find better food in a sit down restaurant. The staff even brought over an extra chicken curry dish for us to try for free.
"Chicken, chilli, peanuts and crispy ikan bilis are good.","The huge piece of fried chicken (you get to choose between breast/white meat or thigh/dark meat) and large portion of ikan bilis and peanuts plus the ambience helped justify the price you pay for that plate of Nasi Lemak.
The chicken portion is sizeable - probably a quarter chicken in there. It's nicely fried and crispy. Ikan bilis and peanuts are very crispy too and fragrant. The chilli is not very sweet. I should have asked for more.
Probably the disappointment in this dish is the nasi - the rice.
I can't really taste the coconut milk and the overall flavour is somewhat muted. It's a big portion but not flavourful enough for my liking.
Other things which I do not quite like - the background music is somewhat too loud, you may have to share your table with others when space runs out and the expensive Otak Otak, which has chunks of fish meat but overall the taste is blend.
I will not rule out coming back here again though, perhaps to bring overseas guests here.
Service is very good - all the staff are attentive and regularly check that all is ok for you."
Nice place,"The food is good as in most places in Singapore! The location is great, the ambience is very nice, and the prices are so cheap for big portions!"
Good food but long wait,"The Nasi Lemak here is very good. But the service could be improved. We waited 1 hour for the table, which is fine. But they need to better manage their turnover tables. With people queuing for over 1 hour the staff need to help rotate the tables. Their was a Chinese family that had finished and paid but were allowed to stay at the table 25 minutes after they paid. It was not until we came in that they finally vacated. Given the long queues they need to better manage this."
My 1st Nasi Lemak,"This is my 1st visit to The Coconut Club. I have read about it online as one of the TOP 10 for serving the best Nasi Lemak in Singapore. I had Nasi Lemak (chicken breast fillet) as my main & Cendol as my cold dessert. The Nasi Lemak consists of coconut rice, chicken, Ikan Bilis, peanuts, cucumber, fried egg and samba. The Nasi Lemak was well prepared, the fillet was juicy and easily chewable, the flesh was soft. The rice was with a delicate coconut flavour and soft. The Ikan Bilis (Dried Anchovies) was not fishy, it was pleasantly crunchy, the egg was perfectly cooked and with no egg smell and surely not overcooked, the peanuts tasted fresh and well roasted. The balance of flavour was just right. This was my 1st Nasi Lemak and a perfect one. I went ahead with the cooling dessert of Cendol. I love this dessert with Pandan leaves flavour and coconut milk, it was smooth and delightful. My drink was the fragrant lemongrass.

SEE photos."
Authentic and friendly!,Had a great meal with friends and my 2 year old. The staff were amazing with us and my daughter as we waited and ate. Famous for the Nas Lemak and I can understand why! The Beef Randang was also delicious
Good Nasi Lemak and Child Friendly,"I have been to coconut club before not to their new location that is just up the road of their old address. I visited with my husband and 2 year old daughter. We went on a Sunday at 11.20am. They don't take reservations but the wait isn't too long. Whilst you wait, you can help yourself to some refreshments of water, iced tea and wines. This was pretty nice. Once our table was ready we were escorted to our table. They brought a toddler chair for my daughter as they ran out of baby chairs. This was perfect for her. I have never been to restaurant with a toddler specific chair before. We ordered 2 sets of nasi lemak and a child's set. Children get to eat for free. Their set comes with coconut rice, peanuts, ikan bilis, and cucumber which is just nice for kids. The staff were so friendly especially to my daughter. The nasi lemak was good and a good portion too. After lunch we ordered Cendol and Coconut Jelly. Both were a nice refreshing dessert to have after nasi lemak. We will be coming back. Thanks Coconut Club!"
Good Service and Gluten Free Sambal,Very friendly and attentive service. Apparently use Tapioca flour on the chicken and you can request a gluten free sambal. Overall I found it a bit light on flavour but the chicken was certainly moist and I enjoyed the sambal. Expensive compared to hawker stalls but I can’t eat this dish at those and this is not a hawker stall.
Great hospitality!,"I have visited the coconut club at my very first time in Singapore. While exploring the place, I was looking for food options and come across with the place. The staff were very polite and friendly. Served the meal quickly even though the place was crowded. It was indeed a decent meal just like what you see in the picture. The quality, presentation and the taste of the food was excellent. The price is relatively high but I'm sure it is fair vs the good food they serve.

I would definitely go there again :-)"
Super Nasi Lemak,"Went to the Coconut Club for the first time a couple of nights ago. Have been wanting to try this restaurant for months. The food was very good especially the fried chicken. The coconut rice was very tasty and the chillie sambal was excellent! We tried some of the side dishes like sambal sotong, lady’s fingers, sambal la la & the tofu. Everything was good. We had the chendol for dessert and that was good too. The restaurant takes no reservations so be prepared to line up and wait up to 40 minutes. The wait is worth the while."
"food amazing, service so so.","Read so many good reviews about this place and we decided to give it a go.

First off, the Nasi Lemak was delicious !! So worth visiting from anywhere in Singapore to try the dish.

This space specialises in one dish, get there early or expect a wait.

The service was probably the downfall, we waited over 40min for our meals while 2 groups who arrived after us received their dishes.

We ended up canceling our side due to the wait and were happy we did. The portion was perfect for us.

I’d probably get in super early to avoid service issues."
Great restaurant,Suggested by Lonely planet so went there with my family for dinner. Great food and very friendly people. Free meals for the kids! The chicken was great but also likes the crispy fish side dish very much. Will not hesitate to come again
Big portion but boney chicken breast,"We decided to try patronizing coconut club for a colleague's farewell on Friday. Fortunately queue was managed well with thoughtful offer of iced water and lemon tea to combat the blistering noonday sun.

The nasi lemak was impressive in portion, the fragrant rice was free flow - which unfortunately wasn't informed upfront so I only had one additional helping. The chicken is fried up pretty well, but sadly my portion was quite boney with not much meat. I should have taken the chicken thigh instead. Otah was really pricey for the portion.

The cendol was pretty rich with the coconut milk and very welcomed again because of the weather. The green cendol was abit stingy though, and did not feel very satisfying. Just a tad more would have been better.

Overall, average experience."
My go to place for nasi lemak,"I must be slacking. This must be my 4th if not my 5th time back at at The Coconut Club for lunch and I have written a review for it.

Very popular place for lunch in An Siang Hill. The owner is meticulous about his source of coconut and that is clear when you taste the nasi lemak.

Menu is really simple. One main dish of nasi lemak with 2 pcs of chicken (breast or leg aka light or dark), peanuts, fried anchovies, fried egg sunny side up, crunchy cucumber slices and a spoonful of sambal chili. Besides the main dish, there are lots of sides like otah and sotong(squid). The main dish is big and I hardly have space for the sides.

A good plate of nasi lemak must be fragrant with coconut without tasting like you are eating coconut. Nasi lemak at TCC is very good. I love the chicken pieces. So tender and deliciously marinated with ginger and other spices. Every little side items are fine so well. The ikan bilis (fried anchovies) is crispy. The peanuts are just the right size.

Only one thing I’m unhappy about. The side of the plate is too shallow. I kept pushing my food out onto the table. Maybe that’s just me.

Lots of drinks of local flavors to choose from. Homemade calamansi (lime), homemade barley, bandung (rose syrup with evaporated milk) etc.

For dessert try the chendol. It is made with palm sugar and coconut milk. You can have it with it without red beans. Go for the red beans. Today they had a special coconut jelly dessert that is so beautifully done. Looks simple but tasted complex. The jelly is smooth not like agar agar. The coconut meat gave it a nice texture. Small dish big taste (of coconut of course)

Definitely a place to visit but be here around 1130-1145. Past that it will fill up and if you have a party of 6, be ready to wait at least 30 minutes."
Sedap,"As a local, its the first time I tried the food. But I’m willing to pay for the amount as the ambience, quality of food, and servtitude are excellent. Quatity of food is generous and well executed.

Great job on the fine establishment of pushing local cusine to a higher level."
amazing,"Coconut club is probably twice expensive as any other nasi lemak in town, but you got a full flavorful set with a nice environment and friendly staff. Not to miss."
Lunch with colleagues,"Being a local I have tried many of the different kind of Nasi Lemak( Coconut milk rice, served with sambal, fried crispy anchovies, toasted peanuts and cucumber.) and its accompanied dishes .
This by far beats my entire life experience of Nasi Lemak.

The chicken are tender and fresh. The nuts and anchovies are of quality selection. The sambal chilli i cant tell you how much i love it.
The rice is refillable.

Dishes- sambal clams, squids, otak are done to fresh-from-oven experience.

Dessert- go for Chendol ( crushed ice, red beans and coconut milk)
Also local peranankan pastry.

No wonder the Singapore Prime Minister invited the Philippines President to lunch at this restaurant.

Price - between local food court and and mid range restaurants.

Must try. Wont regret!"
Felt Unwell Afterwards,"I won't say the food isn't tasty - the nasi lemak is excellent. But I ate there last night and two hours later felt quite unwell and had a bad stomach.

On a previous occasion I went I ordered the cendol and the santan (coconut) had gone off.

I think Coconut Club needs to raise its game on the food storage/hygiene side."
Nasi Lemak with beer,Heard about this place and wanted to try it. Didn’t disappoint. Where else can you get really good nasi lemak with draught beer. Good stuff.
Great nice lemak with great service!,"My wife and I went here on 17th May 2019. We had only one portion of their Nasi Lemak with extra Sambal Sotong and Otak-Otak. In addition, I had Ice Barley as my drink.

The Nasi Lemak tastes so good, with Ikan Bilis, fried chicken, and fresh veggies. The Otak-Otak, Sambal Sotong and Ice Barley could be improved though.

If the prices were more affordable, I would rate it as 5 stars."
Nice Nasi Lemak cooked with heart,"Though the price is higher than normal nasi lemak, i can see and taste the effort the kitchen team has been putting into this rice dish. The chicken leg (really a chicken leg, with drumstick and thigh, not just a drumstick mentioned as chicken leg) is tender and juicy, just cooked to perfect, not overcooked.
Be fair, the other dishes are not as good as their nasi lemak."
Yum!!!,"They specialized in one plate (nasi lemak) with various side dishes to choose from. While it’s a bit far to walk from either Telok Ayer or Chinatown, it’s quite popular for lunch and you need to expect lining up after 11:30 or so, while it’s worth waiting. Staffs are all friendly and they serve your orders quite fast - they even shared us a few kinds of Malaysian desserts on the plate. This is my must-go place in Singapore."
Mediocre nasi lemak in a nostalgic cosy shophouse cafe,"Overall, the nasi lemak set is filling and tasty. Simply love the sambal okra! Really tasty and flavourful. The fried chicken is tender with some crispy bits but it could have been better if it is seasoned longer with the herbs / spices before frying them. The tender chicken drumstick meat is tasteless with some pinkish bits as compared to other nasi lemak chicken I have eaten elsewhere. If you are thinking of coming here during the weekends, be sure to come early as the wait can be 20 mins or longer, depending on the size of the group. The group is only seated when everyone is present."
Earns its Michelin Star,"The Michelin Guide has started making a point of recognizing the very best examples of 'real' food at reasonable prices. Like Jay Fai in Bangkok, the Coconut Club is a perfect example in Singapore. They have a simple but perfectly prepared Nasi Lemak. All the components are done to perfection (especially the chicken) and the sum of the parts is even better if that is possible. A simple dish that is done with great attention to detail. Get there early as there will be a line."
