topic,review
Not many options,"The ambiance is nice, but they did not have many options for dishes especially vegetarian options. The nasi lemak was great and they did constantly come for refills, however that is all. The other options were bland and nothing great."
The best Nasi Lamek,"We went in there by chance because we got caught to the rain. and boy that was the most tastiest food we have ever eaten. I don't eat meat so even when we were there at the closing time, they were very kind enough to provide me with a vegetarian option. That aubergine dish was excellent !"
Beautiful Nasi Lemak,"Beautiful Nasi Lemak - yes it’s expensive but we throughly enjoyed the food and experience

Salad starter of Wing Bean was extremely tasty and something new for us - tofu and crab was good too …. Great start to the meal

Main - Nasi Lemak , half a roast chicken with all the trimmings !

Very tasty and highly recommend"
Restaurant Looks Good,"I dined at the Coconut Club’s new address on Beach Road for the first time. The place looks good. I sat downstairs at one of the tables by the bar where it’s big enough for 2 plates and 2 drinks. Service was fast and friendly. The nasi lemak rice was fragrant. The sambal and fried chicken could do with being more flavorful. Our meal of 2 plates of nasi lemak, one chendol, one coffee and water was $68."
Lived up to the hype,"I am a big fan of nasi lemak so I finally got to try this new dig at Beach Road. It is definitely more spacious that it’s old venue but you will still find queues so better to make reservations.

What I like about the rice is that it is fluffy and fragrant but not too rich. It’s flavoured just right. The chicken drumstick was done just right crispy on the outside and juicy on the inside.

Service was relatively fast and fuss free. It’s pricey for nasi lemak so think of it as premium but it’s worth the price."
Don’t bother,"We were looking forward to trying this restaurant after reading reviews but boy were we disappointed! There is so much hype about this place…. bookings only opens a month ahead of time and they continually tell you they need the table so you are restricted to 90 minute sitting. What absolute rubbish! The night we went there were plenty of tables vacant but for some reason they had a queue at the door! Trying to look more popular that they are ?? Charged for tap water which I find offensive. Then when I went to pay with cash they said we prefer card payment. Nowhere did it say this by the way. I had cash and wanted to use it before leaving Singapore the next day. They were expecting me to change my mind and when I didn’t they proceeded to tell me they would have to go downstairs to get change. No problem I said I am happy to wait!
Now the food was disappointing also. The chicken was dry and not very tasty and small amounts of rice and condiments. Overall so many more tasty and cheaper restaurants in Singapore to spend your time at!"
Hit and miss,Had a business dinner at this venue. Food was plenty and some dishes tasted better than others. I found some sauces to be not so tasty though. The highlight was the roasted chicken which was succulent. The dining chairs are very uncomfortable and gave me pain the whole day after.
Expected More,"We went with high expectations of this restaurant but, unfortunately, it did not live up to them.
We were on the upper floor of the restaurant and it had a nice feel to it.
The servers were friendly and helpful.
However, we found the food average. It was just food served on a plate for sharing with coconut rice and condiments (sambal, peanuts and dried anchovies) to add flavour. Perhaps it was just not to our taste, but we could not avoid thinking that (in the words of Australian MKR, Manu) the food was not cooked with love."
Nothing terrific for the price,"Nice decor and often super busy. The menu is ok, but no sets upstairs in the evening. The food is tasty, accompaniments for food are a bit over the top for some rice. Alcohol is expensive for a restaurant like this and no HH."
"Great food, nice people, cheap prices and free wifi","If you don’t what to spend a million dollars at Cé La Vi but what a nice evening then coconut club should be on your list.

A great place in a busy city. A large group of us went here last week and really enjoyed the food. Fresh meat and fish with recommendations of local cuisine. A coconut theme range of cocktails and a range of cakes too. We celebrate a colleague’s birthday and we had a conver of the restaurant for ourselves. Also free wifi!"
Friendly diner in an interesting part of town,"We came her for the nasi lemak as the CC is well known for it. Unfortunately we were disappointed. It was, sadly, quite bland and really nothing special. What was special though was the very pleasant and helpful staff and the relaxed surroundings."
First Visit To New Location,"Finally managed to dine at the new place at Beach Road. It can get crowded so reservations are useful.

We had the gado gado, otah and tauhu bergedils as starters. Tastewise, they were okay but the gado gado dish was on the small side so we had to order another.

The chicken nasi lemak was good as the chicken was marinated and cooked well. The peanuts and anchovies were fresh and crispy and the chilli was good if a little sweeter than spicy.

The selah fish was also fried well and a hood size. The rice was nice but jot as lemak as expected.

They serve refillable still or sparkling water at $3 a bottle. Meal for three mains came up to $130."
Coco-Coco-Nutty !!!,"Premium Nasi Lemak at its best. What else can I say? Their terung asam manis is really good and their sambal kerang is really soft and delicious.

Finally, the best thing on the menu isn’t even food-related ! It’s their coconut shake. I mean, just on a-notha level ! My God. Similar to their Chendol which is expected. ‍♂️"
Superlative,"First visit after their move to Beach Road. Went twice to Ann Siang Hill and enjoyed their signature nasi lemak so wondered if standards had been maintained in their new premises.
Delightful experience, booked through Seven Rooms for the 1.30pm slot. Had a table for us upstairs, rather a steep climb so hold on to railings but beautifully furnished with cane furniture in tropical setting. Very popular with office crowd and large groups. Went straight for the signature chicken berempah set, wing and thigh tenderly roasted with marinated spices, sambal sweet and not too hot, ikan bilis and peanuts crisp, well-drained, free-range egg a glistening orange, a few slices of cucumber. Well worth the $18.80++for everything done just right.
Ordered the line juice with sour plum and cold lemongrass $5.50 each, a very reasonable $56 for an excellent meal.
Service was prompt and courteous, tables decently set apart, convival ambience.
Only complaint would be the rather dirty restrooms downstairs but that's the fault of inconsiderate users than the staff who can't be cleaning all the time."
An Experience Received,"I wanted to have a meal at this restaurant before it moved from the present location to another. It was timely as it coincided with a meet-up with friends.

The area our table occupied was spacious, in keeping with safe management measures. Scan a QR code on the table for the menu and attract the attention of the wait staff to place the orders. The specialty is the humble local dish, Nasi Lemak. Different sets are offered on the menu, and they all come with a serving of coconut rice, fried egg, anchovies, peanuts, cucumber and a generous helping of sambal. One may order a few starters or sharing portions, if preferred. I like the Gado Gado (tempeh, shredded cabbage, french beans, baby potatoes, quail eggs, peanut sauce). It was tasty and not too spicy.

I wanted an experience and it was an experience I received, so the prices were not an issue. Would I visit the restaurant at its new location? It will have to depend on my lunch or dinner companion(s)."
Okay nasi lemak,"Three of us had dinner at the Coconut Club. We each had nasi lemak but with a different optional extra. So one with fish, one with dry chicken and one with chicken in sauce. Nasi lemak is a popular dish in Singapore and Malaysia and so whilst I enjoyed the NL here (and tasted everyone’s optional extra!) it wasn’t outstanding or memorable in any way which is a shame because I had high expectations - it is a nasi lemak restaurant after all. Everything was just okay - I’d have liked an outstanding sambal or chicken or ikan bilis to feel satisfied. Our waiter was very sweet and helpful and the place itself is very pleasant, clean and relaxed."
Feedback on service and staff,"Hi I was at your restaurant on 9th March for dinner with friends and apparently we start having our dinner around 8.30pm and there was still ample time for us to dine but the staff there was repeatedly telling us they are going to close soon and was giving us the feeling of chasing us and start asking for last order if we had any and we where only start to have our main dish after few minutes come and ask if can serve the dessert which was only 2055hrs and we where still having our main course this really upsets us and we have to rush to finish to have the dessert and as I was noticing it was only our table the staff was picking, just spoil our mood and lastly when we about to settle our bill the staff told us they don't accept card payment only cash due the cashier as already close their counter is this supposed to be the way you should advise us before hand that so if we do not cash at the point of time how you settle my bill ? I'm really unhappy and kindly revert back to me how you can accommodate this feedback.Thank you my email address will be sakirarekha@yahoo.com.sg waiting for you reply."
Great nasi lemak but .........,"The nasi lemak is great.

But as a Singaporean, the price is something I can't get over. I find myself ending my meal with a thought of why the heck I spent over $20 on my nasi lemak and a drink.

Its almost priced to be a tourist trap. There are other amazing options available around the island which would also save you money."
The nasi lemak was quite OK and the portion size was reasonably filling.,Dec2021. I had the [Ayam Goreng Berempah Leg Set] and the [Chendol]. The [Ayam Goreng Berempah Leg Set] was quite good and tasty. The portion size was good and reasonably filling. The [Chendol] was OK tasting (not outstanding) for me. The ambience was good and the serve-staff were very attentive and gave good service. FrancisTLim.
Nasi lemak,"Had always wanted to try this for years and today finally did. I think they moved and now at ann siang. Service at the door was pleasant. Had the nasi lemak of course and the otah starter. Very good food, and service"
Too pricey needs cheaper option,"Had the Nasi Lemak with Leg Set
- The rice is fragrant and the sambal is nice
- The chicken skin was very tasty but the seasoning didn’t penetrate into the meat. So when your are eating the meat without the skin taste a bit bland tbh especially if you order the chicken breast set.

The basic set without chicken is $5 which for me it’s reasonably price considering the quality, ambience and experience you get. But to pay $18.8 just to add on the chicken is not worth it imo. Maybe they should have a cheaper option & give a nice piece of fried chicken wing like most Nasi lemak out there and charge like around $8 … it would make it more accessible and I would return again

Chendol is nice just wish the portion was bigger"
Tasty Nasi Lemak your Peranakan mother-in-law would approve of,"We were on staycation nearby so got the chance to make reservation for an early dinner at The Coconut Club. The decor of the restaurant is simple and laid back with a long counter displaying their ayam goreng berempah (spiced fried chicken) along with other nasi lemak ingredients. Coming from a Peranakan background, we make pretty good nasi lemak at home so we really wanted to find somewhere where the nasi lemak is equally rich and flavourful and hopefully with a new taste for us to enjoy. I ordered the Ayam Goreng Berempah Breast Set while my husband opted for the Homemade Otah Set. Each set comes with a serving of coconut rice, anchovies, peanuts, cucumber, sambal and a fried egg. I was not keen on the fried egg as we normally have nasi lemak with either a triangular slice of omelette, sometimes with hard-boiled egg sambal. The chicken was tasty but since it was a breast portion it was rather dry in the center, but additional sambal helped sort this out. The Otah (Charcoal-grilled fish paste with Kühlbarra Barramundi fish wrapped in banana leaf) was delicious and I will opt for this the next time round. At $16.80 for the chicken set and $14.80 for the otah set, the price is a little steep for this 'kampong style' food but being that it is in classic Ann Siang Road (prime area) and with attention to service and quality, I think that we were prepared to fork out this amount. It was overall an enjoyable meal which was complimented by delicious Coconut Jelly that helped cool the palate ($5.60). We will definitely return with our family members and friends as it is about the best nasi lemak option we currently know of beyond our home kitchens."
Expected more from a Michelin Bib Gourmand,"My wife and I ordered their signature nasi lemak. Rice was nice and fragrant. Sambal was good. Egg, peanuts and ikan bilis was also good. Chicken was well fried on the outside but when we cut into the chicken, we both saw bloody spots in the chicken. This for us indicates that the chicken is not fresh, but could be frozen chicken. The sambal sotong we ordered was rubbery and we had ask them to record. I was expecting more from a Michelin star restaurant. But was quite saddened."
Casual and Friendly Place for Good Food,"Casual place to catch up with friends and friendly service. Most well known for their coconut rice (nasi lemak), with roasted peanuts, fried anchovies, egg, chili sauce accompanied by sambal okra and cuttlefish. Reasonably priced. Spent S$32 per person. Réservation is a must."
Premium offering at super premium prices,"Everything here is more expensive, but it’s delish. The poulet leg is good, not sure it’s worth the premium price, though. The sambal sotong has complex flavours and probably is the best item on the menu. The Sup kambing is said to feed two, but they must be children, for the portion is not generous. We ordered takeaway on National Day; although there was a lot of demand, they were very well organised, and service was impeccable."
Nasi Lemak with amazing French chicken,"Considered one of the most premium nasi lemak outlets in town, their signature French chicken that is used for the dish is worth the price. And paired with their special chilli, simply amazing!"
Seriously pricey,"I must say their nasi lemak is really done very well but the price is probably a bit too exorbitant. I think they also need work on their coordination as one staff told me take my time and not to rush and when i tried to order chendol after my meal, another staff told me kitchen is closed. So sad."
"Good food, great service","A friend made a dinner reservation. My 3rd visit here and twice served by Fifi. He is really warm, friendly and very helpful. Ordered nasi lemak, iga bakar, kuih koswi and their ooohh so lemak and not overly sweet chendol( I can proudly declare that their chendol is my favourite in the whole of SG!!) . The food that we ordered are never disappointing. Loved everything that we had and the service that Fifi gave is extremely commendable! Will definitely be back again... And again.."
Big portion. Almost half chicken.,Considered this as “ high end “ nasi lemak but quality of meat and rice is good. Chicken is almost half. That is a lot! Rice is very fragrant. Chilli at the side is yummy. More “ dry” then the usual “ wetter” versions of sambal. The otah is a good side option.
The nasi lemak is okay if,The nasi lemak is okay if you can’t get to Kuala Lumpur for the real thing. We were seated near the counter and within earshot of a crew member who was rather rude and brusque to her colleagues. She could well be a supervisor judging from her interactions with the rest of the crew. She clearly wasn’t happy working there and had the expression to suit her tone too. Not very enjoyable to dine and have to listen to someone on a power trip.
Over-rated Nasi Lemak,"With much disappointment, the Nasi Lemak is over-rated. The Fried chicken is not well marinated as it rather bland; the sambal is not spicy and lack the real sambal taste. The rice was however, fragrant and well cooked. For such quality, $14.80++ is a ripped off."
Excellent Nasi Lemak! Cendol needs attap chee!,"Had the chicken thigh nasi lemak and the taste was really excellent! The sambal given was good too! Tried also the eggplant and lala, equally excellent choices! The lala can improve further by ensuring no sand bits and most are cooked through as we had quite a few clams that are shut tight, the sauce was really good! The cendol is indeed a perfect and cooling end to the meal, unfortunately despite it's higher price as compared to normal hawker offering, it does not have a single attap chee added to complete an otherwise excellent sweet ending! Hope the management can consider adding attap chee to the cendol!"
Worth waiting,nice food nice environment worth the wait nice colleagues probably can add more variety maintaining good recipe
Great dining experience,"It's our 2nd visit, after COVID-19 phase 2 open.
Place is easy to find, ample street parking nearby.
We reached around 1pm, expecting some queue during the peak hour.

Service is excellent, all the staff is extremely friendly, makes us totally feels welcome.
They keep on apologising for the slight delay in serving, which is not a fault of them really, and totally understandable since it's weekend and peak hours.

We started with kuih platter as appetiser while waiting for the main dished. Assorted and tasty nyonya cake.
For the main dish we had the chicken leg set, sambal sotong (must try!) , sambal kangkong, terung asam manis and kacang panjang (complimentary on the house due to the slightly longer wait than the norm). Too bad the otak otak is sold out, we enjoy it the last time round. Food are great and tasty, chicken leg skin is crispy and meat is moist and tender. The sambal sotong is cooked to perfection, love the sambal gravy, our favourites.

To finish it off, the dessert; a bowl of cendol and coconut jelly.
Cendol is very authentic, rich in coconut milk, gula melaka and the red beans.

Overall, a great dining experience and value for money.
We will be back to try the other remaining items on the menu."
Excellent Customer service,"Two weeks ago, I ordered Nasi Lemak online from #CoconutClub, for my family and parents and waited for 30 minutes, after which, I was told that I needed to wait for another hour or so to pickup my order... Agitated with their service, I cancelled the order and got a full refund.
A few days ago, Abby from #CoconutClub called and apologised politely for the inconvenience and told me that she will give my order for FREE !!
A very good come back by Coconut Club to retain their customers...... Kudos to Abby for handling the customers well....."
Pricey but generous portion,"The nasi lemak was quite pricey. I've had better nasi lemak but the portion was generous, good for 2 to share actually."
Looks good but taste disappointing,"Service non existent. Once they seat you in a corner you are forgotten. Had to wave for the wait staff to take order even though two were standing around counter idling.

When food was served, everything was cold (rice, egg, chicken). Food hygiene questionable as cooked food was not covered and prepared where customers can walk around to see.

For the food taste, only rice was alright with the right amount of coconut flavour. Chicken and chili were too heavily spiced and not quite typical of nasi lemak flavours. Taste more like Indonesian fried chicken with strong tumeric taste and Thai chili with strong lemongrass flavour.

The side dish sambal kangkong was served cold, so was not pleasant to eat.

On the whole, this restaurant is way overrated and pricey. Best to spend your money on any nasi lemak stall in Changi Village, good price and authentic flavours."
Nasi Lemak at its best.....So so Shiok....,"First off, its the crew....the service staff that make this place stand out. There are a plethora of superb dining experiences in Singapore. Nasi Lemak aplenty. And some so good that the experience is truly indescribable. But The Coconut Club is a different breed. I mean, the crew are so amazing. Attentive, friendly and caring. Nothing like it in Singapore. The food...the main reason I went there....was beyond reproach. The nasi....so so tasty....the ikan bilis perfectly cooked, the sambal....oh my....I could eat a tub....and the chicken, I am told by those that consumed the bird was crispy and tasty.....We also ordered the okra and the tempe....I would highly recommend this place anyone...."
"Tasty, Decent Portion but Pricey Nasi Lemak","I won't say this is the best nasi lemak I've had because I definitely had better ones in Singapore that are half the price of what The Coconut Club charges. No doubt their chicken leg portions are great, love the chilli but for the price, I won't necessarily come back again unless I've got a friend in town who wants to try it. They're quite strict on the queue too, so make sure all your friends turn up and queue altogether since they'd only alloe you to enter when everyone turns up."
One of the best nasi lemak in town..,I love to give the 5 stars but there’s something short .. the otak is kind of dry in my view and the assam pedas snapper is average. The chicken leg was good as well as the sambal lala. The rice is quite well cooked and chili sambal taste great.. not too sweet. They gave generous fried anchovies and peanuts too. The chendol is exceptionally good ... service is TOP notch and everyone work here so happily. Small waiting time during peak meal time... will comeback to try the fried fish and spicy squid again.
Good wholesome nasi lemak at a price,"Had lunch here. Came at 2pm and there was a queue. Waited about 15 mins to enter. Ordered the nasi lemak chicken thigh set as the chicken breast set was sold out. Ordered a calamasi with sour plum which was a tad too diluted. The food came after a short while. Plating was quite attractive. The condiments were good, the rice was quite fluffy and the chicken was fried fragrantly. Overall a nice plate of nasi lemak and it was not thirsty later either."
Over Hype and Over Rate For The Price,"Came here for lunch, service was very good and impeccable. I ordered wrongly and the staff was more than happy to sort it out, wanted my egg to be done a certain way and the request was happily accepted. As for sitting arrangements the tables are just too close for comfort, like sitting a hawker centre or food court. Table size are also small if you order extra side dish. Had the Chicken Set , cucumber pieces were fresh, peanuts and ikan bilis were crunchy with the righ texture and not oily or salty. The fried chicken leg was very well balance, moist inside and slightly crispy on the outside the way it should be, which is not easily done. The downside is the rice and sambal. Rice was not aromatic at all like plain rice, sambal had no kick or spiciness."
Best nasi lemak and chendol,The best nasi lemak we have tasted so far. The chicken leg (thigh) set has really well roasted and tender thigh. The chilli was the highlight of any nasi lemak and they give a really generous portion of chilli. Sides like sambal kang kong and otah is great. The meal finish off with the best chendol in town. Perfect.
The Best Nasi Lemak in Singapore so far,"Since moving to Singapore 2 months ago, could not find a good nadi lemak until now. Rice was fluffy with just the right amount of coconut cream. Chicken was fried to perfection and moist. The sambal was great and not too sweet like most places. I truly enjoyed it and will be one of my favourite cafe."
Beat Nasi Lemak in Singapore,"The Nasi Lemak here is expensive but of really high quality. We loved the otah, the crispy chicken wings and the rice was extremely fragrant"
Great experience!,"We went the last Saturday for lunch and it was a great experience. The menu has a good choice of food, service is fast and the Nasi Lemak is absolutely yummy. The vibe of the restaurant is nice and it's a relaxing and casual place to go with friends."
Nasi Lemak 😋,"This apparently gay friendly (judging from the small rainbow flag outside) restaurant serves an excellent nasi lemak with chicken, fried beef, peanuts, dried anchovies and a delicious sambal. A cold drink to go with it and your in for a treat. I even got a free dessert to go! Delicious food for a fair price!"
Everyone in my party got food poisoning after eating there,"The food was delicious and the service was fine. I had no complaints while eating there.. however, something was off - probably the side dishes that were sitting out on the counter - and everyone in my party got severe food poisoning late in the night! It was a horrible experience unfortunately. I hope they can get their food safety standards up, as the food actually tasted quite good."
Delicious food. Super clean,Delicious food. Super clean and chic vibes. I had the Nasi Lemak and Cendol which were both amazing. The service was fast and friendly.
