topic,review
Fabtastic birthday celeb 🥳🙏🏻🙂,"Had a fabulous birthday dinner buffet at THE LINE and was well taken care of by Ms Dolores. Her warm and accomodating personality made sure we are having the best celebration that night . Wide variety of cuisines and scrumptuous desserts were present. I personally enjoyed the fresh array of seafood,sushi bar and the Indian section.
If you are heading here for a celebration or a simple dinner,do look for Ms Dolores and rest assured you are well taken care of :) Thank you so much for your hospitality."
Dinner at The Line,"Enjoyed a scrumptious dinner buffet at The Line which left us amazed and fully satisfied with the wide variety of dishes. As delicious as the food was, the accommodating, excellent, and ever refined service by Ruby, Akshey, and Ameen meant that our evening was much better.

Ruby, in particular, was very attentive to our needs and made sure to delight and interact with us whenever possible, although it seemed busy at the time. All in all, it was definitely worth a visit, and I highly recommend others to give the buffet a try."
Highly recommended service,"Catered to our needs whenever possible. 2 staffs in particular, ruby and akshey made us feel welcomed"
Excellent,Finally we can all let ourselves out at the buffet lines again. Excellent food quality and wide variety. Well done team Shangri-La at the line. Everyone here was clearly impressed and left with a little tummy protruding out. Special mention to our sweet grandmother lady server Mdm chew who is so attentive and always smiling and coming by to clear our plates so promptly. She has absolutely elevated my line buffet experience. What a joy to have such a great service staff.
Great to catch up with Mr Teck (chef) and Ms Chew,Lovely to catch up with both Mr Teck and Ms Chew. Both have excellent memory even though I am not patronising The Line regularly. Happy to see them working at Shang after the covid phrase. :)
Diner de fleurs,"Booked an intimate dinner for our honeymoon at Diner de Fleurs and had an amazing time. Chef Wong went out of his way to prepare a menu with our dietary requirements and both him and Ruby made us feel very comfortable and were friendly and accomodating. We had a lovely experience, would recommend to anyone!"
Food is served cold 🥶. Service is lousy. Price is expensive 😔,Food is served cold 🥶 service is terrible 🤬 staff is slow in clearly our plates since is a buffet setting.
Wonderful experience,"Ameen was meticulous and assisted with our birthday celebration seamlessly! Was a wonderful dining experience, will be back!"
"Still good after all these years, but getting expensive, no fresh oysters on sat night","The Line buffet has been around for many years, and consistently, there is a good range to select from - Japanese, Seafood, Western, Asian, Indian, Peranakan. Love the beef cheek satay! However, this time, it is no longer 5 stars for me as it is now at a pricey $98+ for a Sat night buffet. And for that price, there are no fresh oysters and we felt the japanese sashimi was not that great anymore. The restaurant... is full-house kind of crowded, and tables are packed closed together and it gets a bit too noisy for my liking. I also find the orange decor of The Line rather jarring as well, a sad departure from the overall sophisticated design of the hotel decor. The service staff try their best, but it is at best functional service and little details that used to make The Line so memorable goes out the window. E.g. while I appreciate the hot drink station, it also means you are expected to make your own hot drinks, and it took close to 10 minutes for the bill to arrive after 2 promptings."
Great service,Great service from staff. Fauzan was exceptional. The tandoori fish curry he cooked was just so yummy. He also made a crispy dosa for my elderly mum and she enjoyed it very much. Thank you so so much . It is pleasure to come for breakfast at the Shangri la
"Food Quality Needs to be Improved, Service was Good","I brought my parents for the lunch buffet at the Line. The whole experience was really underwhelming. Laksa certainly disappoints! There were no other ingredients in the bowl of Laksa except for bean sprouts and fishcakes. The noodles were clumped together as well. The chef did not make it a point to ask if my dad wanted other ingredients like eggs or prawns. Overall the food tasted so so even though there was a wide selection. The roast beef could be better as it was way too rare for my parents’ liking even though I asked for the doneness to be medium. Roast pork and Pipa Duck were salty and quite tough. The sashimi were sliced too thinly and presentation was pretty messy. Didn’t make me want to go for seconds. Thankfully the desserts saved the day. All of us love the durian coconut cake. Your staff, Mdm Chew was so attentive to our needs. She was always prompt to clear the plates once we were done and so very helpful with our drinks. Thanks to her impeccable service, she made our lunch experience a whole lot better that day. I doubt I would ever make a return visit."
The line restaurant,Had a pleasant experience at the line buffet. Our service staff Rhea was polite and accommodative to our needs and request. The food was excellent and we get to see and taste a wide spread of food choices. Will come back for a second time.
The Line Buffet Lunch - Thursday,"The hotel entrance was grand and nice, and my partner brought me here to celebrate my birthday. I have to say that the spread and range was fantastic, seating was spacious and cosy, and brightly lit for eating comfortably. We had an amazing time, and i have to say the service by all staff, in particular Aunt Ling Ling, was fantastic. The buffet plates were cleared regularly giving space to the table for more food, there was a nice birthday cake as a surprise, and Ling Ling promptly asked if we needed a parking coupon for our visit. Truly an enjoyable experience and we will definitely be back! Great staff service 10/10, great food! 8.5/10!"
"Nice ambiance,nice staff and food except no halal food",I recommand the breakfast buffet. Nice quality food . The only negative point for me is no halal food.Thank you to jaya raj at the egg station for is job and smile. Very professional
