topic,review
Get Here Early,"The Coconut Club was on our list to eat at. Serving the best nasi lemak in town was the claim, and we now have the evidence to back it up. We arrived just before opening time for lunch. It was already busy, though not open. Large bags of takeaway containers were being carted away.

When we were seated we noticed there were 10 staff, and not a big restaurant, maybe 10 tables. We ordered nasi lemak and assam pedis (with stingray) and it was great. The nasi lemak consisted of a tender, spicy, and crunchy on the outside/ juicy on the inside, joint of chicken, coconut rice, sambal, small roasted peanuts and crispy-fried tiny fishies.

We found out that they took their supplies seriously when we found they source their coconut from far away and owned the plantation to secure the quality supply.

The staff were going hard and many crates/bags of nasi lemak meals, we think, were heading out the door. Whether they had Uber transport or something similar we don’t know but they were certainly supplying the neighbourhood with lunch, big time.

Service was very attentive and a girl brought over a free sweet looking like a chocolate but it wasn’t. It had a palm sugar and coconut flavour and she said that it was usually served at weddings.
Finished off with cendol, a crushed ice flavoured dessert with coconut milk poured over. And that gorgeous lime/calamansi juice again with the meal."
