topic,review
Super pretty cafe!,Super pretty cafe! Went there to drink the coffees and chat with some old friends. I love all the glasses they use for the coffees and they have some unique coffee option. Please go try it :)
Wonderful Lushful Garden Setting!,"This is great cafe with a beautiful garden setting. It's very well decorated and a good place to meet up with friends in a quiet setting since it's located almost by itself on the 3rd floor with little

The service is attentive and the food is fine. But you should come to this place for its ambiance and you'll even get a free pedi/mani to boot.

Definitely a great place to grab a bite and meet up with friends!!!"
Long waiting time,"Went on a weekend. The place is done up very nicely and certainly is a heaven for those who love to post Instagram pictures online. However, the service is another thing altogether. After waiting for close to 30minutes, only 1 out of 3 items was served. it was another 10-15minutes of wait before we finally got our entire order. This is 1 aspect that needs improvement."
Excellent Evening with Colleague,"Nice atmosphere, with drinks and food. I visited with a colleague and we had reserved a table for two for the free flowing beer. it was nice to know you drink all you can for SGD 20 for one hour.

Pure value for money. i also understand you can get your manicure done for free while you drink. I did not try this out, but i sure would next time."
Will come again,"Food are generally nice, servers attentive. Opening hours are early as well. Will definitely visit again."
Value for money breakfast buffet,Value for money breakfast buffet in a garden. Beautiful place and love the food. It will be great if can provide free flow of water.
Integrated cafe!,"Beautiful place where you can eat, drink, do your hair & nails all under one roof. Interesting concept. Presentation of food was appealing and the taste was great! Service was friendly & efficient. Atmosphere was relaxed. Good for sort of settings."
Place nicely done up!,A nice concept to have the salon and cafe together. Cafe is nicely done up with alot of greenery. Not wowed by the food though.
Need to improve,"Visited on 6 sep. Reached there earlier than reservation time but need to wait till reservation time then have table. Food get cold easily due to the air con. And food selection I felt that it can be improve. Pork Jowl dish is delicious and dessert souffle is yummy.
Suggestion: when serving the drinks at least should inform the customer what drink is been served.
Overall, the experience is good. Will go back again for dessert (:"
Disappointing service,"Actually I have been wanna to visit here and I forgotten about it until this recent dinner meet up with friends.

It is a beautiful & cozy place however we were disappointed by their services. Imagine when you're ready to order the food, the server snapped at you regarding one of the orders. This was felt by everyone at the table. We understand that the server may have a bad/long day, however it is not caused by us especially we were at the cafe not long ago. It was really a spoiled moment.

Food wise, it is not too bad however the selection is limited and is difficult to make a selection when you have little or no food preference. Therefore is best to check on the menu before coming and the food is on the slightly pricey range, perhaps due to its location. However this place may be ideal to hang out if you wish to be away from the crowds.

I would give Excellent on Atmosphere but not so good on the other factors"
Behold avid Instagrammers of the kawaii ilk!,"Sunshine you don’t find but you’ll find yourself walking into a cute foliage where you can get immaculate and well fed. WOS has a cafe, nail bar, hair salon and a florist rolled into a lovely flowery bunch. I was here for the $15 free flow weekday breakfast during housewife o’clock, the bewitching hour where it’s not crowded and you still get decent IG angles. Last order was at 11 am, the time I sauntered in so I got to do a big spread at a go. There’s a western and Korean selection, all in small portions so you get to sample to your IG heart’s content. It’s oh so pretty here and if you’re here for the beauty services, they hand out generous discount coupons so you’re held hostage here all day. Which really isn’t too bad an idea. The only snag was paying $1 for water when you’re dining here. I saw patrons nursing that one coffee for hours. Surely free water for those who dine? #eatstylishtravelstylish"
Birthday brunch,Great ambience. I love the decoration. Food was good too. Staffs were friendly. One of them sang a birthday song for the birthday girl.
"Good Environment, Good Tasty Food","Extremely high standard of cuisine. Excellent environment, friendly service, great menu choices and good tasty foods & beverages at affordable prices. Will recommend this restaurant to my family & friends. I will return!!!"
"Good food, Good environment",Visited here with friends last Monday. Really lovely meal and very warm welcome. We would like to recommend this lovely place and will try to go back again.
