topic,review
NO SERVICE NO GREETING,"In the past we have been there, few days ago a big delusion!
We had to ask time by time for water, tea , food ; no one was following our table! We got very very spicy soups without proper explanation by waiters. After an expensive check we went back alone without any greeting by the staff, never again!!!"
Dexperience Undercover Service Quality Surveyor Ratings Review,"Dexperience Undercover Service Quality Surveyor Ratings Review:
Value 4/5
Service 4/5
Quality 4/5
Ambience 3/5
Experience 4/5

Special compliments with gratitude to May for always taking good care of us during our visit."
outstanding experience,"The food was absolutely wonderful, from preparation to presentation, very pleasing.The food was absolutely wonderful, from preparation to presentation, very pleasing.Everything brought to us through room service was impeccable."
Excellent service and food,"I had dinner with gf last night at Wan Hao. I really appreciate the service as it was so nice. The staff led me to the table and recommended a lot of tasteful dishes. I suggest to register and become a member, lots of promotions waiting for you to enjoy."
Service questionable,Basically I am not impressed because it was a birthday lunch and requested for a birthday bun which booked thru CHOP APP and the end we didn’t get the birthday bun nor mentioned about it at all. Then why in the first place asked for celebrating for an occasion...
The Best Chinese Restaurant and Staffs,"We visit Wan Hao Chinese Second Time. We order some signature dishes like peking duck, Black truffle prawn and Beef tenderloin.
All dishes are high quality. Also all service staffs provide excellent service. Winnie welcome us with warm smile and recommend dishes for us, May take care of our needs. Kristin and Cheng An serve wine, peking duck for us with professional knowledge and skills .
Appreciate your nice service.
We have a great night here.
Thanks again."
Excellent staffs,"We enjoy a great night in Wan Hao Chinese Restaurant, nice Peking duck and desserts. Thanks for courtesy staffs, Winnie, May, Kirstin, Cheng An. They provide good service and always smile. We love this restaurant so much."
Outstandingly good,"@TheKuoKnows

Dim Sum in Singapore doesn’t get much better than this. Wan Hou is one of the best exponents of the popular lunchtime delicacy.

The Char Siew Bao is unbelievably fluffy. The Taro is graced by an abalone on top, which explains why they cost $5 a pop.

Try the Pork Puffs. They are outstandingly moreish. The Beef Ho Fun is full of Wok Hei, the subtle caramalisation that defines the dish.

Wan Hou is now on my go-to restaurant for Dim Sum."
Excellent food,"First time dining in wan hao Chinese restaurant at Marriott.
Peking duck with Chinese crepe is the best dish. And we also try some dim sum,it is quite nice!
Good atmosphere and courtesy staffs, they recommend some dishes for us, and they have good knowledge about their food!"
Disappointing experience,"service standards have slipped. Long waits for food, tea went unpoured, plates unchanged, and empty dishes uncleared. We waited for half an hour between our appetisers (yusheng and char siew) and the next courses.

The wait staff seemed really harried although the restaurant wasn’t full - it was hard to get their attention. They could have done with a few more waiters, which is what you would expect from a restaurant that is supposed to provide a fine dining experience.

When we told one of the waitresses that the service wasn’t very good, we got a brusque ‘sorry’. They started pushing food out faster after that.

The food was decent but I’m sad that this restaurant’s service is no longer what it used to be. At these prices - there are many other Cantonese restaurants that offer a better experience."
Delicious food nice service,"It’s my third time to come here. And I’ll come back next time.
All food is good and delicious.
May and Harvey’s service is nice."
Good Dim Sum,First time here for friend’s wedding. Very good food. Will come back again to try their dim sum next time.
Great Peking duct,"Ive never had only the crispy skin cut and put in the crepes before but it was lovely, they cut the meat up into another dish, I chose fried rice but this was a mistake as it was a waste of the meat, the other option was with noodles. This restaurant is expensive but the food & service is very good. The restaurant is located in a hotel and there are no views"
Best Dim Sum in Singapore,"Go to Wan Hao at Marriott and Jiang Nan Chun at Four Seasons Singapore for the best dim sum in Singapore.

Wan Hao is an upscale, private space with 10 tables or so. Service was swift and attentive.

The Dim Sum plates (we ordered 4 portions in total, one portion of 2 pieces at SGD5-6) were as good as those in HK. I am sure there were a few chefs from HK working in the kitchen. And the prices were far more reasonable than Jiang Nan Chun (stunning decor).

The superb wok-fried beef rice noodle was a mere SGD26 for a good portion.
Tea was exceedingly expensive at SGD14 per person. Not worth the money in my opinion.

Highly satisfying lunch experience."
Dim sum is delicious,"Pleasant dining experience, dim sum is really delicious. I would definitely recommend family and friends to dine there."
"Food is decent but at a price, service can be improved",We ate here for dinner in August as a family gathering as my parents were in town from Australia. Food is always good but at a price and is not considered cheap. A meal for 4 pax can be up to S$300. But the service could be improved as the waiters were just interested in getting other people's orders and I could see our food been left on the serving table and not served til 10-15mins later. I was very tempted to just actually pick up the dish myself and serve it ourselves as I don't like food to be served cold. I have worked in the hospitality industry before and one should never leave the food on the serving table and must be served first before other things.
First Visit this restaurant,"We ordered half Bejing Duck with two eating. The duck skin eating not bad, only a few pity that the wrap is cold when we eating, so taste is not so good. The second eating is fried Yee Mian with duck meat, I felt a little bit smell of the duck meat. Although the smell not too strong, just a little bit, but I thought the high quality restaurant should provide very fresh food."
Service Excellence,"Had dinner at Wan Hao Chinese restaurant several times. Service is consistently good.
The new Manager, Cynthia Lai impresses with her strong leadership skills and service excellence.

Eleanor Ee."
"Good Foods, Ambience and Service","A good venue for get together and meals with nice decor.The foods were delicious and fresh which particularly like the signature chicken and fish maw soup. Being a member of Marriott club, we enjoyed bill's discount. Particularly mention the reservation team and staff Cynthia for their good service. I am sure we will be back again."
Wonderful experience,Really enjoyed the entire course meal and the welcoming and friendly staff made my overall dining experience even better! Better mention to Cynthia and her fellow staffs for the kind and friendly service! Would definitely visit again!
Dim Sum Lunch,Food was great and so was service. Ben was very attentive and Cynthia was just a gem. Thanks for a great lunch experience.
Excellent service,My family comes here very often for weekend treat. What a joy to be taken to this first class restaurant at orchard road. The food was nice. The service was excellent even they are short of staff. All the staffs are great-hearted and friendly.
Enjoyable meal,"Really didn’t know what to expect but was welcomed by the staff and helped with our choices.

Certainly not catering for British tastes as very authentic.

Well worth the cost."
Horrendous Experience,"Dinner on 24 November at Wan Hao, HUGE Mess after previous Restaurant Manager Jenny left Marriott. Made us wait for 35mins for 1 more last dish, ended up waitress informed us Kitchen had forgotten it due to short of manpower and several VVIP tables.. Well, thought Marriott is a 5-star property whose F&B outlet should be able carry the brand, indeed disappointing till disgusting stage."
Meet up dinner,Food and ambience is nice but disappointed with the complimentary parking cateria.Despite spending $204 on the food bill just two of us we are not entitled to the complimentary parking. I just wonder how much the management expect us to consume.I rather they not offer the complimentary parking.
Dinner,Had dinner at Wan Hao with my colleagues after work. The food was great & service was very good too. Definitely recommend this place to my family & friends
Warm gathering,"It was a nice dinner and met up with friends.
Good food especially the Iberico Black Pork a must try. Signature fried rice is also very nice.
May is serving with good recommendations and great service with her team. Must come back again."
Dinner with friends,"Dined here in Nov 2018, food and service was excellent. Many thanks to May for the recommendations. We had a great time!"
Excellent lunch at Wan Hao,"First time dining at Wan Hao Chinese restaurant. Here provide good food and warm service! May introduce menu patiently with us. And Kirstin, Wan ting, Chun Xiao always smile to us! The best Chinese restaurant in Singapore!
Look forward next time dining in this restaurant"
Nice food nice service,"Each food is delicious. Every server is good ,then Wei hao is the best. Thank you for your nice attitude and service."
Good service,"First time visited wan hao with my friends. They recommended me here to try the food here. First we have ordered Beijing duck, the skin was very crispy and nice. Also need to try the black truffles mayonnaise crispy prawn. Service was good and very take care of our table. Will come again."
Wonderful Service and Great Food,"We had a great great time and the food is delicious. Wonderful service from May. Very attentative and friendly.

Nice ambience.
Recommendation: Claypot Rice (good to order in advance) Roast Chicken. Peking Duck.

Also must try their dim sum during lunch. Is yummy.

Overall is good place to dine and for gathering with family and friends."
Dexperience Undercover Service Quality Surveyor Ratings on Wan Hao Chinese Restaurant,"Dexperience Undercover Service Quality Surveyor Ratings:
Value 3/5
Quality 3/5
Ambience 2/5
Service 1/5
Experience 1/5

Verdict: Used to be one of the best Cantonese Restaurant in Singapore with its superbly delicious roasted crispy chicken! But service standards now is ridiculously low, it's really tough to gain back confidence now.

Enter Dexperience List: Failed!

Remarks:
We have been loyal supporters of Wan Hao for many years and the service standards of Christine and Benjamin on Wednesday, 31 October 2018, 1pm, is unacceptable.

We sincerely hope the effective management of Marriott and Wan Hao will implement immediate service recovery action.

Special compliments with gratitude to May for taking good care of us during our every visit over the years and we sincerely appreciate her genuine service.

Thanks to Winnie for stepping forward to understand more about our complain at 230pm, unfortunately she was not able to assist much."
Good Food and Ambience,"Love the food there. We had gone there to celebrate my birthday, and it was also because it is on the Entertainer app. Due to our one-for-one deals, the food was value for money. I will return again next year if possible, when my Entertainer app deals are renewed."
Good and quality food with reasonable price,Good and quality food - serves some special dishes that impressed eg - Beef Tenderloin with chilled marinated sour plum pear and light wasabi sauce (highly recommended) and the Shrimp dumpling with black truffle. The steam pork ribs also not bad. Will go back again to try more dishes and dim sum.
GOOD SERVICE,service cheng an and yumi good good service炸子鸡、点心、香芒茼很好吃我会介绍朋友、家人去吃，而且服务也很周到，我很喜欢。我吃得很满足，下次一定再光顾！
Tasty sea abalones and sea cucumbers,My mom and I are fans of abalones and sea cucumbers. This is a place where we usually satisfy our craving. The ambience is great.
Wan Hao Chinese Restaurant,Wan Hao Chinese Restaurant is located right at the start of Orchard Road belt (inside the Marriot Tangs Plaza Hotel). It is a fine dining Chinese restaurant. We had the Braised Lobster with Assorted Seafood which was very tasty & the portions were very reasonable. The crispy and flavourful famous Peking Duck is matched perfectly when served with authentic Chinese crepe. Wan Hao is also known for serving up good authentic dim sum as well.
An awesome experience ..,"We enjoyed every aspect of dinner, from the service, suggestions, serving and the dinner itself.A beautiful setting and very reasonable prices.I have dined all across the world, and highly recommend Wan Hao.Xie xie ni .."
