topic,review
Not too bad,"Atas version of hawker wanton mee. We ordered 2 bowls of noodles, which was cooked al dente and delicious even on its own. We also ordered the char siew and pork. The pork was a little too fatty for our liking though. And we loved the soup! Best of all, it's refillable and unlimited! Good to try once but will probably not return. Nothing spectacular."
"Good attentive service, interesting people!",Good attentive service and the food is not bad. Well prepared food with love! Going for dinners on weekends or would be good to book on Chope first!
Great food,"Love the wantons and dumplings here. Not to mention the noodles! It's a great place in Amoy to have fulfilling dinner before heading to the many bars nearby for drinks. Only gripe was that the music was too loud! it's a dinner place not a bar/club, the music should be a tad lower in volume then people won't have to shout to have conversations over dinner."
Rustic Wanton Noodles,Great restaurant! Food was decently priced and service was as usual excellent. Love the style of this restaurant - $1 noodles with mains
Awesome noodle and sides,The noodles is rather small portion but still filling. The pork belly is nice and portion is quite big. The cafe is pack thus have take the seats outside which is also alright just abit hot and noisy.
Fried wanton,Loves the springy mee and the wanton! Will be back for more to try other dishes. Location is convenient
Good food with cosy trendy environment,"Taking traditional dishes and giving it a modern twist. I like the free flow soup at the start before ordering your meal, the aburi char siew is soft and flavourful, salted egg chicken wings is nice without the bones in the mid wing section."
Great,"Delectable mix of comfort local noodles with well-done side dishes, all washed down with piping hot soup straight from the flask. Especially love the fried wantons and aburi char siu. Missing the yam croquettes though."
Overpriced Noodles,"The noodles are basically a version of Kuching Kolo Mee (where I'm from). In my hometown, kolo mee to the locals is similar to bak chor mee for SIngaporeans. Hence, I was quite disappointed to find that their ramen was actually just a repackaging of Kolo Mee which I've had much better before at lower price points (comparing dollar-for-dollar).

Apart from that, their other dishes are not too bad but nothing I would go back for. Atmosphere is nice but a little cramped.

It might be just because I came from where this ramen is based on but I wouldn't recommend for those that have been to Kuching before and tried the local kolo mee."
Great food,"I've been there several times for lunch but never for dinner . We enjoyed the salted egg duck wings, and the boiled wantons . Price wise quite reasonable and best of all the one dollar nudles ! Only gripe was table was a bit small"
Good food,"food was not disappointing. We ordered soup wanton, aburi char siu and the signature char siu! I like especially the signature char siu! The noodles was perfectly cooked(not too soft). It was so good till we finished everything! Not to mention, the pork lard taste damm good too! Wil definitely visit the place again as the team makes me feel welcomed!"
Too pricey!,"Food was ok, quite smokey and we smelled cuz we sit near the counter. Super disliked when they took away my phone for quite Long when I wanted to claim for my voucher."
Not as good as the past few times,Just felt the noodles weren't that tasty this time and didn't impress one out of three of us in the group. Tried the new XO Wantons on the latest menu which was not bad with some belachan on top. The new lor bak was a tad dry and lacked flavour.
Satisfying noodles,Came for lunch and had char siew noodles. The noodles were tasty and servings are good size. Plenty of condiments to add including pork lard. Soup was good too. Bit pricey but its in the CBD. It also has limited seating so have to be patient to get a table.
Shiok,"We ordered plain noodles and side dishes to share. The ""plain"" noodles are quite tasty and decent serving. Each bowl of noodles is SGD1!!! The side dishes - roasted pork, salted egg yolk wings - are yummy. The restaurant also has an interesting way of self-service. There is free-flow of soup. A flask of soup is placed at the table for you to pour as much as you desire to drink. All the condiments are also placed on trays beside the table for you to help yourself. This restaurant is also located in happening Club Area and you can go for a stroll or cuppa after dinner."
decent wanton mee,"wanton mee was decent, though a little pricey. the highly recommended pork trotter dish was a little dry. loved the other sides though. service was very friendly and prompt, and interesting ambience."
Average wanton noodle,"Had read a lot of good review about this wanton noodle cafe, has came down to try it. During dinner, you will have to order the side dishes separately. Noodle is cheap though, but the other main and side dishes like Char Siew, vegetables, lor ba etc is expensive for a portion of wanton that shared about 2 person. We have ordered the wanton and salted egg chicken wings together with 2 bowl of noodles. The noodles don't really taste springy and lack of taste. The wanton is normal while the salted egg chicken wings is very small with just a bit of meat. Not really recommended as there are better wanton noodle out there and it is over priced."
Unique and Great tasting Wanton Noodles!,One of my favourite places to go to for Wanton noodles! Less than $15 for a sumptous meal. Service was really good too - staff were attentive and helpful. They love their food!
I'd be back for many more times,"Excellent food, dedicated service, and affordable for a CBD location. Just looking at how each dish was prepared was satisfying. Thank you for the great experience. Food: 7.5/10 Atmosphere: 7/10 Service: 9/10"
